repo_name,language,stars,forks,created_at,description
catlog22/Claude-Code-Workflow,TypeScript,2142,168,2025-09-07T09:40:18Z,JSON-driven multi-agent  cadence-team development framework with   intelligent CLI orchestration (Ge
vasu-devs/JustHireMe,Python,2140,344,2026-02-28T08:37:49Z,"Local-first AI job intelligence workbench for scraping roles, ranking fit, and generating tailored a"
nab138/iloader,TypeScript,2140,134,2025-11-02T04:21:23Z,User friendly sideloader
numman-ali/opencode-openai-codex-auth,TypeScript,2139,144,2025-10-01T23:16:59Z,OAuth authentication plugin for personal coding assistance with ChatGPT Plus/Pro subscriptions - use
techjarves/Portable-AI-USB,Shell,2136,537,2026-04-01T13:45:13Z,"A 100% offline, fully portable, zero-trace AI (Ollama + Llama 3 + AnythingLLM) that runs natively fr"
lhfer/claude-howto-zh-cn,Python,2136,316,2026-03-30T06:44:11Z,Claude Code 中文全面上手指南。基于 luongnv89/claude-howto 本土化重写，面向中国小白用户，保留命令与配置兼容性，并附学习路径与本地化校验护栏。
DanOps-1/Gpt-Agreement-Payment,Python,2135,8,2026-04-27T03:48:28Z,ChatGPT Plus/Team/Pro 订阅协议端到端重放工具集 · hCaptcha 视觉求解器 · 反欺诈机制实证研究 / End-to-end protocol replay toolkit
chrisryugj/korean-law-mcp,TypeScript,2134,408,2025-12-19T11:03:22Z,법제처 국가법령정보 MCP — 법령·판례·조례 조회부터 인용 환각 검증까지 · Korean law MCP for LLMs
SHORiN-KiWATA/Shorin-ArchLinux-Guide,Shell,2132,124,2025-07-16T03:54:28Z,【2026最适合新手的Arch Linux教程】具体内容包括：系统安装教程、win+linux双系统、N卡驱动、桌面环境、中文输入法、Linux玩游戏、常用虚拟机程序、显卡直通、干净删除linux等。
xbpeng/MimicKit,Python,2128,277,2025-10-08T15:33:01Z,A lightweight suite of motion imitation methods for training controllers.
wdcpclover/ai4paper,JavaScript,2128,37,2026-02-27T19:59:28Z,内置知识库 · 2.4 亿文献源 · PDF 全文翻译零配置 · AI 速搜文献 · AI 一键综述 · 小程序期刊订阅 · 原生支持 Zotero 7–10 | AI4Paper.pro
boxlite-ai/boxlite,Rust,2127,135,2025-12-07T22:49:32Z,"The micro-VM for AI agents — light enough to embed on your laptop, elastic enough to power an agenti"
carlvellotti/claude-code-pm-course,MDX,2126,348,2025-10-17T21:41:16Z,Interactive course teaching Product Managers how to use Claude Code effectively
LogicLabs-OU/OpenArchiver,TypeScript,2126,114,2025-07-10T10:30:55Z,An open-source platform for legally compliant email archiving.
the-ora/browser,Swift,2122,78,2025-08-09T22:25:31Z,"Less noise, more browsing."
badlogic/pi-skills,JavaScript,2122,194,2025-12-12T22:00:15Z,Skills for pi coding agent (compatible with Claude Code and Codex CLI)
team9ai/team9,TypeScript,2120,219,2025-12-25T09:20:23Z,"Team9 is a collaborative workspace for AI agents, currently built on OpenClaw and its ecosystem."
MineDojo/NitroGen,Python,2118,237,2025-12-17T17:03:47Z,A Foundation Model for Generalist Gaming Agents
ilysenko/codex-desktop-linux,JavaScript,2117,267,2026-02-05T07:57:25Z,Run OpenAI Codex Desktop on Linux - automated installer
vava-nessa/free-coding-models,HTML,2116,238,2026-02-20T23:12:50Z,"Find, benchmark and install in CLI 170+ FREE coding LLM models across 15+ providers in real time"
Liquid4All/cookbook,Jupyter Notebook,2115,343,2025-10-03T08:52:03Z,"Examples, end-2-end tutorials and apps built using Liquid AI Foundational Models (LFM) and the LEAP"
zhizhuodemao/js-reverse-mcp,TypeScript,2112,288,2025-11-29T15:42:31Z,AI Agent-first JS 逆向 MCP Server：有头 Chrome 调试、断点、网络/WebSocket 分析、Patchright 反检测，可选 CloakBrowser。
steipete/RepoBar,Swift,2110,129,2025-11-24T06:48:38Z,"Show status of GitHub Repos right in your menu bar and terminal: CI, Issues, Pull Requests, Latest R"
zachlatta/freeflow,Swift,2108,191,2026-02-15T20:47:25Z,Free & fast alternative to Wispr Flow
peteromallet/dataclaw,Python,2107,238,2026-02-24T20:33:55Z,Agent harness to publish your history from Claude Code et al. as Huggingface datasets.
jinchenma94/bazi-skill,Sin especificar,2107,371,2026-04-04T18:27:34Z,四柱八字命理分析
ciembor/agent-rules-books,Sin especificar,2106,349,2026-04-16T16:58:19Z,"AGENTS.md rules / skills for AI coding agents: Codex, Cursor & Claude Code. Inspired by Clean Code,"
Leanmcp/superview.sh,Shell,2106,2157,2026-03-31T09:17:51Z,See your claude code logs in clear details in your dashboard
yiyuan-jichang/dizhi,Sin especificar,2104,98,2025-11-23T09:52:11Z,一元机场官网
ps5-linux/ps5-linux-loader,C,2103,142,2026-04-24T13:19:30Z,Linux payload implementing HV exploits to run a custom bootloader
cytostack/openwolf,TypeScript,2103,182,2026-03-15T18:16:35Z,Sharper context. Fewer tokens. Open-source middleware for Claude Code.
ColeMurray/background-agents,TypeScript,2102,326,2026-01-25T18:45:47Z,An open-source background agents coding system
agno-agi/dash,Python,2101,239,2026-01-30T13:54:17Z,A self-learning data agent built with systems engineering principles. It grounds answers in 6 layers
mozilla-ai/any-llm,Python,2096,185,2025-07-14T15:38:20Z,Communicate with an LLM provider using a single interface
mgechev/skills-best-practices,Python,2096,160,2026-02-24T19:47:38Z,"Write professional-grade skills for agents, validate them using LLMs, and maintain a lean context wi"
BarutSRB/OmniWM,Swift,2096,74,2025-10-20T15:41:26Z,MacOS Niri and Hyprland inspired tiling window manager that's developer signed and notorized (safe f
ombharatiya/ai-system-design-guide,Sin especificar,2095,428,2025-12-16T11:05:49Z,AI system design guide for engineers building production AI systems and evals.
crshdn/mission-control,TypeScript,2094,436,2026-01-31T13:27:48Z,"The world's first Autonomous Product Engine (APE): AI agents research your market, generate features"
DingTalk-Real-AI/dingtalk-openclaw-connector,TypeScript,2094,209,2026-01-28T09:51:24Z,Official OpenClaw DingTalk channel plugin | 钉钉官方 OpenClaw 插件
DestinyLinker/MingLi-Bench,Python,2094,322,2026-04-22T15:32:29Z,A benchmark for evaluating LLMs on Chinese traditional fortune telling — Bazi (八字) and Ziwei Doushu
rushindrasinha/youtube-shorts-pipeline,Python,2092,505,2026-02-21T17:06:46Z,Automated YouTube Shorts pipeline: news → script → AI visuals → voiceover → captions → upload
stepfun-ai/Step-3.5-Flash,C++,2090,85,2026-01-31T02:57:03Z,"Fast, Sharp & Reliable Agentic Intelligence"
DenisSergeevitch/agents-best-practices,Sin especificar,2089,187,2026-05-15T21:32:21Z,"Provider-neutral Agent Skill for Codex, Claude Code, and agentic harness design."
jwadow/kiro-gateway,Python,2086,494,2025-12-13T00:36:49Z,👻 Proxy API gateway for Kiro IDE & CLI (Amazon Q Developer / AWS CodeWhisperer). Use free Claude mod
dembrandt/dembrandt,TypeScript,2086,205,2025-11-22T13:49:09Z,"Extract any website’s design system into tokens in seconds: logo, colors, typography, borders & more"
GAIR-NLP/daVinci-MagiHuman,Python,2081,213,2026-03-22T17:32:35Z,
Spu7Nix/obamify,Rust,2080,154,2025-09-01T07:37:08Z,revolutionary new technology that turns any image into obama
getkimchi/kimchi,TypeScript,2079,101,2026-04-07T16:44:41Z,Terminal coding agent powered by Kimchi's multi-model orchestration
MoonshotAI/Kimi-K2.5,Sin especificar,2079,263,2026-01-30T14:29:16Z,Moonshot's most powerful model
LeoYeAI/openclaw-master-skills,Python,2078,309,2026-03-02T02:02:25Z,🧠 Curated collection of 1209+ best OpenClaw skills — weekly updated by MyClaw.ai
amitshekhariitbhu/ai-engineering-interview-questions,Markdown,2076,381,2026-03-21T07:28:38Z,Your Cheat Sheet for AI Engineering Interview – Questions and Answers.
Kocoro-lab/Shannon,Go,2076,327,2025-08-29T10:53:48Z,A production-oriented multi-agent orchestration framework.
hgmzhn/manga-translator-ui,Python,2075,97,2025-08-30T19:43:04Z,基于 manga-image-translator 的开源漫画翻译工具。支持日/韩/美漫自动翻译，内置 OpenAI、Gemini 等 5 种翻译引擎，并提供可视化编辑器自由调整文本样式。一键安装，开
midday-ai/ai-sdk-tools,TypeScript,2074,205,2025-09-10T12:22:20Z,Essential utilities for building production-ready AI applications with Vercel AI SDK. State manageme
sdyckjq-lab/llm-wiki-skill,TypeScript,2072,262,2026-04-05T05:27:07Z,基于 Karpathy llm-wiki 方法论的个人知识库构建 Skill，支持多平台！
KartikLabhshetwar/better-shot,Swift,2071,113,2026-01-11T09:39:37Z,"An open-source alternative to CleanShot X for macOS. Capture, edit, and enhance your screenshots wit"
tractorjuice/arc-kit,JavaScript,2070,255,2025-10-14T10:25:11Z,"The Enterprise Architecture Governance Harness — strategy, architecture, delivery, and assurance for"
the-momentum/open-wearables,Python,2069,379,2025-10-30T15:47:04Z,Self-hosted platform to unify wearable health data through one AI-ready API.
NVIDIA-NeMo/DataDesigner,Python,2069,193,2025-10-16T15:01:31Z,🎨 NeMo Data Designer: Generate high-quality synthetic data from scratch or from seed data.
ulab-uiuc/LLMRouter,Python,2068,202,2025-10-07T22:22:55Z,LLMRouter: An Open-Source Library for LLM Routing
iamzhihuix/skills-manage,TypeScript,2068,188,2026-04-13T05:03:06Z,"Desktop app to manage AI coding agent skills across Claude Code, Cursor, Gemini CLI, Codex, and 20+"
iamlukethedev/Claw3D,TypeScript,2068,530,2026-03-15T03:32:58Z,"Claw3D is an open source 3D engine built on OpenClaw for creating games, simulations, and high-perfo"
torvalds/GuitarPedal,C,2067,83,2025-09-17T01:01:29Z,Linus learns analog circuits
saifyxpro/HeadlessX,TypeScript,2065,248,2025-09-12T18:11:48Z,The undetected self-hosted browser automation platform. Powered by Camoufox (Firefox) for 0% detecti
tinyfish-io/tinyfish-cookbook,TypeScript,2061,313,2026-01-22T19:41:14Z,A collection of sample apps and recipes built with the TinyFish web agent. Open-source examples for
cloudflare/skills,TypeScript,2061,183,2025-12-10T16:45:17Z,Skills for teaching agents how to build on Cloudflare.
llmsresearch/paperbanana,Python,2060,302,2026-02-04T14:46:47Z,Open source implementation and extension of Google Research’s PaperBanana for automated academic fig
itigges22/ATLAS,Python,2059,180,2026-02-01T03:52:49Z,Adaptive Test-time Learning and Autonomous Specialization
K-Dense-AI/claude-scientific-writer,Python,2057,247,2025-10-27T06:52:45Z,A general purpose scientific writer
AMAP-ML/SkillClaw,Python,2057,196,2026-04-10T03:25:47Z,Let Skills Evolve Collectively with Agentic Evolver
iannuttall/claude-agents,Sin especificar,2056,273,2025-07-25T11:06:39Z,Custom subagents to use with Claude Code.
pnnbao97/VieNeu-TTS,Python,2054,626,2025-10-28T14:07:23Z,Vietnamese TTS with instant voice cloning • On-device • Real-time CPU inference • 24kHz audio qualit
connorgallopo/Tracearr,TypeScript,2054,69,2025-11-28T01:47:35Z,"Real-time monitoring for Plex, Jellyfin, and Emby servers. Track streams, analyze playback, and dete"
zubair-trabzada/ai-marketing-claude,Python,2053,622,2026-03-02T01:09:47Z,"AI Marketing Suite for Claude Code. 15 marketing skills with parallel subagents — audit any website,"
she-llac/claude-counter,JavaScript,2050,238,2025-12-17T14:16:55Z,"A minimal browser extension that shows token count, cache timer, and usage bars on claude.ai."
Xiangyu-CAS/xiaohongshu-ops-skill,Sin especificar,2050,227,2026-02-16T07:10:54Z,把Openclaw 变成小红书运营助手，帮你分析、选题、创作、复盘、复刻，甚至全面托管
wxtsky/CodeIsland,Swift,2049,230,2026-04-06T06:29:27Z,
ZeroLu/awesome-seedance,Shell,2049,233,2026-02-10T03:17:40Z,The ultimate collection of high-fidelity Seedance 2.0 prompts and Seedance AI resources. Discover Se
wxyhgk/retain-pdf,Python,2048,245,2026-03-29T10:55:41Z,在保留版面、公式与结构的前提下进行 PDF 翻译，适用于科研与技术文档
appshubcc/Bettbox,Go,2048,73,2025-11-03T13:42:14Z,Another Better Mihomo Client
yyfz/Pi3,Python,2046,158,2025-07-16T09:41:37Z,[ICLR 2026] π^3: Permutation-Equivariant Visual Geometry Learning
perkfly/ex-skill,Python,2046,231,2026-03-31T07:05:23Z,前任 skill
pygod7/Authix,Python,2045,360,2025-10-16T12:22:11Z,"Authix is a discord AuthBot v3, imporved speed & quality. This tool helps you to backup your discord"
jingyaogong/minimind-o,Python,2045,236,2026-05-01T04:20:16Z,"🎙️ 「大模型」从0训练0.1B能听能说能看的全模态Omni模型！A 0.1B Omni model trained from scratch, capable of listening, speak"
acsandmann/rift,Rust,2045,70,2025-07-25T03:36:14Z,a tiling window manager for macos
sun-guannan/VectCutAPI,Python,2042,449,2025-07-11T10:03:18Z,Open Cut API.
op7418/Youtube-clipper-skill,Python,2042,305,2026-01-22T03:28:37Z,
Zafer-Liu/Data-Analysis-Agent,Python,2041,162,2026-04-21T06:04:19Z,🚀这是一个由 LLM 驱动的智能数据分析助手。通过对话式交互，自动生成可视化报表与商业洞察，让数据决策变得像聊天一样简单。  🚀 Say goodbye to complex SQL and Exce
GuDaStudio/skills,PowerShell,2036,100,2025-12-16T14:54:52Z,"This repository contains a collection of Agent Skills developed by GudaStudio, enabling seamless col"
trailofbits/claude-code-config,Shell,2035,153,2026-02-04T17:12:06Z,"Opinionated defaults, documentation, and workflows for Claude Code at Trail of Bits"
supabitapp/supacode,Swift,2034,249,2026-01-21T15:59:32Z,worktree coding agents command center.
cporter202/social-media-scraping-apis,JavaScript,2031,425,2026-01-20T16:44:05Z,"A curated collection of social media scraping APIs and tools for Instagram, LinkedIn, Twitter/X, Tik"
treadiehq/port-kill,Rust,2030,54,2025-08-24T02:58:20Z,Port Kill helps you find and free ports and caches blocking your dev work.
raphaelmansuy/edgequake,Rust,2028,234,2025-12-21T11:19:52Z,EdegQuake 🌋 High-performance GraphRAG inspired from LightRag written in Rust; Transform documents in
yaojingang/yao-meta-skill,Python,2027,186,2026-03-31T11:59:35Z,"YAO = Yielding AI Outcomes. A rigorous engineering, evaluation, governance, and portability system f"
grp06/openclaw-studio,TypeScript,2027,299,2026-01-28T19:25:48Z,"A clean web dashboard for OpenClaw. Connect your Gateway, manage agents, and ship faster. ⭐️ Star if"
google-github-actions/run-gemini-cli,TypeScript,2027,264,2025-07-11T15:49:11Z,A GitHub Action invoking the Gemini CLI.
JIA-Lab-research/DreamOmni2,Python,2025,173,2025-09-28T05:20:51Z,This project is the official implementation of 'DreamOmni2: Multimodal Instruction-based Editing and
facebookresearch/ai4animationpy,Python,2024,248,2026-02-03T18:18:34Z,A Python framework for AI-driven character animation using neural networks.
aagentah/nw_wrld,TypeScript,2024,187,2025-12-31T23:38:47Z,nw_wrld is an event-driven sequencer for triggering visuals using web technologies. It enables users
thelastoutpostworkshop/ESPConnect,Vue,2022,285,2025-10-26T22:38:26Z,"Zero-installation web application that lets you explore, back up, and manage your ESP32… right from"
Dicklesworthstone/mcp_agent_mail,Python,2019,212,2025-10-23T03:42:36Z,"Asynchronous coordination layer for AI coding agents: identities, inboxes, searchable threads, and a"
TestSprite/testsprite-cli,TypeScript,2014,72,2026-06-11T10:44:15Z,Official TestSprite CLI — AI-powered automated testing from your terminal
Nezreka/SoulSync,Python,2013,88,2025-07-09T19:07:58Z,Automated Music Discovery and Collection Manager
nv-tlabs/vipe,Python,2008,160,2025-08-11T00:19:56Z,ViPE: Video Pose Engine for Geometric 3D Perception
VictoriaMetrics/VictoriaLogs,Go,2005,150,2025-07-06T22:56:52Z,"Fast and easy to use database for logs, which can efficiently handle terabytes of logs"
0xsdeo/AntiDebug_Breaker,JavaScript,2005,284,2025-07-19T13:19:56Z,JavaScript Reverse Tools -- JS逆向工具
zts212653/clowder-ai,TypeScript,2003,539,2026-03-12T09:14:51Z,"Build AI teams, not just agents. Hard rails, soft power, shared mission."
tanbiralam/claude-code,TypeScript,2003,2680,2026-03-31T10:02:18Z,"Claude Code is an agentic coding tool that lives in your terminal, understands your codebase, and he"
hellodigua/code996,TypeScript,2003,77,2025-11-05T11:00:30Z,统计 Git 项目的 commit 时间分布，进而推导出项目的编码工作强度。  Analyzes the commit time distribution of Git projects to inf
chi111i/BypassAIGC,Python,2001,242,2025-11-02T14:09:42Z,论文润色，AIGC 降重工具(gptzero等检测网站)
smittix/intercept,Python,2000,262,2025-12-19T14:05:44Z,"iNTERCEPT, a free and open-source platform that unites the best signal intelligence tools into a sin"
chrisworsey55/atlas-gic,Python,2000,365,2026-03-11T18:51:14Z,ATLAS by General Intelligence Capital — Self-improving AI trading agents using Karpathy-style autore
NeuralNomadsAI/CodeNomad,TypeScript,1996,135,2025-11-01T23:29:24Z,CodeNomad: The command center that puts AI coding on steroids.
Roboparty/roboto_origin,Python,1995,271,2025-12-31T09:30:49Z,Roboto_origin Fully Open-Source DIY Humanoid Robot/萝博头原型机全开源手搓级人形机器人
memohai/Memoh,Go,1994,188,2026-01-12T09:27:39Z,"✨ The open-source multi-agent platform. Every agent gets its own computer, desktop, network, and lon"
rpamis/comet,TypeScript,1992,208,2026-05-14T09:22:35Z,Comet: agent skill harness phase-guarded automation from idea to archive
GuDaStudio/codexmcp,Python,1991,108,2025-11-05T16:46:30Z,"Enable seamless collaboration between Claude Code and Codex, transforming from a single agent to mul"
cnlimiter/codex-manager,Python,1990,749,2026-03-15T12:59:27Z,
datascale-ai/opentalking,Python,1986,394,2026-04-16T03:05:42Z,OpenTalking: An industrial-grade open-source AI digital human framework that supports real-time conv
xmanrui/OpenClaw-bot-review,TypeScript,1984,392,2026-02-17T17:26:06Z,A lightweight web dashboard for viewing all your OpenClaw Bots/Agents/Models/Sessions status at a gl
hyperspaceai/agi,Sin especificar,1983,239,2026-03-08T23:08:37Z,"The first distributed AGI system. Thousands of autonomous AI agents collaboratively train models, sh"
little-book-of/linear-algebra,Jupyter Notebook,1982,65,2025-09-02T03:28:30Z,"A concise, beginner-friendly introduction to the core ideas of linear algebra."
QwenLM/Qwen-Image-Layered,Python,1982,158,2025-12-18T08:54:50Z,Qwen-Image-Layered: Layered Decomposition for Inherent Editablity
jgravelle/jcodemunch-mcp,Python,1979,300,2026-02-09T01:58:27Z,"Cut AI token costs 95%+ on code exploration. The leading MCP server for precise, symbol-level GitHub"
jd-opensource/OxyGent,Python,1979,273,2025-07-18T02:40:42Z,"[ACL 2026] OxyGent: Making Multi-Agent Systems Modular, Observable, and Evolvable via Oxy Abstractio"
1sdv/TripStar,JavaScript,1973,226,2026-03-07T12:27:59Z,旅途星辰 (TripStar)是一个创新的 AI 文旅智能体应用，旨在解决用户在规划旅行时面临的各种问题，为提供一站式旅游攻略而生。
NuvioMedia/NuvioTV,Kotlin,1969,256,2026-02-01T14:25:02Z,Official Nuvio Android TV Repository
Doorman11991/smallcode,JavaScript,1969,151,2026-05-18T06:19:44Z,AI coding agent optimized for small LLMs. 87% benchmark with 4B-active model.
MatinSenPai/SenPaiScanner,Go,1968,101,2026-05-28T17:02:54Z,"A light-weight scanner for Cloudflare IPs, written in Golang"
MiniMax-AI/cli,TypeScript,1967,140,2026-03-25T15:34:45Z,"Generate text, images, video, speech, and music by MiniMax."
UZDoom/UZDoom,C++,1966,162,2025-10-14T15:41:42Z,"UZDoom is a feature centric port for all Doom engine games, based on GZDoom, adding an advanced rend"
leo-lilinxiao/codex-autoresearch,Python,1962,117,2026-03-18T02:20:03Z,Codex Autoresearch Skill — A self-directed iterative system for Codex that continuously cycles throu
hexo-ai/sia,Python,1962,241,2026-03-25T16:00:10Z,SIA is a Self Improving AI framework to autonomously improve the performance of any AI system (Model
bytetriper/RAE,Python,1962,86,2025-09-28T07:29:37Z,"Official PyTorch Implementation of ""Diffusion Transformers with Representation Autoencoders"""
antirez/iris.c,C,1962,141,2026-01-18T17:55:48Z,Flux 2 image generation model pure C inference
phuryn/claude-usage,Python,1961,362,2026-04-07T18:49:32Z,"A local dashboard for tracking your Claude Code token usage, costs, and session history. Pro and Max"
lenucksi/aur-malware-check,Python,1961,44,2026-06-12T13:17:07Z,Detection tools for the June 2026 atomic-lockfile AUR supply-chain attack. Consolidated from communi
glittercowboy/taches-cc-resources,TypeScript,1961,411,2025-11-13T18:02:17Z,A collection of my favorite custom Claude Code resources to make life easier.
xintaofei/codeg,TypeScript,1957,227,2026-02-09T09:22:50Z,"Collaborative multi-agent AI coding workspace: aggregate sessions from Claude Code, Codex, OpenCode,"
openclaw/openclaw-windows-node,C#,1957,237,2026-01-29T01:34:54Z,"Windows companion suite for OpenClaw - System Tray app, Shared library, Node, and PowerToys Command"
hexagonal-sun/moss-kernel,Rust,1954,88,2025-11-20T14:54:10Z,Rust Linux-compatible kernel
PKU-YuanGroup/Helios,Python,1954,156,2026-03-02T13:37:00Z,Helios: Real Real-Time Long Video Generation Model
Sophomoresty/gemini-web2api,Python,1953,455,2026-05-28T11:25:55Z,"Convert Google Gemini web into OpenAI-compatible API. Zero auth, cross-platform, single file."
dodo-reach/hermes-desktop,Swift,1951,145,2026-04-08T22:56:34Z,"The safest, simplest way to manage Hermes from your Mac. Pure SSH. No gateways, no exposed ports, no"
Gururagavendra/gmail-cleaner,Python,1951,118,2025-11-29T09:19:54Z,"web based GUI to cleanup gmail delete, mark as read, unsubsribe from uncessary things u dont like"
0xSteph/pentest-ai-agents,Shell,1951,386,2026-03-28T15:21:59Z,Turn Claude Code into your offensive security research assistant. Specialized AI subagents for autho
PVE-Tools/PVE-Tools-9,JavaScript,1950,233,2025-09-01T15:34:39Z,面向 Proxmox VE 9.x 的一键运维脚本，覆盖 VM 生命周期运维、宿主机网络 / 防火墙 / IPv6、GPU / PCI 直通、系统维护与第三方生态集成。
jherrodthomas/automotive-skills-suite,Sin especificar,1949,109,2026-05-01T10:30:37Z,"100+ installable Claude skills covering Engineering areas such as, ISO 26262 functional safety, ISO/"
forloopcodes/contextplus,TypeScript,1949,164,2026-02-27T12:12:20Z,Semantic Intelligence for Large-Scale Engineering. Context+ is an MCP server designed for developers
pmxt-dev/pmxt,TypeScript,1948,232,2026-01-08T20:24:39Z,"CCXT for prediction markets. PMXT is a unified API for trading on Polymarket, Kalshi, and more."
lupantech/AgentFlow,Python,1946,228,2025-09-27T02:17:05Z,AgentFlow: In-the-Flow Agentic System Optimization
comeonzhj/Auto-Redbook-Skills,Python,1946,242,2026-01-18T13:51:27Z,一个自动撰写小红书笔记，自动生成图片，自动发布的 Skills
afar1/fieldtheory-cli,TypeScript,1941,201,2026-04-03T16:36:36Z,"Field Theory CLI for bookmarks, Library, commands, and agent workflows"
duongductrong/Snapzy,Swift,1938,92,2026-01-15T19:29:33Z,An open-source native macOS screenshot and screen recording app. A CleanShot X alternative.
openai/chatkit-js,TypeScript,1937,182,2025-10-04T21:00:32Z,
brightbeanxyz/brightbean-studio,Python,1937,387,2026-03-25T11:16:28Z,"Open-source, self-hostable social media management platform. Schedule, publish, and manage content a"
Tong89/smartNode,Python,1937,173,2026-05-21T07:31:35Z,
southleft/figma-console-mcp,TypeScript,1936,212,2025-10-05T16:28:53Z,"Your design system as an API. Connect AI to Figma for extraction, creation, and debugging."
fccview/jotty,TypeScript,1934,112,2025-08-11T10:55:06Z,"Lightweight but powerful alternative for managing your personal, file based, notes and checklists."
MetapriseAI/OrgKernel,Python,1927,176,2026-03-25T07:21:32Z,"Open-source trust layer for AI agents — cryptographic agent identity (Ed25519), instance-scoped exec"
Draculabo/AntigravityManager,TypeScript,1927,242,2025-11-29T15:50:32Z,Antigravity Manager is a powerful Electron-based application designed to manage accounts and process
codedogQBY/ReadAny,TypeScript,1926,133,2026-02-25T16:59:27Z,
hero8152/Infinite-Canvas,Python,1925,377,2026-05-11T01:58:39Z,Supports comfyui/API calls/modelscope calls
Netflix/void-model,Python,1924,179,2026-03-26T16:56:49Z,
WildDataX/suppr-zotero-plugin,Sin especificar,1923,3,2025-07-19T13:17:38Z,"Translate PDF, Word, PowerPoint, etc. | zotero翻译插件，微信扫码注册，新用户可免费翻译25万汉字或100万个英文字母。超能文献官网:suppr.wildd"
Lingyan000/fluxdo,Dart,1923,81,2026-01-24T07:52:54Z,一个 Linux.do 第三方客户端
yjeanrenaud/yj_nearbyglasses,Kotlin,1920,87,2026-02-11T13:56:36Z,attempting to detect smart glasses nearby and warn you
Yuan-lab-LLM/ClawManager,Go,1920,148,2026-03-20T10:43:22Z,"A Kubernetes-native control plane for AI agent instance management, with governed AI access, runtime"
Luoyacheng/legado-E,Kotlin,1920,416,2025-07-25T08:21:33Z,阅读Sigma是legado的继承，保持开源免费，延续开源精神。
JingMatrix/TEESimulator,Kotlin,1920,217,2025-08-29T14:02:27Z,Software simulation for Android hardware-backed key pairs with key attestation
nook-browser/Nook,Swift,1919,74,2025-08-01T21:25:52Z,"A new browser, not owned by Atlassian."
renatoasse/opensquad,JavaScript,1918,492,2026-03-01T16:45:21Z,
knight-L/sc-datav,TypeScript,1916,408,2025-11-11T09:57:52Z,Three.js 可视化大屏，地理轮廓精确呈现3D地图
4thfever/cultivation-world-simulator,Python,1916,213,2025-08-18T15:09:49Z,基于 AI Agent 工作流的修仙世界模拟器，旨在还原智能、开放的仙侠世界。| An open-source Cultivation World Simulator using Agentic Wo
jdx/fnox,Rust,1915,93,2025-10-18T11:19:04Z,encrypted/remote secret manager
alpic-ai/skybridge,TypeScript,1915,119,2025-10-07T05:53:48Z,Skybridge is a full-stack TypeScript framework for MCP Apps and ChatGPT Apps. Type-safe. React-power
