repo_name,language,stars,forks,created_at,description
GeeeekExplorer/nano-vllm,Python,12846,1919,2025-06-09T16:22:14Z,Nano vLLM
xpzouying/xiaohongshu-mcp,Go,12818,1934,2025-08-03T09:08:45Z,MCP for xiaohongshu.com
ryoppippi/ccusage,TypeScript,12776,473,2025-05-29T16:56:50Z,A CLI tool for analyzing Claude Code/Codex CLI usage from local JSONL files.
yusufkaraaslan/Skill_Seekers,Python,12725,1315,2025-10-17T14:43:48Z,"Convert documentation websites, GitHub repositories, and PDFs into Claude AI skills with automatic c"
alam00000/bentopdf,JavaScript,12682,1020,2025-10-12T13:30:08Z,The Privacy First PDF Toolkit
fish2018/pansou,Go,12621,3020,2025-07-10T07:17:46Z,PanSou是一款高性能的网盘资源搜索API服务，支持TG频道和插件搜索。系统设计以性能和可扩展性为核心，支持多频道多插件并发搜索、结果智能排序和网盘类型分类。docker集成前后端，一键启动，开箱即
sapientinc/HRM,Python,12383,1801,2025-07-09T02:09:32Z,Hierarchical Reasoning Model Official Release
contains-studio/agents,Sin especificar,12347,2534,2025-07-28T14:42:35Z,sharing current agents in use
byJoey/cfnew,Sin especificar,12258,6076,2025-09-06T17:10:05Z,
Wei-Shaw/sub2api,Go,12177,2032,2025-12-18T02:26:18Z,Sub2API-CRS2 一站式开源中转服务，让 Claude、Openai 、Gemini、Antigravity订阅统一接入，支持拼车共享，更高效分摊成本，原生工具无缝使用。
NoFxAiOS/nofx,Go,11869,2914,2025-10-28T07:17:53Z,"Your personal AI trading assistant. Any market. Any model. Pay with USDC, not API keys."
OpenBMB/VoxCPM,Python,11769,1363,2025-09-16T03:41:49Z,"VoxCPM2: Tokenizer-Free TTS for Multilingual Speech Generation, Creative Voice Design, and True-to-L"
nearai/ironclaw,Rust,11718,1343,2026-02-03T06:57:10Z,IronClaw is OpenClaw inspired implementation in Rust focused on privacy and security
jd-opensource/joyagent-jdgenie,Java,11635,1604,2025-07-16T02:59:53Z,开源的端到端产品级通用智能体
sanbuphy/learn-coding-agent,Sin especificar,11594,19726,2026-03-31T09:07:08Z,Research on Coding Agents
OpenHub-Store/GitHub-Store,Kotlin,11436,404,2025-11-21T13:03:23Z,"🩵 A free, open-source app store for GitHub releases — browse, discover, and install apps with one cl"
HW-whistleblower/True-Story-of-Pangu,Sin especificar,11420,1326,2025-07-05T20:40:24Z,诺亚盘古大模型研发背后的真正的心酸与黑暗的故事。
BeehiveInnovations/pal-mcp-server,Python,11416,977,2025-06-08T15:36:50Z,The power of Claude Code / GeminiCLI / CodexCLI + [Gemini / OpenAI / OpenRouter / Azure / Grok / Oll
danielmiessler/Personal_AI_Infrastructure,TypeScript,11338,1582,2025-09-08T16:18:30Z,Agentic AI Infrastructure for magnifying HUMAN capabilities.
bytedance/trae-agent,Python,11328,1229,2025-06-13T12:05:15Z,Trae Agent is an LLM-based agent for general purpose software engineering tasks.
saturndec/waoowaoo,TypeScript,11265,2537,2026-01-22T12:09:36Z,首家工业级全流程 AI 影视生产平台。Industry-first professional AI Agent platform for controllable film & video produ
hangwin/mcp-chrome,TypeScript,11195,987,2025-06-09T09:07:06Z,Chrome MCP Server is a Chrome extension-based Model Context Protocol (MCP) server that exposes your 
anthropics/knowledge-work-plugins,Python,11154,1273,2026-01-23T20:11:54Z,Open source repository of plugins primarily intended for knowledge workers to use in Claude Cowork
travisvn/awesome-claude-skills,Sin especificar,11153,1118,2025-10-16T20:42:39Z,"A curated list of awesome Claude Skills, resources, and tools for customizing Claude AI workflows — "
aiming-lab/AutoResearchClaw,Python,11070,1267,2026-03-15T03:38:49Z,Fully autonomous & self-evolving research from idea to paper. Chat an Idea. Get a Paper. 🦞
JCodesMore/ai-website-cloner-template,TypeScript,11039,1584,2026-03-13T11:14:39Z,Clone any website with one command using AI coding agents
Wei-Shaw/claude-relay-service,JavaScript,10982,1644,2025-07-14T10:11:32Z,CRS-自建Claude Code镜像，一站式开源中转服务，让 Claude、OpenAI、Gemini、Droid 订阅统一接入，支持拼车共享，更高效分摊成本，原生工具无缝使用。
Tongyi-MAI/Z-Image,Python,10946,739,2025-11-26T09:18:10Z,
Usagi-org/ai-goofish-monitor,Python,10897,1548,2025-07-16T08:13:41Z,基于 Playwright 和AI实现的闲鱼多任务实时/定时监控与智能分析系统，配备了功能完善的后台管理UI。帮助用户从闲鱼海量商品中，找到心仪产品。
YouMind-OpenLab/awesome-nano-banana-pro-prompts,TypeScript,10884,1148,2025-11-23T07:17:48Z,"🍌 World's largest Nano Banana Pro prompt library — 10,000+ curated prompts with preview images, 16 l"
yichuan-w/LEANN,Python,10794,948,2025-06-09T06:52:59Z,"[MLsys2026]: RAG on Everything with LEANN. Enjoy 97% storage savings while running a fast, accurate,"
alirezarezvani/claude-skills,Python,10787,1370,2025-10-19T04:04:05Z,"232+ Claude Code skills & agent plugins for Claude Code, Codex, Gemini CLI, Cursor, and 8 more codin"
MoonshotAI/Kimi-K2,Sin especificar,10627,810,2025-07-03T12:28:22Z,Kimi K2 is the large language model series developed by Moonshot AI team
QwenLM/Qwen3-TTS,Python,10618,1379,2026-01-21T06:41:32Z,"Qwen3-TTS is an open-source series of TTS models developed by the Qwen team at Alibaba Cloud, suppor"
accomplish-ai/accomplish,TypeScript,10612,1259,2026-01-14T12:22:38Z,Accomplish™ is the open source Al coworker that lives on your desktop
steipete/CodexBar,Swift,10589,785,2025-11-16T17:00:44Z,"Show usage stats for OpenAI Codex and Claude Code, without having to login."
QuipNetwork/quip-protocol,Python,10406,151,2026-01-16T05:39:29Z,experimental quip protocol network node
browseros-ai/BrowserOS,TypeScript,10401,1021,2025-05-18T16:23:54Z,"🌐 The open-source Agentic browser; alternative to ChatGPT Atlas, Perplexity Comet, Dia."
teng-lin/notebooklm-py,Python,10379,1364,2026-01-07T15:27:19Z,Unofficial Python API and agentic skill for Google NotebookLM. Full programmatic access to NotebookL
nikopueringer/CorridorKey,Python,10365,621,2026-02-25T08:51:11Z,Perfect Green Screen Keys
Open-Dev-Society/OpenStock,TypeScript,10345,1384,2025-09-28T18:16:32Z,"OpenStock is an open-source alternative to expensive market platforms. Track real-time prices, set p"
RunanywhereAI/runanywhere-sdks,C++,10338,352,2025-07-22T01:23:34Z,Production ready toolkit to run AI locally
anomalyco/opentui,TypeScript,10330,505,2025-07-21T09:35:54Z,OpenTUI is a library for building terminal user interfaces (TUIs)
ValueCell-ai/valuecell,Python,10323,1758,2025-09-01T09:07:06Z,"ValueCell is a community-driven, multi-agent platform for financial applications."
MiniMax-AI/skills,C#,10236,871,2026-03-17T07:19:25Z,
aden-hive/hive,Python,10190,5642,2026-01-12T00:04:22Z,Multi-Agent Harness for Production AI
multica-ai/multica,TypeScript,10172,1277,2026-01-13T17:59:46Z,"The open-source managed agents platform. Turn coding agents into real teammates — assign tasks, trac"
huggingface/skills,Python,10166,632,2025-11-24T07:31:48Z,Give your agents the power of the Hugging Face ecosystem
QuipNetwork/ethereum-sdk,TypeScript,10133,68,2025-04-16T04:02:20Z,
NoeFabris/opencode-antigravity-auth,TypeScript,10100,724,2025-12-09T23:46:18Z,Enable Opencode to authenticate against Antigravity (Google's IDE) via OAuth so you can use Antigrav
facebookresearch/dinov3,Jupyter Notebook,10091,810,2025-08-07T14:11:34Z,Reference PyTorch implementation and models for DINOv3
QuipNetwork/cpp-sdk,C++,10047,42,2025-06-20T17:34:30Z,
chatfire-AI/huobao-drama,TypeScript,10021,1888,2026-01-05T11:38:30Z,🎬 火宝短剧 - 基于AI的一站式短剧生成平台 《一句话生成完整短剧，从剧本到成片全自动化》  Huobao Drama - An AI-Powered End-to-End Short Drama 
QuipNetwork/hashsigs-py,Python,9975,22,2025-08-27T17:25:50Z,
alibaba/OpenSandbox,Python,9962,777,2025-12-17T08:41:09Z,"Secure, Fast, and Extensible Sandbox runtime for AI agents."
pascalorg/editor,TypeScript,9924,1285,2025-10-16T19:35:06Z,Create and share 3D architectural projects.
phuryn/pm-skills,Sin especificar,9860,1088,2026-03-01T23:33:44Z,"PM Skills Marketplace: 100+ agentic skills, commands, and plugins — from discovery to strategy, exec"
cloudflare/moltworker,TypeScript,9823,1788,2026-01-27T11:09:39Z,"Run OpenClaw, (formerly Moltbot, formerly Clawdbot) on Cloudflare Workers"
microsoft/vscode-copilot-chat,TypeScript,9796,1835,2025-06-10T16:21:19Z,Copilot Chat extension for VS Code
microsoft/magentic-ui,Python,9766,972,2025-05-05T20:24:30Z,A research prototype of a human-centered web agent
siteboon/claudecodeui,TypeScript,9745,1296,2025-06-25T12:51:12Z,"Use Claude Code, Cursor CLI or Codex on mobile and web with CloudCLI (aka Claude Code UI). CloudCLI "
ZeroLu/awesome-nanobanana-pro,Sin especificar,9724,821,2025-11-10T13:51:03Z,🚀 An awesome list of curated Nano Banana pro prompts and examples. Your go-to resource for mastering
jundot/omlx,Python,9698,832,2026-02-13T14:13:27Z,LLM inference server with continuous batching & SSD caching for Apple Silicon — managed from the mac
numman-ali/openskills,TypeScript,9695,609,2025-10-26T19:43:54Z,Universal skills loader for AI coding agents - npm i -g openskills
iflytek/astron-agent,Java,9649,970,2025-09-19T08:46:01Z,"Enterprise-grade, commercial-friendly agentic workflow platform for building next-generation SuperAg"
superset-sh/superset,TypeScript,9504,754,2025-10-21T09:16:51Z,"Code Editor for the AI Agents Era - Run an army of Claude Code, Codex, etc. on your machine"
langchain-ai/open-swe,Python,9490,1065,2025-05-21T21:44:24Z,An Open-Source Asynchronous Coding Agent
diet103/claude-code-infrastructure-showcase,Shell,9452,1207,2025-10-30T03:12:16Z,"Examples of my Claude Code infrastructure with skill auto-activation, hooks, and agents"
microsoft/agent-framework,Python,9396,1535,2025-04-28T19:40:42Z,"A framework for building, orchestrating and deploying AI agents and multi-agent workflows with suppo"
chaitin/PandaWiki,TypeScript,9324,885,2025-05-15T12:55:40Z,PandaWiki 是一款 AI 大模型驱动的开源知识库搭建系统，帮助你快速构建智能化的 产品文档、技术文档、FAQ、博客系统，借助大模型的力量为你提供 AI 创作、AI 问答、AI 搜索等能力。
alibaba/zvec,C++,9300,531,2025-12-05T07:45:38Z,"A lightweight, lightning-fast, in-process vector database"
alchaincyf/nuwa-skill,Python,9232,1527,2026-04-05T04:33:04Z,你想蒸馏的下一个员工，何必是同事。蒸馏任何人的思维方式——心智模型、决策启发式、表达DNA。Distill how anyone thinks.
HKUDS/OpenHarness,Python,9211,1600,2026-04-01T15:37:13Z,"""OpenHarness: Open Agent Harness with a Built-in Personal Agent--Ohmo!"""
tirth8205/code-review-graph,Python,9209,1061,2026-02-26T17:25:13Z,Local knowledge graph for Claude Code. Builds a persistent map of your codebase so Claude reads only
NVIDIA/personaplex,Python,9151,1288,2026-01-05T19:10:35Z,PersonaPlex code.
emdash-cms/emdash,TypeScript,9135,724,2026-04-01T08:45:02Z,EmDash is a full-stack TypeScript CMS based on Astro; the spiritual successor to WordPress
ace-step/ACE-Step-1.5,Python,9088,1045,2025-09-04T02:00:07Z,"The most powerful local music generation model that outperforms almost all commercial alternatives, "
vectorize-io/hindsight,Python,9083,539,2025-10-30T11:49:48Z,Hindsight: Agent Memory That  Learns
Kuberwastaken/claurst,Rust,8973,7733,2026-03-31T09:23:58Z,"Your favorite Terminal Coding Agent, now in Rust"
facebookresearch/sam3,Python,8936,1302,2025-07-17T16:15:40Z,The repository provides code for running inference and finetuning with the Meta Segment Anything Mod
bytedance/Dolphin,Python,8887,754,2025-05-13T09:20:19Z,"The official repo for “Dolphin: Document Image Parsing via Heterogeneous Anchor Prompting”, ACL, 202"
KrishKrosh/TrackWeight,Swift,8861,385,2025-07-21T05:55:02Z,Use your Mac trackpad as a weighing scale
ChinaSiro/claude-code-sourcemap,TypeScript,8817,14425,2026-03-31T08:15:54Z,
Donchitos/Claude-Code-Game-Studios,Shell,8791,1361,2026-02-12T05:21:38Z,"Turn Claude Code into a full game dev studio — 48 AI agents, 36 workflow skills, and a complete coor"
pingdotgg/t3code,TypeScript,8785,1576,2026-02-08T23:46:22Z,
calesthio/Crucix,JavaScript,8747,1389,2026-03-14T07:33:06Z,Your personal intelligence agent. Watches the world from multiple data sources and pings you when so
davidkimai/Context-Engineering,Python,8714,973,2025-06-29T00:16:36Z,"""Context engineering is the delicate art and science of filling the context window with just the rig"
lukilabs/beautiful-mermaid,TypeScript,8711,281,2026-01-28T16:31:46Z,
pinchtab/pinchtab,Go,8698,634,2026-02-15T11:12:33Z,High-performance browser automation bridge and multi-instance orchestrator with advanced stealth inj
Piebald-AI/claude-code-system-prompts,JavaScript,8653,1596,2025-11-18T21:26:33Z,"All parts of Claude Code's system prompt, 24 builtin tool descriptions, sub agent prompts (Plan/Expl"
frankbria/ralph-claude-code,Shell,8631,648,2025-08-27T16:03:45Z,Autonomous AI development loop for Claude Code with intelligent exit detection
datalab-to/chandra,Python,8564,876,2025-10-08T21:34:16Z,"OCR model that handles complex tables, forms, handwriting with full layout."
apple/containerization,Swift,8464,269,2025-05-29T17:15:44Z,Containerization is a Swift package for running Linux containers on macOS.
BehiSecc/awesome-claude-skills,Sin especificar,8394,989,2025-10-17T15:05:35Z,A curated list of Claude Skills.
github/copilot-sdk,TypeScript,8367,1109,2026-01-14T00:23:22Z,Multi-platform SDK for integrating GitHub Copilot Agent into apps and services
MoonTechLab/LunaTV,TypeScript,8342,8261,2025-08-12T13:59:33Z,本项目采用 CC BY-NC-SA 协议，禁止任何商业化行为，任何衍生项目必须保留本项目地址并以相同协议开源
MemTensor/MemOS,Python,8331,732,2025-07-06T09:51:27Z,"AI memory OS for LLM and Agent systems(moltbot,clawdbot,openclaw), enabling persistent Skill memory "
rednote-hilab/dots.ocr,Python,8259,744,2025-07-30T11:03:59Z,Multilingual Document Layout Parsing in a Single Vision-Language Model
Leonxlnx/taste-skill,Sin especificar,8233,843,2026-02-19T21:44:05Z,"Taste-Skill (High-Agency Frontend) - gives your AI good taste. stops the AI from generating boring, "
Lum1104/Understand-Anything,TypeScript,8227,686,2026-03-15T02:30:51Z,"Graphs that teach > graphs that impress. Turn any code, or knowledge base (Karpathy LLM wiki), into "
fluxerapp/fluxer,TypeScript,8213,458,2026-01-01T21:09:14Z,"A free and open source instant messaging and VoIP platform built for friends, groups, and communitie"
Jeffallan/claude-skills,Python,8160,648,2025-10-20T20:27:22Z,66 Specialized Skills for Full-Stack Developers. Transform Claude Code into your expert pair program
MiroMindAI/MiroThinker,Python,8104,604,2025-08-07T13:32:12Z,MiroThinker is a deep research agent optimized for complex research and prediction tasks. Our latest
apple/ml-sharp,Python,8083,581,2025-12-12T03:46:09Z,Sharp Monocular View Synthesis in Less Than a Second
0x4m4/hexstrike-ai,Python,8044,1760,2025-07-10T17:53:18Z,"HexStrike AI MCP Agents is an advanced MCP server that lets AI agents (Claude, GPT, Copilot, etc.) a"
boson-ai/higgs-audio,Python,8020,618,2025-07-20T05:25:27Z,Text-audio foundation model from Boson AI
nexmoe/VidBee,TypeScript,7961,570,2025-10-22T13:43:42Z,Download videos from almost any website worldwide
VoltAgent/voltagent,TypeScript,7957,785,2025-04-16T15:41:18Z,AI Agent Engineering Platform built on an Open Source TypeScript AI Agent Framework
automazeio/ccpm,Shell,7952,804,2025-08-18T23:20:08Z,Project management skill system for Agents that uses GitHub Issues and Git worktrees for parallel ag
HKUDS/ClawWork,Python,7944,1031,2026-02-15T16:41:38Z,"""ClawWork: OpenClaw as Your AI Coworker - 💰 $15K earned in 11 Hours"""
openclaw/clawhub,TypeScript,7925,1214,2026-01-03T13:49:41Z,Skill Directory for OpenClaw
mmulet/term.everything,Go,7921,190,2025-09-07T02:52:48Z,Run any GUI app in the terminal❗
jamez-bondos/awesome-gpt4o-images,JavaScript,7860,1788,2025-04-13T15:34:48Z,Awesome curated collection of images and prompts generated by GPT-4o and gpt-image-1. Explore AI gen
slavingia/skills,Sin especificar,7793,783,2026-03-23T19:16:00Z,Claude Code skills based on The Minimalist Entrepreneur by Sahil Lavingia
cloudflare/vinext,TypeScript,7793,303,2026-02-24T05:07:41Z,Vite plugin that reimplements the Next.js API surface — deploy anywhere
QwenLM/Qwen-Image,Python,7771,479,2025-08-03T11:03:25Z,Qwen-Image is a powerful image generation foundation model capable of complex text rendering and pre
paoloanzn/free-code,TypeScript,7758,1715,2026-03-31T11:11:49Z,"[NOTE] Parent repo is migrating ownership, until the operation is done this repo is blocked. The fre"
MoonshotAI/kimi-cli,Python,7757,840,2025-10-15T12:58:03Z,Kimi Code CLI is your next CLI agent.
webadderall/Recordly,TypeScript,7708,581,2026-03-12T23:38:32Z,Create polished screen recordings for free. An open-source alternative to Screen Studio.
zumerlab/snapdom,JavaScript,7682,276,2025-04-27T11:01:19Z,"SnapDOM: Next-generation DOM capture engine — fast, modular, extensible."
snarktank/ai-dev-tasks,Sin especificar,7677,1741,2025-04-19T15:45:58Z,A simple task management system for managing AI dev agents
GetStream/Vision-Agents,Python,7658,624,2025-08-11T18:02:04Z,Open Vision Agents by Stream. Build Vision Agents quickly with any model or video provider. Uses Str
YishenTu/claudian,TypeScript,7654,460,2025-12-05T17:58:26Z,An Obsidian plugin that embeds Claude Code as an AI collaborator in your vault
larksuite/cli,Go,7597,470,2026-03-25T07:13:30Z,"The official Lark/Feishu CLI tool, maintained by the larksuite team — built for humans and AI Agents"
google/adk-go,Go,7532,635,2025-05-05T17:16:26Z,"An open-source, code-first Go toolkit for building, evaluating, and deploying sophisticated AI agent"
Maciek-roboblog/Claude-Code-Usage-Monitor,Python,7522,376,2025-06-19T00:00:05Z,Real-time Claude Code usage monitor with predictions and warnings
ykdojo/claude-code-tips,JavaScript,7516,535,2025-11-28T00:52:00Z,"45 tips for getting the most out of Claude Code, from basics to advanced - includes a custom status "
InsForge/InsForge,TypeScript,7509,613,2025-07-29T05:56:00Z,Give agents everything they need to ship fullstack apps. The backend built for agentic development. 
nicobailon/visual-explainer,HTML,7495,512,2026-02-16T19:33:52Z,"Agent skill that generates rich HTML pages or slide decks for diagrams, diff reviews, plan audits, d"
hicccc77/WeFlow,TypeScript,7477,1877,2026-01-07T13:40:57Z,WeFlow - 一个本地的微信聊天记录导出和年度报告应用
anthropics/financial-services-plugins,Python,7447,933,2026-02-23T19:24:50Z,
LuckyOne7777/LLM-Trading-Lab,Python,7429,1571,2025-07-10T01:57:36Z,This repo powers my experiment where ChatGPT manages a real-money micro-cap stock portfolio.
pickle-com/glass,JavaScript,7375,1095,2025-07-02T20:28:49Z,Digital Mind Extension
apple/ml-fastvlm,Python,7306,547,2025-05-01T22:56:43Z,"This repository contains the official implementation of ""FastVLM: Efficient Vision Encoding for Visi"
sirmalloc/ccstatusline,TypeScript,7212,308,2025-08-08T11:19:28Z,"🚀 Beautiful highly customizable statusline for Claude Code CLI with powerline support, themes, and m"
nullclaw/nullclaw,Zig,7184,841,2026-02-16T21:17:27Z,"Fastest, smallest, and fully autonomous AI assistant infrastructure written in Zig"
Snouzy/workout-cool,TypeScript,7181,569,2025-06-11T13:19:26Z,"🏋 Modern open-source fitness coaching platform. Create workout plans, track progress, and access a c"
vicinaehq/vicinae,C++,7169,184,2025-07-28T03:49:03Z,"A focused launcher for your desktop - native, fast, extensible"
ZyperWave/ZyperWinOptimize,C#,7162,427,2025-08-05T01:46:41Z,ZyperWin++是一个轻便的Windows优化工具，适用于Win7-Win11最新版的优化，包括性能优化、服务项优化、垃圾清理等操作，还支持系统激活和Office快速安装。
lucasgelfond/zerobrew,Rust,7110,164,2026-01-19T12:42:04Z,A 5-20x faster experimental Homebrew alternative
mksglu/context-mode,TypeScript,7102,485,2026-02-23T05:56:28Z,"Context window optimization for AI coding agents. Sandboxes tool output, 98% reduction. 12 platforms"
vudovn/antigravity-kit,TypeScript,7055,1398,2026-01-14T09:06:28Z,
anthropics/claude-code-action,TypeScript,7038,1702,2025-05-19T15:26:50Z,
AnmolSaini16/mapcn,TypeScript,7033,368,2025-12-28T10:57:22Z,"Beautiful map components. 100% Free, Zero config, one command setup."
garrytan/gbrain,TypeScript,7015,749,2026-04-05T14:40:56Z,Garry's Opinionated OpenClaw/Hermes Agent Brain
francescopace/espectre,Python,7010,559,2025-10-26T10:41:51Z,"🛜 ESPectre 👻  - Motion detection system based on Wi-Fi spectre analysis (CSI), with Home Assistant i"
aidenybai/react-grab,TypeScript,6962,316,2025-10-17T10:08:55Z,Select context for coding agents directly from your website
Done-0/fuck-u-code,TypeScript,6881,326,2025-06-25T16:40:22Z,Legacy-Mess Detector – assess the “legacy-mess level” of your code and output a beautiful report
vercel-labs/portless,TypeScript,6843,217,2026-02-15T14:43:03Z,"Replace port numbers with stable, named local URLs. For humans and agents."
justlovemaki/AIClient-2-API,JavaScript,6825,1031,2025-07-20T07:05:56Z,"Simulates Gemini CLI, Antigravity, Codex, Grok, and Kiro client requests, compatible with the OpenAI"
steipete/gogcli,Go,6815,522,2025-12-12T12:36:45Z,"Google Suite CLI: Gmail, GCal, GDrive, GContacts."
53AI/53AIHub,Go,6762,660,2025-04-24T11:24:11Z,"53AI Hub is an open-source AI portal, which enables you to quickly build a operational-level AI port"
HBAI-Ltd/Toonflow-app,HTML,6754,1081,2026-01-29T10:25:45Z,Toonflow 是一款 AI 短剧漫剧工具，能够利用 AI 技术将小说自动转化为剧本，并结合 AI 生成的图片和视频，实现高效的短剧创作。借助 Toonflow，可以轻松完成从文字到影像的全流程，让
SkyworkAI/SkyReels-V2,Python,6749,1418,2025-04-15T10:16:25Z,SkyReels-V2: Infinite-length Film Generative model
tonyantony300/alt-sendme,TypeScript,6719,416,2025-10-17T09:08:25Z,"Send files and folders anywhere in the world without storing in cloud - any size, any format, no acc"
ringhyacinth/Star-Office-UI,HTML,6707,728,2026-02-26T03:45:35Z,A pixel office for your OpenClaw: turn invisible work states into a cozy little space with character
Orchestra-Research/AI-Research-SKILLs,TeX,6698,522,2025-11-03T06:13:06Z,Comprehensive open-source library of AI research and engineering skills for any AI model. Package th
ultraworkers/claw-code-parity,Rust,6665,5427,2026-04-02T05:39:02Z,Join Discord: https://discord.gg/5TUQKqFWd /  claw-code Rust port parity work - it is temporary work
Lake1059/FFmpegFreeUI,Visual Basic .NET,6664,364,2025-05-17T14:28:35Z,3FUI 是 ffmpeg 在 Windows 上的轻度专业交互外壳，收录大量参数，界面美观，交互友好。此项目面向国内使用环境，让普通人也能够轻松压制视频和转换格式。
maderix/ANE,Objective-C,6582,920,2026-02-28T09:27:28Z,Training neural networks on Apple Neural Engine via reverse-engineered private APIs
Yuliang-Liu/MonkeyOCR,Python,6579,460,2025-06-03T06:25:31Z,A lightweight LMM-based Document Parsing Model
stagewise-io/stagewise,TypeScript,6524,459,2025-04-26T12:43:16Z,The coding agent built for the web. stagewise is a purpose-built browser for developers with a codin
pablodelucca/pixel-agents,TypeScript,6493,947,2026-02-08T19:14:11Z,Pixel office.
ValueCell-ai/ClawX,TypeScript,6458,927,2026-02-05T13:58:36Z,ClawX is a desktop app that provides a graphical interface for OpenClaw AI agents. It turns CLI-base
SamsungSAILMontreal/TinyRecursiveModels,Python,6447,1004,2025-10-07T13:24:28Z,
Jackywine/Bella,JavaScript,6437,991,2025-07-16T06:14:09Z,Bella is best
wanshuiyin/Auto-claude-code-research-in-sleep,Python,6431,601,2026-03-10T07:31:45Z,ARIS ⚔️ (Auto-Research-In-Sleep) — Lightweight Markdown-only skills for autonomous ML research: cros
facebookresearch/sam-3d-objects,Python,6423,761,2025-09-29T20:46:40Z,SAM 3D Objects
databasus/databasus,Go,6376,327,2025-06-05T13:10:03Z,"Database backup tool (PostgreSQL, MySQL\MariaDB and MongoDB)"
CyberTimon/RapidRAW,TypeScript,6367,234,2025-06-13T20:16:40Z,"A beautiful, non-destructive, and GPU-accelerated RAW image editor built with performance in mind."
superdesigndev/superdesign,TypeScript,6289,696,2025-06-20T05:34:47Z,AI Product Design Agent - Open Source
hotheadhacker/no-as-a-service,JavaScript,6286,404,2025-04-29T19:56:36Z,No-as-a-Service (NaaS) is a simple API that returns a random rejection reason. Use it when you need 
anthropics/claude-agent-sdk-python,Python,6286,877,2025-06-11T21:33:43Z,
maillab/cloud-mail,JavaScript,6279,6630,2025-04-24T11:36:56Z,A Cloudflare-based email service  | 基于 Cloudflare 的邮箱服务  | Cloudflare Email 邮箱 Mail
iflytek/astron-rpa,Java,6241,652,2025-09-20T08:51:40Z,Agent-ready RPA suite with out-of-the-box automation tools. Built for individuals and enterprises.
ComposioHQ/agent-orchestrator,TypeScript,6201,838,2026-02-13T09:52:36Z," Agentic orchestrator for parallel coding agents — plans tasks, spawns agents, and autonomously hand"
MCLCE/MinecraftConsoles,C++,6200,1190,2026-03-01T04:13:25Z,Vanilla LCE intended as an upstream base for other projects. Based originally on a WIP version of th
BlockRunAI/ClawRouter,TypeScript,6189,542,2026-02-03T17:32:00Z,"The agent-native LLM router for OpenClaw. 41+ models, <1ms routing, USDC payments on Base & Solana v"
millionco/react-doctor,TypeScript,6185,190,2026-02-13T09:02:13Z,Let coding agents diagnose and fix your React code
nlweb-ai/NLWeb,Python,6177,688,2025-04-28T20:44:02Z,"Main reference implementation for NLWeb, implemented in Python."
TheTom/turboquant_plus,Python,6174,850,2026-03-25T01:35:36Z,
nicotsx/zerobyte,TypeScript,6123,154,2025-08-09T08:58:56Z,Backup automation for self-hosters. Built on top of restic
