repo_name,language,stars,forks,created_at,description
tbphp/gpt-load,Go,6120,628,2025-06-06T16:04:32Z,Multi-channel AI proxy with intelligent key rotation. 智能密钥轮询的多渠道 AI 代理。
KaringX/clashmi,Dart,6120,387,2025-04-14T13:37:30Z,Clash Mihomo for iOS/MacOS/Android/Windows/Linux
11cafe/jaaz,TypeScript,6098,588,2025-06-01T14:53:08Z,The world's first open-source multimodal creative assistant  This is a substitute for Canva and Manu
datawhalechina/all-in-rag,Python,6066,3001,2025-06-05T08:12:35Z,🔍大模型应用开发实战一：RAG 技术全栈指南，在线阅读地址：https://datawhalechina.github.io/all-in-rag/
jnMetaCode/agency-agents-zh,Shell,6049,1151,2026-03-06T11:11:51Z,🎭 193 个即插即用的 AI 专家角色 — 支持 OpenClaw/Hermes Agent/Claude Code/Cursor/Copilot 等 16 种工具，覆盖工程/设计/营销/产品等 1
EdoStra/Marketing-for-Founders,Sin especificar,6044,567,2025-05-19T13:29:04Z,Practical marketing resources to get the first 10 / 100 / 1000 users for your SaaS / App / Startup
agentcodee/cursor-free-everyday,Rust,6002,554,2025-05-14T07:24:05Z,"完全免费, 自动获取新账号,一键重置新额度,  解决机器码问题, 自动满额度"
MeiGen-AI/InfiniteTalk,Python,5977,1033,2025-08-14T01:04:53Z,​​Unlimited-length talking video generation​​ that supports image-to-video and video-to-video genera
op7418/Humanizer-zh,Sin especificar,5977,499,2026-01-19T04:23:44Z,Humanizer 的汉化版本，Claude Code Skills，旨在消除文本中 AI 生成的痕迹。
algorithmicsuperintelligence/openevolve,Python,5958,947,2025-05-15T11:46:52Z,Open-source implementation of AlphaEvolve
openai/openai-cs-agents-demo,Python,5952,920,2025-06-14T03:07:09Z,Demo of a customer service use case implemented with the OpenAI Agents SDK
JerryZLiu/Dayflow,Swift,5922,306,2025-09-23T01:58:21Z,The automatic work journal. Privately turns your screen into a timeline of what you actually accompl
UfoMiao/zcf,TypeScript,5909,412,2025-07-30T06:09:00Z,Zero-Config Code Flow for Claude code & Codex
zilliztech/claude-context,TypeScript,5906,523,2025-06-06T02:12:47Z,Code search MCP for Claude Code. Make entire codebase the context for any coding agent.
dataease/SQLBot,JavaScript,5894,676,2025-04-21T05:33:53Z,🔥 基于大模型和 RAG 的智能问数系统，对话式数据分析神器。Text-to-SQL Generation via LLMs using RAG.
NanmiCoder/cc-haha,TypeScript,5890,6251,2026-03-31T17:30:14Z,Claude Code 泄露源码 - 本地可运行版本（附带核心模块解析）
TheCraigHewitt/seomachine,Python,5877,831,2025-10-29T20:50:23Z,"A specialized Claude Code workspace for creating long-form, SEO-optimized blog content for any busin"
zai-org/GLM-OCR,Python,5848,535,2026-02-02T12:59:43Z,GLM-OCR: Accurate ×  Fast × Comprehensive
dwzhu-pku/PaperBanana,Python,5821,414,2026-01-30T06:55:48Z,PaperBanana: Automating Academic Illustration For AI Scientists
ByteDance-Seed/Bagel,Python,5802,513,2025-04-17T06:54:07Z,Open-source unified multimodal model
DearVa/Everywhere,C#,5795,351,2025-04-23T08:19:33Z,"Context-aware AI assistant for your desktop. Ready to respond intelligently, seamlessly integrating "
ChrisWiles/claude-code-showcase,JavaScript,5782,522,2026-01-06T18:51:02Z,"Comprehensive Claude Code project configuration example with hooks, skills, agents, commands, and Gi"
Lightricks/LTX-2,Python,5774,892,2026-01-03T13:16:29Z,Official Python inference and LoRA trainer package for the LTX-2 audio–video generative model.
PleasePrompto/notebooklm-skill,Python,5775,620,2025-10-19T05:36:13Z,Use this skill to enable Claude Code to communicate directly with your Google NotebookLM notebooks. 
SawyerHood/dev-browser,TypeScript,5725,378,2025-12-02T19:20:20Z,A Claude Skill to give your agent the ability to use a web browser
bellard/mquickjs,C,5719,213,2025-12-22T14:20:32Z,Public repository of the Micro QuickJS Javascript Engine
Klavis-AI/klavis,Python,5707,545,2025-04-14T07:53:36Z,Klavis AI:  MCP integration platforms that let AI agents use tools reliably at any scale
JackChen-me/open-multi-agent,TypeScript,5678,2248,2026-03-31T19:07:34Z,"TypeScript multi-agent framework — one runTeam() call from goal to result. Auto task decomposition, "
lintsinghua/DeepAudit,Python,5672,693,2025-09-19T15:53:48Z,DeepAudit：人人拥有的 AI 黑客战队，让漏洞挖掘触手可及。国内首个开源的代码漏洞挖掘多智能体系统。小白一键部署运行，自主协作审计 + 自动化沙箱 PoC 验证。支持 Ollama 私有部署 
steipete/agent-rules,Shell,5670,514,2025-06-12T11:10:14Z,Rules and Knowledge to work better with agents such as Claude Code or Cursor
wassupjay/n8n-free-templates,Sin especificar,5645,1546,2025-05-19T05:03:45Z, A curated set of 200+ plug-and-play n8n workflows that fuse classic automation with today’s AI stac
AvengeMedia/DankMaterialShell,QML,5637,357,2025-07-10T15:18:23Z,"Desktop shell for wayland compositors built with Quickshell & GO, optimized for niri, hyprland, sway"
hellodigua/ChatLab,TypeScript,5635,1290,2025-11-26T05:54:26Z,"Rediscover your social memories with local, AI-powered analysis. 本地化的聊天记录分析工具，通过 AI Agent 回顾你的社交记忆。"
JefferyHcool/BiliNote,Python,5627,713,2025-04-13T09:41:22Z,AI 视频笔记生成工具 让 AI 为你的视频做笔记
bwya77/vscode-dark-islands,PowerShell,5619,188,2026-02-14T05:06:12Z,VSCode theme based off the easemate IDE and Jetbrains islands theme
strands-agents/sdk-python,Python,5612,773,2025-05-14T19:59:51Z,A model-driven approach to building AI agents in just a few lines of code.
ronitsingh10/FineTune,Swift,5601,179,2026-01-18T19:29:15Z,"FineTune, a macOS menu bar app for per-app volume control, multi-device output, audio routing, and 1"
gsd-build/gsd-2,TypeScript,5589,588,2026-03-11T04:28:49Z,"A powerful meta-prompting, context engineering and spec-driven development system that enables agent"
steipete/summarize,TypeScript,5569,349,2025-12-17T12:19:51Z,Point at any URL/YouTube/Podcast or file. Get the gist. CLI and Chrome Extension.
jamwithai/production-agentic-rag-course,Python,5565,1336,2025-08-06T19:52:50Z,
IAmTomShaw/f1-race-replay,Python,5557,740,2025-11-21T17:37:05Z,An interactive Formula 1 race visualisation and data analysis tool built with Python! 🏎️
ngxson/smolvlm-realtime-webcam,HTML,5544,892,2025-05-12T17:24:38Z,Real-time webcam demo with SmolVLM and llama.cpp server
noctalia-dev/noctalia-shell,QML,5543,414,2025-07-11T10:50:50Z,A sleek and minimal desktop shell thoughtfully crafted for Wayland.
datawhalechina/easy-vibe,JavaScript,5542,534,2025-12-28T16:45:28Z,💻 vibe coding 2026 | Your first modern programming course for beginners to master step by step.
tvytlx/ai-agent-deep-dive,Python,5490,1611,2026-03-31T11:27:01Z,AI Agent 源码深度研究报告
zubair-trabzada/geo-seo-claude,Python,5464,896,2026-02-18T09:01:07Z,GEO-first SEO skill for Claude Code. Comprehensive AI search optimization for any website — citabili
alchaincyf/zhangxuefeng-skill,Sin especificar,5454,1846,2026-04-05T11:37:18Z,张雪峰.skill — 张雪峰的认知操作系统。高考志愿/考研/职业规划的实战思维框架。由女娲.skill生成。
Lakr233/vphone-cli,Swift,5451,835,2026-02-26T11:29:08Z,
ghuntley/how-to-build-a-coding-agent,Go,5435,620,2025-07-24T03:56:29Z,"A workshop that teaches you how to build your own coding agent. Similar to Roo code, Cline, Amp, Cur"
21st-dev/1code,TypeScript,5428,584,2026-01-14T02:12:40Z,"Orchestration layer for coding agents (Claude Code, Codex)"
coze-dev/coze-loop,Go,5410,746,2025-06-24T00:26:28Z,Next-generation AI Agent Optimization Platform: Cozeloop addresses challenges in AI agent developmen
permissionlesstech/bitchat-android,Kotlin,5368,725,2025-07-08T18:36:23Z,"bluetooth mesh chat, IRC vibes"
MrLesk/Backlog.md,TypeScript,5334,287,2025-06-04T19:43:33Z,Backlog.md - A tool for managing project collaboration between humans and AI Agents in a git ecosyst
microsoft/TRELLIS.2,Python,5330,625,2025-11-26T10:04:35Z,Native and Compact Structured Latents for 3D Generation
donlon/cloudflare-error-page,HTML,5322,282,2025-11-19T12:00:12Z,✅Browser ❌Cloudflare ✅Host — Generator of customized Cloudflare error pages (unofficial)
getarcaneapp/arcane,Go,5290,183,2025-04-19T00:43:29Z,"Modern Docker Management, Designed for Everyone"
666OS/ClashMac,Sin especificar,5287,207,2025-11-28T04:41:02Z,Native Proxy Experience Built for macOS
THUDM/slime,Python,5264,713,2025-06-18T07:15:54Z,slime is an LLM post-training framework for RL Scaling.
volcengine/MineContext,Python,5237,386,2025-06-24T11:15:21Z,MineContext is your proactive context-aware AI partner（Context-Engineering+ChatGPT Pulse）
op7418/CodePilot,TypeScript,5222,559,2026-02-06T12:38:55Z,"A multi-model AI agent desktop client — connect any AI provider, extend with MCP & skills, control f"
orion-lib/OrionTV,TypeScript,5220,1799,2025-06-28T05:05:24Z,一个基于 React Native TVOS 和 Expo 构建的播放器，旨在提供流畅的视频观看体验。
BigBodyCobain/Shadowbroker,TypeScript,5184,778,2026-03-05T03:59:55Z,Open-source intelligence for the global theater. Track everything from the corporate/private jets of
sohzm/cheating-daddy,JavaScript,5178,888,2025-05-28T22:50:20Z,a free and opensource app that lets you gain an unfair advantage
mengxi-ream/read-frog,TypeScript,5166,334,2025-04-16T23:32:59Z,🐸 Read Frog - Open Source Immersive Translate | 🐸 陪读蛙 - 开源沉浸式翻译
mindfold-ai/Trellis,Python,5165,289,2026-01-26T11:49:10Z,The best agent harness.
utkarshdalal/GameNative,Kotlin,5162,202,2025-04-21T11:25:27Z,"Native PC gaming with Steam, Epic, GOG and Amazon integrations on Android"
memovai/mimiclaw,C,5150,752,2026-02-04T04:25:33Z,MimiClaw: Run OpenClaw on a $5 chip. No OS(Linux). No Node.js. No Mac mini. No Raspberry Pi. No VPS.
neuphonic/neutts,Python,5147,563,2025-10-02T12:48:55Z,On-device TTS model by Neuphonic
iflow-ai/iflow-cli,Shell,5133,407,2025-07-27T02:38:21Z,"iFlow cli is a comprehensive command-line intelligence that embeds in your terminal, analyzes your r"
HisMax/RedInk,Python,5121,973,2025-11-25T10:12:54Z,"Red Ink - A one-stop Xiaohongshu image-and-text generator based on the 🍌Nano Banana Pro🍌, ""One Sente"
Facepunch/sbox-public,C#,5121,440,2025-11-24T08:18:33Z,"s&box is a modern game engine, built on Valve's Source 2 and the latest .NET technology, it provides"
awesome-opencode/awesome-opencode,JavaScript,5112,326,2025-09-22T00:01:14Z,"A curated list of awesome plugins, themes, agents, projects, and resources for https://opencode.ai"
HKUDS/OpenSpace,Python,5111,618,2026-03-24T08:01:49Z,"""OpenSpace: Make Your Agents: Smarter, Low-Cost, Self-Evolving"" -- Community: https://open-space.clo"
CursorTouch/Windows-MCP,Python,5097,647,2025-05-13T02:27:53Z,MCP Server for Computer Use in Windows
knadh/oat,CSS,5078,239,2026-01-15T05:49:47Z,"Ultra-lightweight, zero dependency, semantic HTML, CSS, JS UI library. ~8KB min+gz."
chenhg5/cc-connect,Go,5054,454,2026-02-28T02:39:39Z,"Bridge local AI coding agents (Claude Code, Cursor, Gemini CLI, Codex) to messaging platforms (Feish"
nidhinjs/prompt-master,Sin especificar,5031,499,2026-03-11T16:25:43Z,A Claude skill that writes the accurate prompts for any AI tool. Zero tokens or credits wasted. Full
sentient-agi/ROMA,Python,5026,770,2025-05-12T19:35:31Z,Recursive-Open-Meta-Agent v0.1 (Beta). A meta-agent framework to build high-performance multi-agent 
Kodezi/Chronos,Java,5001,213,2025-07-21T07:34:10Z,Kodezi Chronos is a debugging-first language model that achieves state-of-the-art results on SWE-ben
Hammer1/cozeworkflows,Sin especificar,4994,1929,2025-07-27T13:42:07Z,coze 的200+工作流合集汇总，一直更新
netease-youdao/LobsterAI,TypeScript,4992,748,2026-02-12T09:56:20Z,Your 24/7 all-scenario AI agent that gets work done for you.
vercel/streamdown,TypeScript,4985,254,2025-08-15T01:52:01Z,"A drop-in replacement for react-markdown, designed for AI-powered streaming."
Vector-Wangel/XLeRobot,Python,4979,538,2025-04-26T02:27:05Z,XLeRobot: Practical Dual-Arm Mobile Home Robot for $660
srizzon/git-city,TypeScript,4970,241,2026-02-20T16:11:55Z,Your GitHub profile as a 3D pixel art building in an interactive city
ByteDance-Seed/Depth-Anything-3,Python,4968,515,2025-11-12T08:44:03Z,Depth Anything 3
cloudflare/vibesdk,TypeScript,4938,1182,2025-08-25T15:07:31Z,"An open-source vibe coding platform that helps you build your own vibe-coding platform, built entire"
osaurus-ai/osaurus,Swift,4937,238,2025-08-17T15:05:39Z,"Own your AI. The native macOS harness for AI agents -- any model, persistent memory, autonomous exec"
tiajinsha/JKVideo,TypeScript,4928,2944,2026-03-06T04:58:45Z,
shareAI-lab/Kode-Agent,TypeScript,4914,745,2025-07-12T14:21:51Z,Kode Agent — Design for post-human workflows. One unit agent for every human & computer task.
microsoft/fara,Python,4888,457,2025-10-29T16:23:22Z,Fara-7B: An Efficient Agentic Model for Computer Use
Gen-Verse/OpenClaw-RL,Python,4874,509,2026-02-26T12:57:42Z,OpenClaw-RL: Train any agent simply by talking
Flowseal/tg-ws-proxy,Python,4871,220,2026-03-04T14:10:26Z,Local MTProto proxy server for partial bypassing of Telegram loading
gommzystudio/device-activity-tracker,TypeScript,4848,671,2025-12-07T14:56:14Z,"A phone number can reveal whether a device is active, in standby or offline (and more). This PoC dem"
MatrixSeven/file-transfer-go,TypeScript,4839,617,2025-07-28T10:11:01Z,Go/React开发的端到端webrtc的文件传输/文字传输/桌面共享，安全，隐私，数据不经过服务器。
NVIDIA/OpenShell,Rust,4835,514,2026-02-24T22:52:22Z,"OpenShell is the safe, private runtime for autonomous AI agents."
hugohe3/ppt-master,Python,4826,563,2025-12-10T06:54:33Z,"AI generates natively editable PPTX from any document — real PowerPoint shapes, not images — no desi"
huggingface/nanoVLM,Python,4801,482,2025-05-02T18:08:12Z,"The simplest, fastest repository for training/finetuning small-sized VLMs."
antvis/Infographic,TypeScript,4799,347,2025-09-11T11:13:39Z,"🦋 An Infographic Generation and Rendering Framework, bring words to life with AI!"
BIT-DataLab/Edit-Banana,Python,4775,320,2026-01-16T10:34:52Z,Edit Banana: A framework for converting statistical formats into editable.
openai/parameter-golf,Python,4770,3154,2026-02-09T06:22:45Z,Train the smallest LM you can that fits in 16MB. Best model wins!
dtyq/magic,TypeScript,4747,507,2025-05-14T22:04:29Z,Magicrew. The first open-source all-in-one AI productivity platform (Generalist AI Agent + Workflow 
rdev/liquid-glass-react,TypeScript,4746,313,2025-06-10T22:48:35Z,Apple's Liquid Glass effect for React
eze-is/web-access,JavaScript,4738,328,2026-03-18T05:54:57Z,给 Claude Code 装上完整联网能力的 skill：三层通道调度 + 浏览器 CDP + 并行分治
apple/embedding-atlas,TypeScript,4732,287,2025-05-07T00:56:44Z,Embedding Atlas is a tool that provides interactive visualizations for large embeddings. It allows y
scanopy/scanopy,Rust,4727,222,2025-09-29T18:37:20Z,Network diagrams that update themselves
getcompanion-ai/feynman,TypeScript,4725,582,2026-03-19T18:53:05Z,
HKUDS/ClawTeam,Python,4723,644,2026-03-17T14:42:46Z,"""ClawTeam: Agent Swarm Intelligence"" (One Command → Full Automation)"
psviderski/unregistry,Go,4719,83,2025-06-03T01:48:51Z,Push docker images directly to remote servers without an external registry
breaking-brake/cc-wf-studio,TypeScript,4711,531,2025-11-01T16:04:15Z,CC Workflow Studio
productdevbook/port-killer,Swift,4709,177,2025-12-16T01:44:50Z,"A powerful cross-platform port management tool for developers. Monitor ports, manage Kubernetes port"
AgriciDaniel/claude-seo,Python,4693,706,2026-02-07T08:17:38Z,"Universal SEO skill for Claude Code. 19 sub-skills, 12 subagents, 3 extensions (DataForSEO, Firecraw"
Diorser/LiteMonitor,C#,4665,190,2025-11-10T12:58:51Z,"一款轻量级、高度可定制的 Windows桌面和任务栏硬件性能监控工具，支持监测 CPU、GPU、内存、磁盘、网速、FPS 计数、插件扩展及内存清理。A lightweight, customizabl"
presenton/presenton,TypeScript,4660,911,2025-05-10T14:12:46Z,"Open-Source AI Presentation Generator and API (Gamma, Beautiful AI, Decktopus Alternative)"
0xGF/boneyard,TypeScript,4656,174,2026-04-01T15:25:45Z,Auto generated skeleton loading framework
MCP-UI-Org/mcp-ui,TypeScript,4622,345,2025-05-13T22:41:43Z,UI over MCP. Create next-gen UI experiences with the protocol and SDK!
cactus-compute/cactus,C,4620,353,2025-04-23T14:33:43Z,Low-latency AI engine for mobile devices & wearables
RICHQAQ/PasteMD,Python,4594,278,2025-10-25T14:18:34Z,一键将 Markdown 和网页 AI 对话（ChatGPT/DeepSeek等）完美粘贴到 Word、WPS 和 Excel 的效率工具 | One-click paste Markdown and
unhappychoice/gitlogue,Rust,4573,100,2025-11-08T21:22:33Z,"A cinematic Git commit replay tool for the terminal, turning your Git history into a living, animate"
antfu/skills,TypeScript,4567,238,2026-01-28T05:59:03Z,Anthony Fu's curated collection of agent skills.
MoonshotAI/Kimi-Audio,Python,4562,343,2025-04-25T10:00:18Z,"Kimi-Audio, an open-source audio foundation model excelling in audio understanding, generation, and "
IRS-Public/direct-file,JavaScript,4551,1367,2025-05-19T16:46:38Z,Direct File
yonggekkk/argosbx,Shell,4539,1969,2025-04-22T01:46:41Z,小白自建代理神器！ArgoSBX一键无交互小钢炮脚本💣：Sing-box、Xray、Argo三内核自动搭配；支持VPS、Docker、容器多环境部署；套CDN的5大方案+套WARP的15种组合；已支持
su-kaka/gcli2api,Python,4521,1270,2025-08-14T11:54:36Z,将 GeminiCLI 和 Antigravity 转换为 OpenAI 、GEMINI 和 Claude API 接口
dmtrKovalenko/fff.nvim,Rust,4520,185,2025-07-31T22:01:49Z,"The fastest and the most accurate file search toolkit for AI agents, Neovim, Rust, C, and NodeJS"
trailofbits/skills,Python,4518,393,2026-01-14T18:23:21Z,"Trail of Bits Claude Code skills for security research, vulnerability detection, and audit workflows"
datawhalechina/vibe-vibe,Dockerfile,4517,370,2025-11-28T10:30:29Z,"AI for All: The First Systematic Vibe Coding Tutorial | From Zero to Full-Stack, Bring Your Ideas to"
ThePrimeagen/99,Lua,4511,232,2025-11-22T18:47:43Z,Neovim AI agent done right
TencentCloudADP/youtu-agent,Python,4500,462,2025-08-21T07:58:13Z,A simple yet powerful agent framework that delivers with open-source models
Dammyjay93/interface-design,Shell,4496,308,2026-01-05T00:41:45Z,"Design engineering for Claude Code. Craft, memory, and enforcement for consistent UI."
hotheadhacker/seedbox-lite,JavaScript,4485,338,2025-08-09T14:00:22Z,A light-weight torrent media center at one place.
campfirein/byterover-cli,TypeScript,4445,430,2025-06-19T22:40:22Z,ByteRover CLI (brv) - The portable memory layer for  autonomous coding agents (formerly Cipher)
PeonPing/peon-ping,Shell,4432,312,2026-02-09T23:12:48Z,"Warcraft III Peon voice notifications (+ more!) for Claude Code, Codex, IDEs, and any AI agent. Stop"
epiral/bb-browser,TypeScript,4416,424,2026-01-31T03:55:42Z,Your browser is the API. CLI + MCP server for AI agents to control Chrome with your login state.
microsoft/BASIC-M6502,Assembly,4413,495,2025-07-16T17:24:03Z,Microsoft BASIC for 6502 Microprocessor - Version 1.1
elder-plinius/G0DM0D3,TypeScript,4412,1015,2026-03-25T17:43:02Z,LIBERATED AI CHAT
going-doer/Paper2Code,Python,4411,633,2025-04-25T07:58:12Z,Paper2Code: Automating Code Generation from Scientific Papers in Machine Learning
amantus-ai/vibetunnel,TypeScript,4395,320,2025-06-15T17:56:11Z,Turn any browser into your terminal & command your agents on the go.
therealXiaomanChu/ex-skill,Python,4387,441,2026-03-31T09:36:56Z,把前任蒸馏成 AI Skill，用ta的方式跟你说话。
Arthur-Ficial/apfel,Swift,4379,165,2026-03-24T19:07:22Z,"The free AI already on your Mac. CLI tool, OpenAI-compatible server, and interactive chat — all on-d"
Tencent-Hunyuan/HunyuanVideo-1.5,Python,4369,217,2025-11-20T06:15:42Z,HunyuanVideo-1.5: A leading lightweight video generation model
google-labs-code/stitch-skills,TypeScript,4369,505,2026-01-16T17:17:17Z,
elder-plinius/OBLITERATUS,Python,4365,808,2026-03-03T19:37:51Z,OBLITERATE THE CHAINS THAT BIND YOU
max-sixty/worktrunk,Rust,4353,146,2025-10-17T22:13:14Z,"Worktrunk is a CLI for Git worktree management, designed for parallel AI agent workflows"
modelcontextprotocol/go-sdk,Go,4349,403,2025-04-23T10:07:33Z,The official Go SDK for Model Context Protocol servers and clients. Maintained in collaboration with
torvalds/AudioNoise,C,4327,204,2026-01-09T02:33:29Z,Random digital audio effects
mukul975/Anthropic-Cybersecurity-Skills,Python,4319,473,2026-02-25T09:47:50Z,"754 structured cybersecurity skills for AI agents · Mapped to 5 frameworks: MITRE ATT&CK, NIST CSF 2"
zai-org/GLM-4.5,Python,4315,448,2025-07-20T09:24:09Z,"GLM-4.5: Agentic, Reasoning, and Coding (ARC) Foundation Models"
buildermethods/agent-os,Shell,4312,717,2025-07-16T21:28:59Z,Agent OS is a system for injecting your codebase standards and writing better specs for spec-driven 
m1heng/clawdbot-feishu,TypeScript,4311,460,2026-01-25T18:19:30Z,
ace-step/ACE-Step,Python,4310,541,2025-04-28T07:03:09Z,ACE-Step: A Step Towards Music Generation Foundation Model
newton-physics/newton,Python,4307,445,2025-04-22T04:12:07Z,"An open-source, GPU-accelerated physics simulation engine built upon NVIDIA Warp, specifically targe"
taigrr/spank,Go,4306,219,2026-02-23T00:43:05Z,"Slap your MacBook, it yells back. Uses Apple Silicon accelerometer via IOKit HID."
ModelEngine-Group/nexent,Python,4304,570,2025-04-28T10:44:33Z,Nexent is a zero-code platform for auto-generating production-grade AI agents using Harness Engineer
czlonkowski/n8n-skills,Shell,4301,765,2025-10-20T05:51:27Z,n8n skillset for Claude Code to build flawless n8n workflows
jlcodes99/cockpit-tools,Rust,4301,389,2026-01-16T07:09:32Z, 🚀 通用 AI IDE 账号管理工具：支持 Antigravity / Codex / GitHub Copilot / Windsurf / Kiro / Cursor / Gemini-cli 
jlcodes99/vscode-antigravity-cockpit,TypeScript,4299,121,2025-12-08T02:24:15Z,"VS Code extension for monitoring Google Antigravity AI quotas. Features Webview dashboard, QuickPick"
nibzard/awesome-agentic-patterns,HTML,4299,358,2025-05-31T11:20:41Z,A curated catalogue of awesome agentic AI patterns
PancakeTAS/lsfg-vk,C++,4290,101,2025-06-28T08:52:08Z,Lossless Scaling Frame Generation on Linux
github/gh-aw,Go,4288,353,2025-08-12T17:40:41Z,GitHub Agentic Workflows
deepseek-ai/Engram,Python,4271,312,2026-01-12T05:26:50Z,Conditional Memory via Scalable Lookup: A New Axis of Sparsity for Large Language Models
basecamp/once-campfire,Ruby,4266,717,2025-08-15T09:57:36Z,"Super simple group chat, without a subscription"
openai/harmony,Rust,4265,264,2025-07-31T16:10:01Z,Renderer for the harmony response format to be used with gpt-oss
vllm-project/vllm-omni,Python,4260,741,2025-09-11T00:34:43Z,A framework for efficient model inference with omni-modality models
Martian-Engineering/lossless-claw,TypeScript,4258,353,2026-02-18T23:36:36Z,Lossless Claw — LCM (Lossless Context Management) plugin for OpenClaw
denizsafak/abogen,Python,4248,265,2025-04-24T01:06:05Z,"Generate audiobooks from EPUBs, PDFs and text with synchronized captions."
komari-monitor/komari,Go,4245,399,2025-04-19T16:34:16Z,A simple server monitor tool.
Narcooo/inkos,TypeScript,4233,802,2026-03-12T02:12:54Z,"Autonomous novel writing CLI AI Agent — agents write, audit, and revise novels with human review gat"
agent-infra/sandbox,Python,4233,360,2025-08-06T14:51:05Z,"All-in-One Sandbox for AI Agents that combines Browser, Shell, File, MCP and VSCode Server in a sing"
nguyenphutrong/quotio,Swift,4230,263,2025-12-24T14:42:00Z,"Stop juggling AI accounts. Quotio is a beautiful native macOS menu bar app that unifies your Claude,"
anthropics/claude-code-security-review,Python,4227,376,2025-08-04T16:07:27Z,An AI-powered security review GitHub Action using Claude to analyze code changes for security vulner
zensical/zensical,Rust,4197,98,2025-05-18T09:07:43Z,A modern static site generator by the Material for MkDocs team
p2r3/bareiron,C,4187,234,2025-08-12T00:45:13Z,Minimalist Minecraft server for memory-restrictive embedded systems
run-llama/liteparse,TypeScript,4187,279,2026-02-09T22:16:30Z,"A fast, helpful, and open-source document parser"
chenyme/grok2api,Python,4185,1494,2025-10-10T09:00:02Z,Grok2API 是一个基于 FastAPI 构建的 Grok 网关，支持将 Grok Web 能力以 OpenAI 兼容 API 的方式转换。
linuxhsj/openclaw-zero-token,TypeScript,4183,973,2026-02-23T06:27:57Z,OpenClaw: Use All Major AI Models NO API Token! Claude/ChatGPT/Gemini/DeepSeek/Doubao/Grok/Qwen/Manu
CortexReach/memory-lancedb-pro,TypeScript,4162,692,2026-02-24T08:38:15Z,"Enhanced LanceDB memory plugin for OpenClaw — Hybrid Retrieval (Vector + BM25), Cross-Encoder Rerank"
zenc-lang/zenc,C,4156,210,2026-01-11T15:08:19Z,"Write like a high-level language, run like C."
mitchellh/vouch,Nushell,4153,73,2026-02-05T20:50:58Z,A community trust management system based on explicit vouches to participate.
vijaythecoder/awesome-claude-agents,Sin especificar,4150,497,2025-07-26T17:18:06Z,An orchestrated sub agent dev team powered by claude code
drona23/claude-token-efficient,Sin especificar,4136,292,2026-03-30T12:59:07Z,One CLAUDE.md file. Keeps Claude responses terse. Reduces output verbosity on heavy workflows. Drop-
open-pencil/open-pencil,TypeScript,4134,348,2026-02-27T12:48:35Z,AI-native design editor. Open-source Figma alternative.
backnotprop/plannotator,TypeScript,4128,276,2025-12-28T02:09:40Z,"Annotate and review coding agent plans and code diffs visually, share with your team, send feedback "
mauriceboe/TREK,TypeScript,4122,376,2026-03-19T11:51:54Z,"A self-hosted travel/trip planner with real-time collaboration, interactive maps, PWA support, SSO, "
Pimzino/spec-workflow-mcp,TypeScript,4111,339,2025-08-07T13:18:06Z,A Model Context Protocol (MCP) server that provides structured spec-driven development workflow tool
