repo_name,language,stars,forks,created_at,description
LuckyOne7777/LLM-Trading-Lab,Python,7458,1569,2025-07-10T01:57:36Z,This repo powers my experiment where ChatGPT manages a real-money micro-cap stock portfolio.
ronitsingh10/FineTune,Swift,7439,246,2026-01-18T19:29:15Z,"FineTune, a macOS menu bar app for per-app volume control, multi-device output, audio routing, and 1"
getagentseal/codeburn,TypeScript,7416,557,2026-04-13T22:11:53Z,"See where your AI coding tokens go. Interactive TUI dashboard for Claude Code, Codex, and Cursor cos"
walkinglabs/learn-harness-engineering,TypeScript,7387,763,2026-03-29T12:28:19Z,"Harness engineering official style beginner tutorial, from 0 to 1"
rmyndharis/OpenWA,TypeScript,7371,1547,2026-02-02T12:14:45Z,"Free, Open Source, Self-Hosted WhatsApp API Gateway"
ComposioHQ/agent-orchestrator,TypeScript,7357,998,2026-02-13T09:52:36Z," Agentic orchestrator for parallel coding agents — plans tasks, spawns agents, and autonomously hand"
ValueCell-ai/ClawX,TypeScript,7346,1093,2026-02-05T13:58:36Z,ClawX is a desktop app that provides a graphical interface for OpenClaw AI agents. It turns CLI-base
lucasgelfond/zerobrew,Rust,7328,172,2026-01-19T12:42:04Z,A 5-20x faster experimental Homebrew alternative
aidenybai/react-grab,TypeScript,7272,330,2025-10-17T10:08:55Z,Copy any UI element for your agent
yizhiyanhua-ai/fireworks-tech-graph,Python,7271,635,2026-04-10T15:07:10Z,"Generate production-quality SVG+PNG technical diagrams from natural language. 7 styles, UML support,"
ringhyacinth/Star-Office-UI,HTML,7212,778,2026-02-26T03:45:35Z,A pixel office for your OpenClaw: turn invisible work states into a cozy little space with character
noctalia-dev/noctalia-shell,QML,7191,495,2025-07-11T10:50:50Z,A sleek and minimal desktop shell thoughtfully crafted for Wayland.
anthropics/claude-agent-sdk-python,Python,7139,1059,2025-06-11T21:33:43Z,
elder-plinius/G0DM0D3,TypeScript,7119,1654,2026-03-25T17:43:02Z,LIBERATED AI CHAT
AnInsomniacy/motrix-next,TypeScript,7112,218,2026-03-04T00:46:49Z,A full-featured download manager — rebuilt from the ground up
brokermr810/QuantDinger,Python,7079,1538,2025-12-28T18:39:26Z,"AI quantitative trading platform for crypto, stocks, and forex with backtesting, live trading, marke"
getpaseo/paseo,TypeScript,7072,685,2025-10-13T12:27:02Z,"Coding agents from your phone, desktop and CLI"
TheCraigHewitt/seomachine,Python,7065,960,2025-10-29T20:50:23Z,"A specialized Claude Code workspace for creating long-form, SEO-optimized blog content for any busin"
greensock/gsap-skills,Sin especificar,7033,437,2026-03-04T17:22:35Z,Official AI skills for GSAP. These skills teach AI coding agents how to correctly use GSAP (GreenSoc
databasus/databasus,Go,7031,380,2025-06-05T13:10:03Z,PostgreSQL backup tool with Point-In-Time-Recovery and restore verification
Lightricks/LTX-2,Python,7020,1134,2026-01-03T13:16:29Z,Official Python inference and LoRA trainer package for the LTX-2 audio–video generative model.
Done-0/fuck-u-code,TypeScript,7020,326,2025-06-25T16:40:22Z,Legacy-Mess Detector – assess the “legacy-mess level” of your code and output a beautiful report
dmtrKovalenko/fff,Rust,7011,297,2025-07-31T22:01:49Z,"The fastest and the most accurate file search toolkit for AI agents, Neovim, Rust, C, and NodeJS"
eze-is/web-access,JavaScript,7004,525,2026-03-18T05:54:57Z,给 Claude Code 装上完整联网能力的 skill：三层通道调度 + 浏览器 CDP + 并行分治
YouMind-OpenLab/awesome-gpt-image-2,TypeScript,6965,625,2026-04-16T13:57:42Z,"🚀 World's largest GPT Image 2 prompt library, updated daily — 2000+ curated prompts with preview ima"
Robbyant/lingbot-map,Python,6947,685,2026-04-15T17:59:48Z,A feed-forward 3D foundation model for reconstructing scenes from streaming data
tashfeenahmed/freellmapi,TypeScript,6914,1103,2026-04-21T13:38:59Z,OpenAI-compatible proxy that stacks the free tiers of 16 LLM providers (~1.7B tokens/month) behind o
TheTom/turboquant_plus,Python,6897,916,2026-03-25T01:35:36Z,
EKKOLearnAI/hermes-web-ui,TypeScript,6877,850,2026-04-11T07:38:18Z,"Web dashboard for Hermes Agent — multi-platform AI chat, session management, scheduled jobs, usage a"
ConardLi/garden-skills,CSS,6876,943,2026-04-21T11:56:17Z,"ConardLi's open-source Skills collection, featuring web design, knowledge retrieval, image generatio"
k2-fsa/OmniVoice,Python,6872,1036,2026-03-31T12:00:45Z,High-Quality Voice Cloning TTS for 600+ Languages
davebcn87/pi-autoresearch,TypeScript,6871,407,2026-03-11T20:25:53Z,Autonomous experiment loop extension for pi
zai-org/GLM-OCR,Python,6863,633,2026-02-02T12:59:43Z,GLM-OCR: Accurate ×  Fast × Comprehensive
freestylefly/awesome-gpt-image-2,JavaScript,6849,915,2026-04-25T09:19:13Z,Prompt as Code | GPT-Image2 工业级提示词引擎与模板库，470+ 个案例逆向工程，20+ 套工业级模板，并提炼出Skills，持续更新中
Narcooo/inkos,TypeScript,6807,1291,2026-03-12T02:12:54Z,"Autonomous novel writing AI Agent — agents write, audit, and revise novels with human review gates"
1jehuang/jcode,Rust,6806,758,2026-01-05T09:43:36Z,Coding Agent Harness
Flowseal/tg-ws-proxy,Python,6784,339,2026-03-04T14:10:26Z,Local MTProto proxy server for partial bypassing of Telegram loading
PleasePrompto/notebooklm-skill,Python,6783,771,2025-10-19T05:36:13Z,Use this skill to enable Claude Code to communicate directly with your Google NotebookLM notebooks. 
MeiGen-AI/InfiniteTalk,Python,6756,1199,2025-08-14T01:04:53Z,​​Unlimited-length talking video generation​​ that supports image-to-video and video-to-video genera
facebookresearch/sam-3d-objects,Python,6740,799,2025-09-29T20:46:40Z,SAM 3D Objects
tw93/Kami,HTML,6734,317,2026-04-20T16:35:19Z,👩‍🚒 Good content deserves good paper.
FULU-Foundation/OrcaSlicer-bambulab,C++,6706,5118,2026-05-11T17:44:55Z,
ultraworkers/claw-code-parity,Rust,6692,5345,2026-04-02T05:39:02Z,Join Discord: https://discord.gg/5TUQKqFWd /  claw-code Rust port parity work - it is temporary work
maderix/ANE,Objective-C,6685,921,2026-02-28T09:27:28Z,Training neural networks on Apple Neural Engine via reverse-engineered private APIs
Lakr233/vphone-cli,Swift,6676,994,2026-02-26T11:29:08Z,
EverMind-AI/EverOS,Python,6636,657,2025-10-28T15:09:32Z,"Build, evaluate, and integrate long-term memory for self-evolving agents."
Yuliang-Liu/MonkeyOCR,Python,6600,458,2025-06-03T06:25:31Z,A lightweight LMM-based Document Parsing Model
AvengeMedia/DankMaterialShell,QML,6584,406,2025-07-10T15:18:23Z,"Desktop shell for wayland compositors built with Quickshell & GO, optimized for niri, hyprland, sway"
OpenCoworkAI/open-codesign,TypeScript,6582,701,2026-04-18T03:14:33Z,Open-source Claude Design alternative. One-click import your Claude Code / Codex API key. Prompt → p
stonerl/Thaw,Swift,6562,144,2026-01-29T18:26:51Z,Menu bar manager for macOS 26
ChatLab/ChatLab,TypeScript,6562,1389,2025-11-26T05:54:26Z,Local-first chat history analyzer with AI. | 本地优先的 AI 聊天记录分析工具
BlockRunAI/ClawRouter,TypeScript,6536,599,2026-02-03T17:32:00Z,"The agent-native LLM router for OpenClaw. 41+ models, <1ms routing, USDC payments on Base & Solana v"
superdesigndev/superdesign,TypeScript,6530,710,2025-06-20T05:34:47Z,AI Product Design Agent - Open Source
SamsungSAILMontreal/TinyRecursiveModels,Python,6521,1024,2025-10-07T13:24:28Z,
dwzhu-pku/PaperBanana,Python,6448,476,2026-01-30T06:55:48Z,PaperBanana: Automating Academic Illustration For AI Scientists
nicotsx/zerobyte,TypeScript,6441,162,2025-08-09T08:58:56Z,Backup automation for self-hosters. Built on top of restic
NVIDIA/OpenShell,Rust,6441,780,2026-02-24T22:52:22Z,"OpenShell is the safe, private runtime for autonomous AI agents."
Jackywine/Bella,JavaScript,6426,987,2025-07-16T06:14:09Z,Bella is best
HKUDS/OpenSpace,Python,6401,791,2026-03-24T08:01:49Z,"""OpenSpace: Make Your Agents: Smarter, Low-Cost, Self-Evolving"" -- Community: https://open-space.clo"
openai/openai-cs-agents-demo,Python,6386,979,2025-06-14T03:07:09Z,Demo of a customer service use case implemented with the OpenAI Agents SDK
PDFCraftTool/pdfcraft,TypeScript,6354,1556,2026-01-03T01:14:49Z,"PDFCraft is a free, privacy-focused PDF toolkit that runs entirely in your browser. With 90+ profess"
11cafe/jaaz,TypeScript,6317,622,2025-06-01T14:53:08Z,The world's first open-source multimodal creative assistant  This is a substitute for Canva and Manu
open-multi-agent/open-multi-agent,TypeScript,6300,2375,2026-03-31T19:07:34Z,"From a goal to a task DAG, automatically. TypeScript-native multi-agent orchestration."
nirholas/fresh-start,Sin especificar,6289,10,2026-03-31T09:38:18Z,"The original nirholas/claude-code before DMCA and take down. Once everything is cleared, it will ret"
farzaa/clicky,Swift,6277,1182,2026-04-07T05:12:51Z,
Tracer-Cloud/opensre,Python,6268,828,2026-01-13T00:04:47Z,Build your own AI SRE agents. The open source toolkit for the AI era.
lintsinghua/DeepAudit,Python,6267,775,2025-09-19T15:53:48Z,DeepAudit：人人拥有的 AI 黑客战队，让漏洞挖掘触手可及。国内首个开源的代码漏洞挖掘多智能体系统。小白一键部署运行，自主协作审计 + 自动化沙箱 PoC 验证。支持 Ollama 私有部署 
Facepunch/sbox-public,C#,6252,614,2025-11-24T08:18:33Z,"s&box is a modern game engine, built on Valve's Source 2 and the latest .NET technology, it provides"
crynta/terax-ai,TypeScript,6243,668,2026-04-21T18:33:12Z,Lightweight (7MB) Terminal-first AI-native dev workspace
tbphp/gpt-load,Go,6211,647,2025-06-06T16:04:32Z,Multi-channel AI proxy with intelligent key rotation. 智能密钥轮询的多渠道 AI 代理。
jamwithai/production-agentic-rag-course,Python,6202,1471,2025-08-06T19:52:50Z,
SawyerHood/dev-browser,TypeScript,6199,395,2025-12-02T19:20:20Z,A Claude Skill to give your agent the ability to use a web browser
craft-ai-agents/craft-agents-oss,TypeScript,6192,843,2026-01-19T10:35:59Z,
igareck/vpn-configs-for-russia,Sin especificar,6136,279,2025-11-13T15:10:23Z,"🗽Бесплатные и проверенные VPN конфигурации, работающие в РФ ⚪ Белые списки / обход белых списков ⚪ F"
jo-inc/camofox-browser,JavaScript,6100,607,2026-01-26T07:31:13Z,"Stealth headless browser for AI agents — bypass Cloudflare, bot detection, and anti-scraping. Drop-i"
steipete/summarize,TypeScript,6082,392,2025-12-17T12:19:51Z,Point at any URL/YouTube/Podcast or file. Get the gist. CLI and Chrome Extension.
JerryZLiu/Dayflow,Swift,6056,329,2025-09-23T01:58:21Z,The automatic work journal. Privately turns your screen into a timeline of what you actually accompl
TencentCloud/CubeSandbox,Rust,6040,471,2026-04-10T03:00:31Z,"Instant, Concurrent, Secure & Lightweight Sandbox for AI Agents."
UfoMiao/zcf,TypeScript,6022,422,2025-07-30T06:09:00Z,Zero-Config Code Flow for Claude code & Codex
neuphonic/neutts,Python,5958,646,2025-10-02T12:48:55Z,On-device TTS model by Neuphonic
averygan/reclip,HTML,5954,1071,2026-03-31T04:29:13Z,"Download videos from almost any website. Lightweight, self-hosted media downloader with a clean web "
ChrisWiles/claude-code-showcase,JavaScript,5935,562,2026-01-06T18:51:02Z,"Comprehensive Claude Code project configuration example with hooks, skills, agents, commands, and Gi"
elder-plinius/OBLITERATUS,Python,5922,1129,2026-03-03T19:37:51Z,OBLITERATE THE CHAINS THAT BIND YOU
SimoneAvogadro/android-reverse-engineering-skill,Shell,5918,661,2026-02-02T15:57:57Z,Claude Code skill to support Android app's reverse engineering
THUDM/slime,Python,5906,852,2025-06-18T07:15:54Z,slime is an LLM post-training framework for RL Scaling.
IAmTomShaw/f1-race-replay,Python,5876,778,2025-11-21T17:37:05Z,An interactive Formula 1 race visualisation and data analysis tool built with Python! 🏎️
op7418/CodePilot,TypeScript,5871,636,2026-02-06T12:38:55Z,"A multi-model AI agent desktop client — connect any AI provider, extend with MCP & skills, control f"
dontbesilent2025/dbskill,Shell,5867,770,2026-03-20T16:52:16Z,dontbesilent 的商业诊断 Skills
AgriciDaniel/claude-obsidian,Python,5860,680,2026-04-07T08:59:37Z,"Self-organizing AI second brain for Obsidian + Claude Code. Drop any source and Claude reads, links,"
bellard/mquickjs,C,5848,229,2025-12-22T14:20:32Z,Public repository of the Micro QuickJS Javascript Engine
open-jarvis/OpenJarvis,Python,5834,1245,2026-02-15T00:24:16Z,"Personal AI, On Personal Devices"
google-labs-code/stitch-skills,TypeScript,5821,713,2026-01-16T17:17:17Z,A library of Agent Skills designed to work with the Stitch MCP server. Each skill follows the Agent 
0xGF/boneyard,TypeScript,5799,231,2026-04-01T15:25:45Z,Auto generated skeleton loading framework
midudev/autoskills,Ruby,5774,541,2026-03-25T10:25:34Z,One command. Your entire AI skill stack. Installed.
666OS/ClashMac,Sin especificar,5764,235,2025-11-28T04:41:02Z,Native Proxy Experience Built for macOS
tvytlx/ai-agent-deep-dive,Python,5760,1648,2026-03-31T11:27:01Z,AI Agent 源码深度研究报告
pshenok/server-survival,JavaScript,5753,661,2025-11-21T02:36:29Z,"Tower defense game that teaches cloud architecture. Build infrastructure, survive traffic, learn sca"
backnotprop/plannotator,TypeScript,5752,400,2025-12-28T02:09:40Z,"Annotate and review coding agent plans and code diffs visually, share with your team, send feedback "
nexu-io/html-anything,HTML,5714,559,2026-05-11T09:40:38Z,"✨ The agentic HTML editor — your local AI agent writes the HTML, you ship it. 🚀 75 Skills × 9 Surfac"
cporter202/API-mega-list,JavaScript,5713,1115,2025-12-09T15:36:20Z,This GitHub repo is a powerhouse collection of APIs you can start using immediately to build everyth
steipete/agent-rules,Shell,5686,513,2025-06-12T11:10:14Z,Rules and Knowledge to work better with agents such as Claude Code or Cursor
QuipNetwork/quip-protocol-rs,Rust,5678,32,2026-04-02T13:12:31Z,A rust implementation of the Quip Protocol forked from Substrate
MrLesk/Backlog.md,TypeScript,5659,341,2025-06-04T19:43:33Z,Backlog.md - A tool for managing project collaboration between humans and AI Agents in a git ecosyst
xindoo/agentic-design-patterns,HTML,5657,798,2025-09-30T03:58:49Z,谷歌新书Agent设计模式(agentic design patterns)最佳中文版，持续优化。附：在线阅读、pdf和epub电子书下载。 
epiral/bb-browser,TypeScript,5631,558,2026-01-31T03:55:42Z,Your browser is the API. CLI + MCP server for AI agents to control Chrome with your login state.
ghuntley/how-to-build-a-coding-agent,Go,5629,639,2025-07-24T03:56:29Z,"A workshop that teaches you how to build your own coding agent. Similar to Roo code, Cline, Amp, Cur"
diegosouzapw/OmniRoute,TypeScript,5615,968,2026-02-13T12:38:31Z,"Never stop coding. Free AI gateway: one endpoint, 160+ providers (50+ free), connect Claude Code, Co"
QuipNetwork/xq-rs,Rust,5614,17,2026-04-02T13:07:49Z,A rust implementation of the Quip Network's quantum virtual machine.
mattpocock/sandcastle,TypeScript,5602,570,2026-03-17T14:49:05Z,Orchestrate sandboxed coding agents in TypeScript with sandcastle.run()
srizzon/git-city,TypeScript,5602,275,2026-02-20T16:11:55Z,Your GitHub profile as a 3D pixel art building in an interactive city
vercel-labs/open-agents,TypeScript,5578,723,2025-12-26T17:01:07Z,An open source template for building cloud agents.
QuipNetwork/xq-py,Sin especificar,5550,13,2026-04-02T13:20:52Z,A python implementation of the Quip Network's quantum virtual machine
21st-dev/1code,TypeScript,5548,598,2026-01-14T02:12:40Z,"Orchestration layer for coding agents (Claude Code, Codex)"
osaurus-ai/osaurus,Swift,5540,302,2025-08-17T15:05:39Z,"Own your AI. The native macOS harness for AI agents -- any model, persistent memory, autonomous exec"
QuipNetwork/quip-node-manager,Rust,5530,17,2026-04-02T13:03:34Z,A simple GUI client to manage a Quip Network node
zhouxiaoka/autoclip,Python,5524,1104,2025-07-08T04:51:15Z,AutoClip : AI-powered video clipping and highlight generation · 一款智能高光提取与剪辑的二创工具
android/skills,Sin especificar,5524,290,2026-03-16T12:41:46Z,
iOfficeAI/OfficeCLI,C#,5520,451,2026-03-15T07:39:12Z,"OfficeCLI is the first and best Office suite  purpose-built for AI agents to read, edit, and automat"
Arthur-Ficial/apfel,Swift,5509,211,2026-03-24T19:07:22Z,"The free AI already on your Mac. CLI tool, OpenAI-compatible server, and interactive chat — all on-d"
trailofbits/skills,Python,5503,484,2026-01-14T18:23:21Z,"Trail of Bits Claude Code skills for security research, vulnerability detection, and audit workflows"
drona23/claude-token-efficient,Sin especificar,5497,418,2026-03-30T12:59:07Z,One CLAUDE.md file. Keeps Claude responses terse. Reduces output verbosity on heavy workflows. Drop-
holaboss-ai/holaOS,TypeScript,5477,363,2026-03-22T07:36:16Z,"Your super agent for work: local-first, learn your working context in mins and never forget it."
coze-dev/coze-loop,Go,5475,762,2025-06-24T00:26:28Z,Next-generation AI Agent Optimization Platform: Cozeloop addresses challenges in AI agent developmen
Cocoon-AI/architecture-diagram-generator,HTML,5475,411,2025-12-22T17:40:16Z,Generate beautiful dark-themed system architecture diagrams as standalone HTML/SVG files. Works as a
permissionlesstech/bitchat-android,Kotlin,5473,776,2025-07-08T18:36:23Z,"bluetooth mesh chat, IRC vibes"
debpalash/OmniVoice-Studio,Python,5472,816,2026-04-09T21:40:26Z,"The open-source ElevenLabs alternative for local voice cloning, design, create, dubbing and dictatio"
tw93/Waza,Python,5467,323,2026-03-12T00:35:56Z,"🥷 Engineering habits you already know, turned into skills Claude can run."
unicity-sphere/sphere-sdk,TypeScript,5456,99,2026-01-27T12:05:07Z,"The SDK for autonomous economic agents. Give an agent an identity, a wallet, and the ability to find"
memovai/mimiclaw,C,5454,804,2026-02-04T04:25:33Z,MimiClaw: Run OpenClaw on a $5 chip. No OS(Linux). No Node.js. No Mac mini. No Raspberry Pi. No VPS.
MorpheApp/morphe-manager,Kotlin,5450,115,2025-11-26T16:29:57Z,Morphe app patcher for Android
AgriciDaniel/claude-ads,Python,5448,818,2026-02-11T13:01:49Z,Comprehensive paid advertising audit & optimization skill for Claude Code. 250+ checks across Google
adongwanai/AgentGuide,HTML,5444,548,2025-11-03T10:46:38Z,https://adongwanai.github.io/AgentGuide | AI Agent开发指南 | LangGraph实战 | 高级RAG | 转行大模型 | 大模型面试 | 算法工程师
donlon/cloudflare-error-page,HTML,5440,280,2025-11-19T12:00:12Z,✅Browser ❌Cloudflare ✅Host — Generator of customized Cloudflare error pages (unofficial)
ByteDance-Seed/Depth-Anything-3,Python,5432,589,2025-11-12T08:44:03Z,Depth Anything 3
lijigang/ljg-skills,HTML,5431,625,2026-03-08T03:08:33Z,
Gen-Verse/OpenClaw-RL,Python,5422,586,2026-02-26T12:57:42Z,OpenClaw-RL: Train any agent simply by talking
fengshao1227/ccg-workflow,Go,5403,413,2026-01-04T15:56:26Z,多模型协作工作流引擎 — /ccg:go 一个命令，AI 自动分析意图、选择策略、编排 Codex + Gemini + Claude 协作执行
earthtojake/text-to-cad,JavaScript,5400,640,2026-04-22T01:09:45Z,"A collection of agent skills for CAD, robotics and hardware design"
therealXiaomanChu/ex-skill,Python,5378,509,2026-03-31T09:36:56Z,把前任蒸馏成 AI Skill，用ta的方式跟你说话。
microsoft/fara,Python,5350,521,2025-10-29T16:23:22Z,Fara-7B: An Efficient Agentic Model for Computer Use
volcengine/MineContext,Python,5350,400,2025-06-24T11:15:21Z,MineContext is your proactive context-aware AI partner（Context-Engineering+ChatGPT Pulse）
Thysrael/Horizon,Python,5341,743,2026-02-20T08:22:45Z,📡 Your own AI-powered news radar. Generates daily briefings in English & Chinese. | 用 AI 构建你专属的新闻雷达
ParthJadhav/app-store-screenshots,TypeScript,5332,365,2026-03-07T13:56:04Z,end to end app store screenshot creation using AI
open-pencil/open-pencil,TypeScript,5321,486,2026-02-27T12:48:35Z,AI-native design editor. Open-source Figma alternative.
orion-lib/OrionTV,TypeScript,5321,1821,2025-06-28T05:05:24Z,一个基于 React Native TVOS 和 Expo 构建的播放器，旨在提供流畅的视频观看体验。
NomaDamas/k-skill,JavaScript,5319,580,2026-03-24T16:39:30Z,"한국인을 위한 스킬 모음집 - SRT, KTX, 카카오톡, 한글과컴퓨터, 날씨, 미세먼지, 법령, 주식정보, 조선왕조실록, KBO, K-리그, LCK, 특허 검색, 토스 증권, 맞"
mauriceboe/TREK,TypeScript,5307,511,2026-03-19T11:51:54Z,"A self-hosted travel/trip planner with real-time collaboration, interactive maps, PWA support, SSO, "
Michael-A-Kuykendall/shimmy,Rust,5304,499,2025-08-28T22:55:46Z,"⚡ Python-free Rust inference server — OpenAI-API compatible. GGUF + SafeTensors, hot model swap, aut"
datawhalechina/vibe-vibe,Dockerfile,5301,422,2025-11-28T10:30:29Z,"AI for All: The First Systematic Vibe Coding Tutorial | From Zero to Full-Stack, Bring Your Ideas to"
HisMax/RedInk,Python,5294,1011,2025-11-25T10:12:54Z,"Red Ink - A one-stop Xiaohongshu image-and-text generator based on the 🍌Nano Banana Pro🍌, ""One Sente"
max-sixty/worktrunk,Rust,5290,176,2025-10-17T22:13:14Z,"Worktrunk is a CLI for Git worktree management, designed for parallel AI agent workflows"
lewislulu/html-ppt-skill,HTML,5278,503,2026-04-15T07:36:22Z,"HTML PPT Studio — AgentSkill with 24 themes, 31 layouts, 20+ animations for building professional HT"
HKUDS/ClawTeam,Python,5274,722,2026-03-17T14:42:46Z,"""ClawTeam: Agent Swarm Intelligence"" (One Command → Full Automation)"
BIT-DataLab/Edit-Banana,Python,5267,356,2026-01-16T10:34:52Z,Edit Banana: A framework for converting statistical formats into editable.
vercel/streamdown,TypeScript,5258,264,2025-08-15T01:52:01Z,"A drop-in replacement for react-markdown, designed for AI-powered streaming."
knadh/oat,CSS,5256,248,2026-01-15T05:49:47Z,"Ultra-lightweight, zero dependency, semantic HTML, CSS, JS UI library. ~8KB min+gz."
Hammer1/cozeworkflows,Sin especificar,5254,1979,2025-07-27T13:42:07Z,coze 的200+工作流合集汇总，一直更新
Diorser/LiteMonitor,C#,5250,214,2025-11-10T12:58:51Z,"一款轻量级、高度可定制的 Windows桌面和任务栏硬件性能监控工具，支持监测 CPU、GPU、内存、磁盘、网速、FPS 计数、插件扩展及内存清理。A lightweight, customizabl"
heilcheng/awesome-agent-skills,TypeScript,5247,473,2025-12-29T21:13:40Z,"Tutorials, Guides and Agent Skills Directories"
czlonkowski/n8n-skills,Shell,5241,901,2025-10-20T05:51:27Z,n8n skillset for Claude Code to build flawless n8n workflows
tw93/Kaku,Rust,5236,260,2026-02-07T13:00:49Z,"🎃 A fast, out-of-the-box terminal built for AI coding."
netease-youdao/LobsterAI,TypeScript,5217,798,2026-02-12T09:56:20Z,Your 24/7 all-scenario AI agent that gets work done for you.
tonhowtf/omniget,Svelte,5209,390,2026-02-11T22:44:56Z,"Open-source desktop app for downloading, organizing and studying media. Native cross-platform (Tauri"
outsourc-e/hermes-workspace,JavaScript,5186,766,2026-03-16T03:53:28Z,"Native web workspace for Hermes Agent — chat, terminal, memory, skills, inspector."
iflytek/astron-rpa,Java,5176,578,2025-09-20T08:51:40Z,Agent-ready RPA suite with out-of-the-box automation tools. Built for individuals and enterprises.
withcoral/coral,Rust,5154,208,2026-04-03T20:56:07Z,"One SQL interface over APIs, files, and live sources — built for agents."
antfu/skills,TypeScript,5142,282,2026-01-28T05:59:03Z,Anthony Fu's curated collection of agent skills.
antvis/Infographic,TypeScript,5130,383,2025-09-11T11:13:39Z,"🦋 An Infographic Generation and Rendering Framework, bring words to life with AI!"
iflow-ai/iflow-cli,Shell,5124,420,2025-07-27T02:38:21Z,"iFlow cli is a comprehensive command-line intelligence that embeds in your terminal, analyzes your r"
builderz-labs/mission-control,TypeScript,5108,885,2026-02-13T04:06:19Z,"Self-hosted AI agent orchestration platform: dispatch tasks, run multi-agent workflows, monitor spen"
shareAI-lab/Kode-CLI,TypeScript,5090,767,2025-07-12T14:21:51Z,Kode CLI — Design for post-human workflows. One unit agent for every human & computer task.
breaking-brake/cc-wf-studio,TypeScript,5075,554,2025-11-01T16:04:15Z,CC Workflow Studio
openai/parameter-golf,Python,5070,3352,2026-02-09T06:22:45Z,Train the smallest LM you can that fits in 16MB. Best model wins!
rdev/liquid-glass-react,TypeScript,5067,339,2025-06-10T22:48:35Z,Apple's Liquid Glass effect for React
darrylmorley/whatcable,Swift,5061,161,2026-05-01T07:45:10Z,"macOS menu bar app that tells you, in plain English, what each USB-C cable plugged into your Mac can"
cloudflare/vibesdk,TypeScript,5056,1208,2025-08-25T15:07:31Z,"An open-source vibe coding platform that helps you build your own vibe-coding platform, built entire"
chenyme/grok2api,Python,5056,1739,2025-10-10T09:00:02Z,Grok2API 是一个基于 FastAPI 构建的 Grok 网关，支持将 Grok Web 能力以 OpenAI 兼容 API 的方式转换。
scanopy/scanopy,Rust,5008,239,2025-09-29T18:37:20Z,Network diagrams that update themselves
VoltAgent/awesome-codex-subagents,Sin especificar,4998,568,2026-03-17T12:26:20Z,A collection of 130+ specialized Codex subagents covering a wide range of development use cases.
truelockmc/streambert,JavaScript,4989,423,2026-02-17T17:40:47Z,"A cross-platform Electron Desktop App to stream and download any Movie, TV Series or Anime in the Wo"
tiajinsha/JKVideo,TypeScript,4983,2929,2026-03-06T04:58:45Z,高颜值第三方 B 站 React Native 客户端
gommzystudio/device-activity-tracker,TypeScript,4977,686,2025-12-07T14:56:14Z,"A phone number can reveal whether a device is active, in standby or offline (and more). This PoC dem"
MatrixSeven/file-transfer-go,TypeScript,4971,638,2025-07-28T10:11:01Z,Go/React开发的端到端webrtc的文件传输/文字传输/桌面共享，安全，隐私，数据不经过服务器。
revfactory/harness,HTML,4969,677,2026-03-26T21:22:07Z,"A meta-skill that designs domain-specific agent teams, defines specialized agents, and generates the"
