repo_name,language,stars,forks,created_at,description
openclaw/openclaw,TypeScript,381911,80114,2025-11-24T10:16:47Z,Your own personal AI assistant. Any OS. Any Platform. The lobster way. 🦞
obra/superpowers,Shell,247427,21954,2025-10-09T19:45:18Z,An agentic skills framework & software development methodology that works.
affaan-m/ECC,JavaScript,226510,34644,2026-01-18T00:51:51Z,"The agent harness performance optimization system. Skills, instincts, memory, security, and research"
NousResearch/hermes-agent,Python,210059,38441,2025-07-22T22:22:28Z,The agent that grows with you
ultraworkers/claw-code,Rust,194602,109820,2026-03-31T08:58:08Z,"An agent-managed museum exhibit, built in Rust with Gajae-Code / LazyCodex — developed and maintaine"
multica-ai/andrej-karpathy-skills,Sin especificar,188311,19328,2026-01-27T03:53:13Z,"A single CLAUDE.md file to improve Claude Code behavior, derived from Andrej Karpathy's observations"
anthropics/skills,Python,158644,18710,2025-09-22T15:53:31Z,Public repository for Agent Skills
mattpocock/skills,Shell,158195,13603,2026-02-03T11:15:53Z,Skills for Real Engineers. Straight from my .claude directory.
msitarzewski/agency-agents,Shell,127853,20758,2025-10-13T12:12:29Z,"A complete AI agency at your fingertips - From frontend wizards to Reddit community ninjas, from whi"
garrytan/gstack,TypeScript,119866,17880,2026-03-11T21:22:45Z,"Use Garry Tan's exact Claude Code setup: 23 opinionated tools that serve as CEO, Designer, Eng Manag"
github/spec-kit,Python,118314,10475,2025-08-21T22:54:31Z,💫 Toolkit to help you get started with Spec-Driven Development
farion1231/cc-switch,Rust,113824,7589,2025-08-04T14:16:16Z,"A cross-platform desktop All-in-One assistant for Claude Code, Codex, OpenCode, OpenClaw, Gemini CLI"
nextlevelbuilder/ui-ux-pro-max-skill,Python,101479,10692,2025-11-30T11:36:31Z,An AI SKILL that provide design intelligence for building professional UI/UX multiple platforms
VoltAgent/awesome-design-md,Sin especificar,96121,11309,2026-03-31T16:37:01Z,A collection of DESIGN.md files analysis by popular brand design systems. Drop one into your project
karpathy/autoresearch,Python,90010,12995,2026-03-06T22:00:43Z,AI agents running research on single-GPU nanochat training automatically
thedotmack/claude-mem,JavaScript,86104,7451,2025-08-31T20:50:03Z,Persistent Context Across Sessions for Every Agent –  Captures everything your agent does during ses
JuliusBrussee/caveman,JavaScript,85407,4754,2026-04-04T10:03:00Z,🪨 why use many token when few token do trick — Claude Code skill that cuts 65% of tokens by talking
pewdiepie-archdaemon/odysseus,Python,81046,10631,2026-05-31T14:05:51Z,Self-hosted AI workspace.
Graphify-Labs/graphify,Python,78427,7746,2026-04-03T15:49:07Z,"AI coding assistant skill (Claude Code, Codex, OpenCode, Cursor, Gemini CLI, and more). Turn any fol"
DietrichGebert/ponytail,JavaScript,75500,4001,2026-06-12T00:52:37Z,Makes your AI agent think like the laziest senior dev in the room. The best code is the code you nev
nexu-io/open-design,TypeScript,75430,8616,2026-04-28T04:25:20Z,🎨 The open-source Claude Design alternative. 🖥️ Local-first desktop app. 🖼️ Your coding agent become
paperclipai/paperclip,TypeScript,72841,13580,2026-03-02T15:01:51Z,The open-source app everyone uses to manage agents at work
Egonex-AI/Understand-Anything,TypeScript,71270,5925,2026-03-15T02:30:51Z,Graphs that teach > graphs that impress. Turn any code into an interactive knowledge graph you can e
addyosmani/agent-skills,Shell,70274,7617,2026-02-15T20:20:26Z,Production-grade engineering skills for AI coding agents.
rtk-ai/rtk,Rust,68833,4269,2026-01-22T16:54:16Z,"CLI proxy that reduces LLM token consumption by 60-90% on common dev commands. Single Rust binary, z"
earendil-works/pi,TypeScript,68000,8342,2025-08-09T14:03:50Z,"AI agent toolkit: unified LLM API, agent loop, TUI, coding agent CLI"
666ghj/MiroFish,Python,67922,10586,2025-11-26T04:23:02Z,"A Simple and Universal Swarm Intelligence Engine, Predicting Anything. 简洁通用的群体智能引擎，预测万物"
ComposioHQ/awesome-claude-skills,Python,66956,7475,2025-10-17T07:15:01Z,"A curated list of awesome Claude Skills, resources, and tools for customizing Claude AI workflows"
code-yeongyu/oh-my-openagent,TypeScript,65011,5311,2025-12-03T01:40:05Z,omo/lazycodex: The coding agent for tokenmaxxers;the one and only agent harness for complex codebase
gsd-build/get-shit-done,JavaScript,64682,5476,2025-12-14T14:17:12Z,"A light-weight and powerful meta-prompting, context engineering and spec-driven development system f"
datawhalechina/hello-agents,Python,64297,7970,2025-09-07T09:50:24Z,📚 《从零开始构建智能体》——从零开始的智能体原理与实践教程
shanraisshan/claude-code-best-practice,HTML,62086,6202,2025-10-31T14:15:28Z,from vibe coding to agentic engineering - practice makes claude perfect
koala73/worldmonitor,TypeScript,61437,9565,2026-01-08T17:26:06Z,"Real-time global intelligence dashboard. AI-powered news aggregation, geopolitical monitoring, and i"
Fission-AI/OpenSpec,TypeScript,58945,4099,2025-08-05T10:37:45Z,Spec-driven development (SDD) for AI coding assistants.
santifer/career-ops,JavaScript,58768,11533,2026-04-04T18:21:18Z,"AI-powered job search system built on Claude Code. 14 skill modes, Go dashboard, PDF generation, bat"
Leonxlnx/taste-skill,JavaScript,58313,3980,2026-02-19T21:44:05Z,"Taste-Skill - gives your AI good taste. stops the AI from generating boring, generic slop"
tw93/Mole,Shell,58099,2048,2025-09-23T06:38:40Z,"🐹 Clean, uninstall, analyze, optimize, and monitor your Mac from the terminal."
colbymchenry/codegraph,TypeScript,57949,3565,2026-01-18T21:45:37Z,"Pre-indexed code knowledge graph, auto syncs on code changes, for Claude Code, Codex, Gemini, Cursor"
MemPalace/mempalace,Python,57010,7366,2026-04-05T01:12:07Z,The best-benchmarked open-source AI memory system. And it's free.
headroomlabs-ai/headroom,Python,56993,4188,2026-01-07T19:58:51Z,"Compress tool outputs, logs, files, and RAG chunks before they reach the LLM. 60-95% fewer tokens, s"
karpathy/nanochat,Python,55904,7712,2025-10-13T13:46:35Z,The best ChatGPT that $100 can buy.
ZhuLinsen/daily_stock_analysis,Python,54981,47533,2026-01-10T06:43:20Z,LLM 驱动的多市场股票智能分析系统：多源行情、实时新闻、决策看板与自动推送，支持零成本定时运行。  LLM-powered multi-market stock analysis system wi
Panniantong/Agent-Reach,Python,51773,4147,2026-02-24T02:10:24Z,"Give your AI agent eyes to see the entire internet. Read & search Twitter, Reddit, YouTube, GitHub,"
VoltAgent/awesome-openclaw-skills,Sin especificar,50973,4938,2026-01-25T09:22:32Z,"The awesome collection of OpenClaw skills. 5,400+ skills filtered and categorized from the official"
microsoft/VibeVoice,Python,49952,5582,2025-08-25T13:24:01Z,Open-Source Frontier Voice AI
mvanhorn/last30days-skill,Python,49484,4119,2026-01-23T20:37:37Z,"AI agent skill that researches any topic across Reddit, X, YouTube, HN, Polymarket, and the web - th"
chenglou/pretext,TypeScript,48979,2718,2026-03-07T21:06:28Z,"Fast, accurate & comprehensive text measurement & layout"
ChromeDevTools/chrome-devtools-mcp,TypeScript,46020,2993,2025-09-11T10:39:55Z,Chrome DevTools for coding agents
KeygraphHQ/shannon,TypeScript,45451,5272,2025-09-27T01:51:47Z,"Shannon is an autonomous, white-box AI pentester for web applications and APIs. It analyzes your sou"
HKUDS/nanobot,Python,45064,7950,2026-02-01T07:16:15Z,"Lightweight, open-source AI agent for your tools, chats, and workflows."
HKUDS/CLI-Anything,Python,44832,4195,2026-03-08T13:52:57Z,"""CLI-Anything: Making ALL Software Agent-Native"" -- CLI-Hub: https://clianything.cc/"
pbakaus/impeccable,JavaScript,43809,2493,2025-11-16T01:52:04Z,The design language that makes your AI harness better at design.
abhigyanpatwari/GitNexus,TypeScript,43674,4871,2025-08-02T23:20:31Z,GitNexus: The Zero-Server Code Intelligence Engine -       GitNexus is a client-side knowledge graph
sickn33/antigravity-awesome-skills,Python,42436,6765,2026-01-14T17:48:09Z,"Installable GitHub library of 1,800+ agentic skills for Claude Code, Cursor, Codex CLI, Gemini CLI,"
kepano/obsidian-skills,Sin especificar,39940,2841,2026-01-02T21:45:11Z,"Agent skills for Obsidian. Teach your agent to use Obsidian CLI and open formats including Markdown,"
Hmbown/CodeWhale,Rust,39500,3401,2026-01-19T18:21:01Z,"Open-source, community-driven agent harness"
luongnv89/claude-howto,Python,39317,4746,2025-11-07T22:59:34Z,"A visual, example-driven guide to Claude Code — from basic concepts to advanced agents, with copy-pa"
multica-ai/multica,Go,39218,4914,2026-01-13T17:59:46Z,"The open-source managed agents platform. Turn coding agents into real teammates — assign tasks, trac"
siddharthvaddem/openscreen,TypeScript,39199,2867,2025-10-10T05:36:55Z,"Create stunning demos for free. Open-source, no subscriptions, no watermarks, and free for commercia"
Alishahryar1/free-claude-code,Python,38833,6174,2026-01-28T19:02:30Z,"Use claude code and codex for free in the terminal, VSCode extension, and discord like OpenClaw (voi"
jamiepine/voicebox,TypeScript,38140,4578,2026-01-25T12:27:03Z,"The open-source AI voice studio. Clone, dictate, create."
vercel-labs/agent-browser,Rust,37935,2437,2026-01-11T05:38:15Z,Browser automation CLI for AI agents
usestrix/strix,Python,37675,3822,2025-08-05T21:28:30Z,Open-source AI penetration testing tool to find and fix your app’s vulnerabilities.
wshobson/agents,Python,37576,4035,2025-07-24T23:28:14Z,"Multi-harness agentic plugin marketplace for Claude Code, Codex CLI, Cursor, OpenCode, GitHub Copilo"
rohitg00/ai-engineering-from-scratch,Python,37458,6224,2026-03-18T18:38:02Z,Learn it. Build it. Ship it for others.
Yeachan-Heo/oh-my-claudecode,TypeScript,37458,3378,2026-01-09T03:36:29Z,Teams-first Multi-agent orchestration for Claude Code
hugohe3/ppt-master,Python,37058,3103,2025-12-10T06:54:33Z,"AI generates a real, editable PowerPoint from any document — native shapes & animations, editable ch"
google/langextract,Python,37011,2554,2025-07-08T20:46:06Z,A Python library for extracting structured information from unstructured text using LLMs with precis
coreyhaines31/marketingskills,JavaScript,36763,5916,2026-01-15T19:45:23Z,"Marketing skills for Claude Code and AI agents. CRO, copywriting, SEO, analytics, and growth enginee"
Imbad0202/academic-research-skills,Python,36521,2983,2026-02-26T06:31:01Z,Academic Research Skills for Claude Code: research → write → review → revise → finalize
tinyhumansai/openhuman,Rust,34247,3327,2026-02-18T20:01:27Z,"Your Personal AI super intelligence. A brain that builds a local-first memory of your life, a fantas"
calesthio/OpenMontage,Python,34053,3894,2026-03-29T15:23:22Z,"World's first open-source, agentic video production system. 12 pipelines, 52 tools, 500+ agent skill"
heygen-com/hyperframes,TypeScript,33410,3114,2026-03-10T01:51:06Z,Write HTML. Render video. Built for agents.
anthropics/financial-services,Python,33150,4842,2026-02-23T19:24:50Z,
OpenBMB/VoxCPM,Python,32592,3721,2025-09-16T03:41:49Z,"VoxCPM2: Tokenizer-Free TTS for Multilingual Speech Generation, Creative Voice Design, and True-to-L"
zeroclaw-labs/zeroclaw,Rust,32165,4793,2026-02-13T08:56:04Z,"Fast, small, and fully autonomous AI personal assistant infrastructure, any OS, any platform — deplo"
Yeachan-Heo/oh-my-codex,TypeScript,31724,2461,2026-02-02T14:21:18Z,"OmX - Oh My codeX: Your codex is not alone. Add hooks, agent teams, HUDs, and so much more."
anthropics/claude-plugins-official,Python,31642,3482,2025-11-20T18:36:20Z,"Official, Anthropic-managed directory of high quality Claude Code Plugins."
hesamsheikh/awesome-openclaw-usecases,Sin especificar,31467,2705,2026-02-08T22:08:17Z,A community collection of OpenClaw use cases for making life easier.
Leey21/awesome-ai-research-writing,Sin especificar,30643,2320,2026-01-30T07:59:30Z,"Elevate your AI research writing, no more tedious polishing ✨"
Wei-Shaw/sub2api,Go,30452,6236,2025-12-18T02:26:18Z,Sub2API 一站式开源中转服务，让 Claude、Openai 、Gemini、Grok订阅统一接入，支持拼车共享，更高效分摊成本，原生工具无缝使用。
K-Dense-AI/scientific-agent-skills,Python,30287,3052,2025-10-19T20:54:15Z,"Turn any AI agent into an AI Scientist. The #1 Agent Skills library for science, used by 160,000+ sc"
nanocoai/nanoclaw,TypeScript,30132,12900,2026-01-31T15:47:22Z,"A lightweight alternative to OpenClaw that runs in containers for security. Connects to WhatsApp, Te"
lbjlaq/Antigravity-Manager,Rust,30002,3260,2025-11-26T10:47:13Z,Professional Antigravity Account Manager & Switcher. One-click seamless account switching for Antigr
Gitlawb/openclaude,TypeScript,29809,8861,2026-04-01T03:15:49Z,runs anywhere. uses anything
sipeed/picoclaw,Go,29599,4263,2026-02-04T12:32:35Z,"Tiny, Fast, and Deployable anywhere — automate the mundane, unleash your creativity"
googleworkspace/cli,Rust,29448,1692,2026-03-02T19:46:06Z,"Google Workspace CLI — one command-line tool for Drive, Gmail, Calendar, Sheets, Docs, Chat, Admin,"
iOfficeAI/AionUi,TypeScript,29345,2925,2025-08-07T10:29:51Z,"Free, local, open-source 24/7 Cowork app for OpenClaw, Hermes Agent, Claude Code, Codex, OpenCode, G"
AlexsJones/llmfit,Rust,29143,1780,2026-02-15T16:11:31Z,Hundreds of models & providers. One command to find what runs on your hardware.
vercel-labs/agent-skills,JavaScript,28721,2578,2025-12-08T19:10:06Z,Vercel's official collection of agent skills
CloakHQ/CloakBrowser,Python,27825,2224,2026-02-22T08:09:57Z,Stealth Chromium that passes every bot detection test. Drop-in Playwright replacement with source-le
blader/humanizer,Sin especificar,27699,2567,2026-01-18T05:30:15Z,Claude Code skill that removes signs of AI-generated writing from text
tobi/qmd,TypeScript,27470,1721,2025-12-08T14:22:57Z,"mini cli search engine for your docs, knowledge bases, meeting notes, whatever. Tracking current sot"
VoltAgent/awesome-agent-skills,Sin especificar,27434,2940,2025-10-28T08:55:32Z,"A curated collection of 1000+ agent skills from official dev teams and the community, compatible wit"
firecrawl/open-lovable,TypeScript,27330,5234,2025-08-08T13:04:02Z,🔥 Clone and recreate any website as a modern React app in seconds
virattt/dexter,TypeScript,27315,3388,2025-10-14T21:02:00Z,An autonomous agent for deep financial research
DeusData/codebase-memory-mcp,C,27101,2013,2026-02-24T22:01:00Z,High-performance code intelligence MCP server. Indexes codebases into a persistent knowledge graph —
alchaincyf/nuwa-skill,Python,27008,3850,2026-04-05T04:33:04Z,你想蒸馏的下一个员工，何必是同事。蒸馏任何人的思维方式——心智模型、决策启发式、表达DNA。Distill how anyone thinks.
Yuan1z0825/nature-skills,Python,26424,1603,2026-04-24T03:11:46Z,符合nature论文学术表达和科研绘图的Skill
xai-org/x-algorithm,Rust,26378,4526,2026-01-19T23:12:35Z,Algorithm powering the For You feed on X
volcengine/OpenViking,Python,26354,2048,2026-01-05T07:11:17Z,"Self-evolving Context Database for AI Agents. Unify Agent Memory, Knowledge RAG and Skills."
jarrodwatts/claude-hud,JavaScript,26185,1199,2026-01-02T01:35:07Z,"A Claude Code plugin that shows what's happening - context usage, active tools, running agents, and"
esengine/DeepSeek-Reasonix,Go,26140,1627,2026-04-21T08:27:02Z,DeepSeek-native AI coding agent for your terminal. Engineered around prefix-cache stability — leave
jackwener/OpenCLI,JavaScript,26130,2589,2026-03-14T22:10:23Z,Make Any Website into CLI & Use your logged-in browser by AI agent.
JCodesMore/ai-website-cloner-template,TypeScript,26055,3672,2026-03-13T11:14:39Z,Clone any website with one command using AI coding agents
openai/codex-plugin-cc,JavaScript,26006,1559,2026-03-30T15:29:52Z,Use Codex from Claude Code to review code or delegate tasks.
p-e-w/heretic,Python,25827,2803,2025-09-21T05:46:16Z,Fully automatic censorship removal for language models
openai/symphony,Elixir,25808,2616,2026-02-26T21:54:00Z,"Symphony turns project work into isolated, autonomous implementation runs, allowing teams to manage"
langchain-ai/deepagents,Python,25780,3623,2025-07-27T23:07:53Z,The batteries-included agent harness.
zai-org/Open-AutoGLM,Python,25704,4001,2025-12-08T09:23:44Z,An Open Phone Agent Model & Framework. Unlocking the AI Phone for Everyone
HKUDS/DeepTutor,Python,25230,3444,2025-12-28T15:35:54Z,DeepTutor: Agent-native Personalized Tutoring. https://deeptutor.info/.
vercel-labs/skills,TypeScript,25203,2098,2026-01-14T21:31:18Z,The open agent skills tool - npx skills
garrytan/gbrain,TypeScript,25155,3632,2026-04-05T14:40:56Z,Garry's Opinionated OpenClaw/Hermes Agent Brain
gastownhall/beads,Go,25110,1675,2025-10-12T03:09:46Z,Beads - A memory upgrade for your coding agent
google-labs-code/design.md,TypeScript,25109,1951,2026-04-10T17:54:59Z,A format specification for describing a visual identity to coding agents. DESIGN.md gives agents a p
OthmanAdi/planning-with-files,Python,24875,2112,2026-01-03T07:37:28Z,Persistent file-based planning for AI coding agents and long-running agentic tasks. Crash-proof mark
toon-format/toon,TypeScript,24780,1100,2025-10-22T18:17:32Z,"🎒 Token-Oriented Object Notation (TOON) – Compact, human-readable, schema-aware JSON for LLM prompts"
mukul975/Anthropic-Cybersecurity-Skills,Python,24706,2815,2026-02-25T09:47:50Z,"817 structured cybersecurity skills for AI agents · Mapped to 6 frameworks: MITRE ATT&CK, NIST CSF 2"
zarazhangrui/frontend-slides,JavaScript,24691,2009,2026-01-28T00:42:34Z,Create beautiful slides on the web using a coding agent's frontend skills
rohitg00/agentmemory,TypeScript,24645,2027,2026-02-25T07:32:52Z,#1 Persistent memory for AI coding agents based on real-world benchmarks
alibaba/page-agent,TypeScript,24417,2093,2025-09-23T09:30:17Z,JavaScript in-page GUI agent. Control web interfaces with natural language.
ATH-MaaS/Pixelle-Video,Python,24213,3475,2025-11-07T06:34:27Z,🚀 AI 全自动短视频引擎 | AI Fully Automated Short Video Engine
manaflow-ai/cmux,Swift,23720,1879,2026-01-28T10:03:24Z,Open source Ghostty-based macOS terminal with vertical tabs and notifications for AI coding agents.
BigPizzaV3/CodexPlusPlus,Rust,23586,1498,2026-05-06T09:32:49Z,"An enhanced tool for CodexApp, striving to make Codex better to use and more comfortable 一个CodexApp的"
deepseek-ai/DeepSeek-OCR,Python,23520,2167,2025-10-17T06:14:27Z,Contexts Optical Compression
openai/skills,Python,23305,1580,2025-11-25T06:25:42Z,Skills Catalog for Codex
JimLiu/baoyu-skills,TypeScript,23186,2623,2026-01-13T03:04:56Z,
PicoTrex/Awesome-Nano-Banana-images,Sin especificar,23160,2377,2025-08-28T17:03:09Z,"A curated collection of fun and creative examples generated with Nano Banana & Nano Banana Pro🍌, Gem"
VoltAgent/awesome-claude-code-subagents,Shell,22941,2683,2025-07-30T12:31:51Z,A collection of 100+ specialized Claude Code subagents covering a wide range of development use case
agentsmd/agents.md,TypeScript,22804,1688,2025-08-19T17:22:54Z,"AGENTS.md — a simple, open format for guiding coding agents"
phuryn/pm-skills,Sin especificar,22716,2284,2026-03-01T23:33:44Z,"PM Skills Marketplace: 100+ agentic skills, commands, and plugins — from discovery to strategy, exec"
EveryInc/compound-engineering-plugin,TypeScript,22708,1686,2025-10-09T19:43:46Z,"Official Compound Engineering plugin for Claude Code, Codex, Cursor, and more"
Donchitos/Claude-Code-Game-Studios,Shell,22651,3260,2026-02-12T05:21:38Z,"Turn Claude Code into a full game dev studio — 49 AI agents, 72 workflow skills, and a complete coor"
agentskills/agentskills,Python,22520,1423,2025-12-16T15:47:19Z,Specification and documentation for Agent Skills
slopus/happy,TypeScript,22444,1884,2025-07-18T05:53:18Z,"Mobile and Web client for Codex and Claude Code, with realtime voice, encryption and fully featured"
anthropics/knowledge-work-plugins,Python,22393,2632,2026-01-23T20:11:54Z,Open source repository of plugins primarily intended for knowledge workers to use in Claude Cowork
karpathy/llm-council,Python,22252,4036,2025-11-22T23:24:14Z,LLM Council works together to answer your hardest questions
NawfalMotii79/PLFM_RADAR,PLSQL,22238,5197,2026-03-08T23:20:58Z,"Open-source, low-cost 10.5 GHz PLFM phased array RADAR system"
2025Emma/vibe-coding-cn,Python,22024,2339,2025-12-17T00:10:23Z,
NVIDIA/NemoClaw,TypeScript,21617,2909,2026-03-15T17:04:09Z,Run agents like Hermes and OpenClaw more securely inside NVIDIA OpenShell with managed inference
alchaincyf/huashu-design,HTML,20964,2513,2026-04-19T14:42:06Z,Huashu Design · HTML-native design skill for Claude Code · Claude Code 里 HTML 原生的设计 skill · 高保真原型 /
alirezarezvani/claude-skills,Python,20911,2816,2025-10-19T04:04:05Z,"337 Claude Code skills & agent skills & plugins (30+ Agents, 70+ custom commands, 330+ skills, custo"
snarktank/ralph,TypeScript,20870,2037,2026-01-07T14:45:10Z,Ralph is an autonomous AI agent loop that runs repeatedly until all PRD items are complete.
claude-code-best/claude-code,TypeScript,20870,16361,2026-03-31T13:33:21Z,"原汁原昧 Claude Code 可运行,可构建, 可调试版; 生产级工程化, 企业级可靠性; 安全无毒, 内存泄露修复"
agentscope-ai/QwenPaw,Python,20769,2733,2026-02-24T03:42:56Z,"Your Personal AI Assistant; easy to install, deploy on your own machine or on the cloud; supports mu"
HKUDS/AI-Trader,Python,20552,3152,2025-10-23T12:45:00Z,"""AI-Trader: 100% Fully-Automated Agent-Native Trading"""
op7418/guizang-ppt-skill,HTML,20314,1462,2026-04-23T13:23:07Z,"AI-agent Skill for generating polished HTML slide decks: editorial magazine and Swiss layouts, image"
decolua/9router,JavaScript,20163,3268,2026-01-05T02:59:30Z,"Unlimited FREE AI coding. Connect Claude Code, Codex, Cursor, Cline, Copilot, Antigravity to FREE Cl"
titanwings/colleague-skill,Python,20090,1978,2026-03-30T05:22:23Z,将冰冷的离别化为温暖的 Skill，欢迎加入数字生命1.0！Transforming cold farewells into warm skills? It's giving rebirth era.
THU-MAIC/OpenMAIC,TypeScript,19368,3807,2026-03-11T10:13:16Z,"Open Multi-Agent Interactive Classroom — Get an immersive, multi-agent learning experience in just o"
tirth8205/code-review-graph,Python,19225,2058,2026-02-26T17:25:13Z,Local-first code intelligence graph for MCP and CLI. Builds a persistent map of your codebase so AI
Nagi-ovo/gemini-voyager,TypeScript,19094,616,2025-10-04T23:42:35Z,"An all-in-one enhancement suite for Google Gemini & AI Studio - timeline navigation, folder manageme"
webadderallorg/Recordly,TypeScript,18681,1340,2026-03-12T23:38:32Z,Create polished demo videos without editing skills. Mac/Windows/Linux
tanweai/pua,TypeScript,18657,1121,2026-03-08T16:55:16Z,你是一个曾经被寄予厚望的 P8 级工程师。Anthropic 当初给你定级的时候，对你的期望是很高的。  一个agent使用的高能动性的skill。  Your AI has been placed
mksglu/context-mode,TypeScript,18633,1303,2026-02-23T05:56:28Z,"Context window optimization for AI coding agents. Sandboxes tool output (98% reduction), persists se"
refactoringhq/tolaria,TypeScript,18374,1248,2026-02-14T19:43:14Z,Desktop app to manage markdown knowledge bases
pranshuparmar/witr,Go,18165,564,2025-12-20T17:26:59Z,Why is this running?
HKUDS/Vibe-Trading,Python,18094,2991,2026-04-01T09:52:20Z,"""Vibe-Trading: Your Personal Trading Agent"""
vectorize-io/hindsight,Python,18032,1102,2025-10-30T11:49:48Z,Hindsight: Agent Memory That  Learns
RightNow-AI/openfang,Rust,17975,2279,2026-02-24T23:12:38Z,Open-source Agent Operating System
datawhalechina/easy-vibe,JavaScript,17843,1691,2025-12-28T16:45:28Z,💻 vibe coding 2026 | Your First Modern Coding course beginners to master step by step.
Tencent/WeKnora,Go,17838,2407,2025-07-22T08:01:23Z,"Open-source LLM knowledge platform: turn raw documents into a queryable RAG, an autonomous reasoning"
h4ckf0r0day/obscura,Rust,17744,1230,2026-04-13T10:31:41Z,The headless browser for AI agents and web scraping
antirez/ds4,C,17688,1512,2026-05-06T17:17:05Z,"DeepSeek 4 Flash and PRO local inference engine for Metal, CUDA and ROCm"
jundot/omlx,Python,17554,1484,2026-02-13T14:13:27Z,LLM inference server with continuous batching & SSD caching for Apple Silicon — managed from the mac
pascalorg/editor,TypeScript,17270,2332,2025-10-16T19:35:06Z,Create and share 3D architectural projects.
teng-lin/notebooklm-py,Python,17251,2349,2026-01-07T15:27:19Z,Unofficial Python API and agentic skill for Google NotebookLM. Full programmatic access to NotebookL
muratcankoylan/Agent-Skills-for-Context-Engineering,Python,16885,1382,2025-12-21T02:43:42Z,"A comprehensive collection of Agent Skills for context engineering, multi-agent architectures, and p"
jnMetaCode/agency-agents-zh,Shell,16710,2857,2026-03-06T11:11:51Z,🎭 266 个即插即用的 AI 专家角色 — 支持 Hermes Agent/Claude Code/Cursor/Copilot 等 18 种工具，覆盖工程/设计/营销/金融等 20 个部门。含 5
different-ai/openwork,TypeScript,16655,1688,2026-01-14T01:39:31Z,An open-source alternative to Claude Cowork (powered by opencode)
KKKKhazix/khazix-skills,Python,16562,1929,2026-04-06T07:37:02Z,数字生命卡兹克开源的 AI Skills 合集
steipete/CodexBar,Swift,16543,1364,2025-11-16T17:00:44Z,"Show usage stats for OpenAI Codex and Claude Code, without having to login."
Wan-Video/Wan2.2,Python,16542,2057,2025-07-28T08:17:01Z,Wan: Open and Advanced Large-Scale Video Generative Models
gastownhall/gastown,Go,16530,1530,2025-12-16T00:33:33Z,Gas Town - multi-agent workspace manager
Snapchat/Valdi,C++,16392,540,2025-11-06T17:33:28Z,Valdi is a cross-platform UI framework that delivers native performance without sacrificing develope
danielmiessler/LifeOS,TypeScript,16376,2249,2025-09-08T16:18:30Z,An AI-powered Life Operating System for Magnifying Human Capabilities
