repo_name,language,stars,forks,created_at,description
teng-lin/notebooklm-py,Python,15652,2147,2026-01-07T15:27:19Z,Unofficial Python API and agentic skill for Google NotebookLM. Full programmatic access to NotebookL
decolua/9router,JavaScript,15617,2346,2026-01-05T02:59:30Z,"Unlimited FREE AI coding. Connect Claude Code, Codex, Cursor, Cline, Copilot, Antigravity to FREE Cl"
jundot/omlx,Python,15594,1327,2026-02-13T14:13:27Z,LLM inference server with continuous batching & SSD caching for Apple Silicon — managed from the mac
datawhalechina/easy-vibe,JavaScript,15501,1477,2025-12-28T16:45:28Z,💻 vibe coding 2026 | Your first modern Coding course for beginners to master step by step.
vectorize-io/hindsight,Python,15378,870,2025-10-30T11:49:48Z,Hindsight: Agent Memory That  Learns
MemoriLabs/Memori,Python,15161,2530,2025-07-24T07:07:51Z,Memori is agent-native memory infrastructure. A LLM-agnostic layer that turns agent execution and co
google-labs-code/design.md,TypeScript,15123,1430,2026-04-10T17:54:59Z,A format specification for describing a visual identity to coding agents. DESIGN.md gives agents a p
google/A2UI,TypeScript,15080,1177,2025-09-24T23:14:02Z,
pewdiepie-archdaemon/odysseus,JavaScript,15007,1890,2026-05-31T14:05:51Z,Self-hosted AI workspace. 
vercel-labs/json-render,TypeScript,14947,810,2026-01-14T17:22:39Z,The Generative UI framework
Yuan1z0825/nature-skills,Python,14899,906,2026-04-24T03:11:46Z,符合nature论文学术表达和科研绘图的Skill
Anionex/banana-slides,Python,14792,1729,2025-11-29T17:37:26Z,一个基于nano banana pro🍌的原生AI PPT生成应用，迈向＂Vibe PPT＂; 支持上传任意模板图片，上传任意素材&智能解析，一句话/大纲/页面描述自动生成PPT，口头修改指定区域、一
danielmiessler/Personal_AI_Infrastructure,TypeScript,14554,2067,2025-09-08T16:18:30Z,Agentic AI Infrastructure for magnifying HUMAN capabilities.
microsoft/RustTraining,Rust,14455,1123,2026-03-13T04:25:17Z,"Beginner, advanced, expert level Rust training material"
AndyMik90/Aperant,TypeScript,14312,1933,2025-12-04T22:10:37Z,Autonomous multi-session AI coding
OpenHub-Store/GitHub-Store,Kotlin,14255,513,2025-11-21T13:03:23Z,"🩵 A free, open-source app store for GitHub releases — browse, discover, and install apps with one cl"
eigent-ai/eigent,TypeScript,14173,1674,2025-07-29T15:56:02Z,Eigent: The Open Source Cowork Desktop to Unlock Your Exceptional Productivity. Local and Free Alter
browser-use/browser-harness,Python,14151,1315,2026-04-17T01:56:15Z,Browser Harness | Self-healing harness that enables LLMs to complete any task.
op7418/guizang-ppt-skill,HTML,14070,1068,2026-04-23T13:23:07Z,"AI-agent Skill for generating polished HTML slide decks: editorial magazine and Swiss layouts, image"
h4ckf0r0day/obscura,Rust,14037,913,2026-04-13T10:31:41Z,The headless browser for AI agents and web scraping
KittenML/KittenTTS,Python,14033,773,2025-08-05T03:30:24Z, State-of-the-art TTS model under 25MB 😻 
steipete/CodexBar,Swift,14026,1106,2025-11-16T17:00:44Z,"Show usage stats for OpenAI Codex and Claude Code, without having to login."
xpzouying/xiaohongshu-mcp,Go,13907,2102,2025-08-03T09:08:45Z,MCP for xiaohongshu.com
yusufkaraaslan/Skill_Seekers,Python,13869,1436,2025-10-17T14:43:48Z,"Convert documentation websites, GitHub repositories, and PDFs into Claude AI skills with automatic c"
byJoey/cfnew,Sin especificar,13858,6672,2025-09-06T17:10:05Z,
GeeeekExplorer/nano-vllm,Python,13787,2167,2025-06-09T16:22:14Z,Nano vLLM
NevaMind-AI/memU,Python,13753,1032,2025-07-29T01:54:40Z,Memory for 24/7 proactive agents like OpenClaw.
nikopueringer/CorridorKey,Python,13733,844,2026-02-25T08:51:11Z,Perfect Green Screen Keys
alam00000/bentopdf,JavaScript,13548,1096,2025-10-12T13:30:08Z,The Privacy First PDF Toolkit
jnMetaCode/agency-agents-zh,Shell,13518,2411,2026-03-06T11:11:51Z,🎭 211 个即插即用的 AI 专家角色 — 支持 Hermes Agent/Claude Code/Cursor/Copilot 等 16 种工具，覆盖工程/设计/营销/金融等 18 个部门。含 4
kyegomez/OpenMythos,Python,13502,3071,2026-04-18T12:57:52Z,"A theoretical reconstruction of the Claude Mythos architecture, built from first principles using th"
andrewyng/context-hub,JavaScript,13474,1181,2025-10-30T12:20:34Z,
originalankur/maptoposter,Python,13428,1207,2026-01-08T12:29:35Z,"Transform your favorite cities into beautiful, minimalist designs. MapToPoster lets you create and e"
coleam00/context-engineering-intro,Python,13406,2709,2025-07-02T11:54:47Z,Context engineering is the new vibe coding - it's the way to actually make AI coding assistants work
HKUDS/OpenHarness,Python,13382,2197,2026-04-01T15:37:13Z,"""OpenHarness: Open Agent Harness with a Built-in Personal Agent--Ohmo!"""
floci-io/floci,Java,13368,1259,2026-02-18T02:28:29Z,"Light, fluffy, and always free - The AWS Local Emulator alternative"
fish2018/pansou,Go,13337,3194,2025-07-10T07:17:46Z,PanSou是一款高性能的网盘资源搜索API服务，支持TG频道和插件搜索。系统设计以性能和可扩展性为核心，支持多频道多插件并发搜索、结果智能排序和网盘类型分类。docker集成前后端，一键启动，开箱即
larksuite/cli,Go,13236,902,2026-03-25T07:13:30Z,"The official Lark/Feishu CLI tool, maintained by the larksuite team — built for humans and AI Agents"
mukul975/Anthropic-Cybersecurity-Skills,Python,13138,1537,2026-02-25T09:47:50Z,"754 structured cybersecurity skills for AI agents · Mapped to 5 frameworks: MITRE ATT&CK, NIST CSF 2"
travisvn/awesome-claude-skills,Sin especificar,13080,1449,2025-10-16T20:42:39Z,"A curated list of awesome Claude Skills, resources, and tools for customizing Claude AI workflows — "
aiming-lab/AutoResearchClaw,Python,13064,1528,2026-03-15T03:38:49Z,Fully autonomous & self-evolving research from idea to paper. Chat an Idea. Get a Paper. 🦞
Open-Dev-Society/OpenStock,TypeScript,12841,1698,2025-09-28T18:16:32Z,"OpenStock is an open-source alternative to expensive market platforms. Track real-time prices, set p"
ComposioHQ/awesome-codex-skills,Python,12692,1233,2026-01-12T11:58:21Z,A curated list of practical Codex skills for automating workflows across the Codex CLI and API.
antirez/ds4,C,12665,1094,2026-05-06T17:17:05Z,DeepSeek 4 Flash local inference engine for Metal and CUDA
chatfire-AI/huobao-drama,TypeScript,12549,2379,2026-01-05T11:38:30Z,🎬 火宝短剧 - 基于AI的一站式短剧生成平台 《一句话生成完整短剧，从剧本到成片全自动化》  Huobao Drama - An AI-Powered End-to-End Short Drama 
NoFxAiOS/nofx,Go,12510,2997,2025-10-28T07:17:53Z,"Your AI trading terminal assistant for US stocks, commodities, forex, and crypto."
waooAI/waoowaoo,TypeScript,12500,2822,2026-01-22T12:09:36Z,首家工业级全流程 AI 影视生产平台。Industry-first professional AI Agent platform for controllable film & video produ
sapientinc/HRM,Python,12499,1825,2025-07-09T02:09:32Z,Hierarchical Reasoning Model Official Release
KKKKhazix/khazix-skills,Python,12386,1661,2026-04-06T07:37:02Z,数字生命卡兹克开源的 AI Skills 合集
nearai/ironclaw,Rust,12385,1446,2026-02-03T06:57:10Z,"IronClaw is an Agent OS focused on privacy, security and extensibility"
lsdefine/GenericAgent,Python,12380,1427,2026-01-16T15:45:24Z,"Self-evolving agent: grows skill tree from 3.3K-line seed, achieving full system control with 6x les"
contains-studio/agents,Sin especificar,12379,2531,2025-07-28T14:42:35Z,sharing current agents in use
YouMind-OpenLab/awesome-nano-banana-pro-prompts,TypeScript,12348,1340,2025-11-23T07:17:48Z,"🍌 World's largest Nano Banana Pro prompt library — 10,000+ curated prompts with preview images, 16 l"
MiniMax-AI/skills,C#,12270,1048,2026-03-17T07:19:25Z,
Usagi-org/ai-goofish-monitor,Python,12266,1774,2025-07-16T08:13:41Z,基于 Playwright 和AI实现的闲鱼多任务实时/定时监控与智能分析系统，配备了功能完善的后台管理UI。帮助用户从闲鱼海量商品中，找到心仪产品。
pingdotgg/t3code,TypeScript,12260,2427,2026-02-08T23:46:22Z,
YishenTu/claudian,TypeScript,12159,737,2025-12-05T17:58:26Z,An Obsidian plugin that embeds Claude Code/Codex as an AI collaborator in your vault
NanmiCoder/cc-haha,TypeScript,12042,8114,2026-03-31T17:30:14Z,Claude Code 泄露源码 - 本地可运行版本，新增跨平台桌面端软件补齐Computer Use（附带核心模块解析）
sanbuphy/learn-coding-agent,Sin especificar,11941,19724,2026-03-31T09:07:08Z,Research on Coding Agents
Wei-Shaw/claude-relay-service,JavaScript,11940,1794,2025-07-14T10:11:32Z,CRS-自建Claude Code镜像，一站式开源中转服务，让 Claude、OpenAI、Gemini、Droid 订阅统一接入，支持拼车共享，更高效分摊成本，原生工具无缝使用。
StarTrail-org/LEANN,Python,11845,1054,2025-06-09T06:52:59Z,"[MLsys2026]: RAG on Everything with LEANN. Enjoy 97% storage savings while running a fast, accurate,"
phuryn/pm-skills,Sin especificar,11813,1394,2026-03-01T23:33:44Z,"PM Skills Marketplace: 100+ agentic skills, commands, and plugins — from discovery to strategy, exec"
jd-opensource/joyagent-jdgenie,Java,11811,1627,2025-07-16T02:59:53Z,开源的端到端产品级通用智能体
hangwin/mcp-chrome,TypeScript,11792,1057,2025-06-09T09:07:06Z,Chrome MCP Server is a Chrome extension-based Model Context Protocol (MCP) server that exposes your 
millionco/react-doctor,TypeScript,11725,380,2026-02-13T09:02:13Z,Your agent writes bad React. This catches it
refactoringhq/tolaria,TypeScript,11711,849,2026-02-14T19:43:14Z,Desktop app to manage markdown knowledge bases
QwenLM/Qwen3-TTS,Python,11684,1524,2026-01-21T06:41:32Z,"Qwen3-TTS is an open-source series of TTS models developed by the Qwen team at Alibaba Cloud, suppor"
zilliztech/claude-context,TypeScript,11667,860,2025-06-06T02:12:47Z,Code search MCP for Claude Code. Make entire codebase the context for any coding agent.
QuipNetwork/quip-protocol,Python,11645,159,2026-01-16T05:39:29Z,experimental quip protocol network node
bytedance/trae-agent,Python,11618,1275,2025-06-13T12:05:15Z,Trae Agent is an LLM-based agent for general purpose software engineering tasks.
BeehiveInnovations/pal-mcp-server,Python,11572,1009,2025-06-08T15:36:50Z,The power of Claude Code / GeminiCLI / CodexCLI + [Gemini / OpenAI / OpenRouter / Azure / Grok / Oll
anomalyco/opentui,TypeScript,11547,579,2025-07-21T09:35:54Z,OpenTUI is a library for building terminal user interfaces (TUIs)
siteboon/claudecodeui,TypeScript,11544,1567,2025-06-25T12:51:12Z,"Use Claude Code, Cursor CLI or Codex on mobile and web with CloudCLI (aka Claude Code UI). CloudCLI "
superset-sh/superset,TypeScript,11481,968,2025-10-21T09:16:51Z,"Code Editor for the AI Agents Era - Run an army of Claude Code, Codex, etc. on your machine"
Tongyi-MAI/Z-Image,Python,11430,778,2025-11-26T09:18:10Z,
HW-whistleblower/True-Story-of-Pangu,Sin especificar,11410,1312,2025-07-05T20:40:24Z,诺亚盘古大模型研发背后的真正的心酸与黑暗的故事。
QuipNetwork/cpp-sdk,C++,11323,44,2025-06-20T17:34:30Z,
chenhg5/cc-connect,Go,11274,1032,2026-02-28T02:39:39Z,"Bridge local AI coding agents (Claude Code, Cursor, Gemini CLI, Codex) to messaging platforms (Feish"
QuipNetwork/hashsigs-py,Python,11247,26,2025-08-27T17:25:50Z,
wanshuiyin/Auto-claude-code-research-in-sleep,Python,11160,1050,2026-03-10T07:31:45Z,ARIS ⚔️ (Auto-Research-In-Sleep) — Lightweight Markdown-only skills for autonomous ML research: cros
hicccc77/WeFlow,TypeScript,11093,2637,2026-01-07T13:40:57Z,WeFlow - 一个本地的微信聊天记录导出和年度报告应用
supertone-inc/supertonic,Swift,11088,1155,2025-11-18T08:23:58Z,"Lightning-Fast, On-Device, Multilingual TTS — running natively via ONNX."
datalab-to/chandra,Python,11051,1147,2025-10-08T21:34:16Z,"OCR model that handles complex tables, forms, handwriting with full layout."
google/skills,Python,11005,873,2026-03-31T19:02:20Z,Agent Skills for Google products and technologies
alibaba/OpenSandbox,Python,10922,875,2025-12-17T08:41:09Z,"Secure, Fast, and Extensible Sandbox runtime for AI agents."
accomplish-ai/accomplish,TypeScript,10831,1278,2026-01-14T12:22:38Z,Accomplish™ is the open source Al coworker that lives on your desktop
MoonshotAI/Kimi-K2,Sin especificar,10816,845,2025-07-03T12:28:22Z,Kimi K2 is the large language model series developed by Moonshot AI team
InsForge/InsForge,TypeScript,10811,937,2025-07-29T05:56:00Z,"The all-in-one, open-source backend platform for agentic coding. InsForge gives your coding agent da"
ace-step/ACE-Step-1.5,Python,10788,1309,2025-09-04T02:00:07Z,"The most powerful local music generation model that outperforms almost all commercial alternatives, "
ValueCell-ai/valuecell,Python,10765,1806,2025-09-01T09:07:06Z,"ValueCell is a community-driven, multi-agent platform for financial applications."
NoeFabris/opencode-antigravity-auth,TypeScript,10718,22,2025-12-09T23:46:18Z,Enable Opencode to authenticate against Antigravity (Google's IDE) via OAuth so you can use Antigrav
emdash-cms/emdash,TypeScript,10709,965,2026-04-01T08:45:02Z,EmDash is a full-stack TypeScript CMS based on Astro; the spiritual successor to WordPress
Piebald-AI/claude-code-system-prompts,JavaScript,10696,1871,2025-11-18T21:26:33Z,"All parts of Claude Code's system prompt, 27 builtin tool descriptions, sub agent prompts (Plan/Expl"
huggingface/skills,Python,10602,693,2025-11-24T07:31:48Z,Give your agents the power of the Hugging Face ecosystem
nesquena/hermes-webui,Python,10594,1422,2026-03-30T21:50:12Z,Hermes WebUI: The best way to use Hermes Agent from the web or from your phone!
facebookresearch/dinov3,Jupyter Notebook,10553,865,2025-08-07T14:11:34Z,Reference PyTorch implementation and models for DINOv3
aden-hive/hive,Python,10472,5660,2026-01-12T00:04:22Z,Multi-Agent Harness for Production AI
BigPizzaV3/CodexPlusPlus,Rust,10357,676,2026-05-06T09:32:49Z,"An enhanced tool for CodexApp, striving to make Codex better to use and more comfortable 一个CodexApp的"
RunanywhereAI/runanywhere-sdks,C++,10345,357,2025-07-22T01:23:34Z,Production ready toolkit to run AI locally
facebookresearch/sam3,Python,10316,1546,2025-07-17T16:15:40Z,The repository provides code for running inference and finetuning with the Meta Segment Anything Mod
numman-ali/openskills,TypeScript,10313,654,2025-10-26T19:43:54Z,Universal skills loader for AI coding agents - npm i -g openskills
huggingface/ml-intern,Python,10182,1088,2025-10-30T13:43:09Z,"🤗 ml-intern: an open-source ML engineer that reads papers, trains models, and ships ML models"
lukilabs/beautiful-mermaid,TypeScript,10178,348,2026-01-28T16:31:46Z,
calesthio/Crucix,JavaScript,10144,1606,2026-03-14T07:33:06Z,Your personal intelligence agent. Watches the world from multiple data sources and pings you when so
sirmalloc/ccstatusline,TypeScript,10064,441,2025-08-08T11:19:28Z,"🚀 Beautiful highly customizable statusline for Claude Code CLI with powerline support, themes, and m"
nashsu/llm_wiki,TypeScript,10052,1245,2026-04-08T11:24:01Z,"LLM Wiki is a cross-platform desktop application that turns your documents into an organized, interl"
ZeroLu/awesome-nanobanana-pro,Sin especificar,10046,849,2025-11-10T13:51:03Z,🚀 An awesome list of curated Nano Banana pro prompts and examples. Your go-to resource for mastering
microsoft/vscode-copilot-chat,TypeScript,9946,1965,2025-06-10T16:21:19Z,Copilot Chat extension for VS Code
NVIDIA/personaplex,Python,9940,1392,2026-01-05T19:10:35Z,PersonaPlex code.
cloudflare/moltworker,TypeScript,9907,1777,2026-01-27T11:09:39Z,"Run OpenClaw, (formerly Moltbot, formerly Clawdbot) on Cloudflare Workers"
jlcodes99/cockpit-tools,Rust,9871,914,2026-01-16T07:09:32Z, 🚀 通用 AI IDE 账号管理工具：支持 Antigravity / Codex / GitHub Copilot / Windsurf / Kiro / Cursor / Gemini-cli 
Kuberwastaken/claurst,Rust,9741,7800,2026-03-31T09:23:58Z,Agentic Coding for Builders who Ship
alibaba/zvec,C++,9737,558,2025-12-05T07:45:38Z,"A lightweight, lightning-fast, in-process vector database"
diet103/claude-code-infrastructure-showcase,Shell,9688,1221,2025-10-30T03:12:16Z,"Examples of my Claude Code infrastructure with skill auto-activation, hooks, and agents"
vercel-labs/portless,TypeScript,9595,303,2026-02-15T14:43:03Z,"Replace port numbers with stable, named local URLs. For humans and agents."
AnmolSaini16/mapcn,TypeScript,9560,549,2025-12-28T10:57:22Z,"Beautiful map components. 100% Free, Zero config, one command setup."
Jeffallan/claude-skills,Python,9541,809,2025-10-20T20:27:22Z,66 Specialized Skills for Full-Stack Developers. Transform Claude Code into your expert pair program
MemTensor/MemOS,TypeScript,9483,859,2025-07-06T09:51:27Z,"Self-evolving memory OS for LLM & AI Agents: ultra-persistent memory, hybrid-retrieval, and cross-ta"
HBAI-Ltd/Toonflow-app,HTML,9357,1675,2026-01-29T10:25:45Z,Toonflow 是开源一站式 AI 短剧创作工具，将小说、剧本快速转化为动画短剧。集成 AI 编剧、智能分镜、角色与视频生成，跨平台桌面端轻量部署，助力创作者低成本批量产出视觉内容。Toonflow
BehiSecc/awesome-claude-skills,Sin especificar,9350,1192,2025-10-17T15:05:35Z,A curated list of Claude Skills.
can1357/oh-my-pi,TypeScript,9308,753,2025-12-31T14:01:28Z,"⌥  AI Coding agent for the terminal — hash-anchored edits, optimized tool harness, LSP, Python, brow"
ChinaSiro/claude-code-sourcemap,TypeScript,9304,14667,2026-03-31T08:15:54Z,
HKUDS/Vibe-Trading,Python,9279,1904,2026-04-01T09:52:20Z,"""Vibe-Trading: Your Personal Trading Agent"""
frankbria/ralph-claude-code,Shell,9238,703,2025-08-27T16:03:45Z,Autonomous AI development loop for Claude Code with intelligent exit detection
Orchestra-Research/AI-Research-SKILLs,TeX,9186,697,2025-11-03T06:13:06Z,Comprehensive open-source library of AI research and engineering skills for any AI model. Package th
nexmoe/VidBee,TypeScript,9159,705,2025-10-22T13:43:42Z,Download videos from almost any website worldwide
pinchtab/pinchtab,Go,9147,677,2026-02-15T11:12:33Z,High-performance browser automation bridge and multi-instance orchestrator with advanced stealth inj
mindfold-ai/Trellis,TypeScript,9064,495,2026-01-26T11:49:10Z,The best agent harness.
0x4m4/hexstrike-ai,Python,9038,1959,2025-07-10T17:53:18Z,"HexStrike AI MCP Agents is an advanced MCP server that lets AI agents (Claude, GPT, Copilot, etc.) a"
davidkimai/Context-Engineering,Python,9037,1009,2025-06-29T00:16:36Z,"""Context engineering is the delicate art and science of filling the context window with just the rig"
fathah/hermes-desktop,TypeScript,9022,1092,2026-04-02T15:26:49Z,Desktop Companion for Hermes Agent
KrishKrosh/TrackWeight,Swift,9015,390,2025-07-21T05:55:02Z,Use your Mac trackpad as a weighing scale
BigBodyCobain/Shadowbroker,Python,8954,1375,2026-03-05T03:59:55Z,Open-source intelligence for the global theater. Track everything from the corporate/private jets of
slavingia/skills,Sin especificar,8928,916,2026-03-23T19:16:00Z,Based on The Minimalist Entrepreneur by Sahil Lavingia
rednote-hilab/dots.ocr,Python,8894,798,2025-07-30T11:03:59Z,Multilingual Document Layout Parsing in a Single Vision-Language Model
MoonshotAI/kimi-cli,Python,8850,1095,2025-10-15T12:58:03Z,Kimi Code CLI is your next CLI agent.
openclaw/clawhub,TypeScript,8833,1377,2026-01-03T13:49:41Z,Skill + Plugin Registry for OpenClaw
op7418/Humanizer-zh,Sin especificar,8820,690,2026-01-19T04:23:44Z,Humanizer 的汉化版本，Claude Code Skills，旨在消除文本中 AI 生成的痕迹。
github/copilot-sdk,Java,8754,1186,2026-01-14T00:23:22Z,Multi-platform SDK for integrating GitHub Copilot Agent into apps and services
browser-use/video-use,Python,8750,1279,2026-04-12T01:34:42Z,Edit videos with coding agents
MoonTechLab/LunaTV,TypeScript,8739,8567,2025-08-12T13:59:33Z,本项目采用 CC BY-NC-SA 协议，禁止任何商业化行为，任何衍生项目必须保留本项目地址并以相同协议开源
fluxerapp/fluxer,TypeScript,8701,493,2026-01-01T21:09:14Z,"A free and open source instant messaging and VoIP platform built for friends, groups, and communitie"
nicobailon/visual-explainer,HTML,8647,580,2026-02-16T19:33:52Z,"Agent skill that generates rich HTML pages or slide decks for diagrams, diff reviews, plan audits, d"
nidhinjs/prompt-master,Sin especificar,8604,993,2026-03-11T16:25:43Z,A Claude skill that writes the accurate prompts for any AI tool. Zero tokens or credits wasted. Full
run-llama/liteparse,Rust,8583,508,2026-02-09T22:16:30Z,"A fast, helpful, and open-source document parser"
ykdojo/claude-code-tips,JavaScript,8572,648,2025-11-28T00:52:00Z,"45 tips for getting the most out of Claude Code, from basics to advanced - includes a custom status "
bwya77/vscode-dark-islands,PowerShell,8552,272,2026-02-14T05:06:12Z,VSCode theme based off the easemate IDE and Jetbrains islands theme
iflytek/astron-agent,Java,8531,847,2025-09-19T08:46:01Z,"Enterprise-grade, commercial-friendly agentic workflow platform for building next-generation SuperAg"
we-promise/sure,Ruby,8474,120,2025-07-23T04:13:55Z,The personal finance app for everyone (by everyone)
apple/ml-sharp,Python,8451,611,2025-12-12T03:46:09Z,Sharp Monocular View Synthesis in Less Than a Second
freecodexyz/free-code,TypeScript,8409,2004,2026-03-31T11:11:49Z,"The free build of Claude Code. All telemetry removed, security-prompt guardrails stripped, all exper"
MiroMindAI/MiroThinker,Python,8216,636,2025-08-07T13:32:12Z,MiroThinker is a deep research agent optimized for complex research and prediction tasks. Our latest
HKUDS/ClawWork,Python,8176,1060,2026-02-15T16:41:38Z,"""ClawWork: OpenClaw as Your AI Coworker - 💰 $15K earned in 11 Hours"""
automazeio/ccpm,Shell,8162,834,2025-08-18T23:20:08Z,Project management skill system for Agents that uses GitHub Issues and Git worktrees for parallel ag
datawhalechina/all-in-rag,Python,8142,4014,2025-06-05T08:12:35Z,🔍大模型应用开发实战一：RAG 技术全栈指南，在线阅读地址：https://datawhalechina.github.io/all-in-rag/
cloudflare/vinext,TypeScript,8118,329,2026-02-24T05:07:41Z,Vite plugin that reimplements the Next.js API surface — deploy anywhere
Maciek-roboblog/Claude-Code-Usage-Monitor,Python,8115,417,2025-06-19T00:00:05Z,Real-time Claude Code usage monitor with predictions and warnings
tonyantony300/alt-sendme,TypeScript,8114,497,2025-10-17T09:08:25Z,"Send files and folders anywhere in the world without storing in cloud - any size, any format, no acc"
justlovemaki/AIClient2API,JavaScript,8096,1274,2025-07-20T07:05:56Z,"Simulates Gemini CLI, Antigravity, Codex, Grok, and Kiro client requests, compatible with the OpenAI"
boson-ai/higgs-audio,Python,8092,621,2025-07-20T05:25:27Z,Text-audio foundation model from Boson AI
microsoft/TRELLIS.2,Python,8076,979,2025-11-26T10:04:35Z,Native and Compact Structured Latents for 3D Generation
mmulet/term.everything,Go,7987,190,2025-09-07T02:52:48Z,Run any GUI app in the terminal❗
QwenLM/Qwen-Image,Python,7957,499,2025-08-03T11:03:25Z,Qwen-Image is a powerful image generation foundation model capable of complex text rendering and pre
CyberTimon/RapidRAW,TypeScript,7934,356,2025-06-13T20:16:40Z,"A beautiful, non-destructive, and GPU-accelerated RAW image editor built with performance in mind."
anthropics/claude-for-legal,Python,7928,1400,2026-04-21T15:43:42Z,A suite of plugins for legal workflows
hardikpandya/stop-slop,Sin especificar,7915,562,2026-01-11T12:00:59Z,A skill file for removing AI tells from prose
pixel-agents-hq/pixel-agents,TypeScript,7882,1211,2026-02-08T19:14:11Z,Pixel office.
GetStream/Vision-Agents,Python,7871,657,2025-08-11T18:02:04Z,Open Vision Agents by Stream. Build voice and vision agents quickly with any model or video provider
vicinaehq/vicinae,C++,7870,207,2025-07-28T03:49:03Z,"A focused launcher for your desktop - native, fast, extensible"
Snouzy/workout-cool,TypeScript,7839,659,2025-06-11T13:19:26Z,"🏋 Modern open-source fitness coaching platform. Create workout plans, track progress, and access a c"
AgriciDaniel/claude-seo,Python,7808,1167,2026-02-07T08:17:38Z,"Universal SEO skill for Claude Code. 25 sub-skills + 18 sub-agents covering technical SEO, E-E-A-T, "
ZyperWave/ZyperWinOptimize,C#,7791,454,2025-08-05T01:46:41Z,ZyperWin++是一个轻便的Windows优化工具，适用于Win7-Win11最新版的优化，包括性能优化、服务项优化、垃圾清理等操作，还支持系统激活和Office快速安装。
zubair-trabzada/geo-seo-claude,Python,7739,1268,2026-02-18T09:01:07Z,GEO-first SEO skill for Claude Code. Comprehensive AI search optimization for any website — citabili
gsd-build/gsd-2,TypeScript,7735,786,2026-03-11T04:28:49Z,"A powerful meta-prompting, context engineering and spec-driven development system that enables agent"
nullclaw/nullclaw,Zig,7640,890,2026-02-16T21:17:27Z,"Fastest, smallest, and fully autonomous AI assistant infrastructure written in Zig"
companion-inc/feynman,TypeScript,7638,931,2026-03-19T18:53:05Z,
vudovn/ag-kit,TypeScript,7632,1480,2026-01-14T09:06:28Z,
openclaw/gogcli,Go,7629,597,2025-12-12T12:36:45Z,Google Workspace in your terminal.
francescopace/espectre,Python,7612,591,2025-10-26T10:41:51Z,"🛜 ESPectre 👻  - Motion detection system based on Wi-Fi spectre analysis (CSI), with Home Assistant i"
EvoMap/evolver,JavaScript,7611,775,2026-02-01T05:59:24Z,"The GEP-powered self-evolving engine for AI agents. Auditable evolution with Genes, Capsules, and Ev"
pickle-com/glass,JavaScript,7517,1109,2025-07-02T20:28:49Z,Digital Mind Extension
awesome-opencode/awesome-opencode,JavaScript,7485,515,2025-09-22T00:01:14Z,"A curated list of awesome plugins, themes, agents, projects, and resources for https://opencode.ai"
alchaincyf/zhangxuefeng-skill,Sin especificar,7472,2359,2026-04-05T11:37:18Z,张雪峰.skill — 张雪峰的认知操作系统。高考志愿/考研/职业规划的实战思维框架。由女娲.skill生成。
