repo_name,language,stars,forks,created_at,description
V380-Ori/Astris.Binaries,Sin especificar,739,21,2025-11-15T00:40:05Z,Distribution binaries of Astris - a Nintendo Switch 1 emulator based on Ryujinx for Apple silicon Ma
toon-format/toon-python,Python,738,59,2025-11-01T21:01:52Z,🐍 Community-driven Python implementation of TOON
bukkbeek/GodotPixelRenderer,GDScript,738,68,2025-07-21T06:16:38Z,Complete 3D to Pixel Toolkit [Built using Godot Engine]
darcyegb/ClaudeCodeAgents,Sin especificar,737,68,2025-07-31T18:34:10Z,A set of useful QA agents for Claude Code.
assistant-ui/tool-ui,TypeScript,737,30,2025-11-03T17:14:11Z,UI components for AI interfaces
MohElshamy1994/n8n-course-Projetcs,Sin especificar,737,93,2025-07-13T21:35:50Z,n8n Projects for my Youtube’ course.
MaskerPRC/everything-ai-chat,JavaScript,737,43,2025-07-29T20:51:17Z,一个现代化的 Everything 搜索客户端，将 AI 智能与极速本地搜索完美结合。
4ier/neo,JavaScript,737,52,2025-11-03T13:53:10Z,"Turn any web app into an API. Chrome extension captures browser traffic, auto-generates schemas, let"
sameerasw/airsync-mac,Swift,735,58,2025-07-27T00:01:46Z,AirSync macOS - Bring the forbidden macOS continuity to Android
stretchcloud/claude-code-unified-agents,Shell,734,73,2025-08-03T15:47:38Z,
aws/bedrock-agentcore-sdk-python,Python,734,126,2025-07-07T22:12:31Z,Python SDK for transforming any AI agent into a production-ready application. Framework-agnostic pri
langchain-ai/deep_research_from_scratch,Jupyter Notebook,733,241,2025-07-11T04:28:58Z,
build-with-groq/groq-code-cli,TypeScript,733,112,2025-07-30T00:07:27Z,"A highly customizable, lightweight, and open-source coding CLI powered by Groq for instant iteration"
oceanbase/powermem,Python,732,90,2025-11-10T02:46:06Z,"PowerMem: AI Memory Plugin— Accurate, Agile, Affordable. Make AI Agent smarter."
divar-ir/ai-doc-gen,Python,731,76,2025-07-19T08:15:43Z,AI-powered multi-agent system that automatically analyzes codebases and generates comprehensive docu
robot-learning-co/trlc-dk1,Python,730,102,2025-07-29T15:22:29Z,TRLC's Developer Kit 1
patrick-kidger/tinyio,Python,730,24,2025-07-20T11:35:59Z,Ever used asyncio and wished you hadn't? A tiny (~400 lines) event loop for Python.
carlrannaberg/claudekit,TypeScript,727,115,2025-07-11T19:09:58Z,"A toolkit of custom commands, hooks, and utilities for Claude Code"
NVlabs/rcm,Python,727,26,2025-10-09T00:37:47Z,rCM & Causal-rCM: Leading and Unified Algorithms/Infrastructures for Bidirectional/Autoregressive Vi
ServerTechnologies/3x-ui-with-xhttp,Shell,726,62,2025-08-11T12:19:28Z,Настройка прокси vless c xhttp с помощью 3x-ui
NVlabs/Long-RL,Python,726,28,2025-07-08T14:18:54Z,Long-RL: Scaling RL to Long Sequences (NeurIPS 2025)
NVlabs/Jet-Nemotron,Python,726,48,2025-08-20T15:23:21Z,
Tencent-Hunyuan/Hunyuan-GameCraft-1.0,Python,725,75,2025-08-13T07:56:51Z,Hunyuan-GameCraft: High-dynamic Interactive Game Video Generation with Hybrid History Condition
Alia5/SISR,Go,725,14,2025-11-23T15:22:17Z,"SISR (Steam Input System Redirector; pronounced ""scissor"") is a tool that allows users to redirect S"
archistico/ShadeOfColor2,C#,724,58,2025-08-29T10:35:16Z,A simple cross-platform tool to hide files inside PNG images
zhzhzhy/NinjiaTag-backend,Python,723,82,2025-07-14T15:23:29Z,
OfficialKango/KANGO-XMD-LITE,JavaScript,722,1783,2025-07-02T13:52:37Z,
vinhnx/VTCode,Rust,721,64,2025-08-29T09:01:48Z,"VT Code is a Rust coding agent with LLM-native code understanding, OS-native sandboxing, and multi-p"
steipete/Trimmy,Swift,721,39,2025-11-15T22:43:58Z,"""Paste once, run once."" — Trimmy flattens those multi-line shell snippets you copy so they actually"
KartikLabhshetwar/screenshot-studio,TypeScript,721,116,2025-11-03T09:59:12Z,"A free, browser-based editor for creating stunning screenshots and visuals. No signup, no watermarks"
diinki/linux-retroism,CSS,720,26,2025-08-04T19:10:53Z,"A 1990's Retro linux-rice for Hyprland or Sway, based on Quickshell."
Chen-zexi/open-ptc-agent,Python,720,87,2025-11-07T02:48:40Z,An open source implementation of code execution with MCP (Programatic Tool Calling)
777genius/claude-notifications-go,Go,720,92,2025-10-19T15:10:46Z,🔔 Cross-platform smart notifications plugin for Claude Code. 6 types. Click-to-focus. 1 line install
23blocks-OS/ai-maestro,TypeScript,720,94,2025-10-10T00:17:03Z,"AI Agent Orchestrator with Skills System - Give AI Agents superpowers: memory search, code graph que"
wecode-ai/RunVSAgent,Kotlin,719,101,2025-07-31T06:15:13Z,Run VSCode-based coding agents and extensions seamlessly within other IDE platforms - bridging the g
ryoiki-tokuiten/Iterative-Contextual-Refinements,TypeScript,719,63,2025-08-01T13:32:43Z,Using BFS & DFS like techniques over LLMs for iteratively exploring the solution search space at sca
livewire/blaze,PHP,719,33,2025-08-08T01:00:41Z,Pre-compile Blade components for blazing fast rendering performance
vyrx-dev/Wallpapers,Sin especificar,718,28,2025-11-10T14:10:39Z,My fav Wallpapers Collections
chenran818/CFP-Study,Sin especificar,718,226,2025-10-11T18:33:26Z,
soufianekhiat/ImAnim,C++,717,35,2025-11-27T13:57:58Z,Animation Engine for Dear ImGui
Flame-00/vue3-request,TypeScript,716,1,2025-06-30T03:27:43Z,A concise and elegant Vue 3 asynchronous processing solution that simplifies complex asynchronous lo
google-deepmind/disco_rl,Python,714,60,2025-07-24T16:06:21Z,"Accompanying code for ""Discovering State-of-the-art Reinforcement Algorithms"" Nature publication"
Tencent-Hunyuan/Hunyuan-MT,Python,713,69,2025-08-28T09:54:40Z,
RecapAI/Recap,Swift,713,39,2025-08-02T10:19:05Z,"Open Source, Privacy-First, macOS-Native AI Meeting Summary"
Chimioo/InxLocker,Kotlin,712,23,2025-08-14T17:19:21Z,Xposed-based Installer Locker for Android (Powered by YukiHookAPI)
kn1026/cc,Sin especificar,710,269,2025-07-26T19:06:59Z,claude code system prompt
fazgal0/free-sms-receivers,Sin especificar,710,60,2025-10-10T08:26:00Z,16个免费接码平台：注册免烦恼，一键即可接码！
timothepoznanski/poznote,JavaScript,708,29,2025-08-01T16:19:33Z,Poznote is a note-taking and documentation platform.
tahayvr/omarchist,Rust,708,21,2025-08-30T13:18:31Z,A GUI app for Omarchy Linux.
du2333/flare-stack-blog,TypeScript,708,530,2025-10-24T06:21:39Z,A modern full-stack blog CMS driven by Cloudflare. | 基于 Cloudflare 生态的全栈现代化博客 CMS。
liyupi/ai-code-helper,Vue,707,235,2025-07-09T08:09:59Z,2025 年 AI 编程助手实战项目（作者：程序员鱼皮），基于 Spring Boot 3.5 + Java 21 + LangChain4j + AI 构建智能编程学习与求职辅导机器人，覆盖 AI
kavan010/Atoms,C++,706,96,2025-10-04T13:04:08Z,
obra/superpowers-skills,TypeScript,705,161,2025-10-11T17:06:05Z,Community-editable skills for Claude Code's superpowers plugin
saihgupr/HomeAssistantTimeMachine,JavaScript,704,15,2025-10-13T19:04:34Z,"Home Assistant Time Machine is a web-based tool that acts as a ""Time Machine"" for your Home Assistan"
dahlia/optique,TypeScript,704,8,2025-08-19T05:34:10Z,Type-safe combinatorial CLI parser for TypeScript
PacktPublishing/30-Agents-Every-AI-Engineer-Must-Build,Jupyter Notebook,704,273,2025-08-07T14:10:13Z,"30 Agents Every AI Engineer Must Build, published by Packt"
badlogic/sitegeist,TypeScript,703,113,2025-10-04T21:21:12Z,"An AI assistant that lives in your browser. Built for collaboration, not autonomy theater. You guide"
ubikron/Awesome-AI-OSINT,Sin especificar,702,110,2025-08-25T18:48:09Z,"A list of articles, videos, and tools related to the use of AI for OSINT."
kmccleary3301/nested_learning,Python,702,101,2025-11-10T05:53:54Z,A Reproduction of GDM's Nested Learning Paper
gensyn-ai/codeassist,Python,702,124,2025-10-31T14:03:09Z,"A completely private and local AI coding assistant, developed by Gensyn. It helps you practice progr"
csswizardry/Obs.js,JavaScript,701,18,2025-08-10T09:23:41Z,Context-aware web performance for everyone
LayoutitStudio/polycss,TypeScript,701,18,2025-11-16T16:51:14Z,A CSS 3D engine for the DOM. Renders polygon meshes in HTML by leveraging matrix3d transforms.
ml-explore/mlx-swift-lm,Swift,700,299,2025-10-02T00:45:12Z,LLMs and VLMs with MLX Swift
googlecolab/colab-mcp,Python,700,134,2025-10-24T18:38:59Z,An MCP server for interacting with Google Colab
bartolli/codanna,Rust,699,63,2025-07-24T23:13:52Z,Local code intelligence MCP server and CLI for AI coding agents
team-mirai/marumie,TypeScript,698,81,2025-08-13T02:25:52Z,政治資金の流れを透明性を持って公開するプラットフォームです
komal-SkyNET/claude-skill-homeassistant,Sin especificar,698,45,2025-11-29T00:45:14Z,Claude Code skill to supercharge and manage all Home Assistant workflows
leekleak/traffic-light,Kotlin,697,25,2025-10-28T18:52:59Z,Track your network and data usage with privacy
agentscope-ai/OpenJudge,Python,697,57,2025-07-08T06:17:01Z,OpenJudge: A Unified Framework for Holistic Evaluation and Quality Rewards
kinghacker0/WhatsApp-OSINT,Python,696,136,2025-10-16T10:24:41Z,"OSINT tool for WhatsApp that allows you to obtain profile pictures, verify Business accounts, check"
gokapso/whatsapp-cloud-inbox,TypeScript,696,116,2025-10-20T16:00:25Z,Open source Inbox for the official WhatsApp Cloud API.
ahmedbna/ui,TypeScript,696,53,2025-07-04T20:37:11Z,"BNA UI - Expo, React Native components library"
bobvibes/Awesome-Vibecoding-Guide,Sin especificar,694,75,2025-10-28T13:21:50Z,A compendium drawn from real commercial projects and hundreds of thousands of lines of AI‑assisted c
ZeroLu/awesome-gemini-ai,Sin especificar,693,71,2025-11-20T07:14:07Z,"The ultimate collection of Awesome Gemini Prompts, use cases, and examples. Curated from X (Twitter)"
SimonvBez/CPUSetSetter,C#,693,19,2025-07-31T14:36:52Z,Make your games and apps run on the right CPU cores - for smoother performance on AMD Dual-CCD and I
BryceWG/BiBi-Keyboard,Kotlin,693,51,2025-10-06T09:18:49Z,说点啥（BiBi Keyboard）:一个基于 Kotlin 的 Android 平台的 LLM 与 ASR 语音输入法键盘应用  An LLM ASR voice input method keyb
hashicorp/agent-skills,Shell,692,80,2025-11-08T02:07:20Z,A collection of Agent skills and Claude Code plugins for HashiCorp products.
Danitilahun/n8n-workflow-templates,Python,692,200,2025-07-11T21:43:17Z,"A professionally organized collection of 2,053 n8n workflows with a lightning-fast documentation sys"
stepfun-ai/NextStep-1,Python,691,27,2025-08-14T08:50:25Z,[🚀 ICLR 2026 Oral] NextStep-1: SOTA Autogressive Image Generation with Continuous Tokens. A research
syncora-ai/synthetic-credit-default-syncora,Jupyter Notebook,690,0,2025-07-30T11:44:15Z,High-fidelity synthetic dataset for credit default modeling
jasonkneen/kiro,TypeScript,690,188,2025-07-16T17:47:23Z,Complete System Prompts for Kiro IDE by Amazon
AnasMalas/pcb-edge-usb-c,Sin especificar,690,33,2025-10-25T07:48:57Z,"Use your PCB itself as a USB C connector! Including 10,14, and 24 Pin versions"
nuxt-content/nuxt-studio,TypeScript,689,135,2025-08-26T18:44:56Z,"Edit your Markdown website, in production."
StevenMXZ/Adreno-Tools-Drivers,Shell,689,19,2025-08-24T00:22:59Z,"A script for building turnip driver as an adrenotool package from mesa repository, scheduled release"
syncora-ai/syncora-benchmarks,Jupyter Notebook,688,0,2025-07-31T11:51:51Z,"A lightweight, plug‑and‑play benchmark kit for synthetic data. Compare Syncora against other generat"
LongQT-sea/OpenCore-ISO,C,688,77,2025-10-05T17:18:27Z,A properly configured OpenCore-ISO image for Proxmox VE and QEMU/KVM - Support Mac OS X 10.4 to macO
mshumer/gpt-pro-mode,Jupyter Notebook,687,81,2025-08-05T17:46:56Z,
kuestcom/prediction-market,TypeScript,687,706,2025-07-29T21:16:40Z,Launch your own web3 decentralized prediction market in minutes (Polymarket like)
Tam-Taro/SEL-Filtering-and-Sorting,Sin especificar,687,41,2025-10-19T03:00:51Z,This page features AIOStreams templates and AIOMetadata configs for your perfect all-in-one stremio
markfulton/NanoBananaEditor,TypeScript,686,160,2025-08-31T08:04:53Z,The most advanced Nano Banana image generator and editor application. Your central hub for AI image
fmz200/global-testflight-link,Sin especificar,685,26,2025-08-16T10:29:42Z,收集苹果公开的iOS/iPadOS/MacOS Testflight链接。Collect Apple's public iOS/iPadOS/MacOS Testflight links.
cruzyjapan/Gemini-CLI-UI,JavaScript,685,170,2025-07-15T14:31:42Z,"A responsive web-based UI that provides an intuitive interface for Google's Gemini CLI, enabling AI-"
ananddtyagi/cc-marketplace,Python,685,84,2025-10-09T21:48:16Z,Marketplace repo for Claude Code Plugins
tytsxai/IDM-Activation-Script-Chinese,Batchfile,684,51,2025-10-05T19:44:49Z,GPL-3.0 开源的 IDM Activation Script 中文版：Windows 批处理脚本，支持 IDM 试用期冻结、普通激活、重置和环境自检
googleads/google-ads-mcp,Python,683,172,2025-10-03T22:09:25Z,
LightwheelAI/leisaac,Python,683,120,2025-07-03T08:03:59Z,"LeIsaac provides teleoperation functionality in IsaacLab using the SO101Leader (LeRobot), including"
A-Hemeda/Remote-Jobs-List,Sin especificar,682,41,2025-07-13T09:34:20Z,
shotgun-sh/shotgun,Python,681,35,2025-08-05T08:53:12Z,Spec Driven Development 🤠 Write codebase-aware specs for AI coding agents so they don't derail.
mult1v4c/hestia-core,JavaScript,681,40,2025-11-24T08:30:22Z,"A grid-based, modular dashboard built entirely from HTML, CSS, and JS with the ability to create you"
lostb1t/Gelato,C#,681,51,2025-08-27T11:50:11Z,Jellyfin Stremio Integration Plugin
syncora-ai/synthetic-personality-dataset,Jupyter Notebook,680,0,2025-07-31T09:22:44Z,"Synthetic dataset and notebooks for introvert vs. extrovert personality modeling (privacy-safe, ML-r"
stepfun-ai/Step-Audio-R1,Python,680,50,2025-11-11T02:38:13Z,
eishare/tuic-hy2-node.js-python,Shell,680,441,2025-10-05T02:54:20Z,tuic hy2-nodejs+python
yihao-meng/HoloCine,Python,679,120,2025-10-22T11:49:32Z,[CVPR 2026 Highlight] Official Implementations for Paper - HoloCine: Holistic Generation of Cinemati
8bit2qubit/XboxFullScreenExperienceTool,C#,679,14,2025-10-03T17:18:24Z,A one-click GUI tool to safely enable the hidden Xbox full screen gaming experience on Windows 11.
hasinhayder/tyro,PHP,678,49,2025-11-22T04:02:58Z,"Tyro is a powerful API Authentication, Authorization, Role & Privilege Management solution for Larav"
ardanlabs/kronk,Go,678,45,2025-11-18T06:00:04Z,Your personal engine for running open source models locally. Use Go for hardware accelerated local i
Inception3D/TTT3R,Python,678,31,2025-10-01T00:48:38Z,[ICLR 2026] A simple state update rule to enhance length generalization for CUT3R
Cp0204/SmartStrm,Shell,678,47,2025-08-07T10:59:40Z,"媒体库 STRM 文件生成工具。和 Emby 优雅配合，媒体资源丝滑入库，支持 302 直链播放，支持同步删除。 配合 Quark-Auto-Save, CloudSaver, Emby 力求即存即看"
m31-galaxy/Hexecute,C,677,25,2025-10-08T22:29:41Z,Launch apps by casting spells! 🪄
195440/nof1.ai,TypeScript,677,199,2025-10-27T04:58:37Z,⚡ Open nof1.ai  | Autonomous AI Trading Agent (自主AI交易系统)
rlresearch/dr-tulu,Python,676,72,2025-11-18T05:58:40Z,Official repository for DR Tulu: Reinforcement Learning with Evolving Rubrics for Deep Research
unilei/kerkerker,TypeScript,675,212,2025-11-07T11:58:20Z,🎬 这是壳儿 - 影视聚合平台 - 豆瓣集成/多源切换/智能匹配 | Next.js + TypeScript | Docker 部署 | Vercel 部署
stdstu12/YUME,Python,675,44,2025-07-14T09:52:12Z,The official code of Yume
oficcejo/tdx-api,Go,675,224,2025-11-03T09:39:02Z,tdx通达信实时数据查询及api接口，docker本地部署，支持32个接口- ✅ **实时行情** - 五档买卖盘口、最新价、涨跌幅 - ✅ **K线数据** - 支持10种周期（1分钟~年K） -
nagisa77/OpenIsle,Java,674,132,2025-06-30T09:07:22Z,完全开源的社区平台
bufbuild/hyperpb-go,Go,674,16,2025-07-14T20:19:44Z,10x faster dynamic Protobuf parsing in Go that’s even 3x faster than generated code.
StrayMeteor3337/WeFriends,C++,672,74,2025-07-13T03:15:54Z,WeFriends是一个开源、免费、安全的微信好友检测工具，快去看看有没有朋友偷偷删掉或者拉黑你
MonchiLin/antigravity-agent,TypeScript,672,124,2025-11-19T17:46:24Z,Effortlessly manage your Antigravity multi-accounts
syncora-ai/Synthetic-AI-Developer-Productivity-Dataset,Jupyter Notebook,671,0,2025-07-31T09:43:36Z,"High-fidelity synthetic dataset capturing AI developer productivity metrics — including focus hours,"
opsre/AutoOps,PLpgSQL,671,172,2025-10-04T09:16:57Z,
MorDavid/NetworkHound,Python,671,75,2025-10-04T05:55:25Z,"Advanced Active Directory network topology analyzer with SMB validation, multiple authentication met"
DamianB-BitFlipper/proton-drive-sync,TypeScript,670,31,2025-11-30T13:34:01Z,"Local folders, automatically synced to Proton Drive. (Unofficial Sync Client)"
agassiz/vscode-augment,Sin especificar,669,48,2025-07-26T09:01:10Z,无需清理任何数据，最新免费无限续杯augment试用的插件
Pantheon-Security/medusa,Python,669,123,2025-11-15T15:55:22Z,"AI-first security scanner. NEW in v2026.7: Claude Code compromise detection — vet .claude/ hooks, pe"
OpenGalaxea/GalaxeaVLA,Python,669,48,2025-08-10T04:35:45Z,Galaxea's open-source VLA repository
FinStep-AI/ContestTrade,Python,669,151,2025-08-08T09:06:46Z,A Multi-Agent Trading System Based on Internal Contest Mechanism
xiaobox/mdeditor,JavaScript,668,78,2025-07-26T02:16:02Z,Modern MD Editor 是一款面向创作者与内容团队的「高颜值 Markdown 编辑器 + 社交平台发布器」。它以极致的界面与交互为基础，提供所见即所得的实时预览与多端视口切换，并通过一键复
simonw/research,Python,667,47,2025-10-20T03:16:41Z,Research projects
pat-jj/Awesome-Adaptation-of-Agentic-AI,Sin especificar,667,60,2025-11-02T01:36:49Z,"Repo for ""Adaptation of Agentic AI"""
bobvibes/Clavix,TypeScript,667,43,2025-11-13T10:30:36Z,"Transform vague ideas into production-ready prompts. Analyze gaps, generate PRDs, and supercharge yo"
Weather-OS/WineGDK,C,667,24,2025-10-31T22:13:06Z,GDK Components and *some* WinRT Components ported to Wine.
yorkeccak/Polyseer,TypeScript,666,120,2025-08-30T09:00:08Z,Polymarket alpha at the speed of now.
samber/ro,Go,666,22,2025-10-14T12:06:01Z,🏎️ Streams & Reactive Programming paradigm for Go: declarative and composable API for event-driven a
loocor/codmate,Swift,666,41,2025-10-17T08:56:42Z,"CodMate is a macOS SwiftUI app for managing CLI AI sessions: browse, search, organize, resume, and r"
kaushiksrini/parqeye,Rust,666,11,2025-07-02T20:00:30Z,Peek inside Parquet files right from your terminal
shuding/nstr,TypeScript,665,13,2025-08-21T21:03:28Z,"number → string, but looks good"
microsoft/docfind,Rust,665,30,2025-11-10T15:23:08Z,A high-performance document search engine built in Rust with WebAssembly support.
OwnGoalStudio/TrollNFC,Sin especificar,665,20,2025-07-11T18:08:30Z,"A versatile tool for reading, writing, managing, and emulating NFC cards on your iPhone."
vvb2060/PackageInstaller,Kotlin,664,32,2025-07-27T19:06:36Z,A lightweight yet powerful package installer for Android.
DFin/Neural-Network-Visualisation,JavaScript,664,75,2025-10-11T11:30:07Z,Interactive web visualisation for handwritting detection using a simple neural network
ScrapeGraphAI/scrapecraft,Python,663,102,2025-07-01T15:04:46Z,"🤖 AI-powered web scraping editor with visual workflow builder. Build, test & deploy web scrapers usi"
Ottrlang/otterlang,Rust,663,21,2025-10-27T02:11:00Z,Otterlang programming language 🦦
K-Dense-AI/agentic-data-scientist,Python,663,101,2025-11-04T07:29:49Z,An end-to-end Data Scientist
nuance-dev/Web,Swift,660,57,2025-07-20T21:16:29Z,
Vijayabaskar56/tancn,TypeScript,660,37,2025-08-03T08:15:01Z,Tanstack Builder for Form and Table
dragon1086/prism-insight,Python,659,231,2025-08-15T07:32:09Z,AI-based stock analysis and trading system
Dancode-188/synckit,TypeScript,659,22,2025-11-21T21:22:57Z,"🚀 Local-first collaboration SDK for React, Vue, and Svelte. Batteries-included: Rich text, undo/redo"
BnanZ0/ok-duet-night-abyss,Python,659,62,2025-11-06T14:56:40Z,二重螺旋 后台副本挂机 Automation for Duet Night Abyss
soonfx-engine/core,TypeScript,658,118,2025-11-07T08:54:27Z,"🎮 TypeScript game numeric engine for RPG & strategy games. Zero dependencies, type-safe formula pars"
debuggyo/Exo,Python,657,20,2025-08-19T06:41:06Z,A Material 3 inspired desktop shell for Niri and Hyprland created with Ignis.
XtrLumen/TS-Enhancer-Extreme,Shell,657,48,2025-07-26T03:53:18Z,由于我购买的小米17Ultra可以使用superturtlee/gbl_root_canoe项目实现TEE完美锁定状态，所以本项目短期内存档，除非我实在闲的没事干。//Enhances the Tri
Epistates/treemd,Rust,654,24,2025-11-08T03:51:32Z,A (TUI/CLI) markdown navigator with tree-based structural navigation.
leggedrobotics/robotic_world_model,Python,653,54,2025-11-24T15:49:49Z,Repository for our papers: Robotic World Model: A Neural Network Simulator for Robust Policy Optimiz
alchaincyf/huasheng_editor,JavaScript,653,179,2025-10-13T15:10:47Z,花生公众号排版器
LeCAR-Lab/BFM-Zero,Python,653,55,2025-11-04T01:33:37Z,BFM_Zero: A Promptable Behavioral Foundation Model for Humanoid Control Using Unsupervised Reinforce
mantoni/beads-ui,JavaScript,652,88,2025-10-22T11:55:05Z,Local UI for Beads — Collaborate on issues with your coding agent.
califio/publications,C,652,113,2025-07-05T02:11:52Z,Publications from Calif
vrmiguel/pgpad,Rust,651,28,2025-07-25T17:56:12Z,"A small, fast cross-platform database client"
repomirrorhq/repomirror,TypeScript,651,72,2025-08-23T01:35:15Z,
pompelmi/pompelmi,JavaScript,651,28,2025-07-25T10:51:35Z,ClamAV antivirus scanning for Node.js — scan file uploads with a single  function call. Zero depende
ooboqoo/interview-coder-cn,TypeScript,651,97,2025-08-20T04:06:02Z,AI 解题助手，考试助手，在「面试」或「在线考试」时，借助AI实时提供解题思路和答案。
dnlzro/horizon,TypeScript,651,17,2025-08-09T13:06:28Z,"The current sky at your approximate location, rendered as a CSS gradient"
Team-intN18-SoybeanSeclab/Phantom,JavaScript,651,33,2025-08-21T03:13:43Z,一款面向SRC漏洞挖掘中，页面信息收集场景的浏览器扩展，自动收集页面及相关资源中的敏感信息与可疑线索，支持基础扫描、深度递归扫描、批量 API 测试及结果导出与自定义正则配置
micahkepe/jsongrep,Rust,649,11,2025-08-08T22:08:52Z,"A path query language for JSON, YAML, TOML, and other serialization formats."
kazetaos/kazeta,Rust,649,24,2025-08-07T11:58:35Z,Retro 90s style gaming operating system
traceroot-ai/traceroot,TypeScript,648,174,2025-07-22T19:50:15Z,TraceRoot - open-source observability and self-healing layer for AI agents. YC S25
google-deepmind/limit,Jupyter Notebook,648,51,2025-08-29T00:37:49Z,On the Theoretical Limitations of Embedding-Based Retrieval
awwaiid/gremllm,Python,648,12,2025-07-02T01:09:02Z,A slight upgrade to the Gremlins in your code
symgraph/GhidrAssistMCP,Java,647,50,2025-07-09T00:59:13Z,An native MCP server extension for Ghidra
PierreGode/Ragnar,Python,647,58,2025-11-01T03:12:25Z,Ragnar is a Powerful network scanning and offensive security tool for the Raspberry Pi with a 2.13-i
meshsplatting/mesh-splatting,Python,646,46,2025-11-18T19:19:01Z,
aigc3d/LHM-plusplus,Python,645,39,2025-09-09T06:13:11Z,LHM++: An Efficient Large Human Reconstruction Model for Pose-free Images to 3D
best-of-ai/best-of-ai,HTML,644,99,2025-08-14T08:44:13Z,A curated list of best ai tools
themidnightgospel/Imposter,C#,643,15,2025-07-19T19:38:47Z,Mocking library with the perfect balance of Performance and Intuitive API
Tencent/AICGSecEval,Python,643,109,2025-07-08T01:19:12Z,A.S.E (AICGSecEval) is a repository-level AI-generated code security evaluation benchmark developed
syncora-ai/syncora-sdk,Python,642,0,2025-07-25T04:17:54Z,
syncora-ai/syncora-docs,MDX,642,0,2025-07-29T09:48:42Z,Documentation for Syncora.ai
4regab/TaskSync,TypeScript,642,38,2025-07-13T19:16:16Z,
open-gigaai/giga-datasets,Python,641,76,2025-09-26T06:39:37Z,"GigaDatasets: A Unified and Lightweight Framework for Data Processing, Curation, and Visualization"
openai/openai-chatkit-advanced-samples,Sin especificar,638,295,2025-10-06T01:08:49Z,Starter app to build with OpenAI ChatKit SDK
mingyin0312/RLFromScratch,Python,638,66,2025-08-12T05:29:23Z,
adny-code/fastgrind,C++,638,48,2025-07-23T07:16:02Z,"A head-only, lightweight, fast, thread safe, valgrind-like memory monitor, which output perf-like re"
pengzhangzhi/Open-dLLM,Python,637,49,2025-09-02T15:52:35Z,"Open diffusion language model for code generation — releasing pretraining, evaluation, inference, an"
foreveryh/claude-code-switch,Shell,637,88,2025-09-20T11:33:55Z,One-command model switcher for Claude Code (Only for Anthropic API).
ahaduoduoduo/bilibili-youtube-danmaku,JavaScript,635,19,2025-08-03T11:28:07Z,自动将Bilibili的弹幕同步显示在YouTube视频上
WuKongOpenSource/Wukong_AI_CRM_15,Shell,635,193,2025-09-19T02:31:54Z,Wukong AI-CRM 15 is a comprehensive customer relationship management system that supports the entire
Deathbyteacup/fluentbird,CSS,635,10,2025-07-06T21:49:44Z,"FluentBird is a userChrome.css theme for Mozilla Thunderbird, that implemenets Windows 11 Fluent Des"
zzyfight/genai-compliance-bench,Python,634,55,2025-10-12T04:01:10Z,GenAI compliance benchmark is a evaluation benchmarks for generative AI in regulated industries.
firecrawl/firegeo,TypeScript,634,212,2025-07-15T17:02:22Z,"🔥 GEO-powered SaaS starter built with Firecrawl for brand monitoring, auth, and billing"
ClashX-Pro/ClashX,Swift,634,75,2025-10-13T09:44:16Z,Clash X
xyjoey/PRISM,TypeScript,633,187,2025-11-18T21:30:07Z,An Elegant Academic Homepage Builder
MCG-NJU/SteadyDancer,Python,633,36,2025-11-21T00:43:09Z,SteadyDancer: Harmonized and Coherent Human Image Animation with First-Frame Preservation
