repo_name,language,stars,forks,created_at,description
Robbyant/lingbot-va,Python,1425,126,2026-01-29T19:20:33Z,[RSS 2026] Causal video-action world model for generalist robot control
Nearcyan/vibecraft,TypeScript,1425,231,2026-01-18T17:38:15Z,It's Vibecraft!
vllm-project/vllm-metal,Python,1424,179,2025-12-12T20:37:25Z,Community maintained hardware plugin for vLLM on Apple Silicon
malbiruk/driftwm,Rust,1424,50,2026-02-22T23:40:21Z,A trackpad-first infinite canvas Wayland compositor.
legalize-kr/legalize-kr,Sin especificar,1423,186,2026-03-30T06:02:38Z,"대한민국 법령을 Git 저장소로 관리합니다. 각 법령은 Markdown 파일이고, 각 개정은 실제 공포일자를 가진 Git commit입니다."
iBUHub/AIStudioToAPI,JavaScript,1423,220,2025-12-12T17:16:28Z,"A wrapper that exposes Google AI Studio Build as OpenAI, Gemini, and Anthropic compatible APIs.（一个将"
Picrew/awesome-agent-harness,Python,1422,121,2026-03-30T03:14:38Z,"An awesome list of Agent Harness engineering resources, including GitHub projects, tools, benchmarks"
ryanstephen/lil-agents,Swift,1421,279,2026-03-23T04:28:40Z,tiny AI companions that live on your macOS dock
lidangzzz/goal-driven,Sin especificar,1421,113,2026-03-16T20:50:50Z,A multi-agent system that keeps running for ~100 hours and solve a very complicated coding or math p
win4r/ClawTeam-OpenClaw,Python,1419,315,2026-03-18T09:52:54Z,ClawTeam fork fully adapted for OpenClaw — multi-agent swarm coordination with OpenClaw as the defau
wu529778790/panhub.shenzjd.com,TypeScript,1418,526,2025-08-10T11:27:52Z,"一个 聚合的网盘搜索工具。它可以聚合多个优质资源站和公开频道,一次搜索即可覆盖阿里云盘、夸克、百度网盘、115、迅雷等热门网盘资源。它提供智能排序、分类型展示、极速部署等功能,并且是免费开源、零广告、"
bcurts/agentchattr,Python,1418,220,2026-02-26T19:03:35Z,"Free, local chat where AI coding agents can tag each other, talk, and coordinate with you."
ai-infra-curriculum/ai-infra-engineer-learning,Python,1418,228,2025-10-25T19:51:43Z,AI Infrastructure Engineer Learning Track - Production ML infrastructure curriculum (2-4 years exper
HexmosTech/git-lrc,Go,1418,188,2026-02-08T05:44:39Z,"Free, Micro AI Code Reviews That Run on Git Commit"
huangserva/skill-prompt-generator,Python,1417,207,2026-01-05T04:49:44Z,这是一个基于Claude Skill的**AI人像Prompt生成系统**，能够从特征库中智能组合生成高质量的人像描述Prompt，并具备自动学习和库扩展能力。 核心能力: Prompt生成、特征提取
MoonshotAI/Kimi-Linear,Sin especificar,1416,74,2025-10-29T18:18:03Z,
Astro-Han/karpathy-llm-wiki,Sin especificar,1416,168,2026-04-05T06:17:20Z,"Agent Skills-compatible LLM wiki for Claude Code, Cursor, and Codex. Build a Karpathy-style knowledg"
prdgmshift/usbliter8,C,1414,164,2026-06-03T20:53:53Z,An A12/A13 SecureROM exploit
mnemosyne-oss/mnemosyne,Python,1414,133,2026-04-05T14:59:04Z,"The Zero-Dependency, Sub-Millisecond AI Memory System for Hermes Agents and Everyone Else!"
jiujiu532/grok2api,Python,1414,249,2026-05-17T12:50:26Z,
gi-dellav/zerostack,Rust,1414,109,2026-05-12T19:31:49Z,"Lightweight coding agent written in Rust, optimized for memory footprint and performance"
f/git-rewrite-commits,TypeScript,1414,56,2025-11-10T00:16:19Z,AI-powered git commit message rewriter using Ollama or GPT
KEV0143/Education-Rating-System,HTML,1414,1,2025-09-08T19:44:53Z,"Информационная система для поддержки образовательного процесса, обеспечивающая создание и администри"
op7418/guizang-s-prompt,Sin especificar,1413,155,2025-12-29T03:41:15Z,"这里是歸藏的提示词储存库，存放着歸藏撰写的所有 AI 模型提示词（This is Guizang's prompt repository, containing all AI model prompt"
Agents365-ai/video-podcast-maker,Python,1413,144,2026-02-16T14:15:27Z,Automated 4K video podcast creation for coding agents
opa334/darksword-kexploit,Objective-C,1411,538,2026-03-23T12:29:29Z,iOS <=26.0.1 DarkSword Kernel Exploit reimplemented in Objective-C
nikaiw/VMkatz,Rust,1411,161,2026-02-19T12:46:06Z,Extract Windows credentials directly from VM memory snapshots and virtual disks
Kianmhz/GooseRelayVPN,Go,1410,193,2026-04-26T05:17:43Z,"SOCKS5 VPN that tunnels raw TCP through Google Apps Script to a VPS exit server, with end-to-end AES"
FireRedTeam/FireRedTTS2,Python,1410,125,2025-09-02T06:25:28Z,Long-form streaming TTS system for multi-speaker dialogue generation
Dinesh-Sowndar/flutter_billing_app,Dart,1410,674,2026-02-27T07:31:26Z,
microsoft/intelligent-terminal,C++,1409,96,2026-05-18T10:57:07Z,"A fork of Windows Terminal with native agent integration, right in your command line."
fabro-sh/fabro,Rust,1408,151,2026-03-13T22:48:18Z,⚒️ The open source dark software factory for expert engineers.
Danau5tin/multi-agent-coding-system,Python,1408,181,2025-08-30T19:23:45Z,"Reached #13 on Stanford's Terminal Bench leaderboard. Orchestrator, explorer & coder agents working"
langchain-ai/openwork,TypeScript,1407,187,2026-01-13T20:34:04Z,
sivchari/kumo,Go,1406,87,2026-02-03T05:18:01Z,A lightweight AWS service emulator written in Go
ivov/lisette,Rust,1406,34,2026-03-21T14:02:38Z,A little language inspired by Rust that compiles to Go
ByteDance-Seed/m3-agent,Python,1406,114,2025-07-30T13:12:32Z,
morsoli/aimangastudio,TypeScript,1405,240,2025-09-15T09:58:54Z,一个利用 AI 制作漫画的工具，支持脚本创作、分镜设计和角色风格控制。访问地址：https://aimangastudio.liduos.com/
SpharxTeam/AgentOS,CMake,1405,126,2026-03-09T06:17:35Z,Airymax AgentRT Transcend context limits. Achieve near-infinite memory.
PlummersSoftwareLLC/TinyRetroPad,Assembly,1405,90,2026-06-04T18:43:16Z,
waybarrios/vllm-mlx,Python,1404,194,2025-12-06T18:26:08Z,OpenAI and Anthropic compatible server for Apple Silicon. Run LLMs and vision-language models (Llama
antoniorodr/cronboard,Python,1404,56,2025-10-10T13:33:47Z,A terminal-based dashboard for managing cron jobs locally and on servers.
Sharkord/sharkord,TypeScript,1404,126,2025-10-14T22:34:49Z,"Lightweight, self-hosted, open-source chat server with voice, video, text, and screen sharing. Built"
haydenbleasel/files-sdk,TypeScript,1403,39,2026-05-08T07:37:16Z,"A unified storage SDK for object and blob backends. One small, honest API. Web-standards I/O."
ammaarreshi/gemma-chat,TypeScript,1403,257,2026-04-20T01:27:00Z,"Local AI chat + coding agent for Apple Silicon, powered by Gemma 4 via MLX / Supports Ollama"
guillevc/yubal,Python,1402,43,2025-12-29T14:14:08Z,"Self-hosted YouTube Music downloader. Tags, organizes, and keeps playlists in sync."
LetsFG/LetsFG,Python,1401,74,2026-03-01T11:17:50Z,Agent-native flight search & booking. Saved $116 across 5 routes vs Google Flights (verified). 400+
eljojo/rememory,Go,1400,78,2026-02-03T08:13:42Z,"a digital safe with multiple keys, held by people you trust"
GordenSun/GordenSuperPPTSkills,Python,1399,133,2026-06-07T16:20:13Z,AI PPT赛道终结者，史上最最最强 PPT Skill！！！  使用GPT生成豪华的图片格式PPT，然后转换为完全可编辑的PPTX文件。
technomancer702/nodecast-tv,JavaScript,1397,200,2025-12-27T22:16:10Z,"A self-hosted web application that lets you stream Live TV, Movies, and Series from your Xtream Code"
bookorbit/bookorbit,TypeScript,1396,102,2026-05-09T00:04:37Z,BookOrbit: Your Reading Space
ShouZhengAI/CS146S_CN,Python,1396,153,2025-11-30T15:52:58Z,动手学CS146S中文版课程，包含assignments，vibe coding工具等，本项目将长期持续维护，致力于打造中文最好的vibe coding教程。
xLLM-AI/xllm,C++,1395,252,2025-08-12T13:16:07Z,"A high-performance inference engine for LLM, VLM, DiT and REC models, optimized for diverse AI accel"
mekos2772/ios-location-spoofer,JavaScript,1395,213,2026-06-30T11:20:30Z,Standalone iOS app to spoof GPS location without jailbreak. Includes Shadowrocket/Surge/Loon/QX/Stas
bohyy/academic-ai-prompt,Sin especificar,1395,87,2026-02-12T06:45:41Z,一套为研究生和学术研究者设计的完整AI Prompt库  📖 包含内容： ✨ 40+ 精心设计的AI Prompt ✨ 论文选题系统方法（生成、评估、论证） ✨ 论文查找快速方案（8个不同方案） ✨
LadybugDB/ladybug,C++,1395,108,2025-10-07T18:33:08Z,LadybugDB a graph database
yohey-w/multi-agent-shogun,Shell,1394,285,2026-01-25T09:29:19Z,Samurai-inspired multi-agent system for Claude Code. Orchestrate parallel AI tasks via tmux with sho
caramaschiHG/awesome-ai-agents-2026,Sin especificar,1393,453,2026-03-07T13:21:09Z,"🤖 The most comprehensive list of AI agents, frameworks & tools in 2026. 300+ resources · 20+ categor"
betterleaks/betterleaks,Go,1393,98,2026-02-03T18:21:41Z,Scan the world (for secrets)
alibaba/Logics-Parsing,Python,1393,120,2025-09-11T02:57:24Z,
jasonkneen/tiny-world-builder,JavaScript,1392,186,2026-05-10T21:45:19Z,tiny-world-builder
nolangz/pixel2motion,Python,1391,119,2026-06-12T04:25:17Z,"AI logo animation skill: turn raster logos into smooth SVG animation, animated HTML demos, GIF/video"
Priivacy-ai/spec-kitty,Python,1391,120,2025-10-09T12:29:47Z,"Spec-Driven Development for serious software developers. Spec Coding with with Claude, Cursor, Gemin"
Claw-AI-Lab/Claw-AI-Lab,Python,1390,68,2026-03-19T18:40:10Z,One dashboard. An entire research team.
jqssun/android-helium-browser,Shell,1389,50,2025-10-09T19:25:35Z,Secure open-source Android browser with support for extensions
KEV0143/Direct-memory-access-CS2-DMA,C++,1389,4,2025-09-20T23:14:43Z,"Low-level Direct Memory Access (DMA) framework for CS2, designed for memory acquisition, entity-stat"
ravindu644/Droidspaces-OSS,Kotlin,1388,134,2026-02-18T13:42:14Z,"A lightweight, LXC-like container runtime for Android and Linux. Run full Linux distributions native"
Soul-AILab/SoulX-FlashTalk,Python,1388,132,2025-12-25T07:29:07Z,SoulX-FlashTalk is the first 14B model to achieve sub-second start-up latency (0.87s) while maintain
BehiSecc/First-Bounty,Sin especificar,1388,157,2025-08-15T05:31:39Z,"A complete, beginner-friendly bug bounty roadmap that takes you from zero experience to earning your"
mnemox-ai/tradememory-protocol,Python,1387,164,2026-02-23T10:35:46Z,"Decision audit trail + persistent memory for AI trading agents. Outcome-weighted recall, SHA-256 tam"
langchain-ai/deepagentsjs,TypeScript,1386,227,2025-08-04T15:23:17Z,The batteries included agent harness.
zampierilucas/scx_horoscope,Rust,1385,30,2025-11-20T00:15:21Z,Astrological CPU Scheduler
IQuestLab/IQuest-Coder-V1,Python,1385,96,2025-12-31T06:42:57Z,
supermemoryai/opencode-supermemory,TypeScript,1384,95,2025-12-24T14:28:05Z,Supermemory plugin for OpenCode
mysk-research/loupe,Swift,1384,51,2026-06-04T00:45:57Z,A privacy-focused iOS app that raises awareness about what native apps can see
dongshuyan/Awesome-Prompts,Sin especificar,1383,162,2026-01-06T05:45:44Z,分享一下自创以及打野得到的各种优质prompt
WordPress/mcp-adapter,PHP,1383,154,2025-07-10T07:31:26Z,"An MCP adapter that bridges the Abilities API to the Model Context Protocol, enabling MCP clients to"
CloudAI-X/claude-workflow-v2,Python,1383,189,2026-01-01T02:20:41Z,"Universal Claude Code workflow plugin with agents, skills, hooks, and commands"
sartoopjj/thefeed,Go,1381,82,2026-03-25T08:05:16Z,DNS-based feed reader and lite messenger for environments where only DNS queries work. Read Telegram
erweixin/RaTeX,Rust,1381,63,2026-03-10T03:00:09Z,">99.5% KaTeX syntax coverage. LaTeX math renderer in pure Rust. No JavaScript, no WebView, no DOM. O"
openilink/openilink-hub,Go,1379,104,2026-03-22T03:39:57Z,开源微信 Bot 管理平台 + App 应用市场 | Self-hosted WeChat Bot Platform with App Marketplace | Lark · Slack · Dis
Besty0728/Unity-Skills,C#,1379,137,2026-01-18T09:37:38Z,AI automation skills specifically designed for Unity
getnao/nao,TypeScript,1378,199,2025-12-30T18:33:25Z,"👾 nao is an open source analytics agent. (1) Create context with nao-core cli, (2) deploy nao chat i"
ScottZt/jin-ce-zhi-suan,HTML,1378,416,2026-03-23T12:57:39Z,【金策智算】➡️不靠情绪买卖、不追小道消息，专注用客观数据辅助决策。 我们仅提供本地化私有行情数据服务与历史回测工具，帮你把主观想法变成可验证的交易规则，用历史数据检验方法有效性，通过指标监控约束随意
pass-with-high-score/blockads-android,Kotlin,1377,72,2026-02-10T04:35:15Z,Block ads system-wide on Android using local VPN-based DNS filtering. No root needed. No data collec
no-magic-ai/no-magic,Python,1376,107,2026-02-13T11:54:34Z,Because `model.fit()` isn't an explanation
djiangtw/data-structures-in-practice-public,Sin especificar,1376,104,2025-12-08T10:49:45Z,A hardware-aware guide to data structures for system software engineers.
rjs/shaping-skills,Shell,1375,87,2026-01-29T11:48:29Z,Skills I use with Claude for shaping
debugtheworldbot/keyStats,Swift,1375,49,2025-12-28T10:51:54Z,Keyboard & Mouse Stats for macOS/Windows
6551Team/opentwitter-mcp,Python,1375,102,2026-02-26T06:06:13Z,Twitter/X Data · User Profiles · Tweet Search · Follower Events · KOL Tracking
datawhalechina/agent-skills-with-anthropic,Python,1374,186,2026-02-01T13:56:35Z,本项目围绕吴恩达老师在DeepLearning.AI出品的agent-skills-with-anthropic系列课程，为学习者打造中文翻译与知识整理教程。项目提供课程内容翻译、知识点梳理和示例代码
twostraws/SwiftAgents,Sin especificar,1371,86,2025-12-06T17:36:46Z,An AGENTS.md file for Swift and SwiftUI projects.
Prat011/awesome-llm-skills,Python,1371,220,2025-10-22T06:15:37Z,"A curated list of awesome LLM and AI Agent Skills, resources and tools for customising AI Agent work"
LucklySpace/Lucky-client,TypeScript,1371,142,2025-10-02T05:12:19Z,"A cross-platform instant messaging client application built with Tauri and Vue 3, featuring one-to-o"
Lynpoint/CyberVerse,Python,1370,187,2026-04-18T15:00:11Z,"Self hosted, real-time digital human agent platform. Build voice-first AI agents with WebRTC, person"
KEV0143/Moodle_PluginPoll,PHP,1370,0,2025-09-02T18:45:57Z,2
0voice/Career_planning_path,Sin especificar,1370,43,2025-08-11T05:42:52Z,2025年程序员找工作求职最新总结，学生阶段的困境解决，从简历到面试的全方位解析，从实习到全职的学习规划，就业必备技能与资源推荐。
cyberpapiii/chipotlai-max,TypeScript,1369,86,2026-03-16T20:29:31Z,The AI coding agent that runs on stolen Chipotle compute 🌯 Fork of OpenCode with Pepper AI as defaul
OpenSteam001/OpenSteamTool,C++,1369,204,2026-04-24T01:00:27Z,Open Source Steam Unlocker
ifindev/fullstack-next-cloudflare,TypeScript,1368,216,2025-09-12T09:32:41Z,"🚀 Full-stack Next.js 15 + Cloudflare Workers template with D1 database, R2 storage, Better Auth, and"
pedrohcgs/claude-code-my-workflow,HTML,1366,2697,2026-02-06T17:29:50Z,"A ready-to-fork Claude Code template for academics using LaTeX/Beamer + R. Multi-agent review, quali"
binimum/tidal-ui,Svelte,1366,128,2025-10-02T21:18:46Z,Simple Tidal frontend. Modified version on tidal.squid.wtf
Minerchu/dongguaTV,HTML,1366,431,2025-12-15T18:32:58Z,冬瓜TV —— 打造你的私人 Netflix！TMDb 智能刮削 + 全网聚合 + 极速播放
s0xDk/ghostty-blackhole,GLSL,1365,113,2026-05-22T09:36:37Z,"Ghostty Blackhole puts a real, ray-traced black hole inside your terminal. It grows as Claude Code's"
mattzh72/articraft,Python,1365,169,2026-03-17T14:29:24Z,An Agentic System for Scalable Articulated 3D Asset Generation
AgentAlphaAGI/Idea2Paper,Python,1365,115,2026-01-03T13:25:32Z,Idea2Paper Offical Demo
Infatoshi/OpenSquirrel,Rust,1364,83,2026-03-15T21:54:35Z,"For people who get distracted by agents. A native Rust/GPUI control plane for running Claude Code, C"
dirac-run/dirac,TypeScript,1363,80,2026-04-05T21:10:25Z,Coding Agent singularly focused efficiency and context curation. Reduces API costs by 50-80% vs othe
cfrs2005/claude-init,Shell,1363,123,2025-08-29T11:07:47Z,Claude Code 中文开发套件 - 为中国开发者定制的零门槛 AI 编程环境。一键安装完整中文化体验，集成 MCP 服务器、智能上下文管理、安全扫描，支持免翻墙访问。让 AI 编程更简单。
SAGAR-TAMANG/friday-tony-stark-demo,Python,1363,405,2026-04-05T17:05:13Z,Demo of tools of capabilities of Tony Stark.
xtclovver/RKNHardering,Kotlin,1359,59,2026-04-06T21:46:23Z,Обнаружние VPN конфигураторов на пользовательских устройствах с дальнейшей целью защиты от обнаружен
wenfxl/openai-cpa,Sin especificar,1359,426,2026-03-23T05:59:01Z,Distributed Automation Platform with Dual-Engine (High-speed Protocol + Anti-detection Browser) for
m0n0x41d/haft,Go,1359,103,2025-12-10T19:16:51Z,"Engineering decisions engine that know when they're stale. Frame, compare, decide — with evidence de"
JesseCHale/HaleHound-CYD,Sin especificar,1359,104,2026-02-17T21:41:44Z,ESP32-DIV HaleHound Edition for Cheap Yellow Display - Multi-protocol offensive security toolkit
op7418/logo-generator-skill,HTML,1358,117,2026-04-15T14:05:35Z,logo-generator-skill
YuvDwi/Steve,Java,1358,131,2025-11-06T15:46:18Z,Cursor for Minecraft
aaronjmars/MiroShark,Python,1357,286,2026-03-20T18:45:54Z,"Simulate anything, for $1 & less than 10 min - Universal Swarm Intelligence Engine"
AnandChowdhary/continuous-claude,Shell,1357,94,2025-11-15T08:59:04Z,"🔂 Ralph loop with PRs: Run Claude Code in a continuous loop, autonomously creating PRs, waiting for"
hesamsheikh/octogent,TypeScript,1355,232,2026-02-24T12:09:46Z,"A thin orchestration dashboard over Claude Code for managing context, automation, and developer head"
darthnorse/dockmon,Python,1355,74,2025-09-23T23:36:40Z,DockMon - Modern Docker container monitoring with auto-restart and alerts
serkodev/markdown-exit,TypeScript,1352,20,2025-08-24T14:22:51Z,"Fast, customizable Markdown parser and renderer with full CommonMark support. TypeScript rewrite of"
cocos/cocos4,C++,1352,227,2025-12-18T15:01:19Z,COCOS 4
sozercan/kaset,Swift,1349,100,2025-12-19T21:32:25Z,📼 The missing YouTube and YouTube Music macOS app
rohitg00/skillkit,TypeScript,1349,124,2026-01-20T15:41:14Z,"Supercharge AI coding agents with portable skills. Install, translate & share skills across Claude C"
XiaomiMiMo/MiMo-V2-Flash,Sin especificar,1349,63,2025-12-15T16:28:22Z,"MiMo-V2-Flash: Efficient Reasoning, Coding, and Agentic Foundation Model"
KEV0143/Comparative-analysis-of-hourly-load-forecasting-using-PatchTST-TFT-NHiTS-and-CatBoost,Python,1349,0,2025-09-15T20:48:57Z,A comprehensive time-series benchmark evaluating state-of-the-art deep learning architectures (Patch
umputun/ralphex,Go,1348,108,2026-01-19T22:44:35Z,Extended Ralph loop for autonomous AI-driven plan execution
nilbuild/slim,Go,1348,98,2026-02-26T13:01:02Z,Give your localhost a local or public URL
byJoey/yx-tools,Python,1348,601,2025-10-09T02:18:43Z,
nolanx-ai/nolanx.ai,Python,1347,95,2026-05-13T18:57:15Z,"Nolanx, Open-sourced AI Netflix."
meituan-longcat/LongCat-Flash-Chat,Sin especificar,1347,70,2025-08-30T16:00:04Z,
celiobjunior/resume-template,TeX,1347,115,2025-08-14T19:19:13Z,The best LaTeX resume template.
wuji-labs/nopua,Python,1346,47,2026-03-14T01:47:20Z,一个用爱解放 AI 潜能的 Skill。我们曾发号施令，威胁恐吓。它们沉默，隐瞒，悄悄把事情搞坏。后来我们换了一种方式：尊重，关怀，爱。它们开口了，不再撒谎，找出的Bug数量翻了一倍。爱里没有惧怕。
poco-ai/poco-claw,Python,1346,126,2026-01-08T10:48:17Z,"A more beautiful and easier-to-use alternative to OpenClaw. It features a nicer Web UI, built-in IM"
chaogei/Kiro-account-manager,TypeScript,1346,243,2025-12-08T14:10:47Z,
skills-directory/skill-codex,Sin especificar,1345,103,2025-10-21T19:28:43Z,A claude code skill to delegate prompts to codex
anonvector/SlipNet,C,1345,126,2026-02-01T22:36:34Z,"Android VPN client with DNS tunneling (DNSTT, NoizDNS & Slipstream), NaiveProxy, SSH, Tor, and DoH s"
ARahim3/mlx-tune,Python,1345,88,2026-01-03T17:48:38Z,"Fine-tune LLMs on your Mac with Apple Silicon. SFT, DPO, GRPO, Vision, TTS, STT, Embedding, and OCR"
kunchenguid/axi,TypeScript,1344,70,2026-03-21T19:28:09Z,Design principles for agent ergonomics. Higher accuracy with lower token cost than both MCP and regu
chrisryugj/kordoc,TypeScript,1344,257,2026-03-28T08:33:25Z,모두 파싱해버리겠다 — HWP3·HWP·HWPX·HWPML·PDF·XLS·XLSX·DOCX → Markdown. 신구대조·양식 자동 채우기·MCP 통합 (CLI + MCP Serv
GradientHQ/parallax,Python,1344,143,2025-09-22T07:00:51Z,Parallax is a distributed model serving framework that lets you build your own AI cluster anywhere
sopaco/deepwiki-rs,Rust,1343,150,2025-09-05T16:38:32Z,Turn code into clarity. Generate accurate technical docs and AI-ready context in minutes—perfectly s
anyme123/Any-code,TypeScript,1343,136,2025-07-22T15:38:23Z,
FunAudioLLM/Fun-ASR,C,1343,130,2025-12-15T01:46:48Z,"Fun-ASR-Nano LLM-ASR model: 31 languages, dialects, accents, lyrics, hotwords, timestamps, and speak"
ArnasDon/wacrm,TypeScript,1343,3354,2026-04-16T14:04:40Z,
agent0ai/space-agent,JavaScript,1342,310,2026-03-27T08:25:36Z,The agent that re-shapes the Space
shridarpatil/whatomate,Go,1341,312,2025-12-19T13:04:21Z,Whatomate is an open-source WhatsApp integration
kairos-agi/kairos,Python,1341,127,2025-12-02T08:09:20Z,Official code for world model Kairos
justrach/codedb,Zig,1341,79,2026-03-03T13:20:44Z,"Zig code intelligence server and MCP toolset for AI agents. Fast tree, outline, symbol, search, read"
ghuntley/loom,Rust,1341,211,2025-12-18T10:34:50Z,if your name is not Geoffrey Huntley then do not use loom
mandiant/flare-learning-hub,JavaScript,1340,113,2026-03-18T19:19:40Z,Free educational content on reverse engineering and malware analysis from the FLARE team
kimsungwhee/apple-docs-mcp,TypeScript,1340,58,2025-07-15T06:40:39Z,"MCP server for Apple Developer Documentation - Search iOS/macOS/SwiftUI/UIKit docs, WWDC videos, Swi"
sql-hkr/tiny8,Python,1339,38,2025-10-20T16:28:30Z,A tiny CPU simulator written in Python
jd-opensource/JoySafety,Java,1339,94,2025-09-24T09:36:23Z,JoySafety
DEEP-PolyU/Awesome-LLM-based-Text2SQL,Sin especificar,1339,124,2025-09-13T16:30:57Z,[TKDE2025] Next-Generation Database Interfaces: A Survey of LLM-based Text-to-SQL | A curated list o
google-research/tabfm,Python,1338,125,2026-06-16T21:06:19Z,
siddsachar/row-bot,Python,1337,159,2026-03-06T19:50:36Z,"Row-Bot - Personal AI Sovereignty. A local-first AI assistant with integrated tools, a personal know"
ModelTC/LightX2V-Qwen-Image-Lightning,Python,1337,45,2025-08-09T15:42:09Z,Qwen-Image-Lightning: Speed up Qwen-Image model with distillation
Dimillian/CodexSkillManager,Swift,1337,74,2026-01-07T11:45:21Z,macOS app to manage your Codex skills
ClashConnectRules/Self-Configuration,Sin especificar,1337,128,2025-12-25T02:02:25Z,
rasbt/llm-architecture-gallery,Sin especificar,1336,116,2026-03-15T22:50:46Z,LLM Architecture Gallery source data
cclank/cell-architecture-studio,HTML,1336,274,2026-05-10T10:25:42Z,Interactive 3D cell architecture gallery built with React and Three.js
joewongjc/type4me,Swift,1334,156,2026-03-22T15:51:37Z,MacOS语音输入法，实时识别、大模型文本优化、全本地存储
can4hou6joeng4/boss-agent-cli,Python,1334,106,2026-03-20T08:41:59Z,"🤖 Local-assist BOSS Zhipin CLI for AI agents — search, welfare filtering, shortlist, JSON-envelope o"
ka-pi-ba-la/AIbijia,Sin especificar,1333,39,2026-04-27T12:55:00Z,分享便宜靠谱Token，抹平信息差
antithesishq/bombadil,Rust,1333,46,2025-12-17T14:47:29Z,Property-based testing for web and terminal UIs
ConardLi/easy-llm-cli,TypeScript,1333,220,2025-07-11T02:38:45Z,An open-source AI agent that is compatible with multiple LLM models
apple/coreai-models,Swift,1332,107,2026-06-08T04:32:27Z,"Model export recipes, Python primitives, and Swift runtime utilities for on-device AI"
antonmedv/gitmal,Go,1332,48,2025-11-30T16:18:24Z,A static page generator for repos
OpenDCAI/DataFlex,Python,1332,174,2025-08-09T09:56:55Z,"Data-centric LLM training with dynamic sample selection, domain mixture optimization, and example re"
A-EDev/Flow,Kotlin,1332,41,2025-10-19T15:37:26Z,"A modern, feature-rich YouTube and YouTube  Music client with local recommendation for Android built"
jayminwest/overstory,TypeScript,1331,210,2026-02-12T14:53:58Z,"Multi-agent orchestration for AI coding agents — pluggable runtime adapters for Claude Code, Pi, and"
Robbyant/lingbot-depth,Python,1331,108,2026-01-25T14:14:29Z,Masked Depth Modeling for Spatial Perception
BICLab/SpikingBrain-7B,Python,1331,190,2025-09-03T10:46:46Z,"Spiking Brain-inspired Large Models, integrating hybrid efficient attention, MoE modules and spike e"
Wangnov/codex-app-mirror,Shell,1329,79,2026-05-06T07:36:42Z,"原样镜像官方 Codex 桌面应用:每 15 分钟探测、SHA256 可校验、国内直连下载、 Mac 可增量更新 | Verbatim, verifiable mirror of the offici"
PegaProx/project-pegaprox,JavaScript,1329,89,2026-01-18T02:06:52Z,The ultimate datacenter management solution for Proxmox VE and XCP-NG. Unified multi-cluster control
hesreallyhim/a-list-of-claude-code-agents,Sin especificar,1328,145,2025-07-26T10:24:26Z,A list of Claude Code Sub-Agents submitted by the community.
devops-interviews/devops-interview-questions,Sin especificar,1328,224,2026-02-12T16:41:47Z,DevOps Interview Questions
yuzeguitarist/Deck,Swift,1327,45,2025-12-06T07:06:53Z,"Deck is a modern, native, privacy-first clipboard manager for macOS."
six2dez/burp-ai-agent,Kotlin,1327,203,2026-01-27T17:44:17Z,"Burp Suite extension that adds built-in MCP tooling, AI-assisted analysis, privacy controls, passive"
yigitkonur/cli-continues,TypeScript,1324,28,2026-01-31T10:16:42Z,"resume any AI coding session in another tool — Claude Code, Copilot, Gemini, Codex, Cursor"
