repo_name,language,stars,forks,created_at,description
corsairdev/corsair,TypeScript,4168,150,2025-10-14T18:50:32Z,Your Agent's Integration Layer
hipcityreg/situation-monitor,TypeScript,4161,925,2026-01-07T18:07:09Z,"Real-time dashboard for monitoring global news, markets, and geopolitical events"
midudev/jscamp,JavaScript,4160,441,2025-09-28T13:28:51Z,Contenido y ejercicios del JSCamp InfoJobs
junhoyeo/tokscale,Rust,4158,277,2025-12-01T13:15:27Z,"🛰️ A CLI tool for tracking token usage from OpenCode, Claude Code, 🦞OpenClaw, Pi, Codex, Gemini, Cur"
dotnet/skills,C#,4151,311,2026-02-03T22:51:09Z,Repository for skills to assist AI coding agents with .NET and C#
every-app/open-seo,TypeScript,4139,458,2026-02-27T18:57:41Z,Open source alternative to Semrush and Ahrefs
maziyarpanahi/openmed,Python,4138,474,2025-10-04T15:13:34Z,"Local-first healthcare AI: clinical NER & HIPAA PII de-identification that runs 100% on-device. 1,00"
samhenrigold/LidAngleSensor,Swift,4132,175,2025-09-06T19:07:20Z,tfw when you when your lid when uhh angle your lid sensor
caamer20/Telegram-Drive,TypeScript,4130,633,2026-01-23T20:19:39Z,"Turn your Telegram account into an unlimited, secure cloud storage drive. an Open-source desktop app"
Dimillian/CodexMonitor,TypeScript,4129,401,2026-01-11T07:56:35Z,An app to monitor the (Codex) situation
abhi1693/openclaw-mission-control,TypeScript,4095,828,2026-02-01T16:53:45Z,"AI Agent Orchestration Dashboard - Manage AI agents, assign tasks, and coordinate multi-agent collab"
openai/plugins,JavaScript,4094,472,2026-03-04T21:52:32Z,OpenAI Plugins
NateBJones-Projects/OB1,TypeScript,4093,790,2026-03-11T17:59:59Z,"Open Brain — The infrastructure layer for your thinking. One database, one AI gateway, one chat chan"
EvoScientist/EvoScientist,Python,4073,273,2026-01-26T11:19:26Z,🔬 Harness Vibe Research with Self-evolving AI Scientists
serenakeyitan/awesome-notebookLM-prompts,Sin especificar,4067,584,2025-12-12T00:51:13Z,A curated collection of the strongest NotebookLM slide prompts sourced from the real creative underg
benjitaylor/agentation,TypeScript,4061,327,2026-01-18T02:01:24Z,The visual feedback tool for agents.
lucas-maes/le-wm,Python,4058,583,2026-03-13T02:56:21Z,Official code base for LeWorldModel: Stable End-to-End Joint-Embedding Predictive Architecture from
dataelement/Clawith,Python,4047,665,2026-03-03T04:58:21Z,Your First AI Agents Company
codebymitch/TitanBot,JavaScript,4041,6606,2026-01-30T00:40:44Z,"A powerful, all-in-one Discord assistant built for every server."
Robbyant/lingbot-world,Python,4032,371,2026-01-28T04:52:50Z,Advancing Open-source World Models
opactorai/Claudable,TypeScript,4026,616,2025-08-20T05:15:16Z,"Claudable is an open-source web builder that leverages local CLI agents, such as Claude Code, Codex,"
alvinreal/awesome-opensource-ai,Python,4025,480,2026-03-24T15:58:22Z,"Curated list of the best truly open-source AI projects, models, tools, and infrastructure. Daily upd"
iDescriptor/iDescriptor,C++,4023,192,2025-07-27T03:59:37Z,"A free, open-source, and cross-platform iDevice management tool"
fallow-rs/fallow,Rust,4023,130,2026-03-17T08:40:57Z,Codebase intelligence for TypeScript and JavaScript. Free static analysis of code and styles: unused
MemeCalculate/moyin-creator,TypeScript,4022,834,2026-02-09T17:01:11Z,AI 影视生产级工具 | 支持 Seedance 2.0 | 剧本到成片全流程批量化 | AI-powered film production tool with Seedance 2.0 suppo
V0id-v2/Void-Tools-v2.0,Python,4020,51,2026-05-30T21:57:30Z,"Python terminal multitool — OSINT, Discord, web & network utilities. Rich TUI, 13 themes, remote upd"
SaladDay/cc-switch-cli,Rust,4019,230,2025-11-23T11:15:12Z,"⭐️ A cross-platform CLI All-in-One assistant tool for Claude Code, Codex & Gemini CLI."
RLinf/RLinf,Python,4010,574,2025-08-14T03:52:19Z,RLinf: Reinforcement Learning Infrastructure for Embodied and Agentic AI
theori-io/copy-fail-CVE-2026-31431,Python,4004,897,2026-04-29T12:15:28Z,Copy Fail (CVE-2026-31431): 9-year-old Linux kernel LPE found by Theori's Xint Code
TianyiDataScience/openclaw-control-center,TypeScript,4003,617,2026-03-11T11:52:02Z,"Turn OpenClaw from a black box into a local control center you can see, trust, and control."
coleam00/excalidraw-diagram-skill,Python,3996,466,2026-03-01T12:36:44Z,Skill to give Claude Code (and any coding agent) the ability to generate beautiful and practical Exc
0voice/Campus_recruitment_interview_questions,Sin especificar,3990,255,2025-07-14T07:23:06Z,2025 最新校招面试题合集， 面向 2026 届应届生，全网最全整理！收录 1000+道真实面试题以及面经，涵盖阿里、腾讯、字节、美团、百度、华为、小米、英伟达、微软、米哈游等百家大中小厂。每题配备
anysearch-ai/anysearch-skill,Python,3975,282,2026-04-30T02:55:36Z,Unified real-time search engine skill for AI agents.
danveloper/flash-moe,Objective-C,3965,497,2026-03-18T16:13:13Z,Running a big model on a small laptop
cursor/cookbook,TypeScript,3958,465,2026-04-27T08:27:12Z,
erincatto/box3d,C,3955,156,2026-05-10T20:26:19Z,Box3D is a 3D physics engine for games
BytePioneer-AI/openclaw-china,TypeScript,3955,344,2026-01-28T06:23:08Z,OpenClaw中国插件：支持飞书，钉钉，QQ，企业微信，微信
ZSeven-W/openpencil,TypeScript,3950,382,2026-02-17T10:51:46Z,The world's first open-source AI-native vector design tool and the first to feature concurrent Agent
FoundZiGu/GuJumpgate,JavaScript,3948,997,2026-05-19T11:52:52Z,
PerryTS/perry,Rust,3946,134,2026-01-19T07:42:31Z,A native TypeScript compiler written in Rust. Compiles TypeScript directly to executables using SWC
zhongerxin/Cowart,JavaScript,3944,308,2026-06-18T16:08:30Z,
archestra-ai/archestra,TypeScript,3930,1095,2025-07-15T12:07:55Z,"Enterprise AI Platform with guardrails, MCP registry, gateway & orchestrator"
garinasset/leak-check,Python,3929,445,2026-03-27T10:26:52Z,个人信息 “泄漏” 检测接口
anthropics/original_performance_takehome,Python,3920,892,2026-01-19T19:16:04Z,"Anthropic's original performance take-home, now open for you to try!"
ResearAI/AutoFigure-Edit,Python,3917,261,2026-02-03T18:50:36Z,
vercel-labs/just-bash,TypeScript,3907,216,2025-12-23T17:10:51Z,Bash for Agents
34306/vphone-aio,Shell,3905,693,2026-02-28T10:20:47Z,1 script run the vphone
Lin-arm/GKD_subscription,TypeScript,3902,99,2025-11-15T03:15:04Z,用于安卓 GKD 的第三方订阅规则 (👻Fork版)
masterking32/MasterHttpRelayVPN,Python,3901,449,2026-04-20T10:32:26Z,Domain-fronted HTTP/SOCKS5 proxy tunneling traffic through Google Apps Script with MITM TLS intercep
shuvonsec/claude-bug-bounty,Python,3891,690,2026-03-08T05:34:18Z,"AI-powered bug bounty hunting from your terminal - recon, 20 vuln classes,   autonomous hunting, and"
remotion-dev/skills,TypeScript,3888,447,2026-01-19T09:58:43Z,Agent Skills
Open-Legal-Products/mike,TypeScript,3882,1215,2026-04-29T17:41:12Z,OSS AI Legal Platform
cacggghp/vk-turn-proxy,Go,3879,269,2025-11-25T11:38:20Z,
CodeGraphContext/CodeGraphContext,Python,3879,764,2025-08-16T19:20:31Z,An MCP server plus a CLI tool that indexes local code into a graph database to provide context to AI
OneRedOak/claude-code-workflows,Sin especificar,3876,565,2025-08-12T03:34:53Z,"The best workflows and configurations I've developed, having heavily used Claude Code since the day"
mvanhorn/cli-printing-press,Go,3875,418,2026-03-23T16:02:09Z,"Every API has a secret identity. This finds it, absorbs every feature from every competing tool, the"
kenn-io/agentsview,Go,3873,298,2026-02-19T19:33:24Z,"Local-first session search, analytics, insights, and token use statistics for coding agents, support"
OpenMOSS/MOSS-TTS-Nano,Python,3872,499,2026-04-10T16:25:07Z,MOSS-TTS-Nano is an open-source multilingual tiny speech generation model from MOSI.AI and the OpenM
lintsinghua/claude-code-book,Sin especificar,3870,790,2026-03-31T18:00:16Z,《御舆：解码 Agent Harness》42万字拆解 AI Agent 的Harness骨架与神经 —— Claude Code 架构深度剖析，15 章从对话循环到构建你自己的 Agent Harn
QwenLM/Qwen3-Omni,Jupyter Notebook,3868,268,2025-09-21T09:46:10Z,"Qwen3-omni is a natively end-to-end, omni-modal LLM developed by the Qwen team at Alibaba Cloud, cap"
parcadei/Continuous-Claude-v3,Python,3856,295,2025-12-23T00:12:49Z,Context management for Claude Code. Hooks maintain state via ledgers and handoffs. MCP execution wit
wiltodelta/remove-ai-watermarks,Python,3855,348,2026-03-25T18:15:24Z,AI watermark remover. CLI and Python library to strip visible and invisible AI watermarks (Gemini /
novatic14/MANPADS-System-Launcher-and-Rocket,Sin especificar,3846,1063,2026-03-11T22:44:44Z,
homeassistant-ai/ha-mcp,Python,3842,150,2025-09-14T13:23:45Z,The Unofficial and Awesome Home Assistant MCP Server
timescale/pg_textsearch,C,3840,110,2025-07-06T17:45:50Z,PostgreSQL extension for BM25 relevance-ranked full-text search. Postgres OSS licensed.
nexu-io/html-video,HTML,3839,481,2026-05-27T02:08:11Z,"Programmatic video for coding agents — HTML to video on your laptop. Turn HTML, CSS & data into real"
jackwener/wx-cli,Rust,3835,1435,2026-04-16T01:08:18Z,WeChat local data CLI with daemon architecture
BenedictKing/ccx,Go,3827,301,2026-01-31T04:27:57Z,Claude / Codex / Gemini API Proxy - CCX
CarterPerez-dev/Cybersecurity-Projects,Python,3821,539,2025-11-08T02:16:49Z,"Building 70 Projects ranging from beginner to advanced so anyone can — learn from, build upon, use a"
straight-tamago/misaka26,Sin especificar,3812,174,2025-11-16T14:48:46Z,"iOS /iPadOS 16.0 - 26.1, An ultimate customization tool, uilitizing the bug that makes TrollRestore"
badrisnarayanan/antigravity-claude-proxy,JavaScript,3812,522,2025-12-19T13:57:33Z,"Proxy that exposes Antigravity provided claude / gemini models, so we can use them in Claude Code an"
Seeed-Projects/reBot-DevArm,Sin especificar,3812,374,2025-11-25T06:01:17Z,Open Source Robotic Arm for All Developers
KuekHaoYang/KVideo,TypeScript,3801,6611,2025-11-16T02:49:26Z,"一个基于 Next.js 16 构建的现代化视频聚合播放平台。采用独特的 ""Liquid Glass"" 设计语言，提供流畅的视觉体验和强大的视频搜索功能。"
1186258278/OpenClawChineseTranslation,JavaScript,3798,482,2026-01-30T13:12:57Z,🦞 OpenClaw (Clawdbot/Moltbot) 汉化版 - 开源个人 AI 助手中文版 | Claude/ChatGPT LLM 接入 | WhatsApp/Telegram/Discor
Dimillian/Skills,Shell,3796,201,2025-12-30T14:36:32Z,My Codex Skills
bradautomates/claude-video,Python,3794,569,2026-04-24T04:40:43Z,"Give Claude the ability to watch any video. /watch downloads, extracts frames, transcribes, hands it"
WUBING2023/PaperSpine,Python,3793,156,2026-05-17T08:37:31Z,"PaperSpine is a motivation-driven skill for learning from strong academic papers, building a paper’s"
google-gemini/gemini-skills,Python,3789,374,2026-02-06T04:17:28Z,"Skills for the Gemini API, SDK and model/agent interactions"
Pimzino/claude-code-spec-workflow,TypeScript,3787,265,2025-07-18T16:32:32Z,Automated workflows for Claude Code. Features spec-driven development for new features (Requirements
MattParkerDev/SharpIDE,C#,3787,137,2025-11-08T13:01:42Z,"A modern, cross platform IDE for .NET, built with .NET & Godot"
cporter202/scraping-apis-for-devs,JavaScript,3785,681,2025-12-10T18:35:41Z,This GitHub repo is a powerhouse collection of scraping APIs for developers that you can start using
guokaigdg/animal-island-ui,TypeScript,3782,317,2026-04-12T16:53:42Z,"Animal 风格的 React 组件库 灵感来源于任天堂《集合啦！动物森友会》 Vue 版同步发布 Animal Crossing-style React UI component library,"
browser-act/skills,Python,3782,167,2026-02-06T10:35:35Z,"Browser automation CLI built for AI agents. Break through anti-bot walls, hand off to humans across"
mergisi/awesome-openclaw-agents,HTML,3781,614,2026-02-05T10:51:17Z,162 production-ready AI agent templates for OpenClaw. SOUL.md configs across 19 categories. Submit y
HKUDS/Paper2Slides,Python,3775,471,2025-12-07T06:15:43Z,"""Paper2Slides: From Paper to Presentation in One Click"""
iflytek/skillhub,Java,3773,552,2026-03-11T12:17:05Z,"Self-hosted, open-source agent skill registry for enterprises. Publish & version skill packages, gov"
mihail911/modern-software-dev-assignments,Python,3772,912,2025-08-07T07:14:35Z,Assignments for CS146S: The Modern Software Dev (Stanford University Fall 2025)
karpathy/reader3,Python,3769,486,2025-11-18T02:37:00Z,Quick illustration of how one can easily read books together with LLMs. It's great and I highly reco
justlovemaki/openclaw-china-docker,Shell,3763,455,2026-02-01T11:42:18Z,OpenClaw 的中国IM平台整合Docker版本，预装并配置了飞书、钉钉、QQ机器人、企业微信等主流中国IM软件的插件，让您可以快速部署一个支持多个中国IM平台的 AI 机器人网关
OpenBMB/PilotDeck,TypeScript,3761,388,2026-05-22T06:50:28Z,Task-oriented AI Agent productivity platform
Lakr233/AssppWeb,TypeScript,3755,583,2026-02-08T03:22:35Z,
nyldn/claude-octopus,Shell,3751,348,2026-01-15T08:49:38Z,"Surface AI blindspots before you ship. Put up to 8 AI models on every research, design or coding tas"
HeartMuLa/heartlib,Python,3747,423,2026-01-15T07:53:15Z,HeartMuLa Official Repo: The Most Powerful Open-Source Music Generation Model of 2026
golutra/golutra,Rust,3746,431,2026-02-15T11:49:39Z,"Multi-agent AI orchestration platform for automation, workflows, and developer tools. Golutra transf"
tobi/try,Shell,3743,147,2025-08-19T19:25:23Z,fresh directories for every vibe
worldwonderer/oh-story-claudecode,JavaScript,3741,592,2026-04-22T16:35:39Z,网文/小说写作 skill 包，覆盖长篇与短篇网络小说的扫榜、拆文、写作、去AI味、封面图全流程
sanyuan0704/sanyuan-skills,Python,3730,329,2026-02-04T06:44:11Z,"Expert code review skill: SOLID, security, performance, error handling, boundary conditions"
bikini/exploitarium,Python,3727,1079,2026-06-23T05:14:11Z,A single archive of public exploit PoCs and vulnerability research writeups. At the time I post thes
Augani/openreel-video,TypeScript,3721,526,2026-01-19T11:24:02Z,OpenReel Video - Professional browser-based video editor. Open source CapCut alternative. 100% brows
OpenMOSS/MOSS-TTS,Python,3719,325,2026-02-07T14:05:49Z,MOSS‑TTS Family is an open‑source speech and sound generation model family from MOSI.AI and the Open
Hunyuan-PromptEnhancer/PromptEnhancer,Python,3719,324,2025-09-09T08:56:47Z,"[CVPR 2026] PromptEnhancer is a prompt-rewriting tool, refining prompts into clearer, structured ver"
p2r3/convert,TypeScript,3716,345,2025-12-07T07:40:09Z,Truly universal online file converter
bgreenwell/doxx,Rust,3711,91,2025-08-16T18:48:24Z,"Expose the contents of .docx files without leaving your terminal. Fast, safe, and smart — no Office"
ZHO-ZHO-ZHO/ZHO-nano-banana-Creation,Sin especificar,3711,353,2025-08-28T13:09:00Z,我的 nano-banana 创意玩法大合集！  持续更新中！
makerspet/oomwoo,Python,3708,159,2026-06-10T06:03:33Z,Open-source vacuum robot cleaner
FareedKhan-dev/all-agentic-architectures,Jupyter Notebook,3706,653,2025-09-24T11:47:58Z,"35 production-grade agentic AI architectures (Reflexion, LATS, GraphRAG, MemGPT, Voyager, BrowserAge"
braedonsaunders/codeflow,HTML,3696,593,2025-12-16T03:42:56Z,"Paste any GitHub URL → interactive architecture map. See how files connect, find what breaks if you"
panphora/overtype,JavaScript,3687,94,2025-08-15T02:17:49Z,The markdown editor that's just a textarea https://overtype.dev
remorses/playwriter,HTML,3681,161,2025-11-13T18:23:26Z,Chrome extension & CLI to let agents control your browser. Runs Playwright snippets in a stateful sa
ycccccccy/echotrace,Sin especificar,3677,658,2025-10-17T14:40:37Z,"EchoTrace 是一个本地、安全的微信聊天记录导出、分析与年度报告生成工具 | EchoTrace is a local, secure tool for exporting, analyzing"
matt1398/claude-devtools,TypeScript,3665,280,2026-02-07T13:17:25Z,"The missing DevTools for Claude Code — inspect session logs, tool calls, token usage, subagents, and"
QwenLM/Qwen3.6,Sin especificar,3662,243,2025-09-11T05:32:39Z,"Qwen3.6 is the large language model series developed by Qwen team, Alibaba Group."
HKUSTDial/Supervisor-Skills,Python,3653,266,2026-04-19T03:33:02Z,将博导十年科研经验炼化为可直接调用的 AI 技能。从 Idea 构思到论文投稿，你的 AI 科研副导师。
yasasbanukaofficial/claude-code,TypeScript,3648,4769,2026-03-31T19:07:10Z,🚀 Open source Claude Code CLI source code. Advanced AI Agent for developers. Includes TypeScript cod
limix-ldm-ai/LimiX,Python,3641,299,2025-08-27T07:15:45Z,LimiX: Unleashing Structured-Data Modeling Capability for Generalist Intelligence https://arxiv.org/
Adembc/lazyssh,Go,3641,140,2025-08-13T09:33:09Z,A terminal-based SSH manager inspired by lazydocker and k9s - Written in go
grimmory-tools/grimmory,Java,3639,257,2026-03-12T21:32:38Z,Grimmory is an independent community fork of Booklore.
nickjvandyke/opencode.nvim,Lua,3633,141,2025-07-12T13:52:17Z,Neovim 🤝 OpenCode for familiar flow.
Opencode-DCP/opencode-dynamic-context-pruning,TypeScript,3628,201,2025-11-20T01:51:43Z,Dynamic context pruning plugin for OpenCode - intelligently manages conversation context to optimize
browserbase/skills,JavaScript,3627,227,2025-10-12T08:44:05Z,Browserbase's official collection of agent skills to access the web.
Nasiko-Labs/nasiko,Python,3614,552,2026-02-12T10:45:29Z,Developer Control Plane for your AI Agents
zouzhekang/YJYpaper,HTML,3613,221,2025-07-29T06:23:12Z,一个用来记录武汉大学杨景媛论文问题的仓库
GiovanniPasq/agentic-rag-for-dummies,Jupyter Notebook,3608,472,2025-10-13T18:51:41Z,A modular Agentic RAG built with LangGraph — learn Retrieval-Augmented Generation Agents in minutes.
DaKheera47/job-ops,TypeScript,3607,445,2025-12-11T23:57:21Z,"job-ops: DevOps principles applied to job hunting. A self-hosted pipeline to track, analyze, and ass"
Jon-Becker/prediction-market-analysis,Python,3599,509,2025-11-22T16:59:25Z,"A framework for collecting and analyzing prediction market data, including the largest publicly avai"
aiming-lab/SimpleMem,Python,3592,367,2026-01-01T23:53:40Z,SimpleMem: Efficient Lifelong Memory for LLM Agents — Text & Multimodal
gemini-cli-extensions/conductor,Sin especificar,3589,281,2025-12-17T03:25:48Z,"Conductor is a Gemini CLI extension that allows you to specify, plan, and implement software feature"
TinyAGI/tinyagi,TypeScript,3587,504,2026-02-09T00:34:11Z,TinyAGI is the agent teams orchestrator for One Person Company. (fka TinyClaw)
epoko77-ai/im-not-ai,Python,3586,363,2026-04-24T12:48:40Z,AI가 쓴 글이 아닌 것처럼 윤문해주는 스킬
handsomestWei/patent-disclosure-skill,Python,3584,476,2026-04-07T15:44:15Z,中国专利.skill，从项目文档到可交付的技术交底书，专利点挖掘、联网国知局查新、脱敏成文与自检闭环。
OpenSenseNova/SenseNova-U1,Python,3581,322,2026-04-17T03:46:29Z,SenseNova-U series: Native Unified Paradigm with NEO-unify from the First Principles
thinking-machines-lab/tinker-cookbook,Python,3577,454,2025-07-14T22:10:00Z,Post-training with Tinker
hxehex/russia-mobile-internet-whitelist,Sin especificar,3576,99,2025-09-13T11:16:07Z,a list of domains and ips that stay live in russia when the mobile internet gets restricted
memodb-io/Acontext,JavaScript,3571,323,2025-07-16T13:15:48Z,Agent Skills as a Memory Layer
TabularisDB/tabularis,TypeScript,3567,225,2026-01-26T21:48:07Z,"Open-source desktop SQL workspace for PostgreSQL, MySQL/MariaDB, SQLite and 13+ more databases like"
subhashchy/The-Accidental-CTO,TypeScript,3563,284,2025-09-26T09:07:20Z,"How I Scaled from Zero to a Million Store on Dukaan,  Without a CS Degree.  .. A System Design Handb"
facebookresearch/sam-audio,Python,3562,323,2025-09-04T16:46:34Z,The repository provides code for running inference with the Meta Segment Anything Audio Model (SAM-A
wuyoscar/GPT-Image2-Skill,Python,3549,306,2026-04-22T11:27:21Z,"GPT Image 2 prompt gallery, image prompt library, agentic skill, and CLI for OpenAI image generation"
thu-ml/TurboDiffusion,Python,3545,267,2025-12-06T00:25:35Z,TurboDiffusion: 100–200× Acceleration for Video Diffusion Models
Nutlope/hallmark,CSS,3545,215,2026-04-27T20:47:10Z,"Anti-AI-slop design skill for Claude Code, Cursor, and Codex."
Keychron/Keychron-Keyboards-Hardware-Design,Sin especificar,3544,276,2026-04-04T04:28:32Z,"Industrial design files for Keychron keyboards and mice. 100+ models with CAD assets in STEP, DXF, D"
facebookresearch/map-anything,Python,3538,271,2025-09-04T14:37:36Z,MapAnything: Universal Feed-Forward Metric 3D Reconstruction
gotalab/cc-sdd,TypeScript,3537,266,2025-07-17T04:41:37Z,"Turn approved specs into long-running autonomous implementation. A minimal, adaptable SDD harness wi"
zhukunpenglinyutong/desktop-cc-gui,TypeScript,3526,297,2026-02-03T15:08:25Z,CC GUI 客户端（专为开发者打造的VibeCoding平台）
millionco/expect,TypeScript,3526,153,2026-03-12T05:58:06Z,Expect tests your agent's code in a real browser
laravel/boost,PHP,3524,339,2025-07-15T13:57:25Z,Laravel-focused MCP server for augmenting your AI powered local development experience.
ibelick/ui-skills,TypeScript,3523,145,2026-01-07T19:35:54Z,Skills for Design Engineers
jay3-yy/BiliPai,Kotlin,3519,130,2025-11-28T11:17:48Z,原生、纯净、可扩展 —— 重新定义你的 B 站体验
walkinglabs/awesome-harness-engineering,Sin especificar,3513,278,2026-03-29T11:29:37Z,🛠️ Awesome tools & guides for harness engineering.
zc-zhangchen/any-auto-register,Python,3511,1186,2026-03-22T13:00:59Z,
teamchong/pxpipe,TypeScript,3493,239,2026-05-20T12:39:42Z,cut Fable 5 token usage by rendering text context as images
EverMind-AI/MSA,Python,3489,226,2025-10-29T10:05:21Z,"Memory Sparse Attention -  A scalable, end-to-end trainable latent-memory framework for 100M-token c"
BuilderIO/agent-native,TypeScript,3487,332,2026-03-12T14:57:10Z,A framework for building agent-native applications.
zarazhangrui/beautiful-html-templates,HTML,3485,311,2026-05-05T06:18:21Z,A library of HTML slide templates designed so any coding agent can pick the right one and produce a
Soul-AILab/SoulX-Podcast,Python,3478,453,2025-09-22T03:32:35Z,SoulX-Podcast is an inference codebase by the Soul AI team for generating high-fidelity podcasts fro
guohuiyuan/go-music-dl,Go,3472,315,2026-01-18T16:29:10Z,一个基于 Go 语言的全网音乐搜索与下载工具。支持 CLI 命令行与 Web 服务双模式，内置网易云、QQ、酷狗、Bilibili、汽水音乐等 10+ 个主流平台，支持多源并发搜索与无损音质解析。mu
deta/surf,TypeScript,3472,255,2025-10-20T15:09:57Z,"Personal AI Notebooks. Organize files & webpages and generate notes from them. Open source, local &"
edwardkim/rhwp,Rust,3470,608,2026-03-27T05:54:10Z,아래한글 hwp viewer and editor by rust and wasm
npmx-dev/npmx.dev,TypeScript,3469,485,2026-01-22T16:00:54Z,"a fast, modern browser for the npm registry"
BuilderIO/skills,JavaScript,3468,172,2026-06-10T16:04:20Z,Skills for coding agents
karol-broda/snitch,Go,3467,55,2025-08-27T08:32:47Z,a prettier way to inspect network connections
ministackorg/ministack,Python,3458,318,2026-03-24T22:27:58Z,"Ministack: Free, open-source local AWS emulator - 55+ services, Terraform compatible, real databases"
liujuntao123/smart-excalidraw-next,JavaScript,3457,424,2025-10-30T02:12:40Z,"A smart, powerful, and beautiful excalidraw drawing tool.Draw Professional Charts with Natural Langu"
b-nnett/codex-plusplus,JavaScript,3457,174,2026-04-28T10:35:16Z,Codex++ tweak system for the Codex desktop app
aiming-lab/MetaClaw,Python,3456,443,2026-03-09T13:47:13Z,🦞 Just talk to your agent — it learns and EVOLVES 🧬.
liuup/claude-code-analysis,TypeScript,3452,1927,2026-03-31T19:21:23Z,🤖 The analysis of Claude Code
therealaleph/MasterHttpRelayVPN-RUST,Rust,3438,541,2026-04-21T14:46:31Z,Rust port of @masterking32's MasterHttpRelayVPN — all credit to @masterking32 for the original idea
yousifamanuel/terraink,TypeScript,3437,374,2026-02-10T02:04:37Z,Terraink: The Cartographic Poster Engine that creates unique and customizable map posters
pathwaycom/bdh,Python,3435,226,2025-09-30T12:05:01Z,BDH (Dragon Hatchling) – Architecture and Code
agenticnotetaking/arscontexta,Shell,3434,218,2026-02-15T17:26:41Z,Claude Code plugin that generates individualized knowledge systems from conversation. You describe h
miaoxworld/OpenClawInstaller,Shell,3429,471,2026-01-29T14:43:02Z,ClawdBot 一键部署工具
atilaahmettaner/tradingview-mcp,Python,3408,723,2025-08-08T22:34:03Z,"TradingView MCP server — real-time market data, technical analysis, screeners & backtesting for Clau"
f/textream,Swift,3404,235,2026-02-08T09:20:05Z,"Textream is a free macOS teleprompter app for streamers, interviewers, and presenters. It highlights"
GVCLab/PersonaLive,Python,3396,482,2025-11-25T14:36:31Z,[CVPR 2026] PersonaLive! : Expressive Portrait Image Animation for Live Streaming
yuaotian/antigravity-proxy,C++,3395,268,2026-01-08T10:23:46Z,🚀 Transparent proxy injector for Antigravity. Force SOCKS5/HTTP proxy without TUN mode on Windows. |
nextlevelbuilder/goclaw,Go,3393,955,2026-02-22T07:26:36Z,"GoClaw - GoClaw is OpenClaw rebuilt in Go — with multi-tenant isolation, 5-layer security, and nativ"
growchief/growchief,TypeScript,3385,255,2025-08-21T08:06:06Z,The Ultimate all-in social media automation (outreach) tool 🤖
facebookresearch/vggt-omega,Python,3380,178,2026-05-14T04:43:13Z,[CVPR 2026 Oral] VGGT Omega
ShadowHackrs/gmail-account-creator,Python,3373,533,2026-01-14T18:42:23Z,"🚀 Advanced automated Gmail account creation tool with anti-detection, phone verification bypass, 5si"
TrustTunnel/TrustTunnel,Rust,3355,222,2025-11-07T13:01:12Z,"Modern, fast and obfuscated VPN protocol"
dorianborian/sesame-robot,C,3349,456,2025-11-21T18:30:15Z,An open and affordable mini quadruped robot based on ESP32.
