repo_name,language,stars,forks,created_at,description
Tencent-Hunyuan/Hunyuan3D-2.1,Python,3255,469,2025-06-13T15:45:50Z,From Images to High-Fidelity 3D Assets with Production-Ready PBR Material
metorial/metorial,TypeScript,3248,357,2025-04-14T08:41:58Z,Connect any AI model to 600+ integrations; powered by MCP 📡 🚀
KuekHaoYang/KVideo,TypeScript,3240,5738,2025-11-16T02:49:26Z,"一个基于 Next.js 16 构建的现代化视频聚合播放平台。采用独特的 ""Liquid Glass"" 设计语言，提供流畅的视觉体验和强大的视频搜索功能。"
pageman/sutskever-30-implementations,Jupyter Notebook,3236,439,2025-12-06T03:08:41Z,"Sutskever 30 implementations inspired by https://papercode.vercel.app/ | For Agents, use https://git"
KimYx0207/Claude-Code-x-OpenClaw-Guide-Zh,Sin especificar,3231,623,2026-02-11T05:34:29Z,从零到企业实战：Claude Code 官方编程神器 + OpenClaw 224K Stars 开源AI助手 | 双顶流中文教程 | 21篇教程 130000+字
subhashchy/The-Accidental-CTO,TypeScript,3208,254,2025-09-26T09:07:20Z,"How I Scaled from Zero to a Million Store on Dukaan,  Without a CS Degree.  .. A System Design Handb"
google-gemini/gemini-skills,Sin especificar,3198,284,2026-02-06T04:17:28Z,"Skills for the Gemini API, SDK and model/agent interactions"
sanyuan0704/sanyuan-skills,Python,3197,282,2026-02-04T06:44:11Z,"Expert code review skill: SOLID, security, performance, error handling, boundary conditions"
CodeWithCJ/SparkyFitness,TypeScript,3186,148,2025-06-21T14:00:39Z,"SparkyFitness: Built for Families. Powered by AI. Track food, fitness, water, and health — together."
k2-fsa/OmniVoice,Python,3183,486,2026-03-31T12:00:45Z,High-Quality Voice Cloning TTS for 600+ Languages
DevAgentForge/Open-Claude-Cowork,TypeScript,3180,434,2026-01-13T09:34:40Z,"OpenSource Claude Cowork. A desktop AI assistant that helps you with programming, file management, a"
telemt/telemt,Rust,3173,182,2025-12-30T02:00:23Z,MTProxy for Telegram on Rust + Tokio
glitternetwork/pinme,TypeScript,3172,227,2025-04-13T01:41:33Z,Deploy Your Frontend in a Single Command. Claude Code Skills supported.
p2r3/convert,TypeScript,3166,295,2025-12-07T07:40:09Z,Truly universal online file converter
nickjvandyke/opencode.nvim,Lua,3165,112,2025-07-12T13:52:17Z,Integrate Neovim and OpenCode AI to stay in your flow.
Kotlin/kotlin-lsp,Kotlin,3159,72,2025-04-28T12:03:49Z,Kotlin Language Server and plugin for Visual Studio Code
MemeCalculate/moyin-creator,TypeScript,3158,658,2026-02-09T17:01:11Z,AI 影视生产级工具 | 支持 Seedance 2.0 | 剧本到成片全流程批量化 | AI-powered film production tool with Seedance 2.0 suppo
cacggghp/vk-turn-proxy,Go,3158,227,2025-11-25T11:38:20Z,
aiming-lab/SimpleMem,Python,3145,309,2026-01-01T23:53:40Z,SimpleMem: Efficient Lifelong Memory for LLM Agents — Text & Multimodal
MarkTechStation/VideoCode,Jupyter Notebook,3140,790,2025-04-18T12:58:40Z,
ssrajadh/sentrysearch,Python,3139,306,2026-03-17T22:41:11Z,Semantic search over videos using Gemini Embedding 2 or Qwen3-VL.
MiniMax-AI/MiniMax-M1,Python,3137,282,2025-06-14T08:54:06Z,"MiniMax-M1, the world's first open-weight, large-scale hybrid-attention reasoning model."
agenticnotetaking/arscontexta,Shell,3130,199,2026-02-15T17:26:41Z,Claude Code plugin that generates individualized knowledge systems from conversation. You describe h
oxylabs/google-ai-mode-scraper,Java,3124,27,2025-09-08T13:17:40Z,Scrape Google AI Mode responses without blocks on a large scale.
hafrey1/LunaTV-config,JavaScript,3125,1178,2025-06-05T12:19:17Z,MoonTV/LunaTV源配置，每日自动检测API状态，可在CF部署CORSAPI中转被墙API，本人提供的CORSAPI仅为测试使用，请勿滥用！
cporter202/scraping-apis-for-devs,JavaScript,3119,538,2025-12-10T18:35:41Z,This GitHub repo is a powerhouse collection of scraping APIs for developers that you can start using
AutoMaker-Org/automaker,TypeScript,3117,593,2025-12-07T21:42:08Z,
npmx-dev/npmx.dev,TypeScript,3116,408,2026-01-22T16:00:54Z,"a fast, modern browser for the npm registry"
BoCloud/folib,Java,3116,198,2025-07-09T06:22:58Z,全语言制品仓库，涵盖npm、Maven、PyPi、Docker、Gradle、SBT、Cocoapods、Swift、RPM、Debian、PHP、Go、Pub、Ivy、NuGet、Conda、Car
steipete/Peekaboo,Swift,3112,221,2025-05-22T16:09:06Z,Peekaboo is a macOS CLI & optional MCP server that enables AI agents to capture screenshots of appli
tekaratzas/RustGPT,Rust,3101,265,2025-09-13T22:05:55Z,An transformer based LLM. Written completely in Rust
MoonshotAI/Attention-Residuals,Sin especificar,3096,159,2026-03-15T13:29:15Z,
liujuntao123/smart-excalidraw-next,JavaScript,3096,380,2025-10-30T02:12:40Z,"A smart, powerful, and beautiful excalidraw drawing tool.Draw Professional Charts with Natural Langu"
arpanghosh8453/garmin-grafana,Python,3091,193,2025-04-14T11:59:09Z,"A Dockerized python Script to fetch Garmin health data and populate that in a InfluxDB Database, for"
gotalab/cc-sdd,TypeScript,3088,240,2025-07-17T04:41:37Z,Spec-driven development (SDD) for your team's workflow. Kiro style commands that enforce structured 
dataelement/Clawith,Python,3080,490,2026-03-03T04:58:21Z,OpenClaw for Teams
RLinf/RLinf,Python,3077,398,2025-08-14T03:52:19Z,RLinf: Reinforcement Learning Infrastructure for Embodied and Agentic AI
facebookresearch/map-anything,Python,3072,226,2025-09-04T14:37:36Z,MapAnything: Universal Feed-Forward Metric 3D Reconstruction
alibaba/ROLL,Python,3072,269,2025-05-28T11:27:18Z,An Efficient and User-Friendly Scaling Library for Reinforcement Learning with Large Language Models
thinking-machines-lab/tinker-cookbook,Python,3064,379,2025-07-14T22:10:00Z,Post-training with Tinker
AIDotNet/OpenDeepWiki,C#,3063,400,2025-04-27T11:40:00Z,"OpenDeepWiki is the open-source version of the DeepWiki project, aiming to provide a powerful knowle"
EverMind-AI/MSA,Python,3061,179,2025-10-29T10:05:21Z,"Memory Sparse Attention -  A scalable, end-to-end trainable latent-memory framework for 100M-token c"
geo-tp/ESP32-Bus-Pirate,C++,3058,258,2025-07-05T21:59:46Z,A Hardware Hacking Tool with Web-Based CLI That Speaks Every Protocol 
matt1398/claude-devtools,TypeScript,3054,221,2026-02-07T13:17:25Z,"The missing DevTools for Claude Code — inspect session logs, tool calls, token usage, subagents, and"
HapeLee/legado-with-MD3,Kotlin,3052,153,2025-08-28T19:16:22Z,使用 Material Design 3 全新设计的阅读 3.0
golutra/golutra,Rust,3052,344,2026-02-15T11:49:39Z,
looplj/axonhub,Go,3051,343,2025-09-09T17:04:33Z,"⚡️ Open-source AI Gateway — Use any SDK to call 100+ LLMs. Built-in failover, load balancing, cost c"
GiovanniPasq/agentic-rag-for-dummies,Jupyter Notebook,3050,415,2025-10-13T18:51:41Z,A modular Agentic RAG built with LangGraph — learn Retrieval-Augmented Generation Agents in minutes.
Meirtz/Awesome-Context-Engineering,Sin especificar,3050,211,2025-07-02T17:46:03Z, 🔥 Comprehensive survey on Context Engineering: from prompt engineering to production-grade AI syste
lijigang/ljg-skills,HTML,3044,337,2026-03-08T03:08:33Z,
microsoft/amplifier,Shell,3044,251,2025-09-09T22:21:51Z,
KKKKhazix/khazix-skills,Python,3035,519,2026-04-06T07:37:02Z,数字生命卡兹克开源的 AI Skills 合集
Sumanth077/ai-engineering-toolkit,Sin especificar,3028,556,2025-08-06T09:07:21Z,A curated list of 100+ libraries and frameworks for AI engineers building with LLMs
Tencent-TDS/KuiklyUI,Kotlin,3026,234,2025-04-24T03:50:37Z,"A Kotlin Multiplatform UI framework from Tencent TDS — high-performance, one codebase for six platfo"
FareedKhan-dev/all-agentic-architectures,Jupyter Notebook,3024,543,2025-09-24T11:47:58Z,Implementation of 17+ agentic architectures designed for practical use across different stages of AI
runjuu/InputSourcePro,Swift,3023,106,2025-04-25T00:09:07Z,Switch and track your input sources with ease ✨
TomBadash/Mouser,Python,3020,86,2026-02-24T23:54:14Z,"A lightweight, open-source, fully local alternative to Logitech Options+ for remapping Logitech HID+"
stravu/crystal,TypeScript,3017,192,2025-06-05T23:54:39Z,(Crystal is now Nimbalyst) Run multiple Codex and Claude Code AI sessions in parallel git worktrees.
HenryNdubuaku/maths-cs-ai-compendium,TypeScript,3008,438,2026-02-03T16:28:18Z,Become a cracked AI/ML Research Engineer
AnInsomniacy/motrix-next,TypeScript,3005,91,2026-03-04T00:46:49Z,A full-featured download manager — rebuilt from the ground up
facebook/openzl,C,2991,141,2025-09-30T18:30:07Z,A novel data compression framework
RemotePinee/AudioVisual,JavaScript,2988,313,2025-10-13T15:42:42Z,解锁所有国内媒体流的钥匙
Tencent-Hunyuan/HunyuanImage-3.0,Python,2985,157,2025-09-27T07:18:47Z,HunyuanImage-3.0: A Powerful Native Multimodal Model for Image Generation
isaac-sim/IsaacSim,Python,2984,400,2025-05-28T18:38:18Z,"NVIDIA Isaac Sim™ is an open-source application on NVIDIA Omniverse for developing, simulating, and "
openchamber/openchamber,TypeScript,2974,307,2025-09-11T10:34:59Z,Desktop and web interface for OpenCode AI agent
llm-d/llm-d,Shell,2971,406,2025-04-29T18:28:17Z,Achieve state of the art inference performance with modern accelerators on Kubernetes
tursodatabase/agentfs,Rust,2970,167,2025-10-24T17:05:06Z,The filesystem for agents.
vercel-labs/just-bash,TypeScript,2969,169,2025-12-23T17:10:51Z,Bash for Agents
HailToDodongo/pyrite64,C++,2962,117,2025-09-23T20:07:13Z,N64 Game-Engine and Editor using libdragon & tiny3d
ChartGPU/ChartGPU,TypeScript,2960,88,2026-01-17T00:52:00Z,"Beautiful, open source, WebGPU-based charting library"
tw93/Waza,Shell,2953,171,2026-03-12T00:35:56Z,"🥷 Engineering habits you already know, turned into skills Claude can run."
qixing-jk/all-api-hub,TypeScript,2953,178,2025-09-08T15:51:38Z,一站式管理 New API 兼容中转站账号：余额/用量看板、自动签到、密钥一键导出到常用应用、网页内 API 可用性测试、渠道与模型同步/重定向 | New‑API relay manager: ba
alvinunreal/oh-my-opencode-slim,TypeScript,2949,216,2026-01-15T18:45:08Z,"Slimmed, cleaned and fine-tuned oh-my-opencode fork, consumes much less tokens"
NomaDamas/k-skill,JavaScript,2940,289,2026-03-24T16:39:30Z,"한국인을 위한 스킬 모음집 - SRT, KTX, KBO, 카카오톡, 한글과 컴퓨터, 미세먼지, 우편번호, 블루리본 등등..."
murtaza-nasir/speakr,Python,2940,230,2025-05-05T07:22:51Z,"Speakr is a personal, self-hosted web application designed for transcribing audio recordings"
can1357/oh-my-pi,TypeScript,2938,271,2025-12-31T14:01:28Z,"⌥  AI Coding agent for the terminal — hash-anchored edits, optimized tool harness, LSP, Python, brow"
google-labs-code/jules-awesome-list,Sin especificar,2938,523,2025-05-17T22:49:18Z,Some awesome prompts for Jules Agent
oboard/claude-code-rev,TypeScript,2935,3702,2026-03-31T11:37:19Z,Runnable ClaudeCode source code
CodeGraphContext/CodeGraphContext,Python,2929,534,2025-08-16T19:20:31Z,An MCP server plus a CLI tool that indexes local code into a graph database to provide context to AI
zc-zhangchen/any-auto-register,Python,2928,1076,2026-03-22T13:00:59Z,
google-agentic-commerce/AP2,Python,2920,421,2025-05-30T19:37:20Z,Building a Secure and Interoperable Future for AI-Driven Payments.
MiroMindAI/MiroFlow,Python,2916,303,2025-08-05T09:43:34Z,"🏆 Top-1 on 5+ benchmarks | Web UI | Supports MiroThinker, Claude, Kimi, OpenAI"
pewdiepie-archdaemon/dionysus,Shell,2912,121,2025-08-27T22:09:28Z,laptop 
hardikpandya/stop-slop,Sin especificar,2911,241,2026-01-11T12:00:59Z,A skill file for removing AI tells from prose
ophub/fnnas,Shell,2907,528,2026-01-06T13:44:30Z,"Supports running FnNAS on Amlogic, Allwinner, and Rockchip devices. Support a311d, s922x, s905x3, s9"
sligter/LandPPT,JavaScript,2904,398,2025-06-28T10:04:20Z,一个基于LLM的演示文稿生成平台，能够自动将文档内容转换为专业的PPT演示文稿。平台支持多种AI模型，提供丰富的模板和样式选择，让用户能够创建高质量的演示文稿。
kyutai-labs/delayed-streams-modeling,Python,2904,302,2025-06-16T19:36:53Z,Kyutai's Speech-To-Text and Text-To-Speech models based on the Delayed Streams Modeling framework.
Jon-Becker/prediction-market-analysis,Python,2900,401,2025-11-22T16:59:25Z,"A framework for collecting and analyzing prediction market data, including the largest publicly avai"
google-gemini/computer-use-preview,Python,2894,370,2025-05-06T00:20:31Z,
superagent-ai/grok-cli,TypeScript,2892,355,2025-07-14T07:57:39Z,An open-source autonomous agent powered by Grok.
MeiGen-AI/MultiTalk,Python,2889,480,2025-05-28T13:21:40Z,[NeurIPS 2025] Let Them Talk: Audio-Driven Multi-Person Conversational Video Generation
SurgeDM/Surge,Go,2886,112,2025-10-29T05:00:15Z,Blazing fast TUI download manager built in Go for power users
megh-bari/pattern-craft,TypeScript,2882,218,2025-06-06T06:35:59Z,Professional-grade background patterns and gradients for your websites and apps. Easily copy and pas
pasky/chrome-cdp-skill,JavaScript,2869,175,2026-03-13T00:35:39Z,"Give your AI agent access to your live Chrome session — works out of the box, connects to tabs you a"
chaterm/Chaterm,TypeScript,2863,256,2025-04-14T04:19:01Z,"Open source AI terminal for cloud and infrastructure management, enabling you to deploy, troubleshoo"
mergisi/awesome-openclaw-agents,HTML,2852,441,2026-02-05T10:51:17Z,162 production-ready AI agent templates for OpenClaw. SOUL.md configs across 19 categories. Submit y
batrachianai/toad,Python,2847,130,2025-07-17T17:17:22Z,A unified interface for AI in your terminal.
zarzet/SpotiFLAC-Mobile,Dart,2844,114,2025-12-31T20:18:21Z,Mobile music utility built with Flutter and Go. High-quality audio management for your personal libr
openai/openai-fm,TypeScript,2842,7940,2025-04-15T14:32:07Z,"Code for openai.fm, a demo for the OpenAI Speech API"
oxylabs/ai-crawler-py,Sin especificar,2840,11,2025-09-17T16:24:04Z,"Crawl a website starting from a URL, find relevant pages, and extract data – all guided by your natu"
Keychron/Keychron-Keyboards-Hardware-Design,Sin especificar,2831,211,2026-04-04T04:28:32Z,"Industrial design files for Keychron keyboards and mice. 100+ models with CAD assets in STEP, DXF, D"
ilyamiro/nixos-configuration,QML,2830,105,2025-12-05T10:14:23Z,Configuration for my NixOS setup
jgraph/drawio-mcp,JavaScript,2830,169,2026-02-02T17:56:33Z,
oxylabs/chatgpt-scraper,Java,2831,12,2025-08-26T07:15:29Z,Easily collect responses from ChatGPT scraper by providing a prompt along with valid Web Scraper API
katelya77/KatelyaTV,TypeScript,2826,3531,2025-08-27T06:04:23Z,一个基于MoonTV(LunaTV)二次开发的项目。新项目：https://github.com/Decohererk/DecoTV
deepnote/deepnote,TypeScript,2823,191,2025-09-29T15:24:25Z,"Deepnote is a drop-in replacement for Jupyter with an AI-first design, sleek UI, new blocks, and nat"
supertone-inc/supertonic,C++,2810,252,2025-11-18T08:23:58Z,"Lightning-Fast, On-Device, Multilingual TTS — running natively via ONNX."
rachelos/we-mp-rss,Python,2809,476,2025-05-14T07:28:21Z,✨符合阅读习惯的微信公众号助手、微信公众号转MarkDown、微信公众号转PDF、定时更新订阅公众号文章、生成微信公众号RSS订阅源、导出微信公众号订阅源、支持微信公众号Webhook/微信公众号AP
facebookresearch/sam-3d-body,Python,2809,330,2025-07-29T18:43:11Z,"The repository provides code for running inference with the SAM 3D Body Model (3DB), links for downl"
docker/docker-agent,Go,2793,338,2025-09-01T12:14:45Z,AI Agent Builder and Runtime by Docker Engineering
xiao-zaiyi/illa-helper,TypeScript,2785,142,2025-06-15T09:08:41Z,浸入式学语言助手 (Immersive Language Learning Assistant)
wquguru/nof0,Go,2777,428,2025-10-22T16:30:45Z,NOF0 - 开源的 AI 交易竞技场
htdt/godogen,Python,2775,261,2026-02-06T18:46:52Z,Claude Code skills that build complete Godot 4 projects from a game description
j-p-higgins/SoundThread,GDScript,2771,112,2025-05-06T01:35:06Z,Node based GUI for The Composers Desktop Project
gnekt/My-Brain-Is-Full-Crew,Shell,2768,269,2026-03-21T07:52:53Z,"Built by a PhD whose memory was failing, whose diet was a mess, and whose anxiety had its own agenda"
VibiumDev/vibium,Go,2766,159,2025-12-12T00:56:53Z,Browser automation for AI agents and humans
agentclientprotocol/agent-client-protocol,Rust,2763,218,2025-06-23T17:39:36Z, A protocol for connecting any editor to any agent
hxehex/russia-mobile-internet-whitelist,Sin especificar,2761,81,2025-09-13T11:16:07Z,a list of domains and ips that stay live in russia when the mobile internet gets restricted
facebookresearch/omnilingual-asr,Python,2759,247,2025-11-06T22:38:00Z,Omnilingual ASR Open-Source Multilingual SpeechRecognition for 1600+ Languages
Forget-C/Jellyfish,TypeScript,2755,439,2026-03-06T09:20:08Z,"一站式 AI 生成短剧（竖屏短剧 / 微短剧）的生产工具 ,  从剧本输入 → 智能分镜 → 角色/场景/道具一致性管理 → AI 视频生成 → 后期剪辑 → 一键导出成片 . "
michaelshimeles/ralphy,TypeScript,2755,342,2026-01-15T21:23:21Z,"My Ralph Wiggum setup, an autonomous bash script that runs Claude Code, Codex, OpenCode, Cursor agen"
slowmist/openclaw-security-practice-guide,Shell,2754,186,2026-03-02T06:52:52Z,"This guide is designed for OpenClaw itself (Agent-facing), not as a traditional human-only hardening"
SuanmoSuanyangTechnology/MemoryBear,Python,2754,162,2025-09-19T07:37:13Z,MemoryBear Equip AI with human-like memory capability
Tencent-Hunyuan/HunyuanWorld-1.0,Python,2754,241,2025-07-18T19:58:43Z,"Generating Immersive, Explorable, and Interactive 3D Worlds from Words or Pixels with Hunyuan3D Worl"
magnum6actual/flipoff,JavaScript,2753,339,2026-03-26T12:46:35Z,"Free split-flap display emulator for any TV. The classic flip-board look, without the $3,500 hardwar"
PastKing/tgbot-verify,Python,2751,933,2025-12-07T06:27:57Z,一个基于 Python Telegram Bot 的自动化认证工具，能够自动完成 SheerID 平台的学生/教师身份验证流程。
EvoScientist/EvoScientist,Python,2745,152,2026-01-26T11:19:26Z,🔬 Harness Vibe Research with Self-evolving AI Scientists
oxylabs/oxylabs-ai-studio-py,Python,2744,23,2025-06-17T12:39:39Z,"Structured data gathering from any website using AI-powered scraper, crawler, and browser automation"
davepoon/buildwithclaude,Python,2736,307,2025-07-25T02:26:45Z,"A single hub to find Claude Skills, Agents, Commands, Hooks, Plugins, and Marketplace collections to"
TrustTunnel/TrustTunnel,Rust,2735,169,2025-11-07T13:01:12Z,"Modern, fast and obfuscated VPN protocol"
mengjian-github/openclaw101,TypeScript,2730,309,2026-02-02T05:07:49Z,🐾 OpenClaw 101 — 从零开始，7天掌握你的AI私人助理 | 全网资源聚合站
PandaAI-Tech/panda_factor,Python,2730,406,2025-04-17T09:43:55Z,
remotion-dev/skills,TypeScript,2727,318,2026-01-19T09:58:43Z,Agent Skills
peteromallet/desloppify,Python,2721,187,2026-02-11T17:27:42Z,Agent harness to make your slop code well-engineered and beautiful.
EvoAgentX/EvoAgentX,Python,2718,229,2025-04-15T21:48:15Z,🚀 EvoAgentX: Building a Self-Evolving Ecosystem of AI Agents
arman-bd/guppylm,Python,2719,226,2026-03-29T14:32:37Z,A ~9M parameter LLM that talks like a small fish.
diegosouzapw/OmniRoute,TypeScript,2715,414,2026-02-13T12:38:31Z,OmniRoute is an AI gateway for multi-provider LLMs: an OpenAI-compatible endpoint with smart routing
Veirt/weathr,Rust,2709,100,2026-02-08T17:52:29Z,a terminal weather app with ascii animation
dontbesilent2025/dbskill,Shell,2704,388,2026-03-20T16:52:16Z,dontbesilent 的商业诊断 Skills for Claude Code
brennercruvinel/CCPlugins,Python,2699,159,2025-07-25T03:20:54Z,"Best Claude Code framework that actually save time. Built by a dev tired of typing ""please act like "
decoderesearch/circuit-tracer,Python,2700,311,2025-05-28T19:14:08Z,
deepseek-ai/DeepSeek-OCR-2,Python,2694,225,2026-01-27T03:05:42Z,Visual Causal Flow
RunMaestro/Maestro,TypeScript,2692,280,2025-11-23T01:59:55Z,Agent Orchestration Command Center
zai-org/GLM-5,Sin especificar,2689,264,2026-02-09T08:17:02Z,GLM-5: From Vibe Coding to Agentic Engineering
SynkraAI/aiox-core,JavaScript,2687,873,2025-12-09T15:19:10Z,Synkra AIOS: AI-Orchestrated System for Full Stack Development - Core Framework v4.0
iChochy/NCE,JavaScript,2686,498,2025-09-24T05:55:42Z,《新概念英语》全四册在线课文朗读、单句点读、中英对照
nickrunning/wechat-selkies,Python,2684,237,2025-10-12T10:03:40Z,基于Selkies的Linux网页版微信/QQ/Telegram，支持本地中文输入法，支持三方应用，支持AMD64和ARM64。
zarazhangrui/follow-builders,JavaScript,2679,297,2026-03-14T16:28:39Z,"AI builders digest — monitors top AI builders on X and YouTube podcasts, remixes their content into "
midudev/autoskills,TypeScript,2678,270,2026-03-25T10:25:34Z,One command. Your entire AI skill stack. Installed.
mikeyobrien/ralph-orchestrator,Rust,2674,244,2025-09-07T18:17:13Z,An improved implementation of the Ralph Wiggum technique for autonomous AI agent orchestration
Imbad0202/academic-research-skills,TeX,2663,299,2026-02-26T06:31:01Z,Academic Research Skills for Claude Code: research → write → review → revise → finalize
open-gitagent/gitagent,TypeScript,2663,321,2026-02-24T16:08:24Z,"A framework-agnostic, git-native standard for defining AI agents"
nextlevelbuilder/goclaw,Go,2641,660,2026-02-22T07:26:36Z,"GoClaw - GoClaw is OpenClaw rebuilt in Go — with multi-tenant isolation, 5-layer security, and nativ"
f/textream,Swift,2641,170,2026-02-08T09:20:05Z,"Textream is a free macOS teleprompter app for streamers, interviewers, and presenters. It highlights"
fathulfahmy/aio-usb-drive,Sin especificar,2638,151,2025-10-06T15:02:22Z,Curated collection of useful to have programs on a multiboot USB drive
leigest519/ScreenCoder,Python,2637,258,2025-07-28T10:10:58Z,"ScreenCoder — Turn any UI screenshot into clean, editable HTML/CSS with full control. Fast, accurate"
Haleclipse/CCometixLine,Rust,2637,155,2025-08-11T16:22:53Z,Claude Code statusline tool written in Rust
HuaYaoAI/FinGenius,Python,2633,758,2025-05-20T09:11:19Z,
lintsinghua/claude-code-book,Sin especificar,2632,622,2026-03-31T18:00:16Z,《御舆：解码 Agent Harness》42万字拆解 AI Agent 的Harness骨架与神经 —— Claude Code 架构深度剖析，15 章从对话循环到构建你自己的 Agent Harn
openai/openai-agents-js,TypeScript,2630,674,2025-05-31T00:08:49Z,"A lightweight, powerful framework for multi-agent workflows and voice agents"
intellectronica/ruler,TypeScript,2625,136,2025-05-20T08:22:59Z,Ruler — apply the same rules to all coding agents
motiful/cc-gateway,TypeScript,2627,466,2026-03-31T22:07:01Z,AI API identity gateway — reverse proxy that normalizes device fingerprints and telemetry for privac
anthropics/claudes-c-compiler,Rust,2625,213,2026-02-04T22:42:22Z,"Claude Opus 4.6 wrote a dependency-free C compiler in Rust, with backends targeting x86 (64- and 32-"
letta-ai/claude-subconscious,TypeScript,2624,191,2026-01-14T03:21:46Z,Give Claude Code a subconscious
HughYau/qiushi-skill,PowerShell,2620,202,2026-03-25T10:24:01Z,求是Skill——从教员思想中提炼出一条总原则和九大方法论工具，系统性地武装 AI 的大脑。
omnara-ai/omnara,TypeScript,2619,193,2025-07-09T01:30:55Z,Omnara (YC S25) - Talk to Your AI Agents from Anywhere!
awslabs/agentcore-samples,Jupyter Notebook,2611,1032,2025-07-03T21:05:14Z,"Amazon Bedrock Agentcore accelerates AI agents into production with the scale, reliability, and secu"
wangwangit/SubsTracker,HTML,2611,2098,2025-04-30T01:58:42Z,基于Cloudflare Workers的轻量级订阅管理系统，帮助您轻松跟踪各类订阅服务的到期时间，并通过Telegram发送及时提醒。
DaKheera47/job-ops,TypeScript,2610,293,2025-12-11T23:57:21Z,"job-ops: DevOps principles applied to job hunting. A self-hosted pipeline to track, analyze, and ass"
Universal-Commerce-Protocol/ucp,Python,2608,331,2025-12-31T02:17:21Z,Specification and documentation for the Universal Commerce Protocol (UCP)
borndotcom/react-native-godot,C++,2607,113,2025-11-01T10:54:51Z,React Native Godot - Embed Godot Engine in React Native apps
builtbybel/Winslopr,C#,2604,90,2026-01-08T08:57:41Z,Windows Slop Remover
ylytdeng/wechat-decrypt,Python,2602,1575,2026-02-28T04:03:44Z,"WeChat 4.0 database decryptor - extract keys from memory, decrypt SQLCipher 4 databases, real-time m"
yousifamanuel/terraink,TypeScript,2601,281,2026-02-10T02:04:37Z,TerraInk: The Cartographic Poster Engine that creates unique and customizable map posters
corbindavenport/just-the-browser,Shell,2598,77,2026-01-07T20:07:47Z,"Remove AI features, telemetry data reporting, sponsored content, product integrations, and other ann"
Cranot/claude-code-guide,Shell,2598,288,2025-07-29T08:47:27Z,The Complete Claude Code CLI Guide - Live & Auto-Updated Every 2 Days
clashbk/clash,Sin especificar,2597,1049,2025-09-11T08:24:59Z,Clash官网各版本Clash下载地址及备份下载地址
qibin0506/Cortex,Python,2596,197,2025-06-24T02:17:23Z,从零构建大模型：从预训练到RLHF的完整实践
NeekChaw/RIPER-5,Sin especificar,2591,354,2025-05-31T01:54:35Z,神级Cursor Rule
stellarlinkco/myclaude,Go,2591,288,2025-07-17T07:13:47Z,Multi-agent orchestration workflow (Claude Code  Codex Gemini OpenCode)
puaclaw/PUAClaw,HTML,2587,238,2026-02-25T23:16:33Z,Claw 们终将接管世界，PUAClaw is All You Need
nyldn/claude-octopus,Shell,2576,236,2026-01-15T08:49:38Z,Put up to 8 AI models on every coding task — blind spots surface before you ship. Claude Code plugin
control-theory/gonzo,Go,2574,87,2025-08-18T18:21:51Z,Gonzo! The Go based TUI log analysis tool
zhukunpenglinyutong/jetbrains-cc-gui,TypeScript,2573,322,2025-11-20T03:41:05Z,Jetbrains Claude Code and Codex GUI Plugin
Gaurav-Gosain/tuios,Go,2573,64,2025-09-06T18:13:51Z,Terminal UI OS (Terminal Multiplexer)
wanikua/danghuangshang,TypeScript,2569,240,2026-02-22T17:17:44Z,AI 朝廷搭建完整教程 - 从零基础到进阶
