repo_name,language,stars,forks,created_at,description
kort0881/vpn-vless-configs-russia,Python,509,32,2025-10-04T17:07:42Z,Free VLESS/VMESS/Shadowsocks proxy configurations updated daily. VPN keys repository with automated
ikunshare/ikun-music-desktop,TypeScript,509,59,2025-07-04T04:40:20Z,LX Music修改版本
crafter-station/elements,TypeScript,509,29,2025-08-25T03:15:40Z,"Full-stack shadcn/ui blocks for auth, payments, AI, logos, and more"
vyrx-dev/symphony,CSS,508,21,2025-07-05T00:01:25Z,a setup I wish already existed
ozeranskii/httptap,Python,508,22,2025-10-22T22:05:06Z,"Rich-powered CLI that breaks each HTTP request into DNS, connect, TLS, wait, and transfer phases wit"
kiriwalawren/nixflix,Nix,508,33,2025-10-30T22:43:31Z,NixOS Media Server Configuration
ethz-vlg/mvtracker,Python,508,28,2025-08-28T15:54:12Z,[ICCV 2025 Oral] MVTracker: Multi-view 3D Point Tracking
cornradio/tray-chrome,C#,508,20,2025-09-15T16:18:03Z,menubarX for windows
badlogic/claude-commands,Sin especificar,508,31,2025-07-06T20:03:55Z,Global Claude Code commands and workflows
Fantasy-AMAP/fantasy-portrait,Python,508,36,2025-07-17T07:27:11Z,FantasyPortrait: Enhancing Multi-Character Portrait Animation with Expression-Augmented Diffusion Tr
zavora-ai/adk-rust,Rust,507,75,2025-11-23T09:24:22Z,"Rust Agent Development Kit (ADK-Rust): Build AI agents in Rust with modular components for models, t"
getActivity/DeviceCompat,Java,507,47,2025-08-20T07:38:00Z,解决 Android 适配的最后一公里
fanegg/Human3R,Python,507,43,2025-10-07T12:52:33Z,[ICLR 2026] An unified model for 4D human-scene reconstruction
deepseek-ai/LPLB,Python,507,37,2025-11-19T07:02:55Z,An early research stage expert-parallel load balancer for MoE models based on linear programming.
chenfengxu714/StreamDiffusionV2,Python,507,56,2025-07-06T18:51:14Z,"StreamDiffusion, Live Stream APP"
XxxXTeam/business2api,Go,507,62,2025-11-28T07:43:45Z,OpenAI/Gemini 兼容的 Gemini Business API 代理服务
NVlabs/QeRL,Python,507,52,2025-09-22T22:50:04Z,[ICLR 2026]QeRL enables RL for 32B LLMs on a single H100 GPU.
lvzhaobo/qoder-rules,HTML,506,122,2025-11-10T08:26:49Z,
huggingface/gpt-oss-recipes,Jupyter Notebook,506,53,2025-08-01T12:35:15Z,Collection of scripts and notebooks for OpenAI's latest GPT OSS models
Nutlope/whisper,TypeScript,506,77,2025-07-02T15:31:50Z,Take notes with your voice & transform them with AI
HANCORE-linux/waybar-themes,CSS,506,15,2025-09-06T22:08:06Z,"A collection of Waybar themes inspired by Omarchy, designed to be compatible with various Linux dist"
Flixorui/flixor,Swift,506,17,2025-10-01T02:07:31Z,Modern cross-platform Plex client
yhy0/CHYing-agent,Python,505,48,2025-11-10T06:34:54Z,腾讯云黑客松 - 智能渗透挑战赛 第一届Top9
vercel/v0-sdk,TypeScript,505,102,2025-07-16T21:08:27Z,SDK for the v0 Platform API
levnikolaevich/claude-code-skills,JavaScript,505,72,2025-10-24T15:36:01Z,Plugin suite + bundled MCP servers for Claude Code. Full delivery lifecycle: Agile pipeline with mul
Chen-zexi/vllm-cli,Python,505,28,2025-08-14T22:33:18Z,A command-line interface tool for serving LLM using vLLM.
yejy53/Echo-4o,Jupyter Notebook,504,27,2025-08-11T12:14:59Z,Echo-4o: Harnessing Proprietary Models’ Synthetic Images for Improved Image Generation
vrgamegirl19/comfyui-vrgamedevgirl,Python,504,63,2025-07-03T23:19:24Z,"Custom ComfyUI nodes for film grain, color matching, and video enhancement."
shlokkhemani/openpoke,Python,504,113,2025-09-20T20:57:01Z,Open source implementation of Poke
shinpr/claude-code-workflows,JavaScript,504,73,2025-10-10T10:11:27Z,"Production-ready development workflows for Claude Code, powered by specialized AI agents."
Taskosaur/Taskosaur,TypeScript,504,99,2025-07-30T07:23:19Z,Open Source Project Management with Conversational AI Task Execution. Built for teams who want conve
anyup/uView-Pro,Vue,503,49,2025-08-04T08:37:30Z,uView Pro 是为 Vue 3 + TypeScript 的 uni-app 生态量身打造的跨平台 UI 框架。基于 uView 1.8.8 用 TypeScript 重构，提供 80+ 高质量
0xflux/Wyrm,Rust,503,49,2025-09-25T16:41:37Z,The dragon in the dark. A red team post exploitation framework for testing security controls during
tianrun-chen/World-in-Novel-View,Python,502,0,2025-10-17T14:43:19Z,Scaling Novel View Synthesis for Static and Dynamic Scenes
sarim2000/pennywiseai-tracker,Kotlin,502,103,2025-07-18T15:07:31Z,PennyWise automatically reads transaction SMS messages and transforms them    into organized financi
YouMind-OpenLab/awesome-gemini-3-prompts,TypeScript,502,59,2025-11-27T11:07:31Z,"♊ 50+ selected Gemini prompts with images, multilingual support, and instant gallery preview. Open-s"
Tencent-Hunyuan/Hunyuan3D-Part,Python,502,55,2025-09-25T13:14:55Z,Hunyuan 3D Part Segmentation and Generation Pipeline
Sider-ai/hatchify,Python,502,31,2025-11-17T02:01:19Z,
zeitwork/zeitwork,Go,501,26,2025-07-13T12:18:57Z,The fastest way to deploy and scale any application
johnson7788/TrainPPTAgent,Vue,501,93,2025-08-22T01:31:35Z,模版式PPT，可以生成套用模版的PPT
Wood-Q/MokioMind,Python,501,31,2025-11-06T01:45:56Z,三元三小时手敲大模型
TrisenYu/b0gus,Go,501,40,2025-11-13T07:39:07Z,"b0gus, Honeypot Design Using Go"
NVlabs/GraspGen,Python,501,70,2025-07-09T19:14:44Z,Official repo for GraspGen: A Diffusion-based Framework for 6-DOF Grasping
mzazon/cloud-projects,Shell,500,94,2025-08-24T13:39:40Z,"Over 1100 cloud recipes, projects, tutorials, and real-world solutions to gain hands-on experience a"
mattpocock/course-video-manager,TypeScript,500,112,2025-07-24T13:24:35Z,
Sguan-ZhouQing/SguanFOC_Library,C,500,98,2025-10-02T08:31:26Z,SguanFOC为有/无传感器的PMSM电机提供强大的磁场定向控制解决方案。库内集成了基于SVPWM的多种控制模式，支持位置环、速度环、电流环的单环/串级控制...同时针对嵌入式平台优化了数学运算，并
HayatoHongo/EveryonesLLM,Jupyter Notebook,500,82,2025-06-30T05:29:34Z,
ryanfrigo/kalshi-ai-trading-bot,Python,499,177,2025-07-26T18:41:32Z,A toolkit for building AI-automated trading strategies on Kalshi prediction markets.
blazorblueprintui/ui,C#,499,36,2025-11-14T16:33:03Z,"A collection of accessible, headless primitives and beautifully-designed components for Blazor inspi"
OHF-Voice/linux-voice-assistant,Python,499,81,2025-08-06T15:52:37Z,Voice satellite for Home Assistant using the ESPHome protocol
Liansheng-Wang/Super-LIO,C++,499,76,2025-07-10T13:36:08Z,【RA-L 2026】 A Robust and Efficient LiDAR-Inertial Odometry System with a Compact Mapping Strategy.
schollz/e2ecp,JavaScript,498,64,2025-10-27T16:12:44Z,End-to-end encrypted copy file tool
cwyalpha/Word-Formatter-Pro,Python,498,54,2025-10-22T07:55:54Z,一款桌面应用程序，可将格式混乱的 Word 文档（及兼容格式）一键转换为符合规范的专业文档，实现排版工作自动化。
TeleAI-UAGI/Awesome-Agent-Memory,Python,498,54,2025-10-30T01:29:54Z,"Curated systems, benchmarks, and papers etc. on memory for LLMs/MLLMs --- long-term context, retriev"
LNH-team/dspico,Sin especificar,498,15,2025-11-23T13:22:56Z,Documentation repository for the DSpico flashcard
CaptainCrouton89/.claude,JavaScript,498,67,2025-09-07T06:20:42Z,
tuannvm/codex-mcp-server,TypeScript,497,71,2025-08-18T03:39:12Z,MCP server wrapper for OpenAI Codex CLI that enables Claude Code to leverage Codex's AI capabilities
multikernel/kernelscript,OCaml,497,23,2025-07-14T04:08:28Z,"KernelScript is a modern, type-safe, domain-specific programming language for eBPF-centric kernel cu"
aws/bedrock-agentcore-starter-toolkit,Python,497,149,2025-07-12T06:50:22Z,"Python CLI toolkit for Amazon Bedrock AgentCore (legacy). For new projects, use the AgentCore CLI: h"
qodo-ai/open-aware,Sin especificar,496,42,2025-07-16T09:31:32Z,Aware - Deep Code Research Agent for Complex Codebase & Knowledge that “Act As Your Agentic Principa
ika-rwth-aachen/ros2-depth-anything-v3-trt,C++,496,58,2025-11-28T18:56:58Z,ROS2 TensorRT Node for Monocular Metric Depth estimation and Point Cloud generation from camera imag
AIR-hl/llm-interview-code,Jupyter Notebook,496,18,2025-08-17T08:52:45Z,LLM面试常见手撕合集
km-clay/nixos-wizard,Rust,495,9,2025-08-08T00:05:52Z,A TUI installer for NixOS
giovi321/ios-backup-machine,Python,495,26,2025-10-16T20:47:57Z,"Offline, portable and automatic iPhone backup system"
InternRobotics/MeshCoder,Jupyter Notebook,495,28,2025-08-05T03:02:13Z,
weibeifen/wxbackup,Sin especificar,494,23,2025-11-17T07:22:34Z,微备份是一款面向NAS的微信备份/恢复工具(付费)，支持鸿蒙/苹果/安卓微信数据备份至NAS，亦可从NAS恢复至鸿蒙/苹果/安卓微信，实现长期保存与随时查看数据。支持全量/增量备份、全量/部分恢复。❶
vishakhasadhwani/60DaysToCloud,Sin especificar,494,273,2025-11-12T21:30:44Z,
safak/e-commerce-ui,TypeScript,494,578,2025-07-31T15:29:50Z,
quant-king299/EasyXT,Python,494,172,2025-09-12T14:19:23Z,EasyXT是基于miniqmt中xtquant的二次开发封装库，旨在简化xtquant的使用，提供更友好的API接口。通过统一的接口设计、智能参数处理和完善的错误处理，让量化交易开发变得更加简单高效
plutonhq/pluton,TypeScript,494,11,2025-11-19T04:00:15Z,"A modern, self-hosted backup solution for secure, encrypted backups across local and cloud storage."
Nikita-Filonov/ai-review,Python,494,86,2025-09-10T19:18:07Z,"🚀 AI-powered code review tool for GitHub, GitLab, Bitbucket Cloud, Bitbucket Server, Azure DevOps an"
st-lzh/Wuhr-AI-ops,TypeScript,493,72,2025-07-04T03:27:49Z,智能化运维管理平台 ---通过自然语言管理你的Linux服务器和K8s集群
fcavallarin/wirebrowser,JavaScript,493,15,2025-10-12T10:02:49Z,"Wirebrowser is a CDP-based runtime instrumentation platform for the browser. Think Frida, but for Ja"
eunomia-bpf/agentsight,C,493,68,2025-07-07T21:16:41Z,System-level AI agent profling/tracing tool and skills in eBPF
armel/uv-k1-k5v3-firmware-custom,C,493,116,2025-10-26T17:51:50Z,This is a fork of F4HWN firmware https://github.com/armel/uv-k5-firmware-custom by @muzkr and @armel
Pringled/pyversity,Python,493,27,2025-10-08T14:07:43Z,Fast Diversification for Search & Retrieval
ShilohEye/bitchat-terminal,Rust,492,55,2025-07-14T01:44:12Z,"bluetooth mesh chat, IRC vibes"
wildminder/ComfyUI-VoxCPM,Python,491,48,2025-09-17T22:40:11Z,ComfyUI node for highly expressive speech and realistic zero-shot voice cloning
meituan-longcat/LongCat-Flash-Omni,Python,491,33,2025-10-24T12:33:35Z,"This is the official repo for the paper ""LongCat-Flash-Omni Technical Report"""
cashew-olddew/Universal-Transition-Shader,GDShader,491,35,2025-07-02T16:09:04Z,Most common transitions inside one Godot shader. 🎬
Piebald-AI/claude-code-lsps,JavaScript,491,59,2025-11-05T01:33:39Z,Claude Code Plugin Marketplace with LSP servers
tikel1/HA-isometric-animated-picture-card,JavaScript,490,12,2025-07-04T15:51:31Z,Custom Lovelace cards that let Home-Assistant picture-elements play WebM (or PNG) animations whose f
patrickjaja/claude-desktop-bin,Nim,490,29,2025-09-16T11:19:05Z,Unofficial Linux packages for Claude Desktop AI assistant with automated updates.
bgauryy/open-docs,Sin especificar,490,54,2025-10-17T18:18:54Z,This repository contains documentation created to better understand the open project
wandb/catnip,Go,489,41,2025-07-09T22:56:17Z,"Like catnip, a highly addictive agentic coding tool"
raghavpillai/branchlet,TypeScript,489,24,2025-08-20T21:52:26Z,Branchlet: A simple CLI Git worktree manager
neKamita/ToolBox-Activator,PowerShell,489,103,2025-08-20T17:38:13Z,
malhashemi/opencode-skills,TypeScript,489,30,2025-10-18T01:13:35Z,
computer-vision-with-marco/yolo-training-template,Python,489,70,2025-10-15T14:47:47Z,In this repo there are some tips and a template to train your YOLO model for any kind of computer vi
NVIDIA/tilus,Python,489,26,2025-08-01T18:56:09Z,Tilus is a tile-level kernel programming language with explicit control over shared memory and regis
Ali-Hussein-dev/formcn,TypeScript,489,49,2025-08-01T13:38:48Z,Build production-ready forms with a few clicks
Accenture/mcp-bench,Python,489,62,2025-08-27T07:00:10Z,MCP-Bench: Benchmarking Tool-Using LLM Agents with Complex Real-World Tasks via MCP Servers
vvb2060/Ims,Java,487,63,2025-10-12T13:31:19Z,
tis24dev/proxsave,Go,487,73,2025-07-08T07:35:36Z,Backup tool for Proxmox  PBS & PVE System Files with advanced features and notifications
nadimtuhin/claude-token-optimizer,JavaScript,487,57,2025-11-10T20:10:25Z,Optimize token usage for Claude API calls
little-book-of/c,TeX,487,21,2025-09-06T11:31:28Z,"A concise, structured guide to the C programming language."
lidangzzz/AI-Coding-Style-Guides,JavaScript,487,55,2025-07-06T09:34:05Z,A set of coding style guidelines for Vibe Coding or SWE-Agents that maximize efficiency and improve
erans/hyprmon,Go,487,10,2025-08-12T17:37:33Z,"TUI monitor configuration tool for Hyprland with visual layout, drag-and-drop, and profile managemen"
LegNeato/rust-gpu-chimera,Rust,487,14,2025-07-23T22:22:31Z,Demo project showing a single Rust codebase running on CPU and directly on GPUs
obsidianmd/obsidian-maps,TypeScript,486,41,2025-09-24T16:25:10Z,Map layout for Obsidian Bases. Display your notes as an interactive map view.
micytao/vllm-playground,JavaScript,486,64,2025-11-01T22:49:25Z,A modern web interface for managing and interacting with vLLM servers (www.github.com/vllm-project/v
iuliaturc/gguf-docs,Sin especificar,486,36,2025-07-14T06:25:18Z,Docs for GGUF quantization (unofficial)
cpystan/SD-VLM,Python,486,5,2025-08-22T05:56:31Z,[NeurIPS 2025]《SD-VLM: Spatial Measuring and Understanding with Depth-encoded Vision Language Models
NVlabs/vla0,Python,486,31,2025-10-14T16:06:29Z,VLA-0: Building State-of-the-Art VLAs with Zero Modification
Jeremiznoo/FlipperDroid,Kotlin,486,33,2025-07-10T09:38:31Z,FlipperDroid is a Kotlin-based Android app that turns your smartphone into a powerful mobile cyberse
vibesurf-ai/VibeSurf,Python,485,54,2025-08-31T04:59:33Z,A powerful browser assistant for vibe surfing 一个开源的AI浏览器智能助手
flqcsvqqvw/InstantSfM,Python,485,33,2025-09-23T08:04:33Z,"Official code for paper ""InstantSfM: Towards GPU-Native SfM for the Deep Learning Era"""
aw31/openai-imo-2025-proofs,Sin especificar,485,26,2025-07-18T12:21:29Z,
OwnGoalStudio/TrollVNC,C,485,478,2025-08-25T08:46:32Z,"VNC server for iOS devices, allowing remote access and control of the device’s screen."
zhao-kun/VibeVoiceFusion,Python,484,61,2025-09-26T01:16:15Z,"VibeVoiceFusion is a full-stack, multi-speaker voice generation web system featuring LoRA fine-tunin"
theNetworkChuck/dark-web-scraping-guide,Sin especificar,484,104,2025-11-17T18:02:58Z,"Comprehensive guide for NetworkChuck Episode 480 - Robin AI Dark Web Scraping Tool. Installation, us"
terminal-42s/42_examshell,Shell,484,92,2025-09-21T11:32:09Z,42_examshell – Updated with New Subject Support  A practice exam shell for 42 school students to sim
gotempsh/temps,Rust,484,27,2025-10-21T10:30:44Z,Own your PaaS
devinli123/MV-SAM3D,Python,484,44,2025-11-27T21:17:03Z,SAM 3D Objects with Multi-view Images
csdeshang/DSPlatform-open,PHP,484,7,2025-10-22T09:01:46Z,DSPlatform系统是一个集成的解决方案，基于Thinkphp8 + Vue3 + Element Plus + Uniapp 开发，系统支持多种商业模式，包括传统商城购物、外卖配送、上门服务、上
FareedKhan-dev/complex-RAG-guide,Jupyter Notebook,484,134,2025-07-01T04:17:37Z,A step by step implementation of a complex RAG pipeline to solve real world situations
songtianlun/awesome-prompts,HTML,483,44,2025-09-02T02:43:41Z,"Awesome Prompts, Nano Banana, Nano Banana Pro, Sora2, GPT-4o, gpt-image-1"
fbsamples/whatsapp-business-jaspers-market,JavaScript,483,352,2025-10-28T19:37:50Z,Sample Whatsapp App - Jasper's Market
cyberpandino/cluster,TypeScript,483,45,2025-11-16T20:26:38Z,Cyberpandino cluster
anthropics/life-sciences,Python,483,94,2025-10-17T22:43:38Z,Repo for the Claude Code Marketplace to use with the Claude for Life Sciences Launch. This will cont
JiayuXu0/FastAPI-Template,Python,483,73,2025-07-13T04:15:02Z,A production-ready FastAPI backend template with clean architecture. 一个功能完整、架构清晰的企业级FastAPI后端模板，专为团队
yangzhou24/OmniWorld,Python,482,8,2025-09-15T13:11:18Z,[ICLR 2026] OmniWorld: A Multi-Domain and Multi-Modal Dataset for 4D World Modeling
staruhub/ClaudeSkills,Python,482,84,2025-10-31T08:59:13Z,Some sharing on Claude Skills
ssj9596/One-to-All-Animation,Python,482,45,2025-11-28T04:44:18Z,[CVPR 2026 Poster] One-to-All Animation: Alignment-Free Character Animation and Image Pose Transfer
kkkunny/bilitv,Dart,482,15,2025-10-25T10:48:26Z,由flutter实现的TV版哔哩哔哩，类似于bbll和bilibilitv。
ZyphrZero/z.ai2api_python,Python,482,176,2025-09-02T03:06:30Z,仅供学习
vchandu111/python-for-genai,Sin especificar,481,116,2025-11-22T01:20:17Z,"A fast, structured Python foundation designed specifically for GenAI learners. This repository provi"
louislam/its-mytabs,Vue,481,37,2025-09-30T05:52:12Z,"Open source, web based, self hostable guitar/bass tab (tablature) viewer and player, similar to Song"
generative-computing/mellea,Python,481,128,2025-07-31T14:37:32Z,Mellea is a library for writing generative programs.
adrianhajdin/signalist_stock-tracker-app,TypeScript,481,181,2025-08-28T07:35:17Z,"Stock Market app built with Next.js, Shadcn, Better Auth, and Inngest. Track prices, set alerts, exp"
Shredded-Pork/TempFlow-GRPO,Python,481,25,2025-08-05T07:28:24Z,"[ICLR 26] TempFlow-GRPO (Temporal Flow GRPO), a principled GRPO framework that captures and exploits"
vixcpp/vix,CMake,480,34,2025-10-02T15:26:13Z,A modern C++ runtime for building fast and reliable applications.
mogenius/renovate-operator,Go,480,44,2025-09-10T10:34:47Z,Operator to streamline renovate executions in Kubernetes
is-a-software/is-a-software,JavaScript,480,115,2025-08-18T17:43:28Z,Free .is-a.software subdomain for developers
hritwikjohri/Void-for-jellyfin,Kotlin,480,12,2025-08-17T18:35:09Z,
automataIA/graphrag-rs,Rust,480,42,2025-09-21T19:03:13Z,"GraphRAG-rs is a high-performance, state-of-the-art Rust implementation of GraphRAG (Graph-based Ret"
SnapHutaoRemasteringProject/Snap.Hutao.Remastered,C#,480,25,2025-11-22T06:10:04Z,实用的开源多功能原神工具箱 🧰 / Multifunctional Open-source Genshin Impact Toolkit 🧰
KuekHaoYang/AI-Prompt-Protocols,CSS,480,55,2025-07-06T15:07:30Z,"A universal system prompt designed to compel Large Language Models to engage in profound, exhaustive"
AfalpHy/sylvakru,Dart,480,45,2025-09-05T02:29:42Z,"A cross-platform music player for local and self-hosted libraries, built with Flutter"
AdamBankz/kick-viewbot,Python,480,24,2025-10-01T09:23:24Z,A python script utilising WebSockets to artificially increase a stream's viewer count on Kick.
martin-rizzo/AmazingZImageWorkflow,Python,479,36,2025-11-30T13:52:49Z,Z-Image workflow with predefined styles for high-quality image generation and a user-friendly experi
dodopayments/billingsdk,TypeScript,479,147,2025-08-08T14:20:56Z,Modern Billing & Monetization UI Components Library
bahattinkoc/ipaverse,Swift,479,26,2025-08-05T22:10:54Z,"Native macOS workbench to download, inspect, archive, re-sign, and install iOS App Store IPAs."
avibe-bot/avibe,Python,479,68,2025-08-09T14:04:57Z,The local-first Agent OS — your AI partner lives on your own machine. Drive the official Claude Code
ant-intl/Falcon-TST,Python,479,16,2025-10-13T05:49:05Z,Official implementation of Falcon-TST
sxhxliang/agent-studio,Rust,478,47,2025-11-24T18:15:44Z,"AgentX is a GPU-accelerated, cross-platform desktop application that brings AI agents to your workfl"
Piebald-AI/awesome-gemini-cli,Sin especificar,478,75,2025-07-30T16:01:03Z,"A curated list of awesome tools, extensions, and resources for Gemini CLI."
GZWSAMA/OnePoseviaGen,Python,478,29,2025-07-16T09:15:42Z,"[CORL 2025 Oral]One View, Many Worlds: Single-Image to 3D Object Meets Generative Domain Randomizati"
raulcastillabravo/mistlock,Python,477,84,2025-11-10T09:10:54Z,"Catalog of Cloud dev environments. No accounts, local-first and compatible with AWS, Azure and GCP."
enactic/openarm_hardware,Ruby,477,99,2025-07-16T04:51:46Z,OpenArm CAD data and information for manufacturing
khanhduytran0/MacWSBootingGuide,Objective-C,476,21,2025-08-05T10:55:46Z,Booting macOS's WindowServer on your jailbroken iDevice for real
blendi-remade/falcraft,Java,476,38,2025-11-09T22:05:16Z,"3D structure generation in Minecraft, powered by fal.ai"
Tsinghua-MARS-Lab/SLAM-Former,Python,476,9,2025-09-23T02:13:59Z,[ECCV 2026] SLAM-Former: Putting SLAM into One Transformer
TeleHuman/TextOp,Python,476,42,2025-11-12T06:36:25Z,TextOp: Real-time Interactive Text-Driven Humanoid Robot Motion Generation and Control
TanStack/devtools,TypeScript,476,91,2025-07-25T20:33:15Z,🤖 Framework-agnostic devtools panel for handling TanStack libraries devtools and your custom devtool
NiuTrans/LaTeXTrans,TeX,476,47,2025-09-04T05:07:26Z,"A tool for translating the content of LaTeX documents into various other natural languages (e.g., tr"
maodeyu180/mao_nav,Vue,475,290,2025-07-14T10:05:21Z,极简导航站
asxez/MusicBox,TypeScript,475,31,2025-07-28T09:43:37Z,一款高颜值、插件化、可深度定制的本地音乐播放器，支持Windows、MacOS、Linux系统
SafeRL-Lab/agentic-web,Sin especificar,475,43,2025-07-11T03:39:52Z,Agentic Web: Weaving the Next Web with AI Agents.
doclang-project/doclang,Python,474,43,2025-08-19T12:20:47Z,DocLang spec and reference toolkit
dmcke5/DIY_VR,C++,474,30,2025-09-18T19:59:14Z,A fully 3D printed VR Headset with head tracking and adjustable IPD!
dannysmith/astro-editor,TypeScript,474,23,2025-07-14T05:40:50Z,"Astro Editor reads your Zod schemas and transforms frontmatter into smart forms. Get validation, pro"
cmliu/CF-Workers-BPSUB,JavaScript,474,492,2025-09-09T04:42:47Z,Snipaste 节点订阅生成器
apache/sedona-db,Rust,474,57,2025-08-25T00:08:50Z,A single-node analytical database engine with geospatial as a first-class citizen
LongQT-sea/intel-igpu-passthru,Shell,474,47,2025-09-26T13:09:42Z,Intel GVT-d – iGPU passthrough done right (Proxmox / QEMU / KVM)
vicharak-in/shrike,Verilog,473,76,2025-10-02T05:56:08Z,"Low cost microcontroller + FPGA board for makers , hobbyist and student for endless possibility."
inclusionAI/dInfer,Python,473,45,2025-09-29T08:07:23Z,dInfer: An Efficient Inference Framework for Diffusion Language Models
QwenLM/Qwen3Guard,Python,473,32,2025-09-23T08:13:20Z,Qwen3Guard is a multilingual guardrail model series developed by the Qwen team at Alibaba Cloud.
Anttwo/MILo,Python,473,43,2025-09-07T22:25:36Z,[SIGGRAPH Asia 2025 - TOG] Official implementation of MILo: Mesh-In-the-Loop Gaussian Splatting for
timmyy123/LLM-Hub,Kotlin,472,101,2025-07-08T09:40:31Z,Local AI Assistant on your phone
microsoft/langchain-for-beginners,Python,472,153,2025-10-16T17:59:18Z,LangChain for Beginners Course
chinrain/Api-Conversion,Python,472,100,2025-07-27T08:34:26Z,
TangSY/edge-next-starter,TypeScript,472,102,2025-10-26T03:09:36Z,"An out‑of‑the‑box Next.js + Cloudflare full‑stack starter integrating Edge Runtime, D1 database, R2"
lone-cloud/gerbil,TypeScript,471,43,2025-08-12T01:32:06Z,A desktop app for running Large Language Models locally.
JustLookAtNow/pt_mate,Dart,471,32,2025-08-29T02:02:28Z,基于 Flutter（Material Design 3）开发的私有种子站点客户端，支持多种PT站点的种子浏览、搜索和下载管理。目前支持M-Team和NexusPHP类型的站点。
treadiehq/gpu-kill,Rust,470,10,2025-09-18T17:21:38Z,"Manage your GPUs across NVIDIA, AMD, Intel, and Apple Silicon systems."
rustmailer/rustmailer,Rust,470,33,2025-07-17T14:47:29Z,"A self-hosted Email Middleware for IMAP, SMTP, Gmail API, Graph API — built for developers"
rasta-mouse/Crystal-Kit,C,470,60,2025-10-12T18:44:10Z,Evasion kit for Cobalt Strike
nullbyte-lab/wechat-multi-open,Shell,470,47,2025-10-23T16:07:28Z,macOS 微信多开终极解决方案 - 交互式管理工具
langchain-ai/deepagents-quickstarts,Jupyter Notebook,470,125,2025-11-13T17:56:50Z,REPO MOVED
denful/den,Nix,470,44,2025-10-23T02:56:00Z,"Aspect-oriented, context-driven Nix configurations."
CodingWithLewis/ReceiptPrinterAgent,Python,470,72,2025-08-01T14:23:51Z,From my video: I Fixed my ADHD with a Receipt Printer
kagent-dev/kmcp,Go,469,65,2025-07-02T13:17:25Z,"CLI tool and Kubernetes Controller for building, testing and deploying MCP servers"
adoptai/zapi,Python,469,23,2025-10-27T17:08:39Z,ZAPI by Adopt AI is an open-source Python library that helps you build tools for AI Agents by automa
Shim06/Anemoia-ESP32,C++,469,57,2025-08-30T03:43:41Z,A performant NES emulator for the ESP32
taylorsatula/mira-OSS,Python,468,43,2025-10-18T21:46:43Z,"This is the public release of MIRA OS. Discrete memories decay through momentum loss, tools auto-con"
switchangel/strudel-scripts,JavaScript,468,60,2025-09-30T03:31:41Z,my custom strudel scripts that haven't made it in to strudel for whatever reason
rshankras/claude-code-apple-skills,Swift,468,38,2025-10-29T10:30:07Z,"Claude Code skills for Apple platform development (iOS, macOS, iPadOS) — product validation, code ge"
roigoatzzz/Wallsync,Sin especificar,468,5,2025-07-05T00:58:38Z,A place where all wallpapers can be found .... magic!!!
lifeafter619/Aboard,JavaScript,468,16,2025-10-31T14:53:06Z,一个简约的web白板，更适合老师体质 | Just a board.
josix/awesome-claude-md,Python,468,51,2025-07-14T08:31:32Z,Curated collection of exemplary claude.md files and onboarding patterns from public GitHub projects.
gobii-ai/gobii-platform,Python,468,79,2025-08-30T13:28:37Z,"Your easy to use, always-on AI workforce 👾"
cainiaopppppppp/MeshKit,TypeScript,468,107,2025-11-07T04:16:30Z,去中心化工具包
Younghusband/huawei-od-active-manage,Sin especificar,468,313,2025-06-30T11:32:49Z,华为式主动管理
badlogic/cchistory,TypeScript,467,36,2025-08-02T18:29:53Z,Extract and compare system prompts and tools from different Claude Code versions
