repo_name,language,stars,forks,created_at,description
openclaw/openclaw,TypeScript,381054,79816,2025-11-24T10:16:47Z,Your own personal AI assistant. Any OS. Any Platform. The lobster way. 🦞
obra/superpowers,Shell,241687,21456,2025-10-09T19:45:18Z,An agentic skills framework & software development methodology that works.
NousResearch/hermes-agent,Python,205865,37191,2025-07-22T22:22:28Z,The agent that grows with you
anthropics/skills,Python,156724,18455,2025-09-22T15:53:31Z,Public repository for Agent Skills
msitarzewski/agency-agents,Shell,119250,19523,2025-10-13T12:12:29Z,"A complete AI agency at your fingertips - From frontend wizards to Reddit community ninjas, from whi"
github/spec-kit,Python,116467,10290,2025-08-21T22:54:31Z,💫 Toolkit to help you get started with Spec-Driven Development
farion1231/cc-switch,Rust,110818,7328,2025-08-04T14:16:16Z,"A cross-platform desktop All-in-One assistant for Claude Code, Codex, OpenCode, OpenClaw, Gemini CLI"
nextlevelbuilder/ui-ux-pro-max-skill,Python,98167,10340,2025-11-30T11:36:31Z,An AI SKILL that provide design intelligence for building professional UI/UX multiple platforms
thedotmack/claude-mem,JavaScript,85101,7346,2025-08-31T20:50:03Z,Persistent Context Across Sessions for Every Agent –  Captures everything your agent does during ses
666ghj/MiroFish,Python,67520,10529,2025-11-26T04:23:02Z,"A Simple and Universal Swarm Intelligence Engine, Predicting Anything. 简洁通用的群体智能引擎，预测万物"
earendil-works/pi,TypeScript,66571,8130,2025-08-09T14:03:50Z,"AI agent toolkit: unified LLM API, agent loop, TUI, coding agent CLI"
ComposioHQ/awesome-claude-skills,Python,66350,7377,2025-10-17T07:15:01Z,"A curated list of awesome Claude Skills, resources, and tools for customizing Claude AI workflows"
datawhalechina/hello-agents,Python,62760,7761,2025-09-07T09:50:24Z,📚 《从零开始构建智能体》——从零开始的智能体原理与实践教程
shanraisshan/claude-code-best-practice,HTML,61591,6161,2025-10-31T14:15:28Z,from vibe coding to agentic engineering - practice makes claude perfect
Fission-AI/OpenSpec,TypeScript,57771,4026,2025-08-05T10:37:45Z,Spec-driven development (SDD) for AI coding assistants.
tw93/Mole,Shell,57499,2025,2025-09-23T06:38:40Z,"🐹 Clean, uninstall, analyze, optimize, and monitor your Mac from the terminal."
karpathy/nanochat,Python,55614,7653,2025-10-13T13:46:35Z,The best ChatGPT that $100 can buy.
microsoft/VibeVoice,Python,49755,5556,2025-08-25T13:24:01Z,Open-Source Frontier Voice AI
KeygraphHQ/shannon,TypeScript,45273,5250,2025-09-27T01:51:47Z,"Shannon is an autonomous, white-box AI pentester for web applications and APIs. It analyzes your sou"
ChromeDevTools/chrome-devtools-mcp,TypeScript,44722,2901,2025-09-11T10:39:55Z,Chrome DevTools for coding agents
abhigyanpatwari/GitNexus,TypeScript,43266,4839,2025-08-02T23:20:31Z,GitNexus: The Zero-Server Code Intelligence Engine -       GitNexus is a client-side knowledge graph
pbakaus/impeccable,JavaScript,42316,2355,2025-11-16T01:52:04Z,The design language that makes your AI harness better at design.
siddharthvaddem/openscreen,TypeScript,39029,2822,2025-10-10T05:36:55Z,"Create stunning demos for free. Open-source, no subscriptions, no watermarks, and free for commercia"
luongnv89/claude-howto,Python,38926,4688,2025-11-07T22:59:34Z,"A visual, example-driven guide to Claude Code — from basic concepts to advanced agents, with copy-pa"
router-for-me/CLIProxyAPI,Go,38718,6403,2025-07-01T19:43:27Z,"Wrap Antigravity, ChatGPT Codex, Claude Code, Grok Build as an OpenAI/Gemini/Claude/Codex compatible"
wshobson/agents,Python,37340,4013,2025-07-24T23:28:14Z,"Multi-harness agentic plugin marketplace for Claude Code, Codex CLI, Cursor, OpenCode, GitHub Copilo"
google/langextract,Python,36975,2551,2025-07-08T20:46:06Z,A Python library for extracting structured information from unstructured text using LLMs with precis
OpenBMB/VoxCPM,Python,32157,3653,2025-09-16T03:41:49Z,"VoxCPM2: Tokenizer-Free TTS for Multilingual Speech Generation, Creative Voice Design, and True-to-L"
shiyu-coder/Kronos,Python,31588,5419,2025-07-01T02:54:32Z,Kronos: A Foundation Model for the Language of Financial Markets
anthropics/claude-plugins-official,Python,31320,3425,2025-11-20T18:36:20Z,"Official, Anthropic-managed directory of high quality Claude Code Plugins."
lbjlaq/Antigravity-Manager,Rust,29952,3241,2025-11-26T10:47:13Z,Professional Antigravity Account Manager & Switcher. One-click seamless account switching for Antigr
K-Dense-AI/scientific-agent-skills,Python,29620,3021,2025-10-19T20:54:15Z,"Turn any AI agent into an AI Scientist. The #1 Agent Skills library for science, used by 160,000+ sc"
iOfficeAI/AionUi,TypeScript,29074,2896,2025-08-07T10:29:51Z,"Free, local, open-source 24/7 Cowork app for OpenClaw, Hermes Agent, Claude Code, Codex, OpenCode, G"
davila7/claude-code-templates,Python,28363,2960,2025-07-04T01:26:26Z,CLI tool for configuring and monitoring Claude Code
usestrix/strix,Python,27389,3066,2025-08-05T21:28:30Z,Open-source AI penetration testing tool to find and fix your app’s vulnerabilities.
virattt/dexter,TypeScript,27252,3377,2025-10-14T21:02:00Z,An autonomous agent for deep financial research
firecrawl/open-lovable,TypeScript,27234,5218,2025-08-08T13:04:02Z,🔥 Clone and recreate any website as a modern React app in seconds
VoltAgent/awesome-agent-skills,Sin especificar,26869,2876,2025-10-28T08:55:32Z,"A curated collection of 1000+ agent skills from official dev teams and the community, compatible wit"
permissionlesstech/bitchat,Swift,26068,2493,2025-07-04T14:34:38Z,"bluetooth mesh chat, IRC vibes"
p-e-w/heretic,Python,25618,2765,2025-09-21T05:46:16Z,Fully automatic censorship removal for language models
langchain-ai/deepagents,Python,25348,3582,2025-07-27T23:07:53Z,The batteries-included agent harness.
gastownhall/beads,Go,24981,1669,2025-10-12T03:09:46Z,Beads - A memory upgrade for your coding agent
toon-format/toon,TypeScript,24719,1094,2025-10-22T18:17:32Z,"🎒 Token-Oriented Object Notation (TOON) – Compact, human-readable, schema-aware JSON for LLM prompts"
AIDC-AI/Pixelle-Video,Python,23833,3418,2025-11-07T06:34:27Z,🚀 AI 全自动短视频引擎 | AI Fully Automated Short Video Engine
deepseek-ai/DeepSeek-OCR,Python,23476,2159,2025-10-17T06:14:27Z,Contexts Optical Compression
PicoTrex/Awesome-Nano-Banana-images,Sin especificar,23118,2378,2025-08-28T17:03:09Z,"A curated collection of fun and creative examples generated with Nano Banana & Nano Banana Pro🍌, Gem"
openai/skills,Python,23033,1564,2025-11-25T06:25:42Z,Skills Catalog for Codex
agentsmd/agents.md,TypeScript,22624,1669,2025-08-19T17:22:54Z,"AGENTS.md — a simple, open format for guiding coding agents"
VoltAgent/awesome-claude-code-subagents,Shell,22585,2628,2025-07-30T12:31:51Z,A collection of 100+ specialized Claude Code subagents covering a wide range of development use case
slopus/happy,TypeScript,22309,1857,2025-07-18T05:53:18Z,"Mobile and Web client for Codex and Claude Code, with realtime voice, encryption and fully featured"
EveryInc/compound-engineering-plugin,TypeScript,22264,1646,2025-10-09T19:43:46Z,"Official Compound Engineering plugin for Claude Code, Codex, Cursor, and more"
karpathy/llm-council,Python,21787,3988,2025-11-22T23:24:14Z,LLM Council works together to answer your hardest questions
alibaba/page-agent,TypeScript,20653,1773,2025-09-23T09:30:17Z,JavaScript in-page GUI agent. Control web interfaces with natural language.
HKUDS/AI-Trader,Python,20273,3102,2025-10-23T12:45:00Z,"""AI-Trader: 100% Fully-Automated Agent-Native Trading"""
alirezarezvani/claude-skills,Python,19421,2670,2025-10-19T04:04:05Z,"337 Claude Code skills & agent skills & plugins (30+ Agents, 70+ custom commands, 330+ skills, custo"
Nagi-ovo/gemini-voyager,TypeScript,19052,612,2025-10-04T23:42:35Z,"An all-in-one enhancement suite for Google Gemini & AI Studio - timeline navigation, folder manageme"
vectorize-io/hindsight,Python,17787,1081,2025-10-30T11:49:48Z,Hindsight: Agent Memory That  Learns
Tencent/WeKnora,Go,17524,2313,2025-07-22T08:01:23Z,"Open-source LLM knowledge platform: turn raw documents into a queryable RAG, an autonomous reasoning"
pascalorg/editor,TypeScript,17137,2306,2025-10-16T19:35:06Z,Create and share 3D architectural projects.
Wan-Video/Wan2.2,Python,16455,2041,2025-07-28T08:17:01Z,Wan: Open and Advanced Large-Scale Video Generative Models
Snapchat/Valdi,C++,16387,542,2025-11-06T17:33:28Z,Valdi is a cross-platform UI framework that delivers native performance without sacrificing develope
danielmiessler/LifeOS,TypeScript,16186,2228,2025-09-08T16:18:30Z,Agentic AI Infrastructure for magnifying HUMAN capabilities.
kurikomi-labs/komi-store,Kotlin,15898,593,2025-11-21T13:03:23Z,"🩵 A free, open-source app store for developers' releases on GitHub, Codeberg & Forgejo — browse, dis"
a2ui-project/a2ui,TypeScript,15541,1209,2025-09-24T23:14:02Z,
steipete/CodexBar,Swift,15529,1285,2025-11-16T17:00:44Z,"Show usage stats for OpenAI Codex and Claude Code, without having to login."
MemoriLabs/Memori,Python,15501,2758,2025-07-24T07:07:51Z,Memori is agent-native memory infrastructure. A LLM-agnostic layer that turns agent execution and co
Anionex/banana-slides,Python,15085,1753,2025-11-29T17:37:26Z,一个基于nano banana pro🍌的原生AI PPT生成应用，迈向＂Vibe PPT＂; 支持上传任意模板图片，上传任意素材&智能解析，一句话/大纲/页面描述自动生成PPT，口头修改指定区域、一
xpzouying/xiaohongshu-mcp,Go,14429,2151,2025-08-03T09:08:45Z,MCP for xiaohongshu.com
eigent-ai/eigent,TypeScript,14421,1702,2025-07-29T15:56:02Z,Eigent: The Open Source Cowork Desktop to Unlock Your Exceptional Productivity. Local and Free Alter
byJoey/cfnew,Sin especificar,14340,6961,2025-09-06T17:10:05Z,
yusufkaraaslan/Skill_Seekers,Python,14310,1465,2025-10-17T14:43:48Z,"Convert documentation websites, GitHub repositories, and PDFs into Claude AI skills with automatic c"
KittenML/KittenTTS,Python,14180,778,2025-08-05T03:30:24Z,State-of-the-art TTS model under 25MB 😻
NevaMind-AI/memU,Python,13947,1038,2025-07-29T01:54:40Z,"Personal memory for agents - fast memory retrieval, self-evolving skills, and lower cost."
alam00000/bentopdf,JavaScript,13900,1139,2025-10-12T13:30:08Z,The Privacy First PDF Toolkit
travisvn/awesome-claude-skills,Sin especificar,13814,1615,2025-10-16T20:42:39Z,"A curated list of awesome Claude Skills, resources, and tools for customizing Claude AI workflows —"
andrewyng/context-hub,JavaScript,13750,1197,2025-10-30T12:20:34Z,
fish2018/pansou,Go,13689,3278,2025-07-10T07:17:46Z,PanSou是一款高性能的网盘资源搜索API服务，支持TG频道和插件搜索。系统设计以性能和可扩展性为核心，支持多频道多插件并发搜索、结果智能排序和网盘类型分类。docker集成前后端，一键启动，开箱即
Open-Dev-Society/OpenStock,TypeScript,13526,1797,2025-09-28T18:16:32Z,"OpenStock is an open-source alternative to expensive market platforms. Track real-time prices, set p"
coleam00/context-engineering-intro,Python,13506,2706,2025-07-02T11:54:47Z,Context engineering is the new vibe coding - it's the way to actually make AI coding assistants work
supertone-inc/supertonic,Swift,12807,1309,2025-11-18T08:23:58Z,"Lightning-Fast, On-Device, Multilingual TTS — running natively via ONNX."
YouMind-OpenLab/awesome-nano-banana-pro-prompts,TypeScript,12713,1383,2025-11-23T07:17:48Z,"🍌 World's largest Nano Banana Pro prompt library — 10,000+ curated prompts with preview images, 16 l"
Usagi-org/ai-goofish-monitor,Python,12695,1872,2025-07-16T08:13:41Z,基于 Playwright 和AI实现的闲鱼多任务实时/定时监控与智能分析系统，配备了功能完善的后台管理UI。帮助用户从闲鱼海量商品中，找到心仪产品。
sapientinc/HRM,Python,12574,1831,2025-07-09T02:09:32Z,Hierarchical Reasoning Model Official Release
NoFxAiOS/nofx,Go,12487,3007,2025-10-28T07:17:53Z,"Your AI trading terminal assistant for US stocks, commodities, forex, and crypto."
contains-studio/agents,Sin especificar,12396,2528,2025-07-28T14:42:35Z,sharing current agents in use
anomalyco/opentui,TypeScript,12227,628,2025-07-21T09:35:54Z,OpenTUI is a library for building terminal user interfaces (TUIs)
Wei-Shaw/claude-relay-service,JavaScript,12222,1838,2025-07-14T10:11:32Z,CRS-自建Claude Code镜像，一站式开源中转服务，让 Claude、OpenAI、Gemini、Droid 订阅统一接入，支持拼车共享，更高效分摊成本，原生工具无缝使用。
superset-sh/superset,TypeScript,12176,1048,2025-10-21T09:16:51Z,"Code Editor for the AI Agents Era - Run an army of Claude Code, Codex, etc. on your machine"
InsForge/InsForge,TypeScript,12010,1033,2025-07-29T05:56:00Z,"The all-in-one, open-source backend platform for agentic coding. InsForge gives your coding agent da"
jd-opensource/joyagent-jdgenie,Java,11885,1636,2025-07-16T02:59:53Z,开源的端到端产品级通用智能体
Tongyi-MAI/Z-Image,Python,11659,795,2025-11-26T09:18:10Z,
HW-whistleblower/True-Story-of-Pangu,Sin especificar,11547,1310,2025-07-05T20:40:24Z,诺亚盘古大模型研发背后的真正的心酸与黑暗的故事。
Piebald-AI/claude-code-system-prompts,JavaScript,11478,1972,2025-11-18T21:26:33Z,"All parts of Claude Code's system prompt, 27 builtin tool descriptions, sub agent prompts (Plan/Expl"
ace-step/ACE-Step-1.5,Python,11379,1382,2025-09-04T02:00:07Z,"The most powerful local music generation model that outperforms almost all commercial alternatives,"
datalab-to/chandra,Python,11371,1164,2025-10-08T21:34:16Z,"OCR model that handles complex tables, forms, handwriting with full layout."
sirmalloc/ccstatusline,TypeScript,11298,491,2025-08-08T11:19:28Z,"🚀 Beautiful highly customizable statusline for Claude Code CLI with powerline support, themes, and m"
QuipNetwork/hashsigs-py,Python,11224,26,2025-08-27T17:25:50Z,
ValueCell-ai/valuecell,Python,10881,1805,2025-09-01T09:07:06Z,"ValueCell is a community-driven, multi-agent platform for financial applications."
MoonshotAI/Kimi-K2,Sin especificar,10879,866,2025-07-03T12:28:22Z,Kimi K2 is the large language model series developed by Moonshot AI team
facebookresearch/dinov3,Jupyter Notebook,10781,886,2025-08-07T14:11:34Z,Reference PyTorch implementation and models for DINOv3
facebookresearch/sam3,Python,10749,1621,2025-07-17T16:15:40Z,The repository provides code for running inference and finetuning with the Meta Segment Anything Mod
huggingface/skills,Python,10746,708,2025-11-24T07:31:48Z,Give your agents the power of the Hugging Face ecosystem
huggingface/ml-intern,Python,10559,1131,2025-10-30T13:43:09Z,"🤗 ml-intern: an open-source ML engineer that reads papers, trains models, and ships ML models"
numman-ali/openskills,TypeScript,10519,664,2025-10-26T19:43:54Z,Universal skills loader for AI coding agents - npm i -g openskills
RunanywhereAI/runanywhere-sdks,C++,10309,359,2025-07-22T01:23:34Z,Production ready toolkit to run AI locally
Jeffallan/claude-skills,Python,10309,899,2025-10-20T20:27:22Z,66 Specialized Skills for Full-Stack Developers. Transform Claude Code into your expert pair program
Orchestra-Research/AI-Research-SKILLs,TeX,10234,765,2025-11-03T06:13:06Z,Comprehensive open-source library of AI research and engineering skills for any AI model. Package th
ZeroLu/awesome-nanobanana-pro,Sin especificar,10131,856,2025-11-10T13:51:03Z,🚀 An awesome list of curated Nano Banana pro prompts and examples. Your go-to resource for mastering
0x4m4/hexstrike-ai,Python,10038,2129,2025-07-10T17:53:18Z,"HexStrike AI MCP Agents is an advanced MCP server that lets AI agents (Claude, GPT, Copilot, etc.) a"
MemTensor/MemOS,TypeScript,10034,912,2025-07-06T09:51:27Z,"Self-evolving memory OS for LLM & AI Agents: ultra-persistent memory, hybrid-retrieval, and cross-ta"
EverMind-AI/EverOS,Python,9788,824,2025-10-28T15:09:32Z,"One portable memory layer for every AI agent: local-first, Markdown-native, user-owned, and self-evo"
diet103/claude-code-infrastructure-showcase,Shell,9727,1216,2025-10-30T03:12:16Z,"Examples of my Claude Code infrastructure with skill auto-activation, hooks, and agents"
BehiSecc/awesome-claude-skills,Sin especificar,9664,1277,2025-10-17T15:05:35Z,A curated list of Claude Skills.
nexmoe/VidBee,TypeScript,9651,742,2025-10-22T13:43:42Z,Download videos from almost any website worldwide
getpaseo/paseo,TypeScript,9500,904,2025-10-13T12:27:02Z,Orchestrate multiple coding agents from desktop and mobile
frankbria/ralph-claude-code,Shell,9490,725,2025-08-27T16:03:45Z,Autonomous AI development loop for Claude Code with intelligent exit detection
dmtrKovalenko/fff,Rust,9378,361,2025-07-31T22:01:49Z,"The fastest and the most accurate file search SDK for AI agents, Neovim, Rust, C,  Python, Bun and N"
MoonshotAI/kimi-cli,Python,9112,1134,2025-10-15T12:58:03Z,Kimi Code CLI is your next CLI agent.
KrishKrosh/TrackWeight,Swift,9038,391,2025-07-21T05:55:02Z,Use your Mac trackpad as a weighing scale
ykdojo/claude-code-tips,HTML,8969,687,2025-11-28T00:52:00Z,"40+ tips for getting the most out of Claude Code, from basics to advanced - includes a custom status"
rednote-hilab/dots.ocr,Python,8968,802,2025-07-30T11:03:59Z,Multilingual Document Layout Parsing in a Single Vision-Language Model
MoonTechLab/LunaTV,TypeScript,8968,8723,2025-08-12T13:59:33Z,本项目采用 CC BY-NC-SA 协议，禁止任何商业化行为，任何衍生项目必须保留本项目地址并以相同协议开源
we-promise/sure,Ruby,8823,204,2025-07-23T04:13:55Z,The personal finance app for everyone (by everyone)
francescopace/espectre,Python,8723,662,2025-10-26T10:41:51Z,"🛜 ESPectre 👻  - Motion detection system based on Wi-Fi spectre analysis (CSI), with Home Assistant i"
iflytek/astron-agent,Java,8584,857,2025-09-19T08:46:01Z,"Enterprise-grade, commercial-friendly agentic workflow platform for building next-generation SuperAg"
microsoft/TRELLIS.2,Python,8534,1050,2025-11-26T10:04:35Z,Native and Compact Structured Latents for 3D Generation
awesome-opencode/awesome-opencode,JavaScript,8458,603,2025-09-22T00:01:14Z,"A curated list of awesome plugins, themes, agents, projects, and resources for https://opencode.ai"
tonyantony300/alt-sendme,TypeScript,8372,523,2025-10-17T09:08:25Z,"Send files and folders anywhere in the world without storing in cloud - any size, any format, no acc"
justlovemaki/AIClient2API,JavaScript,8342,1326,2025-07-20T07:05:56Z,"Simulates Gemini CLI, Antigravity, Codex, Grok, and Kiro client requests, compatible with the OpenAI"
MiroMindAI/MiroThinker,Python,8323,644,2025-08-07T13:32:12Z,MiroThinker is a deep research agent optimized for complex research and prediction tasks. Our latest
boson-ai/higgs-audio,Python,8251,639,2025-07-20T05:25:27Z,Text-audio foundation model from Boson AI
automazeio/ccpm,Shell,8234,832,2025-08-18T23:20:08Z,Project management skill system for Agents that uses GitHub Issues and Git worktrees for parallel ag
vicinaehq/vicinae,C++,8197,227,2025-07-28T03:49:03Z,"A focused launcher for your desktop - native, fast, extensible"
noctalia-dev/noctalia,C++,8183,572,2025-07-11T10:50:50Z,A sleek and minimal desktop shell thoughtfully crafted for Wayland.
QwenLM/Qwen-Image,Python,8066,507,2025-08-03T11:03:25Z,Qwen-Image is a powerful image generation foundation model capable of complex text rendering and pre
mmulet/term.everything,Go,8023,192,2025-09-07T02:52:48Z,Run any GUI app in the terminal❗
ZyperWave/ZyperWinOptimize,C#,7990,460,2025-08-05T01:46:41Z,ZyperWin++是一个轻便的Windows优化工具，适用于Win7-Win11最新版的优化，包括性能优化、服务项优化、垃圾清理等操作，还支持系统激活和Office快速安装。
GetStream/Vision-Agents,Python,7956,662,2025-08-11T18:02:04Z,Open Vision Agents by Stream. Build voice and vision agents quickly with any model or video provider
pickle-com/glass,JavaScript,7547,1107,2025-07-02T20:28:49Z,Digital Mind Extension
LuckyOne7777/LLM-Trading-Lab,Python,7473,1564,2025-07-10T01:57:36Z,This repo powers my experiment where ChatGPT manages a real-money micro-cap stock portfolio.
aidenybai/react-grab,TypeScript,7359,333,2025-10-17T10:08:55Z,Copy any UI element for your agent
igareck/vpn-configs-for-russia,Sin especificar,7300,361,2025-11-13T15:10:23Z,"🗽Бесплатные и проверенные VPN конфигурации, работающие в РФ ⚪ Белые списки / обход белых списков ⚪ F"
PleasePrompto/notebooklm-skill,Python,7249,818,2025-10-19T05:36:13Z,Use this skill to enable Claude Code to communicate directly with your Google NotebookLM notebooks.
jamwithai/production-agentic-rag-course,Python,7243,1616,2025-08-06T19:52:50Z,
TheCraigHewitt/seomachine,Python,7201,971,2025-10-29T20:50:23Z,"A specialized Claude Code workspace for creating long-form, SEO-optimized blog content for any busin"
MeiGen-AI/InfiniteTalk,Python,7185,1267,2025-08-14T01:04:53Z,​​Unlimited-length talking video generation​​ that supports image-to-video and video-to-video genera
AvengeMedia/DankMaterialShell,QML,7083,426,2025-07-10T15:18:23Z,"Desktop shell for wayland compositors built with Quickshell & GO, optimized for niri, hyprland, sway"
facebookresearch/sam-3d-objects,Python,7044,841,2025-09-29T20:46:40Z,SAM 3D Objects
ChatLab/ChatLab,TypeScript,6813,1441,2025-11-26T05:54:26Z,Local-first chat history analyzer with AI. | 本地优先的 AI 聊天记录分析工具
nicotsx/zerobyte,TypeScript,6608,167,2025-08-09T08:58:56Z,Backup automation for self-hosters. Built on top of restic
SamsungSAILMontreal/TinyRecursiveModels,Python,6546,1032,2025-10-07T13:24:28Z,
lintsinghua/DeepAudit,Python,6512,804,2025-09-19T15:53:48Z,DeepAudit：人人拥有的 AI 黑客战队，让漏洞挖掘触手可及。国内首个开源的代码漏洞挖掘多智能体系统。小白一键部署运行，自主协作审计 + 自动化沙箱 PoC 验证。支持 Ollama 私有部署
xindoo/agentic-design-patterns,HTML,6496,915,2025-09-30T03:58:49Z,谷歌新书Agent设计模式(agentic design patterns)最佳中文版，持续优化。附：在线阅读、pdf和epub电子书下载。
osaurus-ai/osaurus,Swift,6451,361,2025-08-17T15:05:39Z,"Own your AI. The native macOS harness for AI agents -- any model, persistent memory, autonomous exec"
Jackywine/Bella,JavaScript,6406,979,2025-07-16T06:14:09Z,Bella is best
adongwanai/AgentGuide,HTML,6399,632,2025-11-03T10:46:38Z,https://adongwanai.github.io/AgentGuide | AI Agent开发指南 | LangGraph实战 | 高级RAG | 转行大模型 | 大模型面试 | 算法工程师
Facepunch/sbox-public,C#,6300,626,2025-11-24T08:18:33Z,"s&box is a modern game engine, built on Valve's Source 2 and the latest .NET technology, it provides"
JerryZLiu/Dayflow,Swift,6273,342,2025-09-23T01:58:21Z,The automatic work journal. Privately turns your screen into a timeline of what you actually accompl
pshenok/server-survival,JavaScript,6108,682,2025-11-21T02:36:29Z,"Tower defense game that teaches cloud architecture. Build infrastructure, survive traffic, learn sca"
IAmTomShaw/f1-race-replay,Python,6078,802,2025-11-21T17:37:05Z,An interactive Formula 1 race visualisation and data analysis tool built with Python! 🏎️
neuphonic/neutts,Python,6062,644,2025-10-02T12:48:55Z,On-device TTS model by Neuphonic
UfoMiao/zcf,TypeScript,6057,424,2025-07-30T06:09:00Z,Zero-Config Code Flow for Claude code & Codex
MorpheApp/morphe-manager,Kotlin,6030,135,2025-11-26T16:29:57Z,Morphe app patcher for Android
666OS/ClashMac,Sin especificar,6003,253,2025-11-28T04:41:02Z,Native Proxy Experience Built for macOS
microsoft/fara,Python,5946,574,2025-10-29T16:23:22Z,Fara-7B: An Efficient Agentic Model for Computer Use
openchamber/openchamber,TypeScript,5905,625,2025-09-11T10:34:59Z,Desktop and web interface for OpenCode AI agent
zhouxiaoka/autoclip,Python,5822,1160,2025-07-08T04:51:15Z,AutoClip : AI-powered video clipping and highlight generation · 一款智能高光提取与剪辑的二创工具
clashbk/clash,Sin especificar,5808,1283,2025-09-11T08:24:59Z,Clash官网各版本Clash下载地址及备份下载地址
ghuntley/how-to-build-a-coding-agent,Go,5705,642,2025-07-24T03:56:29Z,"A workshop that teaches you how to build your own coding agent. Similar to Roo code, Cline, Amp, Cur"
max-sixty/worktrunk,Rust,5666,196,2025-10-17T22:13:14Z,"Worktrunk is a CLI for Git worktree management, designed for parallel AI agent workflows"
ByteDance-Seed/Depth-Anything-3,Python,5648,623,2025-11-12T08:44:03Z,Depth Anything 3
czlonkowski/n8n-skills,Shell,5637,959,2025-10-20T05:51:27Z,n8n skillset for Claude Code to build flawless n8n workflows
Diorser/LiteMonitor,C#,5603,229,2025-11-10T12:58:51Z,"一款轻量级、高度可定制的 Windows桌面和任务栏硬件性能监控工具，支持监测 CPU、GPU、内存、磁盘、网速、FPS 计数、插件扩展及内存清理。A lightweight, customizabl"
datawhalechina/vibe-vibe,Dockerfile,5600,444,2025-11-28T10:30:29Z,"AI for All: The First Systematic Vibe Coding Tutorial | From Zero to Full-Stack, Bring Your Ideas to"
antvis/Infographic,TypeScript,5572,425,2025-09-11T11:13:39Z,"🦋 An Infographic Generation and Rendering Framework, bring words to life with AI!"
Michael-A-Kuykendall/shimmy,Rust,5563,533,2025-08-28T22:55:46Z,"⚡ Pure-Rust WebGPU inference engine — OpenAI-API compatible, GGUF native, runs on any GPU. No Python"
permissionlesstech/bitchat-android,Kotlin,5510,788,2025-07-08T18:36:23Z,"bluetooth mesh chat, IRC vibes"
donlon/cloudflare-error-page,HTML,5468,279,2025-11-19T12:00:12Z,✅Browser ❌Cloudflare ✅Host — Customized Cloudflare error page generator. (unofficial)
gepa-ai/gepa,Jupyter Notebook,5434,443,2025-08-05T09:26:27Z,"Optimize prompts, code, and more with AI-powered Reflective Text Evolution"
anthropics/claude-code-security-review,Python,5418,570,2025-08-04T16:07:27Z,An AI-powered security review GitHub Action using Claude to analyze code changes for security vulner
