repo_name,language,stars,forks,created_at,description
legeling/PromptHub,TypeScript,1436,177,2025-11-29T07:06:01Z,一款包含了 Prompt管理，Skill管理，Agent管理的一站式AI工具箱，助你高效管理提示词，一键分发skills ，一站式管理Agent资产，并实现云同步，备份，版本管理 | An all-i
zapdos-labs/unblink,Go,1433,170,2025-11-05T03:55:42Z,Camera monitoring with VLM
bgreenwell/xleak,Rust,1428,62,2025-11-06T12:51:31Z,"A fast terminal Excel viewer with an interactive TUI. Features full-text search, formula display, la"
aaaaalexis/obsidian-baseline,SCSS,1428,37,2025-07-14T02:43:20Z,A foundational Obsidian theme ― The baseline of your thoughts.
WeiboAI/VibeThinker,Python,1427,106,2025-11-04T03:55:22Z,"Tiny Model, Big Logic: Diversity-Driven Optimization Elicits Large-Model Reasoning Ability in VibeTh"
p2r3/beheader,JavaScript,1424,81,2025-07-24T23:30:59Z,Polyglot generator for media files
photon-hq/imessage-kit,TypeScript,1422,125,2025-10-18T06:44:03Z,"A type-safe, elegant iMessage SDK for macOS with zero dependencies"
DanielLavrushin/b4,Go,1421,59,2025-08-07T10:15:59Z,Network packet processor with a friendly UI for circumventing Deep Packet Inspection (DPI) systems.
f/git-rewrite-commits,TypeScript,1413,56,2025-11-10T00:16:19Z,AI-powered git commit message rewriter using Ollama or GPT
ZeroDeng01/sublinkPro,Go,1412,196,2025-10-28T02:47:04Z,✨ 现代化代理订阅管理平台 | 智能分类 · 专业测速 · 链式中转 · 流量监控 · TG管理 · JS扩展 | Go+React 全新UI 🌍 Modern Proxy Subscription
MoonshotAI/Kimi-Linear,Sin especificar,1411,73,2025-10-29T18:18:03Z,
RonitSachdev/ccundo,JavaScript,1403,56,2025-07-05T05:28:16Z,ccundo seamlessly integrates with Claude Code to provide granular undo functionality. It reads direc
antoniorodr/cronboard,Python,1401,56,2025-10-10T13:33:47Z,A terminal-based dashboard for managing cron jobs locally and on servers.
Danau5tin/multi-agent-coding-system,Python,1400,180,2025-08-30T19:23:45Z,"Reached #13 on Stanford's Terminal Bench leaderboard. Orchestrator, explorer & coder agents working"
ByteDance-Seed/m3-agent,Python,1396,114,2025-07-30T13:12:32Z,
Sharkord/sharkord,TypeScript,1394,125,2025-10-14T22:34:49Z,"Lightweight, self-hosted, open-source chat server with voice, video, text, and screen sharing. Built"
wu529778790/panhub.shenzjd.com,TypeScript,1393,518,2025-08-10T11:27:52Z,"一个 聚合的网盘搜索工具。它可以聚合多个优质资源站和公开频道,一次搜索即可覆盖阿里云盘、夸克、百度网盘、115、迅雷等热门网盘资源。它提供智能排序、分类型展示、极速部署等功能,并且是免费开源、零广告、"
ai-infra-curriculum/ai-infra-engineer-learning,Python,1390,226,2025-10-25T19:51:43Z,AI Infrastructure Engineer Learning Track - Production ML infrastructure curriculum (2-4 years exper
zampierilucas/scx_horoscope,Rust,1385,30,2025-11-20T00:15:21Z,Astrological CPU Scheduler
ShouZhengAI/CS146S_CN,Python,1381,153,2025-11-30T15:52:58Z,动手学CS146S中文版课程，包含assignments，vibe coding工具等，本项目将长期持续维护，致力于打造中文最好的vibe coding教程。
langchain-ai/deepagentsjs,TypeScript,1377,222,2025-08-04T15:23:17Z,The batteries included agent harness.
BehiSecc/First-Bounty,Sin especificar,1375,157,2025-08-15T05:31:39Z,"A complete, beginner-friendly bug bounty roadmap that takes you from zero experience to earning your"
LucklySpace/Lucky-client,TypeScript,1371,142,2025-10-02T05:12:19Z,"A cross-platform instant messaging client application built with Tauri and Vue 3, featuring one-to-o"
jd-opensource/xllm,C++,1370,240,2025-08-12T13:16:07Z,"A high-performance inference engine for LLM, VLM, DiT and REC models, optimized for diverse AI accel"
Priivacy-ai/spec-kitty,Python,1370,119,2025-10-09T12:29:47Z,"Spec-Driven Development for serious software developers. Spec Coding with with Claude, Cursor, Gemin"
binimum/tidal-ui,Svelte,1368,128,2025-10-02T21:18:46Z,Simple Tidal frontend. Modified version on tidal.squid.wtf
0voice/Career_planning_path,Sin especificar,1368,43,2025-08-11T05:42:52Z,2025年程序员找工作求职最新总结，学生阶段的困境解决，从简历到面试的全方位解析，从实习到全职的学习规划，就业必备技能与资源推荐。
LadybugDB/ladybug,C++,1365,106,2025-10-07T18:33:08Z,LadybugDB a graph database
cfrs2005/claude-init,Shell,1364,124,2025-08-29T11:07:47Z,Claude Code 中文开发套件 - 为中国开发者定制的零门槛 AI 编程环境。一键安装完整中文化体验，集成 MCP 服务器、智能上下文管理、安全扫描，支持免翻墙访问。让 AI 编程更简单。
ggml-org/Llama-macOS,Swift,1359,78,2025-06-30T11:05:34Z,A cosy home for your LLMs.
AnandChowdhary/continuous-claude,Shell,1357,93,2025-11-15T08:59:04Z,"🔂 Ralph loop with PRs: Run Claude Code in a continuous loop, autonomously creating PRs, waiting for"
peterkrueck/Claude-Code-Development-Kit,Shell,1356,155,2025-07-02T11:04:30Z,Claude Code Workflow for beginners & intermediate users. Tutorial and Installer included
serkodev/markdown-exit,TypeScript,1354,19,2025-08-24T14:22:51Z,"Fast, customizable Markdown parser and renderer with full CommonMark support. TypeScript rewrite of"
YuvDwi/Steve,Java,1353,134,2025-11-06T15:46:18Z,Cursor for Minecraft
Prat011/awesome-llm-skills,Python,1350,211,2025-10-22T06:15:37Z,"A curated list of awesome LLM and AI Agent Skills, resources and tools for customising AI Agent work"
anyme123/Any-code,TypeScript,1344,137,2025-07-22T15:38:23Z,
Tencent/AngelSlim,Python,1344,153,2025-07-04T02:10:39Z,"Model compression toolkit engineered for enhanced usability, comprehensiveness, and efficiency."
Scriptez1/RedXFreeSteamInstaller,PowerShell,1342,17,2025-07-17T16:14:23Z,It allows you to automatically add all free and paid games and DLCs to your Steam account securely a
WordPress/mcp-adapter,PHP,1341,151,2025-07-10T07:31:26Z,"An MCP adapter that bridges the Abilities API to the Model Context Protocol, enabling MCP clients to"
sql-hkr/tiny8,Python,1340,37,2025-10-20T16:28:30Z,A tiny CPU simulator written in Python
meituan-longcat/LongCat-Flash-Chat,Sin especificar,1339,67,2025-08-30T16:00:04Z,
byJoey/yx-tools,Python,1339,597,2025-10-09T02:18:43Z,
skills-directory/skill-codex,Sin especificar,1337,101,2025-10-21T19:28:43Z,A claude code skill to delegate prompts to codex
ModelTC/LightX2V-Qwen-Image-Lightning,Python,1336,45,2025-08-09T15:42:09Z,Qwen-Image-Lightning: Speed up Qwen-Image model with distillation
kimsungwhee/apple-docs-mcp,TypeScript,1335,58,2025-07-15T06:40:39Z,"MCP server for Apple Developer Documentation - Search iOS/macOS/SwiftUI/UIKit docs, WWDC videos, Swi"
celiobjunior/resume-template,TeX,1335,112,2025-08-14T19:19:13Z,The best LaTeX resume template.
nsh07/Tomato,Kotlin,1334,82,2025-06-30T04:58:06Z,"Minimalist, data-oriented pomodoro timer for Android and Desktop based on Material 3 Expressive"
ConardLi/easy-llm-cli,TypeScript,1333,221,2025-07-11T02:38:45Z,An open-source AI agent that is compatible with multiple LLM models
antonmedv/gitmal,Go,1327,48,2025-11-30T16:18:24Z,A static page generator for repos
oxylabs/ai-map-py,Sin especificar,1324,0,2025-10-29T14:05:45Z,AI Map is an AI-powered website mapping tool by Oxylabs AI Studio that uses natural language prompts
hesreallyhim/a-list-of-claude-code-agents,Sin especificar,1324,144,2025-07-26T10:24:26Z,A list of Claude Code Sub-Agents submitted by the community.
zmrlft/GreenWall,TypeScript,1314,97,2025-10-22T03:04:27Z,"customizing the GitHub contribution graph, allowing you to draw various patterns on it.在你的GitHub贡献历史"
jqssun/android-helium-browser,Shell,1313,48,2025-10-09T19:25:35Z,Secure open-source Android browser with support for extensions
gavrielc/Nano-PDF,Python,1313,87,2025-11-28T19:10:45Z,Edit PDF files with Nano Banana
AI-FanGe/OpenAIglasses_for_Navigation,Python,1312,399,2025-10-20T10:03:03Z,a open framework for blind navigation based on esp32
seraui/seraui,TypeScript,1309,93,2025-07-15T00:30:52Z,"UI component library for React, Next.js, and other JSX frameworks. Built with Tailwind CSS, it makes"
oxylabs/browser-agent-py,Sin especificar,1309,1,2025-10-13T08:43:54Z,AI Browser Agent is an advanced Browser AI tool developed by Oxylabs AI Studio that automates real u
VersusControl/devops-ai-guidelines,Python,1307,341,2025-07-20T11:15:56Z,"First AI Journey for DevOps - with comprehensive learning paths, practical tips, and enterprise guid"
0voice/Awesome_c-cpp_Projects,C++,1307,123,2025-07-28T06:53:06Z,2025年 最新收录整理 500+ 个高质量的 C/C++ 项目，包括但不限于核心开发、基础工具、系统与并发、系统编程、图形处理、网络通信、数据处理、应用框架、开源工具、嵌入式开发等多个领域。适合学习
vivoblueos/kernel,Rust,1306,83,2025-07-19T09:57:43Z,
weitianxin/Awesome-Agentic-Reasoning,Sin especificar,1301,101,2025-08-31T03:54:31Z,"A curated list of papers and resources based on the survey ""Agentic Reasoning for Large Language Mod"
oxc-project/tsgolint,Go,1298,76,2025-07-14T07:18:02Z,Type aware linting for oxlint
Datus-ai/Datus-agent,Python,1297,206,2025-07-04T15:43:40Z,"The Future of Data Engineering — A CLI SQL client for the modern data stack, enabling AI-native cont"
A-EDev/Flow,Kotlin,1293,37,2025-10-19T15:37:26Z,"A modern, feature-rich YouTube and YouTube  Music client with local recommendation for Android built"
study8677/antigravity-workspace-template,Python,1291,259,2025-11-19T08:51:14Z,"Give Claude Code, Cursor, Codex CLI a ChatGPT for your codebase. Multi-agent knowledge engine, groun"
Ramakm/ai-hands-on,Jupyter Notebook,1290,278,2025-11-24T11:40:11Z,A group of notebooks  and other files which can help you learn AI from scratch.
Tosencen/XMSLEEP,Kotlin,1289,68,2025-11-04T02:43:31Z,一款白噪音应用送给你，祝您牛掰，有的是钱
wemake-services/django-modern-rest,Python,1287,136,2025-10-09T08:53:53Z,Modern REST framework for Django with types and async support!
preset-io/agor,TypeScript,1287,109,2025-10-04T19:17:32Z,"Orchestrate Claude Code, Codex, and Gemini sessions on a multiplayer canvas. Manage git worktrees, t"
firecrawl/open-scouts,TypeScript,1285,183,2025-11-28T14:46:39Z,🔥 AI-powered web monitoring platform. Create automated scouts that search the web and send email ale
fccview/cronmaster,TypeScript,1284,31,2025-08-18T14:29:31Z,"Cronjob management UI with human readable syntax, live logging and log history for your cronjobs."
869413421/ai-moive-studio,Python,1283,205,2025-11-10T03:31:20Z,自然语言驱动的无限画布工作流 Agent，让 AI 视频创作第一次真正变成可编辑的工作流。   AICON 面向创作者，提供从剧本拆解、分镜生成、素材生成、视频合成到内容分发的一整套能力。   不是只
poetiq-ai/poetiq-arc-agi-solver,Python,1276,214,2025-10-29T17:09:22Z,This repository allows reproduction of Poetiq's record-breaking submission to the ARC-AGI-1 and ARC-
isair/jarvis,Python,1276,233,2025-08-19T18:27:53Z,A 100% private AI voice assistant that lives on your computer (works offline). Talk naturally as if
kuafuai/aipexbase,Java,1272,213,2025-10-18T07:31:20Z,AipexBase is an AI-native BaaS platform. You only need to develop the frontend with vibe coding tool
buyukakyuz/install-nothing,Rust,1270,41,2025-11-17T22:03:19Z,A terminal application that simulates installing things but doesn't actually install anything
vercel/bidc,TypeScript,1269,21,2025-08-04T11:11:27Z,Bidirectional Channels for JavaScript
Hommy-master/capcut-mate,Python,1269,217,2025-08-31T10:09:30Z,开源剪映小助手｜剪映API | 扣子插件 | Open-source CapCut automation toolkit to generate & download draft files.  |
ZimengXiong/ExcaliDash,TypeScript,1266,118,2025-11-22T01:52:29Z,A self-hosted dashboard and organizer for Excalidraw with multi-user collaboration and scoped sharin
Hybrid-Mount/meta-hybrid_mount,Rust,1265,68,2025-11-24T10:42:17Z,Hybrid Mount Metamodule
JessyTsui/Claude-Code-Remote,JavaScript,1264,132,2025-07-12T12:37:50Z,"Control Claude Code remotely via email、discord、telegram. Start tasks locally, receive notifications"
openworkflowdev/openworkflow,TypeScript,1263,60,2025-10-25T15:39:00Z,"Open-source TypeScript framework for building durable, resumable workflows. Supports Node.js and Bun"
moumen-soliman/uitripled,TypeScript,1262,62,2025-11-16T22:26:37Z,"Production-ready UI blocks, components, and full pages available in shadcn/ui and Base UI, powered b"
google/adk-js,TypeScript,1257,165,2025-08-14T01:57:35Z,"An open-source, code-first Typescript toolkit for building, evaluating, and deploying sophisticated"
SSShooter/ebook-to-mindmap,TypeScript,1253,151,2025-07-19T08:40:25Z,AI-powered Summaries by Extracting Content from EPUB and PDF. epub、pdf 拆书 AI 总结
galilai-group/lejepa,Python,1251,108,2025-11-11T14:29:00Z,
ekwek1/soprano,Python,1246,105,2025-11-30T21:24:52Z,"Soprano: Instant, Ultra-Realistic Text-to-Speech"
meridianlabs-ai/inspect_petri,Python,1244,201,2025-08-19T20:39:05Z,An alignment auditing agent capable of quickly exploring alignment hypothesis
Francis-Rings/StableAvatar,Python,1243,111,2025-08-11T11:48:35Z,"We present StableAvatar, the first end-to-end video diffusion transformer, which synthesizes infinit"
chiphuyen/sniffly,Python,1242,116,2025-07-15T16:53:39Z,"Claude Code dashboard with usage stats, error analysis, and sharable feature"
NeteaseCloudMusicApiEnhanced/api-enhanced,JavaScript,1241,1552,2025-07-24T13:17:44Z,🔍  网易云音乐 Node.js  API Services (Half Refactor & Enhanced) 全网最全的网易云音乐API接口
fahrez182/AxManager,Kotlin,1240,111,2025-08-17T06:03:24Z,AxManager is an Android application designed to provide deeper control over apps and the system.
microsoft/hve-core,PowerShell,1235,222,2025-11-02T21:24:46Z,"A refined collection of Hypervelocity Engineering components (instructions, prompts, agents, and ski"
d-kimuson/claude-code-viewer,TypeScript,1235,151,2025-08-31T07:54:51Z,A full-featured web-based Claude Code client that provides complete interactive functionality for ma
OpenDCAI/DataFlex,Python,1233,159,2025-08-09T09:56:55Z,"Data-centric LLM training with dynamic sample selection, domain mixture optimization, and example re"
daymade/claude-code-skills,Python,1231,200,2025-10-22T11:17:31Z,Professional Claude Code skills marketplace featuring production-ready skills for enhanced developme
HugeCatLab/ChatTutor,Vue,1231,179,2025-11-05T07:41:44Z,👨‍🏫 ChatTutor: Visual and Interactive AI Tutor
remorses/critique,TypeScript,1230,37,2025-10-08T15:25:46Z,TUI for reviewing git changes
frankiejun/wxpush,JavaScript,1229,329,2025-11-27T11:15:11Z,一个极简且免费的微信消息推送服务
bytedance/USO,Python,1228,76,2025-08-22T10:45:42Z,[CVPR 2026] 🔥🔥 Official Repo of USO: Unified Style and Subject-Driven Generation via Disentangled an
dexmal/dexbotic,Python,1226,173,2025-10-17T03:23:00Z,Dexbotic: Open-Source Vision-Language-Action Toolbox
TheSmallHanCat/sora2api,Python,1226,372,2025-11-08T04:12:35Z,逆向账号池，Q交流群1073237297
aiming-lab/Agent0,Python,1225,145,2025-10-20T22:27:49Z,[ICML'26] Agent0 Series: Self-Evolving Agents from Zero Data
eooce/Auto-login-netlib,JavaScript,1224,1951,2025-11-06T11:43:07Z,自动登录netlib.re网站保活域名
Gu1llaum-3/sshm,Go,1223,67,2025-08-31T20:56:25Z,SSHM is a beautiful command-line tool that transforms how you manage and connect to your SSH hosts.
HG-ha/MTools,Python,1220,110,2025-10-26T11:24:01Z,MTools 是一个功能强大的多功能桌面应用程序，集成了音视频处理、图片编辑、文本操作和编码工具，内置AI增强功能。旨在简化您的工作流程，提升生产效率
binnewbs/arch-hyprland,CSS,1218,68,2025-07-07T12:22:25Z,My personal hyprland rice dotfiles
Gezine/BD-JB-1250,Java,1215,136,2025-08-02T17:20:54Z,BD-JB for up to PS4 12.50
higress-group/himarket,Java,1214,158,2025-08-21T12:55:00Z,"HiMarket is an enterprise-level ""AI Capability Marketplace and Developer Ecosystem Hub."" It is not m"
snowarch/iNiR,QML,1212,69,2025-11-23T03:28:04Z,A Niri shell illogical-impulse based - with some modifications..
Ayndpa/ConnectTool,C++,1212,87,2025-11-19T11:01:05Z,
jingguanzhang/gift-book,HTML,1211,364,2025-10-02T09:51:16Z,一款开源免费，完全离线、的现代化电子礼簿系统。专为红白喜事设计，提供高效录入、Excel/PDF 专业报表导出一站式礼金管理解决方案。
awesome-skills/code-review-skill,HTML,1211,127,2025-11-29T02:06:50Z,"A comprehensive code review skill for Claude Code, covering React 19, Vue 3, Rust, TypeScript, TanSt"
lirantal/npm-security-best-practices,Sin especificar,1208,42,2025-10-02T08:08:33Z,Collection of npm package manager Security Best Practices
666ghj/DeepSearchAgent-Demo,Python,1206,305,2025-08-17T06:34:02Z,从0实现一个简洁清晰的Deep Search Agent
CharlesQ9/Self-Evolving-Agents,Sin especificar,1205,104,2025-07-22T02:08:25Z,
amclubs/am-cf-tunnel-sub,JavaScript,1201,1348,2025-10-07T07:12:56Z,基于Vercel、Cloudflare 部署该脚本，你可以方便地将Cloudflare Workers 和 Pages的 VLESS、Trojan 配置信息使用在线配置转换到 Clash、 Singb
Devin-AXIS/A2V,TypeScript,1201,153,2025-08-25T03:57:40Z,A2V: Next-Gen AI Value Compute Protocol.
Gezine/Y2JB,JavaScript,1200,145,2025-10-16T12:07:52Z,Y2JB is userland code execution using PS5 Youtube app
GML-MMGroup/GMTalker,Python,1200,55,2025-07-18T08:52:12Z,GMTalker 由光明实验室媒体智能团队打造的3d数字人。系统集成了语音识别、语音合成、自然语言理解、嘴型动画驱动。支持windows、Linux、安卓快速部署。
XPixelGroup/HYPIR,Python,1199,96,2025-07-19T10:33:15Z,Official implementation of HYPIR: Harnessing Diffusion-Yielded Score Priors for Image Restoration (S
stabldev/torrra,Python,1196,71,2025-07-06T12:02:20Z,A Python tool that lets you search and download torrents without leaving your CLI.
joelseverin/linux-wasm,JavaScript,1195,85,2025-10-31T16:54:33Z,WebAssembly (Wasm) arch support for the Linux kernel
NeoLabHQ/context-engineering-kit,TypeScript,1186,128,2025-11-13T23:23:04Z,Hand-crafted Claude Code Skills focused on improving agent results quality. Compatible with OpenCode
hanmaoye/IDM-Activation-Script,Batchfile,1185,439,2025-07-01T06:56:33Z,IDM 激活脚本
JoasASantos/NeuroSploit,Rust,1184,293,2025-08-17T02:58:58Z,"NeuroSploit is an advanced, AI-powered penetration testing framework designed to automate and augmen"
Jman-Github/Universal-ReVanced-Manager,Kotlin,1184,33,2025-10-13T08:31:07Z,"💊 An Android application to use ReVanced, Morphe and AmpleReVanced on that has extra features the of"
l429609201/misaka_danmu_server,Python,1182,132,2025-07-26T14:36:50Z,一个功能强大的自托管弹幕（Danmaku）聚合与管理服务，兼容 弹弹play API 规范。
ace-agent/ace,Python,1180,149,2025-11-16T12:21:11Z,Evolve your language agent with Agentic Context Engineering (ACE)
millylee/anyrouter-check-in,Python,1176,2549,2025-07-11T10:42:58Z,支持 AnyRouter、AgentRouter 的多平台多账号签到，理论兼容所有基于 NewAPI、OneAPI 的平台。
law-chain-hot/websocket-devtools,JavaScript,1174,55,2025-07-03T14:58:36Z,"Complete WebSocket Traffic Control with advanced proxy, simulation, and blocking capabilities"
GAIR-NLP/ASI-Arch,Python,1173,216,2025-07-18T09:49:32Z,AlphaGo Moment for Model Architecture Discovery.
todo-for-ai/todo-for-ai,Shell,1171,103,2025-07-28T18:53:08Z,🤖 A comprehensive task management system specifically designed for AI assistants. Supports project m
openonion/connectonion,Python,1171,163,2025-07-28T04:21:41Z,The Best AI Agent Framework for Agent Collaboration.
farzaa/gemini-bball,Python,1170,308,2025-07-02T04:09:37Z,
SemiAnalysisAI/InferenceX,Python,1169,208,2025-07-12T20:07:46Z,"Open Source Continuous Inference Benchmark Research Platform — Kimi K2.7-Code, MiniMax M3, DeepSeekv"
imputnet/helium-windows,C++,1168,50,2025-08-07T12:55:01Z,Helium Browser for Windows
cubezhao/ai-tools-mng,Vue,1168,209,2025-07-08T01:48:37Z,基于 Tauri 的跨平台桌面应用，用于管理多平台 AI 账号 Augment、Antigravity、Windsurf、Cursor、OpenAI（Codex、API）、Claude Code 与
Rajvir-Sss/Dead-_-,Sin especificar,1164,3,2025-08-18T16:11:32Z,-_-
beakthoven/TrickyStoreOSS,Kotlin,1163,105,2025-06-30T14:18:26Z,Open source alternative to proprietary Tricky Store module
FB208/OpenBidKit_Yibiao,JavaScript,1163,321,2025-08-04T03:22:17Z,开箱即用的AI标书编写工具，标书AI生成工具，投标工具箱、知识库、标书查重、废标项检查，完全开源免费，欢迎使用
withoutbg/withoutbg,Python,1159,58,2025-08-18T19:35:32Z,Image Background Removal Toolkit - Open Source and API Models
vercel-labs/workflow-builder-template,TypeScript,1159,224,2025-11-03T17:14:16Z,Visual AI workflow automation platform
SamuelZ12/longcut,TypeScript,1158,215,2025-08-27T02:34:27Z,The best way to learn from long videos
Gowtham-Darkseid/AutoPentestX,Python,1156,224,2025-11-30T08:33:45Z,AutoPentestX – Automated Pentesting & Vulnerability Reporting Tool
Chevron7Locked/kima-hub,TypeScript,1155,48,2025-11-30T01:01:04Z,Kima Hub is built for music lovers who want the convenience of streaming services without sacrificin
linkedlist771/SoraWatermarkCleaner,Python,1153,245,2025-10-04T14:15:18Z,The fastest and highest-quality deep learning powered Sora2 watermark cleaner.
nari-labs/dia2,Python,1151,99,2025-11-17T19:04:12Z,TTS model capable of streaming conversational audio in realtime.
asdfghj1237890/WebVideo2NAS,Python,1151,66,2025-10-12T15:32:30Z,Self-hosted Chrome → NAS pipeline: capture HLS / DASH / MP4 streams from any site and download to yo
Ricky-7-Yan/intelligent-audit-system,Python,1151,105,2025-10-28T16:14:23Z,🤖 AutoAudit--智能审计决策系统 Python FastAPI License  基于大语言模型的智能审计平台 | 集成知识图谱、RAG、强化学习等前沿技术  功能特性 • 快速开始 • 技
davis7dotsh/better-context,TypeScript,1149,84,2025-11-29T00:56:58Z,A better way to get up to date context on libraries/technologies in your projects
Tencent-Hunyuan/MixGRPO,Python,1148,49,2025-07-29T08:37:47Z,[ECCV 2026] MixGRPO: Unlocking Flow-based GRPO Efficiency with Mixed ODE-SDE
ichason/CPosed,Java,1147,106,2025-08-07T11:15:44Z,"⚡ Continuously updated Android framework forked from Lsposed, enhanced with advanced detection bypas"
Tencent-Hunyuan/HunyuanWorld-Mirror,Python,1147,115,2025-10-16T13:47:15Z,[ICML 2026] WorldMirror: Fast and Universal 3D reconstruction model for versatile tasks
apple/ml-clara,Python,1146,95,2025-11-13T01:49:31Z,
rari-build/rari,Rust,1145,29,2025-07-26T01:44:57Z,"rari: High-performance React Server Components framework powered by a Rust runtime, delivering 18.1x"
journiv/journiv-app,JavaScript,1145,46,2025-10-20T00:53:03Z,Journiv - Self hosted private journaling app
ztx888/HaloWebUI,Python,1144,70,2025-11-10T04:02:33Z,基于官方OpenWebUI，汉化界面提高中文使用体验，增加了模型计费和用量统计
fastgs/FastGS,Python,1142,110,2025-11-07T02:26:16Z,"[CVPR 2026 Highlight, the CVPR Compute Gold Star] Offical code for ""FastGS: Training 3D Gaussian Spl"
Ryandonofrio3/osgrep,TypeScript,1142,67,2025-11-21T06:14:31Z,Open Source Semantic Search for your AI Agent
kitlangton/visual-effect,TypeScript,1141,44,2025-07-10T04:43:40Z,Interactive Effect Visualizations
Mr-sans-and-InitLoader-s-team/Escape-From-Duckov-Coop-Mod-Preview,C#,1140,138,2025-10-28T01:40:36Z,逃离鸭科夫联机mod（by Mr.sans & InitLoader）
vm0-ai/vm0,TypeScript,1135,67,2025-11-14T03:27:22Z,"Zero, your trustworthy AI teammate for real work."
colonelpanichacks/flock-you,HTML,1135,154,2025-08-21T01:27:25Z,flock cam detection
LauZzL/doubao-downloader,TypeScript,1134,100,2025-10-13T11:56:08Z,一键批量下载豆包AI无水印图片/视频资源的浏览器扩展/油猴脚本。
QiaoKes/fntv-electron,TypeScript,1133,91,2025-08-15T03:30:22Z,飞牛影视PC版
DaxianLee/cocos-mcp-server,TypeScript,1133,288,2025-07-17T10:04:01Z,一款全面的、便捷的cocos creator AI MCP服务插件，适用于3.8.0以上cocos版本，一键安装，一键启动。A comprehensive and convenient cocos c
eudoxia0/hashcards,Rust,1130,64,2025-08-09T01:52:11Z,A plain text-based spaced repetition system.
Haleclipse/Claudix,Vue,1130,80,2025-11-13T11:58:56Z,Gorgeous Claude Code Extend for VS Code.
Owloops/claude-powerline,TypeScript,1123,78,2025-08-10T09:35:29Z,Beautiful vim-style powerline for Claude Code
aizhimou/pigeon-pod,Java,1122,93,2025-08-23T05:28:12Z,Listen to YouTube & Bilibili. Anywhere.
obra/superpowers-marketplace,Sin especificar,1121,222,2025-10-09T19:45:25Z,Curated Claude Code plugin marketplace
conorluddy/ios-simulator-skill,Python,1120,76,2025-10-17T12:43:15Z,"An IOS Simulator Skill for ClaudeCode. Use it to optimise Claude's ability to build, run and interac"
microsoft/winappCli,C#,1118,57,2025-07-30T20:40:55Z,"winapp, the Windows App Development CLI, is a single command-line interface for managing Windows SDK"
glink25/Cent,TypeScript,1118,272,2025-08-29T05:29:30Z,"完全免费、开源的多人协作记账 Web App | Completely free, open-source, collaborative accounting Web App"
VILA-Lab/Awesome-DLMs,Sin especificar,1118,52,2025-07-14T08:02:11Z,"The official GitHub repo for the survey paper ""A Survey on Diffusion Language Models""."
Doriandarko/make-it-heavy,Python,1118,183,2025-07-15T21:25:41Z,A Python framework that emulates Grok Heavy functionality using intelligent multi-agent orchestratio
0voice/awesome_audio_video_learning,Sin especificar,1117,150,2025-08-25T11:32:01Z,2025年音视频开发最新总结，提供全面的音视频开发学习资源，涵盖从基础知识到实战项目的资料、论文、书籍、项目和示例，帮助你快速热门并逐步进阶，持续更新维护中！
