repo_name,language,stars,forks,created_at,description
openclaw/openclaw,TypeScript,375998,78521,2025-11-24T10:16:47Z,Your own personal AI assistant. Any OS. Any Platform. The lobster way. 🦞 
obra/superpowers,Shell,214477,19098,2025-10-09T19:45:18Z,An agentic skills framework & software development methodology that works.
affaan-m/ECC,JavaScript,201567,30917,2026-01-18T00:51:51Z,"The agent harness performance optimization system. Skills, instincts, memory, security, and research"
ultraworkers/claw-code,Rust,193056,109987,2026-03-31T08:58:08Z,The repo is finally unlocked. enjoy the party! The fastest repo in history to surpass 100K stars ⭐. 
NousResearch/hermes-agent,Python,175530,29892,2025-07-22T22:22:28Z,The agent that grows with you
multica-ai/andrej-karpathy-skills,Sin especificar,164352,16841,2026-01-27T03:53:13Z,"A single CLAUDE.md file to improve Claude Code behavior, derived from Andrej Karpathy's observations"
anthropics/skills,Python,145026,17078,2025-09-22T15:53:31Z,Public repository for Agent Skills
mattpocock/skills,Shell,113802,9972,2026-02-03T11:15:53Z,Skills for Real Engineers. Straight from my .claude directory.
github/spec-kit,Python,107506,9507,2025-08-21T22:54:31Z,💫 Toolkit to help you get started with Spec-Driven Development
msitarzewski/agency-agents,Shell,106601,17589,2025-10-13T12:12:29Z,"A complete AI agency at your fingertips - From frontend wizards to Reddit community ninjas, from whi"
garrytan/gstack,TypeScript,105436,15712,2026-03-11T21:22:45Z,"Use Garry Tan's exact Claude Code setup: 23 opinionated tools that serve as CEO, Designer, Eng Manag"
farion1231/cc-switch,Rust,87634,5705,2025-08-04T14:16:16Z,"A cross-platform desktop All-in-One assistant for Claude Code, Codex, OpenCode, OpenClaw, Gemini CLI"
VoltAgent/awesome-design-md,Sin especificar,86367,10366,2026-03-31T16:37:01Z,A collection of DESIGN.md files analysis by popular brand design systems. Drop one into your project
nextlevelbuilder/ui-ux-pro-max-skill,Python,85888,8867,2025-11-30T11:36:31Z,An AI SKILL that provide design intelligence for building professional UI/UX multiple platforms
karpathy/autoresearch,Python,84476,12267,2026-03-06T22:00:43Z,AI agents running research on single-GPU nanochat training automatically
thedotmack/claude-mem,TypeScript,80037,6887,2025-08-31T20:50:03Z,Persistent Context Across Sessions for Every Agent –  Captures everything your agent does during ses
ruvnet/RuView,Rust,69739,9317,2025-06-07T04:32:30Z,"π RuView turns commodity WiFi signals into real-time spatial intelligence, vital sign monitoring, an"
paperclipai/paperclip,TypeScript,68599,12696,2026-03-02T15:01:51Z,The open-source app everyone uses to manage agents at work
JuliusBrussee/caveman,JavaScript,67227,3787,2026-04-04T10:03:00Z,🪨 why use many token when few token do trick — Claude Code skill that cuts 65% of tokens by talking 
shareAI-lab/learn-claude-code,Python,64037,10466,2025-06-29T15:34:15Z,"Bash is all you need -  A nano claude code–like 「agent harness」, built from 0 to 1"
gsd-build/get-shit-done,JavaScript,63810,5434,2025-12-14T14:17:12Z,"A light-weight and powerful meta-prompting, context engineering and spec-driven development system f"
666ghj/MiroFish,Python,63499,9943,2025-11-26T04:23:02Z,"A Simple and Universal Swarm Intelligence Engine, Predicting Anything. 简洁通用的群体智能引擎，预测万物"
ComposioHQ/awesome-claude-skills,Python,62774,6888,2025-10-17T07:15:01Z,"A curated list of awesome Claude Skills, resources, and tools for customizing Claude AI workflows"
code-yeongyu/oh-my-openagent,TypeScript,60562,4920,2025-12-03T01:40:05Z,omo; the one and only agent harness for complex codebases; the pickaxe for complex software engineer
earendil-works/pi,TypeScript,58501,6993,2025-08-09T14:03:50Z,"AI agent toolkit: coding agent CLI, unified LLM API, TUI & web UI libraries, Slack bot, vLLM pods"
safishamsi/graphify,Python,57742,6029,2026-04-03T15:49:07Z,"AI coding assistant skill (Claude Code, Codex, OpenCode, Cursor, Gemini CLI, and more). Turn any fol"
rtk-ai/rtk,Rust,57201,3517,2026-01-22T16:54:16Z,"CLI proxy that reduces LLM token consumption by 60-90% on common dev commands. Single Rust binary, z"
ruvnet/ruflo,TypeScript,57151,6510,2025-06-02T21:24:20Z,"🌊 The leading agent meta-harness for Claude. Deploy intelligent multi-agent swarms, coordinate auton"
nexu-io/open-design,TypeScript,56827,6423,2026-04-28T04:25:20Z,"🎨 Local-first, open-source Claude Design alternative. 🖥️ Native desktop app. ⚡ 259+ Skills · ✨ 142+ "
shanraisshan/claude-code-best-practice,HTML,55848,5608,2025-10-31T14:15:28Z,from vibe coding to agentic engineering - practice makes claude perfect
koala73/worldmonitor,TypeScript,55290,8885,2026-01-08T17:26:06Z,"Real-time global intelligence dashboard. AI-powered news aggregation, geopolitical monitoring, and i"
datawhalechina/hello-agents,Python,55187,6754,2025-09-07T09:50:24Z,📚 《从零开始构建智能体》——从零开始的智能体原理与实践教程
karpathy/nanochat,Python,54471,7386,2025-10-13T13:46:35Z,The best ChatGPT that $100 can buy.
tw93/Mole,Shell,54166,1738,2025-09-23T06:38:40Z,"🐹 Clean, uninstall, analyze, optimize, and monitor your Mac from the terminal."
MemPalace/mempalace,Python,53223,7018,2026-04-05T01:12:07Z,The best-benchmarked open-source AI memory system. And it's free.
OpenCut-app/OpenCut,TypeScript,52212,5668,2025-06-22T08:02:17Z,The open-source CapCut alternative
Fission-AI/OpenSpec,TypeScript,52111,3647,2025-08-05T10:37:45Z,Spec-driven development (SDD) for AI coding assistants.
VoltAgent/awesome-openclaw-skills,Sin especificar,49638,4851,2026-01-25T09:22:32Z,"The awesome collection of OpenClaw skills. 5,400+ skills filtered and categorized from the official "
Lum1104/Understand-Anything,TypeScript,48361,3929,2026-03-15T02:30:51Z,Graphs that teach > graphs that impress. Turn any code into an interactive knowledge graph you can e
santifer/career-ops,JavaScript,48143,10009,2026-04-04T18:21:18Z,"AI-powered job search system built on Claude Code. 14 skill modes, Go dashboard, PDF generation, bat"
chenglou/pretext,TypeScript,48026,2679,2026-03-07T21:06:28Z,"Fast, accurate & comprehensive text measurement & layout"
microsoft/VibeVoice,Python,47613,5319,2025-08-25T13:24:01Z,Open-Source Frontier Voice AI
addyosmani/agent-skills,Shell,47568,5274,2026-02-15T20:20:26Z,Production-grade engineering skills for AI coding agents.
KeygraphHQ/shannon,TypeScript,44066,5094,2025-09-27T01:51:47Z,"Shannon Lite is an autonomous, white-box AI pentester for web applications and APIs. It analyzes you"
HKUDS/nanobot,Python,43472,7686,2026-02-01T07:16:15Z,"Lightweight, open-source AI agent for your tools, chats, and workflows."
ChromeDevTools/chrome-devtools-mcp,TypeScript,42494,2725,2025-09-11T10:39:55Z,Chrome DevTools for coding agents
HKUDS/CLI-Anything,Python,41616,3939,2026-03-08T13:52:57Z,"""CLI-Anything: Making ALL Software Agent-Native"" -- CLI-Hub: https://clianything.cc/"
abhigyanpatwari/GitNexus,TypeScript,41029,4674,2025-08-02T23:20:31Z,GitNexus: The Zero-Server Code Intelligence Engine -       GitNexus is a client-side knowledge graph
ZhuLinsen/daily_stock_analysis,Python,39738,38348,2026-01-10T06:43:20Z,LLM驱动的 A/H/美股智能分析：多数据源行情 + 实时新闻 + LLM决策仪表盘 + 多渠道推送，零成本定时运行，纯白嫖. LLM-powered stock analysis system fo
sickn33/antigravity-awesome-skills,Python,39352,6385,2026-01-14T17:48:09Z,"Installable GitHub library of 1,400+ agentic skills for Claude Code, Cursor, Codex CLI, Gemini CLI, "
siddharthvaddem/openscreen,TypeScript,37904,2640,2025-10-10T05:36:55Z,"Create stunning demos for free. Open-source, no subscriptions, no watermarks, and free for commercia"
google/langextract,Python,36779,2532,2025-07-08T20:46:06Z,A Python library for extracting structured information from unstructured text using LLMs with precis
colbymchenry/codegraph,TypeScript,36384,2259,2026-01-18T21:45:37Z,"Pre-indexed code knowledge graph for Claude Code, Codex, Gemini, Cursor, OpenCode, AntiGravity, Kiro"
Hmbown/CodeWhale,Rust,36379,3130,2026-01-19T18:21:01Z,DeepSeek + MiMo coding agent in terminal
wshobson/agents,Python,36224,3928,2025-07-24T23:28:14Z,"Multi-harness agentic plugin marketplace for Claude Code, Codex CLI, Cursor, OpenCode, and Gemini CL"
router-for-me/CLIProxyAPI,Go,35646,5920,2025-07-01T19:43:27Z,"Wrap Gemini CLI, Antigravity, ChatGPT Codex, Claude Code, Grok Build as an OpenAI/Gemini/Claude/Code"
Yeachan-Heo/oh-my-claudecode,TypeScript,35486,3242,2026-01-09T03:36:29Z,Teams-first Multi-agent orchestration for Claude Code
vercel-labs/agent-browser,Rust,34917,2199,2026-01-11T05:38:15Z,Browser automation CLI for AI agents
luongnv89/claude-howto,Python,34755,4233,2025-11-07T22:59:34Z,"A visual, example-driven guide to Claude Code — from basic concepts to advanced agents, with copy-pa"
multica-ai/multica,TypeScript,34560,4170,2026-01-13T17:59:46Z,"The open-source managed agents platform. Turn coding agents into real teammates — assign tasks, trac"
github/awesome-copilot,Python,34236,4189,2025-06-11T16:57:39Z,"Community-contributed instructions, agents, skills, and configurations to help you make the most of "
kepano/obsidian-skills,Sin especificar,33898,2393,2026-01-02T21:45:11Z,"Agent skills for Obsidian. Teach your agent to use Markdown, Bases, JSON Canvas, and use the CLI."
pbakaus/impeccable,JavaScript,32319,1764,2025-11-16T01:52:04Z,The design language that makes your AI harness better at design.
zeroclaw-labs/zeroclaw,Rust,31682,4670,2026-02-13T08:56:04Z,"Fast, small, and fully autonomous AI personal assistant infrastructure, any OS, any platform — deplo"
Alishahryar1/free-claude-code,Python,31476,4770,2026-01-28T19:02:30Z,"Use claude-code for free in the terminal, VSCode extension or discord like OpenClaw (voice supported"
coreyhaines31/marketingskills,JavaScript,31453,5199,2026-01-15T19:45:23Z,"Marketing skills for Claude Code and AI agents. CRO, copywriting, SEO, analytics, and growth enginee"
hesamsheikh/awesome-openclaw-usecases,Sin especificar,31241,2687,2026-02-08T22:08:17Z,A community collection of OpenClaw use cases for making life easier.
Leonxlnx/taste-skill,Shell,30585,2268,2026-02-19T21:44:05Z,"Taste-Skill - gives your AI good taste. stops the AI from generating boring, generic slop "
tinyhumansai/openhuman,Rust,30208,2880,2026-02-18T20:01:27Z,"Your Personal AI super intelligence. Private, Simple and extremely powerful."
Yeachan-Heo/oh-my-codex,TypeScript,30116,2383,2026-02-02T14:21:18Z,"OmX - Oh My codeX: Your codex is not alone. Add hooks, agent teams, HUDs, and so much more."
nanocoai/nanoclaw,TypeScript,29601,12901,2026-01-31T15:47:22Z,"A lightweight alternative to OpenClaw that runs in containers for security. Connects to WhatsApp, Te"
lbjlaq/Antigravity-Manager,Rust,29532,3205,2025-11-26T10:47:13Z,Professional Antigravity Account Manager & Switcher. One-click seamless account switching for Antigr
sipeed/picoclaw,Go,29247,4193,2026-02-04T12:32:35Z,"Tiny, Fast, and Deployable anywhere — automate the mundane, unleash your creativity"
anthropics/financial-services,Python,29220,4096,2026-02-23T19:24:50Z,
jamiepine/voicebox,TypeScript,29037,3561,2026-01-25T12:27:03Z,"The open-source AI voice studio. Clone, dictate, create."
anthropics/claude-plugins-official,Python,29027,3093,2025-11-20T18:36:20Z,"Official, Anthropic-managed directory of high quality Claude Code Plugins."
Gitlawb/openclaude,TypeScript,28136,8660,2026-04-01T03:15:49Z,runs anywhere. uses anything
Crosstalk-Solutions/project-nomad,TypeScript,27942,2722,2025-06-24T15:35:01Z,"Project N.O.M.A.D, is a self-contained, offline survival computer packed with critical tools, knowle"
shiyu-coder/Kronos,Python,27890,4819,2025-07-01T02:54:32Z,Kronos: A Foundation Model for the Language of Financial Markets
davila7/claude-code-templates,Python,27706,2858,2025-07-04T01:26:26Z,CLI tool for configuring and monitoring Claude Code
hsliuping/TradingAgents-CN,Python,27678,5877,2025-06-26T07:45:09Z,基于多智能体LLM的中文金融交易框架 - TradingAgents中文增强版
vercel-labs/agent-skills,JavaScript,27405,2483,2025-12-08T19:10:06Z,Vercel's official collection of agent skills
iOfficeAI/AionUi,TypeScript,27355,2634,2025-08-07T10:29:51Z,"Free, local, open-source 24/7 Cowork app for OpenClaw, Hermes Agent, Claude Code, Codex, OpenCode, G"
AlexsJones/llmfit,Rust,27021,1645,2026-02-15T16:11:31Z,Hundreds of models & providers. One command to find what runs on your hardware.
mvanhorn/last30days-skill,Python,26910,2312,2026-01-23T20:37:37Z,"AI agent skill that researches any topic across Reddit, X, YouTube, HN, Polymarket, and the web - th"
K-Dense-AI/scientific-agent-skills,Python,26827,2774,2025-10-19T20:54:15Z,"Turn any AI agent into an AI Scientist. The #1 Agent Skills library for science, used by 160,000+ sc"
virattt/dexter,TypeScript,26747,3326,2025-10-14T21:02:00Z,An autonomous agent for deep financial research
googleworkspace/cli,Rust,26719,1406,2026-03-02T19:46:06Z,"Google Workspace CLI — one command-line tool for Drive, Gmail, Calendar, Sheets, Docs, Chat, Admin, "
BloopAI/vibe-kanban,Rust,26714,2808,2025-06-14T19:10:21Z,"Get 10X more out of Claude Code, Codex or any coding agent"
Leey21/awesome-ai-research-writing,Sin especificar,26665,2091,2026-01-30T07:59:30Z,"Elevate your AI research writing, no more tedious polishing ✨ "
firecrawl/open-lovable,TypeScript,26639,5118,2025-08-08T13:04:02Z,🔥 Clone and recreate any website as a modern React app in seconds
rohitg00/ai-engineering-from-scratch,Python,26497,4303,2026-03-18T18:38:02Z,Learn it. Build it. Ship it for others.
xai-org/x-algorithm,Rust,26003,4478,2026-01-19T23:12:35Z,Algorithm powering the For You feed on X
permissionlesstech/bitchat,Swift,25990,2481,2025-07-04T14:34:38Z,"bluetooth mesh chat, IRC vibes"
tobi/qmd,TypeScript,25925,1630,2025-12-08T14:22:57Z,"mini cli search engine for your docs, knowledge bases, meeting notes, whatever. Tracking current sot"
usestrix/strix,Python,25708,2880,2025-08-05T21:28:30Z,Open-source AI hackers to find and fix your app’s vulnerabilities.
Imbad0202/academic-research-skills,Python,25564,2102,2026-02-26T06:31:01Z,Academic Research Skills for Claude Code: research → write → review → revise → finalize
zai-org/Open-AutoGLM,Python,25400,3963,2025-12-08T09:23:44Z,An Open Phone Agent Model & Framework. Unlocking the AI Phone for Everyone
volcengine/OpenViking,Python,25005,1915,2026-01-05T07:11:17Z,OpenViking is an open-source context database designed specifically for AI Agents(such as openclaw).
openai/symphony,Elixir,24919,2488,2026-02-26T21:54:00Z,"Symphony turns project work into isolated, autonomous implementation runs, allowing teams to manage "
QwenLM/qwen-code,TypeScript,24823,2438,2025-06-26T01:37:46Z,An open-source AI coding agent that lives in your terminal.
Wei-Shaw/sub2api,Go,24713,4768,2025-12-18T02:26:18Z,Sub2API 一站式开源中转服务，让 Claude、Openai 、Gemini、Antigravity订阅统一接入，支持拼车共享，更高效分摊成本，原生工具无缝使用。
HKUDS/DeepTutor,Python,24470,3309,2025-12-28T15:35:54Z,"DeepTutor: Agent-native, Open-sourced Personalized Tutoring. https://deeptutor.info/."
toon-format/toon,TypeScript,24436,1084,2025-10-22T18:17:32Z,"🎒 Token-Oriented Object Notation (TOON) – Compact, human-readable, schema-aware JSON for LLM prompts"
gastownhall/beads,Go,24253,1618,2025-10-12T03:09:46Z,Beads - A memory upgrade for your coding agent
jarrodwatts/claude-hud,JavaScript,24232,1087,2026-01-02T01:35:07Z,"A Claude Code plugin that shows what's happening - context usage, active tools, running agents, and "
OpenBMB/VoxCPM,Python,24012,2767,2025-09-16T03:41:49Z,"VoxCPM2: Tokenizer-Free TTS for Multilingual Speech Generation, Creative Voice Design, and True-to-L"
VoltAgent/awesome-agent-skills,Sin especificar,23852,2561,2025-10-28T08:55:32Z,"A curated collection of 1000+ agent skills from official dev teams and the community, compatible wit"
langchain-ai/deepagents,Python,23655,3339,2025-07-27T23:07:53Z,The batteries-included agent harness.
basecamp/omarchy,Shell,23432,2353,2025-06-01T07:26:22Z,"Beautiful, Modern & Opinionated Linux"
jackwener/OpenCLI,JavaScript,23243,2334,2026-03-14T22:10:23Z,Make Any Website into CLI & Use your logged-in browser by AI agent. 
deepseek-ai/DeepSeek-OCR,Python,23215,2147,2025-10-17T06:14:27Z,Contexts Optical Compression
hugohe3/ppt-master,Python,23208,2116,2025-12-10T06:54:33Z,"AI generates a real, editable PowerPoint from any document — native shapes & animations, speaker not"
SuperClaude-Org/SuperClaude_Framework,Python,23112,1966,2025-06-22T12:03:53Z,"A configuration framework that enhances Claude Code with specialized commands, cognitive personas, a"
heygen-com/hyperframes,TypeScript,23054,2142,2026-03-10T01:51:06Z,Write HTML. Render video. Built for agents.
CloakHQ/CloakBrowser,Python,23041,1835,2026-02-22T08:09:57Z,Stealth Chromium that passes every bot detection test. Drop-in Playwright replacement with source-le
PicoTrex/Awesome-Nano-Banana-images,Sin especificar,22922,2368,2025-08-28T17:03:09Z,"A curated collection of fun and creative examples generated with Nano Banana & Nano Banana Pro🍌, Gem"
p-e-w/heretic,Python,22904,2453,2025-09-21T05:46:16Z,Fully automatic censorship removal for language models
OpenListTeam/OpenList,Go,22809,2004,2025-06-11T23:35:02Z,A new AList Fork to Anti Trust Crisis
OthmanAdi/planning-with-files,Python,22481,1993,2026-01-03T07:37:28Z,Claude Code skill implementing Manus-style persistent markdown planning — the workflow pattern behin
alchaincyf/nuwa-skill,Python,22204,3325,2026-04-05T04:33:04Z,你想蒸馏的下一个员工，何必是同事。蒸馏任何人的思维方式——心智模型、决策启发式、表达DNA。Distill how anyone thinks.
winfunc/opcode,TypeScript,21982,1700,2025-06-19T13:53:26Z,"A powerful GUI app and Toolkit for Claude Code - Create custom agents, manage interactive Claude Cod"
blader/humanizer,Sin especificar,21913,2088,2026-01-18T05:30:15Z,Claude Code skill that removes signs of AI-generated writing from text
agentsmd/agents.md,TypeScript,21880,1606,2025-08-19T17:22:54Z,"AGENTS.md — a simple, open format for guiding coding agents"
czlonkowski/n8n-mcp,TypeScript,21432,3471,2025-06-07T12:15:57Z,A MCP for Claude Desktop / Claude Code / Windsurf / Cursor to build n8n workflows for you 
slopus/happy,TypeScript,21424,1780,2025-07-18T05:53:18Z,"Mobile and Web client for Codex and Claude Code, with realtime voice, encryption and fully featured"
2025Emma/vibe-coding-cn,Python,21328,2303,2025-12-17T00:10:23Z,
NawfalMotii79/PLFM_RADAR,PLSQL,21152,4999,2026-03-08T23:20:58Z,"Open-source, low-cost 10.5 GHz PLFM phased array RADAR system"
openai/skills,Python,21038,1418,2025-11-25T06:25:42Z,Skills Catalog for Codex
VoltAgent/awesome-claude-code-subagents,Shell,21002,2462,2025-07-30T12:31:51Z,A collection of 100+ specialized Claude Code subagents covering a wide range of development use case
vercel-labs/skills,TypeScript,20902,1674,2026-01-14T21:31:18Z,The open agent skills tool - npx skills
coze-dev/coze-studio,TypeScript,20891,3028,2025-06-26T02:19:21Z,"An AI agent development platform with all-in-one visual tools, simplifying agent creation, debugging"
HKUDS/RAG-Anything,Python,20833,2422,2025-06-06T06:47:29Z,"""RAG-Anything: All-in-One RAG Framework"""
AIDC-AI/Pixelle-Video,Python,20824,2917,2025-11-07T06:34:27Z,🚀 AI 全自动短视频引擎 | AI Fully Automated Short Video Engine
NVIDIA/NemoClaw,TypeScript,20783,2760,2026-03-15T17:04:09Z,Run agents like Hermes and OpenClaw more securely inside NVIDIA OpenShell with managed inference
Panniantong/Agent-Reach,Python,20760,1828,2026-02-24T02:10:24Z,"Give your AI agent eyes to see the entire internet. Read & search Twitter, Reddit, YouTube, GitHub, "
manaflow-ai/cmux,JavaScript,20649,1550,2026-01-28T10:03:24Z,Ghostty-based macOS terminal with vertical tabs and notifications for AI coding agents
NirDiamant/agents-towards-production,Jupyter Notebook,20576,2735,2025-06-16T17:33:44Z,"End-to-end, code-first tutorials for building production-grade GenAI agents. From prototype to enter"
Donchitos/Claude-Code-Game-Studios,Shell,20559,2999,2026-02-12T05:21:38Z,"Turn Claude Code into a full game dev studio — 49 AI agents, 72 workflow skills, and a complete coor"
rohitg00/agentmemory,TypeScript,20407,1684,2026-02-25T07:32:52Z,#1 Persistent memory for AI coding agents based on real-world benchmarks
garrytan/gbrain,TypeScript,20277,2879,2026-04-05T14:40:56Z,Garry's Opinionated OpenClaw/Hermes Agent Brain
openai/gpt-oss,Python,20132,2086,2025-06-23T16:43:33Z,gpt-oss-120b and gpt-oss-20b are two open-weight language models by OpenAI
JimLiu/baoyu-skills,TypeScript,20083,2349,2026-01-13T03:04:56Z,
openai/codex-plugin-cc,JavaScript,20061,1215,2026-03-30T15:29:52Z,Use Codex from Claude Code to review code or delegate tasks.
zarazhangrui/frontend-slides,JavaScript,19876,1631,2026-01-28T00:42:34Z,Create beautiful slides on the web using a coding agent's frontend skills
snarktank/ralph,TypeScript,19827,1968,2026-01-07T14:45:10Z,Ralph is an autonomous AI agent loop that runs repeatedly until all PRD items are complete. 
karpathy/llm-council,Python,19801,3749,2025-11-22T23:24:14Z,LLM Council works together to answer your hardest questions
agentskills/agentskills,Python,19735,1229,2025-12-16T15:47:19Z,Specification and documentation for Agent Skills
claude-code-best/claude-code,TypeScript,19293,16026,2026-03-31T13:33:21Z,"原汁原昧 Claude Code 可运行,可构建, 可调试版; 生产级工程化, 企业级可靠性; 安全无毒, 内存泄露修复"
HKUDS/AI-Trader,Python,19034,2901,2025-10-23T12:45:00Z,"""AI-Trader: 100% Fully-Automated Agent-Native Trading""  "
EveryInc/compound-engineering-plugin,TypeScript,18972,1422,2025-10-09T19:43:46Z,"Official Compound Engineering plugin for Claude Code, Codex, Cursor, and more"
titanwings/colleague-skill,Python,18768,1868,2026-03-30T05:22:23Z,将冰冷的离别化为温暖的 Skill，欢迎加入数字生命1.0！Transforming cold farewells into warm skills? It's giving rebirth era.
anthropics/knowledge-work-plugins,Python,18572,2181,2026-01-23T20:11:54Z,Open source repository of plugins primarily intended for knowledge workers to use in Claude Cowork
Nagi-ovo/gemini-voyager,TypeScript,18477,583,2025-10-04T23:42:35Z,"An all-in-one enhancement suite for Google Gemini & AI Studio - timeline navigation, folder manageme"
alibaba/page-agent,TypeScript,18210,1551,2025-09-23T09:30:17Z,JavaScript in-page GUI agent. Control web interfaces with natural language.
THU-MAIC/OpenMAIC,TypeScript,18192,3562,2026-03-11T10:13:16Z,"Open Multi-Agent Interactive Classroom — Get an immersive, multi-agent learning experience in just o"
tanweai/pua,TypeScript,17861,1062,2026-03-08T16:55:16Z,你是一个曾经被寄予厚望的 P8 级工程师。Anthropic 当初给你定级的时候，对你的期望是很高的。  一个agent使用的高能动性的skill。  Your AI has been placed 
tirth8205/code-review-graph,Python,17813,1916,2026-02-26T17:25:13Z,Local-first code intelligence graph for MCP and CLI. Builds a persistent map of your codebase so AI 
RightNow-AI/openfang,Rust,17701,2256,2026-02-24T23:12:38Z,Open-source Agent Operating System
pranshuparmar/witr,Go,17613,546,2025-12-20T17:26:59Z,Why is this running?
microsoft/agent-lightning,Python,17261,1508,2025-06-18T07:28:45Z,The absolute trainer to light up AI agents.
agentscope-ai/QwenPaw,Python,17140,2539,2026-02-24T03:42:56Z,"Your Personal AI Assistant; easy to install, deploy on your own machine or on the cloud; supports mu"
alirezarezvani/claude-skills,Python,16789,2311,2025-10-19T04:04:05Z,"337 Claude Code skills & agent skills & plugins (30+ Agents, 70+ custom commands, 330+ skills, custo"
Snapchat/Valdi,C++,16381,543,2025-11-06T17:33:28Z,Valdi is a cross-platform UI framework that delivers native performance without sacrificing develope
pascalorg/editor,TypeScript,16360,2162,2025-10-16T19:35:06Z,Create and share 3D architectural projects.
muratcankoylan/Agent-Skills-for-Context-Engineering,Python,16224,1314,2025-12-21T02:43:42Z,"A comprehensive collection of Agent Skills for context engineering, multi-agent architectures, and p"
mksglu/context-mode,TypeScript,16161,1169,2026-02-23T05:56:28Z,"Context window optimization for AI coding agents. Sandboxes tool output, 98% reduction. 15 platforms"
Wan-Video/Wan2.2,Python,16018,1977,2025-07-28T08:17:01Z,Wan: Open and Advanced Large-Scale Video Generative Models
cft0808/edict,Python,15932,1678,2026-02-23T14:35:04Z,🏛️ 三省六部制 · OpenClaw Multi-Agent Orchestration System — 9 specialized AI agents with real-time dashbo
JCodesMore/ai-website-cloner-template,TypeScript,15917,2431,2026-03-13T11:14:39Z,Clone any website with one command using AI coding agents
alchaincyf/huashu-design,HTML,15915,2068,2026-04-19T14:42:06Z,Huashu Design · HTML-native design skill for Claude Code · Claude Code 里 HTML 原生的设计 skill · 高保真原型 / 
webadderallorg/Recordly,TypeScript,15880,1123,2026-03-12T23:38:32Z,Create polished demo videos without editing skills. Mac/Windows/Linux
Tencent/WeKnora,Go,15869,2034,2025-07-22T08:01:23Z,"Open-source LLM knowledge platform: turn raw documents into a queryable RAG, an autonomous reasoning"
EvoLinkAI/awesome-gpt-image-2-API-and-Prompts,Python,15832,1596,2026-04-18T11:22:14Z,GPT-Image-2 API and Prompts
esengine/DeepSeek-Reasonix,Go,15810,932,2026-04-21T08:27:02Z,DeepSeek-native AI coding agent for your terminal. Engineered around prefix-cache stability — leave 
different-ai/openwork,TypeScript,15699,1545,2026-01-14T01:39:31Z,An open-source alternative to Claude Cowork (powered by opencode)
gastownhall/gastown,Go,15677,1457,2025-12-16T00:33:33Z,Gas Town - multi-agent workspace manager
