repo_name,language,stars,forks,created_at,description
openclaw/openclaw,TypeScript,356077,72130,2025-11-24T10:16:47Z,Your own personal AI assistant. Any OS. Any Platform. The lobster way. 🦞 
ultraworkers/claw-code,Rust,182919,107661,2026-03-31T08:58:08Z,The repo is finally unlocked. enjoy the party! The fastest repo in history to surpass 100K stars ⭐. 
affaan-m/everything-claude-code,JavaScript,153498,23804,2026-01-18T00:51:51Z,"The agent harness performance optimization system. Skills, instincts, memory, security, and research"
obra/superpowers,Shell,149382,12903,2025-10-09T19:45:18Z,An agentic skills framework & software development methodology that works.
anomalyco/opencode,TypeScript,142349,15997,2025-04-30T20:08:00Z,The open source coding agent.
anthropics/skills,Python,116286,13349,2025-09-22T15:53:31Z,Public repository for Agent Skills
google-gemini/gemini-cli,TypeScript,101071,13072,2025-04-17T17:04:31Z,An open-source AI agent that brings the power of Gemini directly into your terminal.
github/spec-kit,Python,87484,7522,2025-08-21T22:54:31Z,💫 Toolkit to help you get started with Spec-Driven Development
msitarzewski/agency-agents,Shell,79163,12622,2025-10-13T12:12:29Z,"A complete AI agency at your fingertips - From frontend wizards to Reddit community ninjas, from whi"
openai/codex,Rust,74930,10594,2025-04-13T05:37:54Z,Lightweight coding agent that runs in your terminal
NousResearch/hermes-agent,Python,73147,9726,2025-07-22T22:22:28Z,The agent that grows with you
karpathy/autoresearch,Python,71277,10408,2026-03-06T22:00:43Z,AI agents running research on single-GPU nanochat training automatically
garrytan/gstack,TypeScript,71054,9995,2026-03-11T21:22:45Z,"Use Garry Tan's exact Claude Code setup: 23 opinionated tools that serve as CEO, Designer, Eng Manag"
nextlevelbuilder/ui-ux-pro-max-skill,Python,64010,6432,2025-11-30T11:36:31Z,An AI SKILL that provide design intelligence for building professional UI/UX multiple platforms
bytedance/deer-flow,Python,60997,7817,2025-05-07T02:50:19Z,"An open-source long-horizon SuperAgent harness that researches, codes, and creates. With the help of"
666ghj/MiroFish,Python,54420,8184,2025-11-26T04:23:02Z,"A Simple and Universal Swarm Intelligence Engine, Predicting Anything. 简洁通用的群体智能引擎，预测万物"
Zie619/n8n-workflows,Python,53722,7001,2025-05-14T08:43:59Z,all of the workflows of n8n i could find (also from the site itself)
ComposioHQ/awesome-claude-skills,Python,53399,5711,2025-10-17T07:15:01Z,"A curated list of awesome Claude Skills, resources, and tools for customizing Claude AI workflows"
paperclipai/paperclip,TypeScript,52656,8823,2026-03-02T15:01:51Z,Open-source orchestration for zero-human companies
shareAI-lab/learn-claude-code,TypeScript,52554,8611,2025-06-29T15:34:15Z,"Bash is all you need -  A nano claude code–like 「agent harness」, built from 0 to 1"
karpathy/nanochat,Python,51711,6868,2025-10-13T13:46:35Z,The best ChatGPT that $100 can buy.
gsd-build/get-shit-done,JavaScript,51589,4333,2025-12-14T14:17:12Z,"A light-weight and powerful meta-prompting, context engineering and spec-driven development system f"
sansan0/TrendRadar,Python,51558,23101,2025-04-28T11:42:16Z,"⭐AI-driven public opinion & trend monitor with multi-platform aggregation, RSS, and smart alerts.🎯 告"
thedotmack/claude-mem,TypeScript,51305,4049,2025-08-31T20:50:03Z,"A Claude Code plugin that automatically captures everything Claude does during your coding sessions,"
code-yeongyu/oh-my-openagent,TypeScript,51131,4093,2025-12-03T01:40:05Z,omo; the best agent harness - previously oh-my-opencode
koala73/worldmonitor,TypeScript,48066,7841,2026-01-08T17:26:06Z,"Real-time global intelligence dashboard. AI-powered news aggregation, geopolitical monitoring, and i"
OpenCut-app/OpenCut,TypeScript,47995,5047,2025-06-22T08:02:17Z,The open-source CapCut alternative
VoltAgent/awesome-design-md,Sin especificar,47186,5856,2026-03-31T16:37:01Z,A collection of DESIGN.md files inspired by popular brand design systems. Drop one into your project
tw93/Mole,Shell,46626,1417,2025-09-23T06:38:40Z,🐹 Deep clean and optimize your Mac.
ruvnet/RuView,Rust,46529,6293,2025-06-07T04:32:30Z,"π RuView: WiFi DensePose turns commodity WiFi signals into real-time human pose estimation, vital si"
VoltAgent/awesome-openclaw-skills,Sin especificar,45810,4449,2026-01-25T09:22:32Z,"The awesome collection of OpenClaw skills. 5,400+ skills filtered and categorized from the official "
bmad-code-org/BMAD-METHOD,JavaScript,44443,5284,2025-04-13T14:54:25Z,Breakthrough Method for Agile Ai Driven Development
MemPalace/mempalace,Python,44088,5650,2026-04-05T01:12:07Z,The highest-scoring AI memory system ever benchmarked. And it's free.
farion1231/cc-switch,Rust,43827,2764,2025-08-04T14:16:16Z,"A cross-platform desktop All-in-One assistant tool for Claude Code, Codex, OpenCode, openclaw & Gemi"
chenglou/pretext,TypeScript,43387,2359,2026-03-07T21:06:28Z,"Fast, accurate & comprehensive text measurement & layout"
shanraisshan/claude-code-best-practice,HTML,40139,3792,2025-10-31T14:15:28Z,practice made claude perfect
Fission-AI/OpenSpec,TypeScript,39478,2689,2025-08-05T10:37:45Z,Spec-driven development (SDD) for AI coding assistants.
HKUDS/nanobot,Python,39310,6877,2026-02-01T07:16:15Z,"""🐈 nanobot: The Ultra-Lightweight Personal AI Agent"""
microsoft/VibeVoice,Python,39153,4530,2025-08-25T13:24:01Z,Open-Source Frontier Voice AI
hesreallyhim/awesome-claude-code,Python,38408,3137,2025-04-19T20:55:59Z,"A curated list of awesome skills, hooks, slash-commands, agent orchestrators, applications, and plug"
asgeirtj/system_prompts_leaks,Sin especificar,38238,6300,2025-05-03T02:43:56Z,"Extracted system prompts from ChatGPT (GPT-5.4, GPT-5.3, Codex), Claude (Opus 4.6, Sonnet 4.6, Claud"
KeygraphHQ/shannon,TypeScript,38148,4091,2025-09-27T01:51:47Z,"Shannon Lite is an autonomous, white-box AI pentester for web applications and APIs. It analyzes you"
datawhalechina/hello-agents,Python,35760,4220,2025-09-07T09:50:24Z,📚 《从零开始构建智能体》——从零开始的智能体原理与实践教程
google/langextract,Python,35614,2419,2025-07-08T20:46:06Z,A Python library for extracting structured information from unstructured text using LLMs with precis
badlogic/pi-mono,TypeScript,35013,3982,2025-08-09T14:03:50Z,"AI agent toolkit: coding agent CLI, unified LLM API, TUI & web UI libraries, Slack bot, vLLM pods"
ChromeDevTools/chrome-devtools-mcp,TypeScript,34667,2107,2025-09-11T10:39:55Z,Chrome DevTools for coding agents
wshobson/agents,Python,33507,3632,2025-07-24T23:28:14Z,Intelligent automation and multi-agent orchestration for Claude Code
sickn33/antigravity-awesome-skills,Python,32549,5418,2026-01-14T17:48:09Z,"Installable GitHub library of 1,400+ agentic skills for Claude Code, Cursor, Codex CLI, Gemini CLI, "
santifer/career-ops,JavaScript,32101,6290,2026-04-04T18:21:18Z,"AI-powered job search system built on Claude Code. 14 skill modes, Go dashboard, PDF generation, bat"
ruvnet/ruflo,TypeScript,31505,3523,2025-06-02T21:24:20Z,"🌊 The leading agent orchestration platform for Claude. Deploy intelligent multi-agent swarms, coordi"
HKUDS/CLI-Anything,Python,30426,2915,2026-03-08T13:52:57Z,"""CLI-Anything: Making ALL Software Agent-Native"" -- CLI-Hub: https://clianything.cc/"
zeroclaw-labs/zeroclaw,Rust,30067,4318,2026-02-13T08:56:04Z,"Fast, small, and fully autonomous AI personal assistant infrastructure, ANY OS, ANY PLATFORM — deplo"
ZhuLinsen/daily_stock_analysis,Python,29626,30336,2026-01-10T06:43:20Z,LLM驱动的 A/H/美股智能分析器：多数据源行情 + 实时新闻 + LLM决策仪表盘 + 多渠道推送，零成本定时运行，纯白嫖. LLM-powered stock analysis system f
github/awesome-copilot,Python,29484,3480,2025-06-11T16:57:39Z,"Community-contributed instructions, agents, skills, and configurations to help you make the most of "
hesamsheikh/awesome-openclaw-usecases,Sin especificar,29485,2513,2026-02-08T22:08:17Z,A community collection of OpenClaw use cases for making life easier.
siddharthvaddem/openscreen,TypeScript,29086,1975,2025-10-10T05:36:55Z,"Create stunning demos for free. Open-source, no subscriptions, no watermarks, and free for commercia"
vercel-labs/agent-browser,Rust,28926,1762,2026-01-11T05:38:15Z,Browser automation CLI for AI agents
Yeachan-Heo/oh-my-claudecode,TypeScript,28266,2612,2026-01-09T03:36:29Z,Teams-first Multi-agent orchestration for Claude Code
lbjlaq/Antigravity-Manager,Rust,28135,3069,2025-11-26T10:47:13Z,Professional Antigravity Account Manager & Switcher. One-click seamless account switching for Antigr
sipeed/picoclaw,Go,28086,3997,2026-02-04T12:32:35Z,"Tiny, Fast, and Deployable anywhere — automate the mundane, unleash your creativity"
qwibitai/nanoclaw,TypeScript,27195,11812,2026-01-31T15:47:22Z,"A lightweight alternative to OpenClaw that runs in containers for security. Connects to WhatsApp, Te"
abhigyanpatwari/GitNexus,TypeScript,27004,3057,2025-08-02T23:20:31Z,GitNexus: The Zero-Server Code Intelligence Engine -       GitNexus is a client-side knowledge graph
apple/container,Swift,25871,724,2025-05-30T21:26:05Z,A tool for creating and running Linux containers using lightweight virtual machines on a Mac. It is 
luongnv89/claude-howto,Python,25870,3122,2025-11-07T22:59:34Z,"A visual, example-driven guide to Claude Code — from basic concepts to advanced agents, with copy-pa"
permissionlesstech/bitchat,Swift,25705,2422,2025-07-04T14:34:38Z,"bluetooth mesh chat, IRC vibes"
router-for-me/CLIProxyAPI,Go,25563,4278,2025-07-01T19:43:27Z,"Wrap Gemini CLI, Antigravity, ChatGPT Codex, Claude Code, Qwen Code, iFlow as an OpenAI/Gemini/Claud"
zama-ai/fhevm,Rust,25378,2052,2025-05-02T10:48:20Z,"FHEVM, a full-stack framework for integrating Fully Homomorphic Encryption (FHE) with blockchain app"
rtk-ai/rtk,Rust,25008,1452,2026-01-22T16:54:16Z,"CLI proxy that reduces LLM token consumption by 60-90% on common dev commands. Single Rust binary, z"
vercel-labs/agent-skills,JavaScript,24984,2271,2025-12-08T19:10:06Z,Vercel's official collection of agent skills
BloopAI/vibe-kanban,Rust,24946,2508,2025-06-14T19:10:21Z,"Get 10X more out of Claude Code, Codex or any coding agent"
zai-org/Open-AutoGLM,Python,24888,3914,2025-12-08T09:23:44Z,An Open Phone Agent Model & Framework. Unlocking the AI Phone for Everyone
firecrawl/open-lovable,TypeScript,24755,4799,2025-08-08T13:04:02Z,🔥 Clone and recreate any website as a modern React app in seconds
googleworkspace/cli,Rust,24532,1244,2026-03-02T19:46:06Z,"Google Workspace CLI — one command-line tool for Drive, Gmail, Calendar, Sheets, Docs, Chat, Admin, "
davila7/claude-code-templates,Python,24529,2416,2025-07-04T01:26:26Z,CLI tool for configuring and monitoring Claude Code
safishamsi/graphify,Python,24313,2572,2026-04-03T15:49:07Z,"AI coding assistant skill (Claude Code, Codex, OpenCode, Cursor, Gemini CLI, GitHub Copilot CLI, Ope"
resemble-ai/chatterbox,Python,24270,3231,2025-04-23T08:16:38Z,SoTA open-source TTS
hsliuping/TradingAgents-CN,Python,23957,5034,2025-06-26T07:45:09Z,基于多智能体LLM的中文金融交易框架 - TradingAgents中文增强版
toon-format/toon,TypeScript,23805,1065,2025-10-22T18:17:32Z,"🎒 Token-Oriented Object Notation (TOON) – Compact, human-readable, schema-aware JSON for LLM prompts"
usestrix/strix,Python,23551,2562,2025-08-05T21:28:30Z,Open-source AI hackers to find and fix your app’s vulnerabilities.
kepano/obsidian-skills,Sin especificar,23387,1472,2026-01-02T21:45:11Z,"Agent skills for Obsidian. Teach your agent to use Markdown, Bases, JSON Canvas, and use the CLI."
JuliusBrussee/caveman,Python,23385,1084,2026-04-04T10:03:00Z,🪨 why use many token when few token do trick — Claude Code skill that cuts 65% of tokens by talking 
Crosstalk-Solutions/project-nomad,TypeScript,23335,2279,2025-06-24T15:35:01Z,"Project N.O.M.A.D, is a self-contained, offline survival computer packed with critical tools, knowle"
AlexsJones/llmfit,Rust,23138,1380,2026-02-15T16:11:31Z,Hundreds of models & providers. One command to find what runs on your hardware.
QwenLM/qwen-code,TypeScript,22950,2131,2025-06-26T01:37:46Z,An open-source AI agent that lives in your terminal.
charmbracelet/crush,Go,22927,1501,2025-05-21T12:14:57Z,Glamourous agentic coding for all 💘
deepseek-ai/DeepSeek-OCR,Python,22813,2099,2025-10-17T06:14:27Z,Contexts Optical Compression
SuperClaude-Org/SuperClaude_Framework,Python,22268,1875,2025-06-22T12:03:53Z,"A configuration framework that enhances Claude Code with specialized commands, cognitive personas, a"
volcengine/OpenViking,Python,22154,1608,2026-01-05T07:11:17Z,OpenViking is an open-source context database designed specifically for AI Agents(such as openclaw).
PicoTrex/Awesome-Nano-Banana-images,Sin especificar,22075,2265,2025-08-28T17:03:09Z,"A curated collection of fun and creative examples generated with Nano Banana & Nano Banana Pro🍌, Gem"
Yeachan-Heo/oh-my-codex,TypeScript,21979,1924,2026-02-02T14:21:18Z,"OmX - Oh My codeX: Your codex is not alone. Add hooks, agent teams, HUDs, and so much more."
OpenListTeam/OpenList,Go,21892,1875,2025-06-11T23:35:02Z,A new AList Fork to Anti Trust Crisis
basecamp/omarchy,Shell,21856,2179,2025-06-01T07:26:22Z,"Beautiful, Modern & Opinionated Linux"
iOfficeAI/AionUi,TypeScript,21627,1798,2025-08-07T10:29:51Z,"Free, local, open-source 24/7 Cowork app and OpenClaw for Gemini CLI, Claude Code, Codex, OpenCode, "
winfunc/opcode,TypeScript,21446,1648,2025-06-19T13:53:26Z,"A powerful GUI app and Toolkit for Claude Code - Create custom agents, manage interactive Claude Cod"
mvanhorn/last30days-skill,Python,21273,1734,2026-01-23T20:37:37Z,"AI agent skill that researches any topic across Reddit, X, YouTube, HN, Polymarket, and the web - th"
tobi/qmd,TypeScript,21258,1313,2025-12-08T14:22:57Z,"mini cli search engine for your docs, knowledge bases, meeting notes, whatever. Tracking current sot"
virattt/dexter,TypeScript,21251,2559,2025-10-14T21:02:00Z,An autonomous agent for deep financial research
enescingoz/awesome-n8n-templates,Sin especificar,21086,5820,2025-05-08T18:34:01Z,"280+ free n8n automation templates — ready-to-use workflows for Gmail, Telegram, Slack, Discord, Wha"
Gitlawb/openclaude,TypeScript,21053,7313,2026-04-01T03:15:49Z,"Open Claude Is Open-source coding-agent CLI for OpenAI, Gemini, DeepSeek, Ollama, Codex, GitHub Mode"
coreyhaines31/marketingskills,JavaScript,20689,3265,2026-01-15T19:45:23Z,"Marketing skills for Claude Code and AI agents. CRO, copywriting, SEO, analytics, and growth enginee"
gastownhall/beads,Go,20653,1382,2025-10-12T03:09:46Z,Beads - A memory upgrade for your coding agent
langchain-ai/deepagents,Python,20555,2849,2025-07-27T23:07:53Z,"Agent harness built with LangChain and LangGraph. Equipped with a planning tool, a filesystem backen"
coze-dev/coze-studio,TypeScript,20500,2966,2025-06-26T02:19:21Z,"An AI agent development platform with all-in-one visual tools, simplifying agent creation, debugging"
agentsmd/agents.md,TypeScript,20089,1460,2025-08-19T17:22:54Z,"AGENTS.md — a simple, open format for guiding coding agents"
openai/gpt-oss,Python,20000,2062,2025-06-23T16:43:33Z,gpt-oss-120b and gpt-oss-20b are two open-weight language models by OpenAI
stan-smith/FossFLOW,TypeScript,19599,1293,2025-06-30T14:31:21Z,Make beautiful isometric infrastructure diagrams
forrestchang/andrej-karpathy-skills,Sin especificar,19418,1553,2026-01-27T03:53:13Z,"A single CLAUDE.md file to improve Claude Code behavior, derived from Andrej Karpathy's observations"
nari-labs/dia,Python,19249,1681,2025-04-19T07:15:57Z,A TTS model capable of generating ultra-realistic dialogue in one pass.
2025Emma/vibe-coding-cn,Python,19210,2077,2025-12-17T00:10:23Z,
p-e-w/heretic,Python,19168,1918,2025-09-21T05:46:16Z,Fully automatic censorship removal for language models
NVIDIA/NemoClaw,TypeScript,19107,2339,2026-03-15T17:04:09Z,Run OpenClaw more securely inside NVIDIA OpenShell with managed inference
pbakaus/impeccable,JavaScript,18819,840,2025-11-16T01:52:04Z,The design language that makes your AI harness better at design.
NirDiamant/agents-towards-production,Jupyter Notebook,18761,2496,2025-06-16T17:33:44Z,"End-to-end, code-first tutorials for building production-grade GenAI agents. From prototype to enter"
jarrodwatts/claude-hud,JavaScript,18743,827,2026-01-02T01:35:07Z,"A Claude Code plugin that shows what's happening - context usage, active tools, running agents, and "
OthmanAdi/planning-with-files,Python,18628,1668,2026-01-03T07:37:28Z,Claude Code skill implementing Manus-style persistent markdown planning — the workflow pattern behin
K-Dense-AI/scientific-agent-skills,Python,18292,2030,2025-10-19T20:54:15Z,"A set of ready to use Agent Skills for research, science, engineering, analysis, finance and writing"
astral-sh/ty,Python,18275,281,2025-05-02T16:37:51Z,"An extremely fast Python type checker and language server, written in Rust."
google-gemini/gemini-fullstack-langgraph-quickstart,Jupyter Notebook,18086,3069,2025-05-22T11:59:02Z,Get started with building Fullstack Agents using Gemini 2.5 and LangGraph
czlonkowski/n8n-mcp,TypeScript,17990,3030,2025-06-07T12:15:57Z,A MCP for Claude Desktop / Claude Code / Windsurf / Cursor to build n8n workflows for you 
slopus/happy,TypeScript,17851,1459,2025-07-18T05:53:18Z,"Mobile and Web client for Codex and Claude Code, with realtime voice, encryption and fully featured"
HKUDS/DeepTutor,Python,17503,2299,2025-12-28T15:35:54Z,"""DeepTutor: Agent-Native Personalized Learning Assistant"""
Leey21/awesome-ai-research-writing,Sin especificar,17263,1397,2026-01-30T07:59:30Z,"Elevate your AI research writing, no more tedious polishing ✨ "
Panniantong/Agent-Reach,Python,17209,1515,2026-02-24T02:10:24Z,"Give your AI agent eyes to see the entire internet. Read & search Twitter, Reddit, YouTube, GitHub, "
VoltAgent/awesome-claude-code-subagents,Shell,17130,1959,2025-07-30T12:31:51Z,A collection of 100+ specialized Claude Code subagents covering a wide range of development use case
karpathy/llm-council,Python,16991,3372,2025-11-22T23:24:14Z,LLM Council works together to answer your hardest questions
alibaba/page-agent,TypeScript,16893,1372,2025-09-23T09:30:17Z,JavaScript in-page GUI agent. Control web interfaces with natural language.
microsoft/agent-lightning,Python,16815,1464,2025-06-18T07:28:45Z,The absolute trainer to light up AI agents.
anthropics/claude-plugins-official,Python,16814,1948,2025-11-20T18:36:20Z,"Official, Anthropic-managed directory of high quality Claude Code Plugins."
openai/skills,Python,16709,1031,2025-11-25T06:25:42Z,Skills Catalog for Codex
RightNow-AI/openfang,Rust,16593,2078,2026-02-24T23:12:38Z,Open-source Agent Operating System
shiyu-coder/Kronos,Python,16453,3121,2025-07-01T02:54:32Z,Kronos: A Foundation Model for the Language of Financial Markets
Snapchat/Valdi,C++,16381,545,2025-11-06T17:33:28Z,Valdi is a cross-platform UI framework that delivers native performance without sacrificing develope
Nagi-ovo/gemini-voyager,TypeScript,16324,502,2025-10-04T23:42:35Z,"An all-in-one enhancement suite for Google Gemini & AI Studio - timeline navigation, folder manageme"
opendataloader-project/opendataloader-pdf,Java,16320,1411,2025-05-13T05:48:02Z,PDF Parser for AI-ready data. Automate PDF accessibility. Open-source.
xai-org/x-algorithm,Rust,16293,2814,2026-01-19T23:12:35Z,Algorithm powering the For You feed on X
snarktank/ralph,TypeScript,16248,1612,2026-01-07T14:45:10Z,Ralph is an autonomous AI agent loop that runs repeatedly until all PRD items are complete. 
agentskills/agentskills,Python,15980,943,2025-12-16T15:47:19Z,Specification and documentation for Agent Skills
tanweai/pua,TypeScript,15942,912,2026-03-08T16:55:16Z,你是一个曾经被寄予厚望的 P8 级工程师。Anthropic 当初给你定级的时候，对你的期望是很高的。  一个agent使用的高能动性的skill。  Your AI has been placed 
HKUDS/RAG-Anything,Python,15619,1854,2025-06-06T06:47:29Z,"""RAG-Anything: All-in-One RAG Framework"""
claude-code-best/claude-code,TypeScript,15617,14957,2026-03-31T13:33:21Z,"原汁原昧 Claude Code 可运行,可构建, 可调试版; Typescript 类型全修复; 企业级可靠性; 安全无毒, lock 文件保真, 可直接 bun i; bun run dev 启动"
game1024/OpenSpeedy,C++,15615,1175,2025-05-16T16:25:43Z,🎮 An open-source game speed modifier.
AsyncFuncAI/deepwiki-open,Python,15592,1751,2025-04-30T06:01:29Z,Open Source DeepWiki: AI-Powered Wiki Generator for GitHub/Gitlab/Bitbucket Repositories. Join the d
jamiepine/voicebox,TypeScript,15562,1859,2026-01-25T12:27:03Z,The open-source voice synthesis studio
VoltAgent/awesome-agent-skills,Sin especificar,15447,1646,2025-10-28T08:55:32Z,"A curated collection of 1000+ agent skills from official dev teams and the community, compatible wit"
jackwener/OpenCLI,JavaScript,15392,1470,2026-03-14T22:10:23Z,"Make Any Website & Tool Your CLI. A universal CLI Hub and AI-native runtime. Transform any website, "
THU-MAIC/OpenMAIC,TypeScript,15337,2769,2026-03-11T10:13:16Z,"Open Multi-Agent Interactive Classroom — Get an immersive, multi-agent learning experience in just o"
Wan-Video/Wan2.2,Python,15214,1855,2025-07-28T08:17:01Z,Wan: Open and Advanced Large-Scale Video Generative Models
agentscope-ai/QwenPaw,Python,15187,2046,2026-02-24T03:42:56Z,"Your Personal AI Assistant; easy to install, deploy on your own machine or on the cloud; supports mu"
HKUDS/DeepCode,Python,15175,2043,2025-05-14T05:23:02Z,"""DeepCode: Open Agentic Coding (Paper2Code & Text2Web & Text2Backend)"""
openai/symphony,Elixir,15004,1257,2026-02-26T21:54:00Z,"Symphony turns project work into isolated, autonomous implementation runs, allowing teams to manage "
muratcankoylan/Agent-Skills-for-Context-Engineering,Python,15001,1180,2025-12-21T02:43:42Z,"A comprehensive collection of Agent Skills for context engineering, multi-agent architectures, and p"
cft0808/edict,Python,14986,1568,2026-02-23T14:35:04Z,🏛️ 三省六部制 · OpenClaw Multi-Agent Orchestration System — 9 specialized AI agents with real-time dashbo
memvid/memvid,Rust,14889,1289,2025-05-27T16:01:08Z,"Memory layer for AI Agents. Replace complex RAG pipelines with a serverless, single-file memory laye"
mattpocock/skills,Shell,14527,1198,2026-02-03T11:15:53Z,"My personal directory of skills, straight from my .claude directory."
JimLiu/baoyu-skills,TypeScript,14314,1657,2026-01-13T03:04:56Z,
addyosmani/agent-skills,Shell,14302,1801,2026-02-15T20:20:26Z,Production-grade engineering skills for AI coding agents.
pranshuparmar/witr,Go,14279,359,2025-12-20T17:26:59Z,Why is this running?
vercel-labs/json-render,TypeScript,14163,753,2026-01-14T17:22:39Z,The Generative UI framework
EveryInc/compound-engineering-plugin,TypeScript,14147,1052,2025-10-09T19:43:46Z,"Official Compound Engineering plugin for Claude Code, Codex, and more"
zarazhangrui/frontend-slides,Shell,13976,1070,2026-01-28T00:42:34Z,Create beautiful slides on the web using Claude's frontend skills
google/A2UI,TypeScript,13949,1070,2025-09-24T23:14:02Z,
gastownhall/gastown,Go,13940,1266,2025-12-16T00:33:33Z,Gas Town - multi-agent workspace manager
AndyMik90/Aperant,TypeScript,13937,1903,2025-12-04T22:10:37Z,Autonomous multi-session AI coding
vercel-labs/skills,TypeScript,13928,1147,2026-01-14T21:31:18Z,The open agent skills tool - npx skills
openai/codex-plugin-cc,JavaScript,13919,766,2026-03-30T15:29:52Z,Use Codex from Claude Code to review code or delegate tasks.
manaflow-ai/cmux,Swift,13868,1014,2026-01-28T10:03:24Z,Ghostty-based macOS terminal with vertical tabs and notifications for AI coding agents
Tencent/WeKnora,Go,13836,1639,2025-07-22T08:01:23Z,"LLM-powered framework for deep document understanding, semantic retrieval, and context-aware answers"
Anionex/banana-slides,TypeScript,13747,1604,2025-11-29T17:37:26Z,一个基于nano banana pro🍌的原生AI PPT生成应用，迈向真正的＂Vibe PPT＂; 支持上传任意模板图片；上传任意素材&智能解析；一句话/大纲/页面描述自动生成PPT；口头修改指定区
different-ai/openwork,TypeScript,13629,1267,2026-01-14T01:39:31Z,"An open-source alternative to Claude Cowork built for teams, powered by opencode"
titanwings/colleague-skill,Python,13595,1266,2026-03-30T05:22:23Z,将冰冷的离别化为温暖的 Skill，欢迎加入数字生命1.0！Transforming cold farewells into warm skills? It's giving rebirth era.
blader/humanizer,Sin especificar,13576,1179,2026-01-18T05:30:15Z,Claude Code skill that removes signs of AI-generated writing from text
eigent-ai/eigent,TypeScript,13561,1586,2025-07-29T15:56:02Z,Eigent: The Open Source Cowork Desktop to Unlock Your Exceptional Productivity. Local and Free Alter
microsoft/RustTraining,Rust,13540,1008,2026-03-13T04:25:17Z,"Beginner, advanced, expert level Rust training material"
KittenML/KittenTTS,Python,13524,749,2025-08-05T03:30:24Z, State-of-the-art TTS model under 25MB 😻 
NevaMind-AI/memU,Python,13323,994,2025-07-29T01:54:40Z,"Memory for 24/7 proactive agents like openclaw (moltbot, clawdbot)."
MemoriLabs/Memori,Python,13294,1719,2025-07-24T07:07:51Z,"Memori is agent-native memory infrastructure. A SQL-native, LLM-agnostic layer that turns agent exec"
HKUDS/AI-Trader,Python,13277,2245,2025-10-23T12:45:00Z,"""AI-Trader: 100% Fully-Automated Agent-Native Trading""  "
coleam00/context-engineering-intro,Python,13136,2691,2025-07-02T11:54:47Z,Context engineering is the new vibe coding - it's the way to actually make AI coding assistants work
ag-ui-protocol/ag-ui,TypeScript,12963,1161,2025-05-07T12:49:37Z,AG-UI: the Agent-User Interaction Protocol. Bring Agents into Frontend Applications.
originalankur/maptoposter,Python,12889,1137,2026-01-08T12:29:35Z,"Transform your favorite cities into beautiful, minimalist designs. MapToPoster lets you create and e"
andrewyng/context-hub,JavaScript,12869,1131,2025-10-30T12:20:34Z,
