repo_name,language,stars,forks,created_at,description
benjitaylor/agentation,TypeScript,3796,302,2026-01-18T02:01:24Z,The visual feedback tool for agents.
lightningpixel/modly,TypeScript,3795,404,2026-03-17T18:02:35Z,Desktop app to generate 3D models from images using local AI — runs entirely on your GPU
parcadei/Continuous-Claude-v3,Python,3794,297,2025-12-23T00:12:49Z,Context management for Claude Code. Hooks maintain state via ledgers and handoffs. MCP execution wit
ylytdeng/wechat-decrypt,Python,3784,2093,2026-02-28T04:03:44Z,"WeChat 4.0 database decryptor - extract keys from memory, decrypt SQLCipher 4 databases, real-time m"
justlovemaki/openclaw-china-docker,Shell,3780,457,2026-02-01T11:42:18Z,OpenClaw 的中国IM平台整合Docker版本，预装并配置了飞书、钉钉、QQ机器人、企业微信等主流中国IM软件的插件，让您可以快速部署一个支持多个中国IM平台的 AI 机器人网关
timescale/pg_textsearch,C,3777,108,2025-07-06T17:45:50Z,PostgreSQL extension for BM25 relevance-ranked full-text search. Postgres OSS licensed.
masterking32/MasterHttpRelayVPN,Python,3773,441,2026-04-20T10:32:26Z,Domain-fronted HTTP/SOCKS5 proxy tunneling traffic through Google Apps Script with MITM TLS intercep
NousResearch/hermes-agent-self-evolution,Python,3771,427,2026-03-09T10:42:48Z,"⚒ Evolutionary self-improvement for Hermes Agent — optimize skills, prompts, and code using DSPy + G"
cloudflare/agentic-inbox,TypeScript,3766,486,2026-04-10T00:26:27Z,"A self-hosted email client with an AI agent, running entirely on Cloudflare Workers"
archestra-ai/archestra,TypeScript,3757,940,2025-07-15T12:07:55Z,"Enterprise AI Platform with guardrails, MCP registry, gateway & orchestrator"
Pimzino/claude-code-spec-workflow,TypeScript,3752,267,2025-07-18T16:32:32Z,Automated workflows for Claude Code. Features spec-driven development for new features (Requirements
novatic14/MANPADS-System-Launcher-and-Rocket,C++,3738,1049,2026-03-11T22:44:44Z,
rocketride-org/rocketride-server,C++,3737,1218,2026-02-11T17:02:53Z,"High-performance AI pipeline engine with a C++ core and 50+ Python-extensible nodes. Build, debug, a"
disler/claude-code-hooks-mastery,Python,3730,615,2025-07-05T16:30:09Z,Master Claude Code Hooks
shiahonb777/web-to-app,Kotlin,3726,561,2025-11-26T04:45:16Z,A native Android application that converts any website URL into a standalone Android App.
straight-tamago/misaka26,Sin especificar,3723,171,2025-11-16T14:48:46Z,"iOS /iPadOS 16.0 - 26.1, An ultimate customization tool, uilitizing the bug that makes TrollRestore "
alvinreal/awesome-opensource-ai,Python,3721,418,2026-03-24T15:58:22Z,"Curated list of the best truly open-source AI projects, models, tools, and infrastructure."
Forget-C/Jellyfish,Python,3718,683,2026-03-06T09:20:08Z,An end-to-end production workspace for AI-generated short dramas. From script input to structured st
badrisnarayanan/antigravity-claude-proxy,JavaScript,3714,504,2025-12-19T13:57:33Z,"Proxy that exposes Antigravity provided claude / gemini models, so we can use them in Claude Code an"
ZHO-ZHO-ZHO/ZHO-nano-banana-Creation,Sin especificar,3710,352,2025-08-28T13:09:00Z,我的 nano-banana 创意玩法大合集！  持续更新中！
cacggghp/vk-turn-proxy,Go,3708,256,2025-11-25T11:38:20Z,
MemeCalculate/moyin-creator,TypeScript,3706,793,2026-02-09T17:01:11Z,AI 影视生产级工具 | 支持 Seedance 2.0 | 剧本到成片全流程批量化 | AI-powered film production tool with Seedance 2.0 suppo
MattParkerDev/SharpIDE,C#,3698,130,2025-11-08T13:01:42Z,"A modern, cross platform IDE for .NET, built with .NET & Godot"
Hunyuan-PromptEnhancer/PromptEnhancer,Python,3695,322,2025-09-09T08:56:47Z,"[CVPR 2026] PromptEnhancer is a prompt-rewriting tool, refining prompts into clearer, structured ver"
HKUDS/Paper2Slides,Python,3694,468,2025-12-07T06:15:43Z,"""Paper2Slides: From Paper to Presentation in One Click"""
34306/vphone-aio,Shell,3687,659,2026-02-28T10:20:47Z,1 script run the vphone
bgreenwell/doxx,Rust,3683,90,2025-08-16T18:48:24Z,"Expose the contents of .docx files without leaving your terminal. Fast, safe, and smart — no Office "
tobi/try,Shell,3679,144,2025-08-19T19:25:23Z,fresh directories for every vibe
karpathy/reader3,Python,3667,466,2025-11-18T02:37:00Z,Quick illustration of how one can easily read books together with LLMs. It's great and I highly reco
panphora/overtype,JavaScript,3662,94,2025-08-15T02:17:49Z,The markdown editor that's just a textarea https://overtype.dev
mihail911/modern-software-dev-assignments,Python,3659,890,2025-08-07T07:14:35Z,Assignments for CS146S: The Modern Software Dev (Stanford University Fall 2025)
lucas-maes/le-wm,Python,3658,487,2026-03-13T02:56:21Z,Official code base for LeWorldModel: Stable End-to-End Joint-Embedding Predictive Architecture from 
chopratejas/headroom,Python,3658,297,2026-01-07T19:58:51Z,"Compress tool outputs, logs, files, and RAG chunks before they reach the LLM. 60-95% fewer tokens, s"
ycccccccy/echotrace,Sin especificar,3636,653,2025-10-17T14:40:37Z,"EchoTrace 是一个本地、安全的微信聊天记录导出、分析与年度报告生成工具 | EchoTrace is a local, secure tool for exporting, analyzing"
microsoft/agent-governance-toolkit,Python,3635,517,2026-03-02T22:11:47Z,"AI Agent Governance Toolkit — Policy enforcement, zero-trust identity, execution sandboxing, and rel"
HeartMuLa/heartlib,Python,3632,401,2026-01-15T07:53:15Z,HeartMuLa Official Repo: The Most Powerful Open-Source Music Generation Model of 2026
golutra/golutra,Rust,3629,416,2026-02-15T11:49:39Z,"Multi-agent AI orchestration platform for automation, workflows, and developer tools. Golutra transf"
zouzhekang/YJYpaper,HTML,3626,226,2025-07-29T06:23:12Z,一个用来记录武汉大学杨景媛论文问题的仓库
0xNyk/awesome-hermes-agent,Sin especificar,3624,245,2026-03-23T05:34:37Z,"A curated list of awesome skills, tools, integrations, and resources for Hermes Agent by Nous Resear"
vercel-labs/just-bash,TypeScript,3613,205,2025-12-23T17:10:51Z,Bash for Agents
cporter202/scraping-apis-for-devs,JavaScript,3601,655,2025-12-10T18:35:41Z,This GitHub repo is a powerhouse collection of scraping APIs for developers that you can start using
RLinf/RLinf,Python,3600,494,2025-08-14T03:52:19Z,RLinf: Reinforcement Learning Infrastructure for Embodied and Agentic AI
Fokkyp/SoftwareCopyright-Skill,Python,3599,544,2026-04-29T10:07:08Z,中国软件著作权申请材料 生成器 Skills，本 Skills 通过阅读本地项目，自动生成全套 .docx 软著申请材料，全开源，无须再付费购买任何软著申请服务
Dimillian/Skills,Shell,3599,188,2025-12-30T14:36:32Z,My Codex Skills
willchen96/mike,TypeScript,3596,1109,2026-04-29T17:41:12Z,OSS AI Legal Platform
google-gemini/gemini-skills,Sin especificar,3589,345,2026-02-06T04:17:28Z,"Skills for the Gemini API, SDK and model/agent interactions"
ogulcancelik/herdr,Rust,3587,227,2026-03-27T17:54:33Z,agent multiplexer that lives in your terminal.
serenakeyitan/awesome-notebookLM-prompts,Sin especificar,3586,509,2025-12-12T00:51:13Z,A curated collection of the strongest NotebookLM slide prompts sourced from the real creative underg
gemini-cli-extensions/conductor,Sin especificar,3583,280,2025-12-17T03:25:48Z,"Conductor is a Gemini CLI extension that allows you to specify, plan, and implement software feature"
sanyuan0704/sanyuan-skills,Python,3582,316,2026-02-04T06:44:11Z,"Expert code review skill: SOLID, security, performance, error handling, boundary conditions"
TinyAGI/tinyagi,TypeScript,3572,505,2026-02-09T00:34:11Z,TinyAGI is the agent teams orchestrator for One Person Company. (fka TinyClaw)
p2r3/convert,TypeScript,3572,332,2025-12-07T07:40:09Z,Truly universal online file converter
remorses/playwriter,HTML,3570,150,2025-11-13T18:23:26Z,Chrome extension & CLI to let agents control your browser. Runs Playwright snippets in a stateful sa
PerryTS/perry,Rust,3566,118,2026-01-19T07:42:31Z,A native TypeScript compiler written in Rust. Compiles TypeScript directly to executables using SWC 
Seeed-Projects/reBot-DevArm,Sin especificar,3566,344,2025-11-25T06:01:17Z,Open Source Robotic Arm for All Developers
KuekHaoYang/KVideo,TypeScript,3562,6275,2025-11-16T02:49:26Z,"一个基于 Next.js 16 构建的现代化视频聚合播放平台。采用独特的 ""Liquid Glass"" 设计语言，提供流畅的视觉体验和强大的视频搜索功能。"
Adembc/lazyssh,Go,3557,133,2025-08-13T09:33:09Z,A terminal-based SSH manager inspired by lazydocker and k9s - Written in go
CodeGraphContext/CodeGraphContext,Python,3547,626,2025-08-16T19:20:31Z,An MCP server plus a CLI tool that indexes local code into a graph database to provide context to AI
NateBJones-Projects/OB1,TypeScript,3521,671,2026-03-11T17:59:59Z,"Open Brain — The infrastructure layer for your thinking. One database, one AI gateway, one chat chan"
nickjvandyke/opencode.nvim,Lua,3518,128,2025-07-12T13:52:17Z,Bridge Neovim and OpenCode AI to stay in your flow.
facebookresearch/sam-audio,Python,3517,317,2025-09-04T16:46:34Z,The repository provides code for running inference with the Meta Segment Anything Audio Model (SAM-A
thu-ml/TurboDiffusion,Python,3515,262,2025-12-06T00:25:35Z,TurboDiffusion: 100–200× Acceleration for Video Diffusion Models
subhashchy/The-Accidental-CTO,TypeScript,3511,283,2025-09-26T09:07:20Z,"How I Scaled from Zero to a Million Store on Dukaan,  Without a CS Degree.  .. A System Design Handb"
lintsinghua/claude-code-book,Sin especificar,3509,745,2026-03-31T18:00:16Z,《御舆：解码 Agent Harness》42万字拆解 AI Agent 的Harness骨架与神经 —— Claude Code 架构深度剖析，15 章从对话循环到构建你自己的 Agent Harn
rullerzhou-afk/clawd-on-desk,JavaScript,3508,344,2026-03-18T09:04:20Z,"A pixel desktop pet that watches Claude Code, Codex, Cursor & other AI coding agents — so you don't "
matt1398/claude-devtools,TypeScript,3499,263,2026-02-07T13:17:25Z,"The missing DevTools for Claude Code — inspect session logs, tool calls, token usage, subagents, and"
memodb-io/Acontext,JavaScript,3495,319,2025-07-16T13:15:48Z,Agent Skills as a Memory Layer
Tencent-Hunyuan/Hunyuan3D-2.1,Python,3494,512,2025-06-13T15:45:50Z,From Images to High-Fidelity 3D Assets with Production-Ready PBR Material
mergisi/awesome-openclaw-agents,HTML,3494,577,2026-02-05T10:51:17Z,162 production-ready AI agent templates for OpenClaw. SOUL.md configs across 19 categories. Submit y
OpenWhispr/openwhispr,TypeScript,3493,495,2025-06-19T00:58:14Z,Voice-to-text dictation app with local (Nvidia Parakeet/Whisper) and cloud models (BYOK). Privacy-fi
laravel/boost,PHP,3493,331,2025-07-15T13:57:25Z,Laravel-focused MCP server for augmenting your AI powered local development experience.
Gentleman-Programming/gentle-ai,Go,3492,415,2026-02-27T23:28:01Z,
millionco/expect,TypeScript,3488,154,2026-03-12T05:58:06Z,Expect tests your agent's code in a real browser
QwenLM/Qwen3.6,Sin especificar,3478,233,2025-09-11T05:32:39Z,"Qwen3.6 is the large language model series developed by Qwen team, Alibaba Group."
smol-machines/smolvm,Rust,3478,163,2025-12-18T23:25:15Z,"Tool to build & run portable, lightweight, self-contained virtual machines."
browserbase/skills,JavaScript,3472,227,2025-10-12T08:44:05Z,Browserbase's official collection of agent skills to access the web.
hafrey1/LunaTV-config,JavaScript,3463,1342,2025-06-05T12:19:17Z,MoonTV/LunaTV源配置，每日自动检测API状态，可在CF部署CORSAPI中转被墙API，本人提供的CORSAPI仅为测试使用，请勿滥用！
EverMind-AI/MSA,Python,3460,220,2025-10-29T10:05:21Z,"Memory Sparse Attention -  A scalable, end-to-end trainable latent-memory framework for 100M-token c"
aiming-lab/SimpleMem,Python,3459,353,2026-01-01T23:53:40Z,SimpleMem: Efficient Lifelong Memory for LLM Agents — Text & Multimodal
karol-broda/snitch,Go,3459,54,2025-08-27T08:32:47Z,a prettier way to inspect network connections
caamer20/Telegram-Drive,TypeScript,3458,504,2026-01-23T20:19:39Z,"Turn your Telegram account into an unlimited, secure cloud storage drive. an Open-source desktop app"
zc-zhangchen/any-auto-register,Python,3456,1197,2026-03-22T13:00:59Z,
liu-ziting/what-to-eat,Vue,3451,517,2025-08-11T08:46:35Z,一饭封神：一个基于 AI 的智能菜谱生成平台，支持中华八大菜系 + 国际料理，提供营养分析、酒水推荐、菜谱效果图生成等全方位烹饪指导。
Jon-Becker/prediction-market-analysis,Python,3449,485,2025-11-22T16:59:25Z,"A framework for collecting and analyzing prediction market data, including the largest publicly avai"
nyldn/claude-octopus,Shell,3445,309,2026-01-15T08:49:38Z,"Surface AI blindspots before you ship. Put up to 8 AI models on every research, design or coding tas"
facebookresearch/map-anything,Python,3438,261,2025-09-04T14:37:36Z,MapAnything: Universal Feed-Forward Metric 3D Reconstruction
junhoyeo/tokscale,Rust,3437,220,2025-12-01T13:15:27Z,"🛰️ A CLI tool for tracking token usage from OpenCode, Claude Code, 🦞OpenClaw (Clawdbot/Moltbot), Pi,"
deta/surf,TypeScript,3434,252,2025-10-20T15:09:57Z,"Personal AI Notebooks. Organize files & webpages and generate notes from them. Open source, local & "
miaoxworld/OpenClawInstaller,Shell,3431,468,2026-01-29T14:43:02Z,ClawdBot 一键部署工具
Keychron/Keychron-Keyboards-Hardware-Design,Sin especificar,3428,263,2026-04-04T04:28:32Z,"Industrial design files for Keychron keyboards and mice. 100+ models with CAD assets in STEP, DXF, D"
aiming-lab/MetaClaw,Python,3423,443,2026-03-09T13:47:13Z,🦞 Just talk to your agent — it learns and EVOLVES 🧬.
FareedKhan-dev/all-agentic-architectures,Jupyter Notebook,3421,603,2025-09-24T11:47:58Z,"35 production-grade agentic AI architectures (Reflexion, LATS, GraphRAG, MemGPT, Voyager, BrowserAge"
gotalab/cc-sdd,TypeScript,3419,254,2025-07-17T04:41:37Z,"Turn approved specs into long-running autonomous implementation. A minimal, adaptable SDD harness wi"
heroui-inc/heroui-native,TypeScript,3418,128,2025-06-03T15:21:45Z,"📱Beautiful, fast and modern React Native UI library"
ResearAI/AutoFigure-Edit,Python,3414,242,2026-02-03T18:50:36Z,
agentscope-ai/agentscope-java,Java,3409,722,2025-09-23T04:37:43Z,AgentScope Java: Agent-Oriented Programming for Building LLM Applications
hxehex/russia-mobile-internet-whitelist,Sin especificar,3398,96,2025-09-13T11:16:07Z,a list of domains and ips that stay live in russia when the mobile internet gets restricted
Soul-AILab/SoulX-Podcast,Python,3398,443,2025-09-22T03:32:35Z,SoulX-Podcast is an inference codebase by the Soul AI team for generating high-fidelity podcasts fro
remotion-dev/skills,TypeScript,3396,388,2026-01-19T09:58:43Z,Agent Skills
coleam00/excalidraw-diagram-skill,Python,3396,420,2026-03-01T12:36:44Z,Skill to give Claude Code (and any coding agent) the ability to generate beautiful and practical Exc
yasasbanukaofficial/claude-code,TypeScript,3395,4680,2026-03-31T19:07:10Z,🚀 Open source Claude Code CLI source code. Advanced AI Agent for developers. Includes TypeScript cod
thinking-machines-lab/tinker-cookbook,Python,3395,434,2025-07-14T22:10:00Z,Post-training with Tinker
limix-ldm-ai/LimiX,Python,3393,299,2025-08-27T07:15:45Z,LimiX: Unleashing Structured-Data Modeling Capability for Generalist Intelligence https://arxiv.org/
pathwaycom/bdh,Python,3392,221,2025-09-30T12:05:01Z,BDH (Dragon Hatchling) – Architecture and Code
basketikun/chatgpt2api,Python,3391,1009,2026-04-19T14:53:01Z,ChatGPT官网接口纯协议的逆向实现，支持注册机维持号池额度，支持GPT-Image-2模型、文本模型，兼容OpenAI接口协议，在线批量生图/编辑图，号池管理，支持可编辑PPT/PSD文件逆向，支
agenticnotetaking/arscontexta,Shell,3382,218,2026-02-15T17:26:41Z,Claude Code plugin that generates individualized knowledge systems from conversation. You describe h
guandeh17/Self-Forcing,Python,3381,268,2025-06-09T05:33:40Z,"Official codebase for ""Self Forcing: Bridging Training and Inference in Autoregressive Video Diffusi"
liujuntao123/smart-excalidraw-next,JavaScript,3381,416,2025-10-30T02:12:40Z,"A smart, powerful, and beautiful excalidraw drawing tool.Draw Professional Charts with Natural Langu"
npmx-dev/npmx.dev,TypeScript,3371,461,2026-01-22T16:00:54Z,"a fast, modern browser for the npm registry"
GiovanniPasq/agentic-rag-for-dummies,Jupyter Notebook,3365,447,2025-10-13T18:51:41Z,A modular Agentic RAG built with LangGraph — learn Retrieval-Augmented Generation Agents in minutes.
growchief/growchief,TypeScript,3351,254,2025-08-21T08:06:06Z,The Ultimate all-in social media automation (outreach) tool 🤖
zai-org/GLM-5,Sin especificar,3347,364,2026-02-09T08:17:02Z,GLM-5: From Vibe Coding to Agentic Engineering
deusyu/harness-engineering,Shell,3341,296,2026-03-23T16:35:38Z,Harness Engineering 学习指南 — 从概念理解到独立实践的深度学习档案
tradesdontlie/tradingview-mcp,JavaScript,3325,1632,2026-03-29T14:39:25Z,AI-assisted TradingView chart analysis — connect Claude Code to your TradingView Desktop for persona
OpenMOSS/MOSS-TTS-Nano,Python,3324,432,2026-04-10T16:25:07Z,MOSS-TTS-Nano is an open-source multilingual tiny speech generation model from MOSI.AI and the OpenM
sligter/LandPPT,Python,3317,441,2025-06-28T10:04:20Z,一个基于LLM的演示文稿生成平台，能够自动将文档内容转换为专业的PPT演示文稿。平台支持多种AI模型，提供丰富的模板和样式选择，让用户能够创建高质量的演示文稿。
htdt/godogen,Python,3317,300,2026-02-06T18:46:52Z,Autonomous game development for Godot and Bevy with Claude Code and Codex
therealaleph/MasterHttpRelayVPN-RUST,Rust,3313,543,2026-04-21T14:46:31Z,Rust port of @masterking32's MasterHttpRelayVPN — all credit to @masterking32 for the original idea 
grimmory-tools/grimmory,Java,3307,222,2026-03-12T21:32:38Z,Grimmory is an independent community fork of Booklore.
Augani/openreel-video,TypeScript,3305,452,2026-01-19T11:24:02Z,OpenReel Video - Professional browser-based video editor. Open source CapCut alternative. 100% brows
DevAgentForge/Open-Claude-Cowork,TypeScript,3296,451,2026-01-13T09:34:40Z,"OpenSource Claude Cowork. A desktop AI assistant that helps you with programming, file management, a"
MoonshotAI/Attention-Residuals,Sin especificar,3294,182,2026-03-15T13:29:15Z,
DaKheera47/job-ops,TypeScript,3283,408,2025-12-11T23:57:21Z,"job-ops: DevOps principles applied to job hunting. A self-hosted pipeline to track, analyze, and ass"
f/textream,Swift,3283,221,2026-02-08T09:20:05Z,"Textream is a free macOS teleprompter app for streamers, interviewers, and presenters. It highlights"
GVCLab/PersonaLive,Python,3279,458,2025-11-25T14:36:31Z,[CVPR 2026] PersonaLive! : Expressive Portrait Image Animation for Live Streaming
EvoScientist/EvoScientist,Python,3274,211,2026-01-26T11:19:26Z,🔬 Harness Vibe Research with Self-evolving AI Scientists
ZSeven-W/openpencil,TypeScript,3274,334,2026-02-17T10:51:46Z,The world's first open-source AI-native vector design tool and the first to feature concurrent Agent
braedonsaunders/codeflow,HTML,3273,524,2025-12-16T03:42:56Z,"Paste any GitHub URL → interactive architecture map. See how files connect, find what breaks if you "
iflytek/skillhub,Java,3270,452,2026-03-11T12:17:05Z,"Self-hosted, open-source agent skill registry for enterprises. Publish & version skill packages, gov"
pageman/sutskever-30-implementations,Jupyter Notebook,3269,445,2025-12-06T03:08:41Z,"Sutskever 30 implementations inspired by https://papercode.vercel.app/ | For Agents, use https://git"
RemotePinee/AudioVisual,JavaScript,3269,346,2025-10-13T15:42:42Z,解锁所有国内媒体流的钥匙
agentclientprotocol/agent-client-protocol,Rust,3267,267,2025-06-23T17:39:36Z, A protocol for connecting any editor to any agent
oxylabs/google-ai-mode-scraper,Java,3258,28,2025-09-08T13:17:40Z,Scrape Google AI Mode responses without blocks on a large scale.
edwardkim/rhwp,Rust,3240,562,2026-03-27T05:54:10Z,아래한글 hwp viewer and editor by rust and wasm
geo-tp/ESP32-Bit-Pirate,C++,3225,276,2025-07-05T21:59:46Z,A Hardware Hacking Tool with Web-Based CLI That Speaks Every Protocol 
dotnet/skills,C#,3220,239,2026-02-03T22:51:09Z,Repository for skills to assist AI coding agents with .NET and C#
FoundZiGu/GuJumpgate,JavaScript,3217,842,2026-05-19T11:52:52Z,
TrustTunnel/TrustTunnel,Rust,3214,205,2025-11-07T13:01:12Z,"Modern, fast and obfuscated VPN protocol"
alchaincyf/darwin-skill,HTML,3213,357,2026-04-13T08:57:49Z,达尔文.skill —— 一个让你的Skill无限进化的系统：评估→改进→测试→保留或回滚 | Autoresearch-inspired autonomous skill optimization 
nextlevelbuilder/goclaw,Go,3211,890,2026-02-22T07:26:36Z,"GoClaw - GoClaw is OpenClaw rebuilt in Go — with multi-tenant isolation, 5-layer security, and nativ"
arman-bd/guppylm,Python,3199,281,2026-03-29T14:32:37Z,A ~9M parameter LLM that talks like a small fish.
yousifamanuel/terraink,TypeScript,3193,348,2026-02-10T02:04:37Z,Terraink: The Cartographic Poster Engine that creates unique and customizable map posters
homeassistant-ai/ha-mcp,Python,3192,124,2025-09-14T13:23:45Z,The Unofficial and Awesome Home Assistant MCP Server
SurgeDM/Surge,Go,3188,129,2025-10-29T05:00:15Z,Blazing fast TUI download manager built in Go for power users
chaitin/MonkeyCode,TypeScript,3185,377,2025-06-25T06:35:32Z,AI 开发平台，内置云端开发环境，并支持业内最全的顶尖大模型。无论是开发项目、做调研、写文档，还是分析数据、处理任务，打开浏览器就能随时开始，让 AI 持续帮你推进工作
HughYau/qiushi-skill,JavaScript,3185,237,2026-03-25T10:24:01Z,"求是Skill——从经典唯物辩证法与实践哲学中提炼出一条总原则和九大方法论工具武装AI大脑。Qiushi-Skill: Build agents that investigate first, foc"
vercel-labs/wterm,TypeScript,3179,137,2026-04-14T14:52:44Z,A terminal emulator for the web
oboard/claude-code-rev,TypeScript,3178,3816,2026-03-31T11:37:19Z,Runnable ClaudeCode source code
batrachianai/toad,Python,3174,151,2025-07-17T17:17:22Z,A unified interface for AI in your terminal.
AutoMaker-Org/automaker,TypeScript,3170,596,2025-12-07T21:42:08Z,
Master-cai/Research-Paper-Writing-Skills,Sin especificar,3169,160,2026-03-05T08:19:31Z,"Skill package for ML/CV/NLP paper writing, curated and adapted from Prof. Peng Sida's open notes for"
Meirtz/Awesome-Context-Engineering,Sin especificar,3165,238,2025-07-02T17:46:03Z, 🔥 Comprehensive survey on Context Engineering: from prompt engineering to production-grade AI syste
jackwener/wx-cli,Rust,3163,1264,2026-04-16T01:08:18Z,WeChat local data CLI with daemon architecture
Sumanth077/ai-engineering-toolkit,Sin especificar,3160,583,2025-08-06T09:07:21Z,A curated list of 100+ libraries and frameworks for AI engineers building with LLMs
gnekt/My-Brain-Is-Full-Crew,Shell,3159,319,2026-03-21T07:52:53Z,"Built by a PhD whose memory was failing, whose diet was a mess, and whose anxiety had its own agenda"
SaladDay/cc-switch-cli,Rust,3157,184,2025-11-23T11:15:12Z,"⭐️ A cross-platform CLI All-in-One assistant tool for Claude Code, Codex & Gemini CLI."
tursodatabase/agentfs,Rust,3155,172,2025-10-24T17:05:06Z,The filesystem for agents.
simonlin1212/a-stock-data,Sin especificar,3152,663,2026-05-11T01:08:15Z,A股全栈数据工具包 — 7层架构 · 28端点 · 13数据源 · 零第三方依赖 | Full-stack China A-Share data toolkit for AI coding assis
XBuilderLAB/cheat-on-content,Python,3152,541,2026-05-05T10:28:33Z,You're reading this. The skill predicted it. A workflow that turns every post into a calibrated expe
MiniMax-AI/MiniMax-M1,Python,3151,282,2025-06-14T08:54:06Z,"MiniMax-M1, the world's first open-weight, large-scale hybrid-attention reasoning model."
Emanuele-web04/remodex,Swift,3142,364,2026-03-07T19:28:35Z,Remote Control for Codex.
virgiliojr94/book-to-skill,Python,3127,398,2026-05-01T02:09:39Z,"Turn any technical book PDF into a Claude Code skill — ready to study, reference, and use while you "
Opencode-DCP/opencode-dynamic-context-pruning,TypeScript,3124,170,2025-11-20T01:51:43Z,Dynamic context pruning plugin for OpenCode - intelligently manages conversation context to optimize
tekaratzas/RustGPT,Rust,3124,265,2025-09-13T22:05:55Z,An transformer based LLM. Written completely in Rust
superagent-ai/grok-cli,TypeScript,3110,387,2025-07-14T07:57:39Z,An open-source coding agent for the Grok API
ChartGPU/ChartGPU,TypeScript,3109,94,2026-01-17T00:52:00Z,"Beautiful, open source, WebGPU-based charting library"
HailToDodongo/pyrite64,C++,3103,131,2025-09-23T20:07:13Z,N64 Game-Engine and Editor using libdragon & tiny3d
yuaotian/antigravity-proxy,C++,3103,248,2026-01-08T10:23:46Z,🚀 Transparent proxy injector for Antigravity. Force SOCKS5/HTTP proxy without TUN mode on Windows. |
MemMachine/MemMachine,Python,3103,181,2025-08-15T16:40:53Z,"Universal memory layer for AI Agents. It provides scalable, extensible, and interoperable memory sto"
Tencent-Hunyuan/HunyuanImage-3.0,Python,3097,165,2025-09-27T07:18:47Z,HunyuanImage-3.0: A Powerful Native Multimodal Model for Image Generation
microsoft/amplifier,Shell,3093,256,2025-09-09T22:21:51Z,
pasky/chrome-cdp-skill,JavaScript,3082,193,2026-03-13T00:35:39Z,"Give your AI agent access to your live Chrome session — works out of the box, connects to tabs you a"
facebook/openzl,C,3081,148,2025-09-30T18:30:07Z,A novel data compression framework
stravu/crystal,TypeScript,3074,196,2025-06-05T23:54:39Z,(Crystal is now Nimbalyst) Run multiple Codex and Claude Code AI sessions in parallel git worktrees.
Universal-Commerce-Protocol/ucp,Python,3073,396,2025-12-31T02:17:21Z,Specification and documentation for the Universal Commerce Protocol (UCP)
nexu-io/nexu,TypeScript,3070,249,2026-02-25T02:47:19Z,"The simplest desktop client for OpenClaw 🦞 — bridge your Agent to WeChat, Feishu, Slack & Discord in"
